source,shared_from,date,text,reactions,likes,ahah,love,wow,sigh,grrr,comments,post_id,url
Trắng TV,,2019-09-19 16:00:01,"""CHỜ CON THI ĐẠI HỌC XONG MỚI LY HÔN"" | TRẮNG ĐỜI Người ta thường nói ''hôn nhân là mồ chôn tình yêu'' là bởi, bước vào hôn nhân, 2 người với 2 nét cá tính riêng biệt dường như đã lột trần nhau tất cả, cả tâm hồn lẫn tính cách. Nếu như không biết dung hòa, nhún nhường và hy sinh, thì có lẽ... cuộc hôn nhân sẽ chỉ là ác mộng. Có rất nhiều cuộc hôn nhân không hạnh phúc nhưng hai người trong cuộc không chọn cách chia tay, chỉ bởi vì hai chữ ""Vì con"". Vì muốn con có cha/mẹ đủ đầy, vì muốn con không bị người đời trêu chọc,… Có rất nhiều lý do xung quanh con cái, nhưng thái độ của cha mẹ trong chuyện này ra sao mới là điều quan trọng.  Mẩu chuyện ngắn ""Con thi đại học xong sẽ ly hôn"" dưới đây (Dưa Hấu dịch) đã khiến nhiều người phải suy ngẫm bởi ý nghĩa sâu xa của tình yêu và hôn nhân đằng sau một cuộc ly hôn tưởng chừng như rất đơn giản ấy. Nguyên văn bản dịch có nội dung như sau:  ''Có một vài người phụ nữ, ly hôn cũng thật tao nhã. Một người đàn ông vừa ly hôn nói về vợ cũ của mình, anh ấy nói, khi chúng tôi bước ra từ Cục dân chính, tôi thì khóc, cô ấy lại cười. Cô ấy nói, tôi chờ ngày này đã mười năm, mười năm chăm chỉ học hành của con, là mười năm cô ấy nếm mật nằm gai. Cô ấy đã nói với anh rất nhiều lần, đợi con thi đại học xong sẽ ly hôn, anh cứ tưởng chỉ là lời nói dối của vợ, không ngờ cô ấy nói thật. Hơn nữa, từ ngày đó cô ấy đã bắt đầu chuẩn bị cho việc ly hôn. Anh nhớ đến những năm đó vợ rất độc lập, dịu dàng, đột nhiên phát hiện những lúc anh cho là hai vợ chồng chung sống rất hòa thuận, thực chất là bởi vợ không còn muốn tính toán với anh nữa. Lúc trước anh rất ghét bị vợ sai làm việc nhà, sau đó không biết bắt đầu từ khi nào, vợ đã không còn kêu anh làm nữa, lúc đó anh rất vui, cho rằng phụ nữ đều như thế cả thôi, không chiều cô ấy, thì cô ấy biết điều tự làm thôi. Bây giờ nghĩ lại, có lẽ lúc đó vợ đã muốn buông bỏ anh rồi. Cô ấy không cần anh, vậy nên việc gì cũng đều tự mình làm. Trong mấy năm ấy, vợ không hề đòi anh một đồng nào. Lúc trước khi con còn nhỏ, vợ không đi làm được, mỗi tháng đều kêu anh đưa mình tiền. Anh nhớ lại lúc ấy, anh vô cùng phiền chán mỗi khi nghe vợ nhắc đến tiền bạc, mỗi tháng làm được vài đồng ít ỏi thì đã tiêu hết cho cái nhà này rồi. Mỗi khi vợ kêu đưa tiền, anh đều nói: ""Em có thể xài tiết kiệm chút không, mua máy lạnh trong phòng khách làm gì, khóa hư rồi thì ráng ráng xài tạm cũng được mà. Ngày nào em cũng mua đồ mới cho con, rồi còn đồ trang điểm, có ích gì không. Em không biết thương tôi chút nào hả? Đàn ông kiếm tiền cũng đâu dễ dàng!"" Tôi nhớ khi vừa bắt đầu, vợ sẽ phản bác lại, càng về sau thì ngậm bồ hòn làm ngọt. Đợi con đi học, vợ bắt đầu đi làm lại, sau đó, vợ không hề đòi anh thêm một cắc nào nữa. Vấn đề tiền nong của hai người từ khi ấy bắt đầu phân chia rạch ròi. Vợ muốn mua cái gì liền mua, anh muốn món gì cũng tự mình trả tiền. Anh không biết mỗi tháng vợ kiếm được bao nhiêu, vợ cũng không quan tâm mỗi tháng anh kiếm được bao nhiêu tiền. Anh nhớ có một đoạn thời gian, vợ tiêu rất nhiều tiền. Mua cho mình rất nhiều quần áo đẹp và mỹ phẩm tốt, anh oán trách vợ: ""Em không thể tiêu tiết kiệm lại chút hả, sau này còn phải lo cho con học hành nữa!"" Kết quả vợ liền trách lại:"" Tôi tự mình kiếm tự mình tiêu, không lấy của anh một cắc. Con có đi học, anh bỏ bao nhiêu tôi cũng bỏ bấy nhiêu, có khi còn bỏ ra nhiều hơn anh, chứ không có việc ít hơn anh!"" Khi ấy anh liền đứng hình, thế nhưng cũng không để trong lòng, không cho quản thì anh không quản, miễn sao đừng đòi tiền anh là được. Bấy giờ anh mới hiểu, khi đó vợ đã không còn cần anh chống đỡ về mặt kinh tế nữa rồi. Không, trong những năm đó, vợ anh không chỉ độc lập về kinh tế, mà còn cả về tinh thần. Vợ bắt đầu rất ít khi cãi nhau với anh. Anh nói gì, cũng chỉ nghe, không muốn nghe, cô ấy liền trốn vào phòng khác. Khi ấy anh còn nghĩ vợ mình biết hiền lương thục đức rồi, thế nhưng không hề nghĩ rằng vợ anh ngay đến cãi nhau với anh cũng thấy không cần thiết. Nghĩ lại những năm đó, anh mới thấy mình muốn làm gì thì làm đấy, bất kể làm gì, vợ anh cũng không hề quan tâm. Có một buổi tối anh không về nhà, vợ cũng không hề gọi một cuộc. Khi ấy anh còn cao ngạo cười những tên bị vợ gọi giục, cảm thấy những người ấy thật không có bản lĩnh, bị vợ chỉnh đến mất cả tôn nghiêm. Bây giờ nghĩ lại, vợ người ta là còn yêu, vợ anh khi ấy đã không còn yêu anh rồi. Khi ấy anh còn vô cùng cao ngạo, cảm thấy người phụ nữ này cũng biết im lặng rồi. Anh lại nghĩ, những năm ấy vợ vì con cái mà không cãi nhau với anh, ôm đồm hết mọi việc cho con, còn anh thì vui vẻ một chút cũng không hề quan tâm. Mười năm, vợ lo kiếm tiền, chăm con cái, lo hết việc nhà. Thậm chí ba mẹ vợ có việc gì, cũng không hề mở miệng nhờ anh giúp đỡ. Anh từng vì việc này mà dương dương tự đắc, cảm thấy vợ nên thế này mới phải. Mỗi lần vợ nhờ việc nhỏ gì, anh liền cảm thấy phiền. Anh không muốn quan tâm đến bất cứ việc gì của vợ, chỉ muốn được phục vụ như hồi giờ, chỉ cần vợ không đòi tiền, vợ thích làm gì cũng được. Có một lần vợ bệnh, liền gọi điện thoại cho anh. Anh nhớ rất rõ khi ấy đã nói những gì: ""Nhà mẹ cô không có ai hả, không phải cô có tiền trong người sao, tìm tôi làm gì?"" Vợ anh không nói một lời liền cúp máy, sau đó vợ khỏi bệnh, anh cảm thấy có chút tội lỗi, tưởng rằng vợ sẽ khóc nháo, thế nhưng vợ lại vờ như chưa có gì xảy ra. Anh liền cảm thấy vợ cũng chỉ đến thế thôi, anh không quan tâm, cô ấy cũng có làm gì được anh đâu. Anh chưa từng nghĩ đến, người vợ an phận thế này, khi ly hôn với anh lại vô cùng kiên định. Loại kiên định này phải chăng được tích góp từ cuộc hôn nhân lạnh lẽo này? Giống như có một lần cô ấy nói: ""Anh sớm đã không còn là chồng tôi nữa, mà chỉ là bố của con tôi"". Vậy nên, cô ấy đợi 10 năm, chuẩn bị 10 năm, đợi khi con thi xong đại học, trở thành người lớn rồi, liền dứt khoát ly hôn. Nghĩ lại, anh thật không có điểm nào để vợ phải lưu luyến. Bởi vì trong cuộc hôn nhân này, đến bản thân cũng không hề nhớ ra được anh đã cho cô ấy những gì. Chỉ có duy nhất một đứa con, cũng chính là nỗi lưu luyến duy nhất của cô ấy. Từ Cục dân chính bước ra, anh khóc, bởi anh không thể tưởng tượng được trong tương lai, anh phải một mình giặt đồ nấu cơm, tự mình làm việc nhà, một mình đảm đương hết mọi việc. Cả đời sau anh cũng không thể uống được canh vợ nấu. Còn vợ thì cười, vì hôn nhân đối với cô ấy, không có chút gì tốt đẹp. Ly hôn rồi, cô ấy chỉ bớt việc chăm sóc một kẻ tính tình không tốt mà thôi. Đàn ông không nên chờ con cái lớn rồi, mới biết trân trọng vợ mình. Khi con còn nhỏ, bạn tưởng rằng cô ấy sẽ không bao giờ rời bỏ mình. Khi bạn có lỗi lớn đến đâu, cô ấy cũng sẽ nhường nhịn bạn, bao dung bạn vì con cái. Thậm chí bạn còn ngây thơ nghĩ rằng, vợ thì nên được răn dạy. Đối với cô ấy quá tốt, sẽ thành hư, đối với cô ấy không tốt, cô ấy mới biết ngoan ngoãn. Bạn ỷ vào sau khi sinh, cô ấy không còn mạnh mẽ như trước, mà ức hiếp, ghét bỏ, nhìn không vừa mắt, chưa từng cho cô ấy chút quan tâm yêu thương. Bạn ỷ vào tấm lòng yêu con của cô ấy, không muốn con phải sống trong gia đình không trọn vẹn, miệt thị, lạnh nhạt, thậm chí chỉ xem cô ấy như một bảo mẫu miễn phí. Bạn nghĩ cô ấy cứ yếu đuối dễ ức hiếp như thế mãi sao? Sao không nghĩ đến, khi đó cô ấy chỉ là không còn lựa chọn nào khác. Khi cô ấy tích góp đủ sức lực, khi cô ấy đủ mạnh mẽ, khi con cái đã trưởng thành, cô ấy sẽ không hề do dự rời bỏ bạn. Bởi vì, một tên đàn ông chỉ yêu bản thân mình, nếu không vì con cái thì chẳng có gì đáng lưu luyến cả. Cả phần đời còn lại với anh, thật sự mệt mỏi! Cả phần đời còn lại không có anh, hạnh phúc làm sao!''. Ngay sau khi đăng tải, mẩu chuyện đầy ý nghĩa này đã lập tức thu hút sự quan tâm của rất đông người dùng mạng. Phần lớn chị em phụ nữ đều đồng cảm xen lẫn xót xa trước hoàn cảnh của người làm mẹ, làm vợ.  Thành viên H.A viết: ''Phụ nữ còn yêu là còn ghen, một khi chẳng thiết tha gì nữa rồi tức là trái tim cô ấy đã chết! Nếu tiếc người nấu cơm, rửa bát thì thà thuê osin là xong, tiếc người chung chăn chung gối, cùng nhau chia ngọt sẻ bùi mới là nỗi luyến tiếc chẳng bao giờ tìm lại được''. ''Phụ nữ khi yếu đuối thì rất yếu đuối nhưng khi độc lập kiên cường thì cũng sẽ chẳng cần gì ngoài con. Khi mọi yêu thương, tha thứ và cả sự tận tụy đều không được đền đáp thì cách tốt nhất cho cô ấy chính là ra đi'', tài khoản B.V viết. Còn nickname H.N thì cho rằng: ''Hy vọng đàn ông sẽ biết trân trọng người phụ nữ ở bên mình. Người vợ trên không biết đã phải gom bao nhiêu lần thất vọng mới có thể bình thản buông tay như thế? Thật xót xa''... Hiện tại, dư âm của câu chuyện trên vẫn đang thu hút được sự quan tâm của đông đảo người dùng mạng. Theo Afamily Còn bạn bạn nghĩ sao!!! #trangtv #tranggiaitri #trangnews #trangtrai #trangdoi","1,1K",1K,11,14,9,42,1,95 bình luậ,1609667802509632,/story.php?story_fbid=1609667802509632&id=497952710347819
Trắng TV,,2019-09-19 11:52:29,"CÁ KOI CHẾT SAU 2 NGÀY THẢ SỐNG TÔ LỊCH | TRẮNG NEWS Trong sáng 19/9, tiếp tục xuất hiện xác cá Koi Nhật Bản chết sau 3 ngày được thả. Trưa 18/9, một con cá Koi Nhật Bản được phát hiện đã chết trong khi những con khác trở nên chậm chạp sau hai ngày được thả xuống bể xử lý nước sông Tô Lịch. Nói về nguyên nhân một con cá Koi chết, đại diện công ty JVE cho biết, sau khi xác nhận với bảo vệ thì bảo vệ thú nhận có lúc không để ý liên tục nên có khả năng có đối tượng phá hoại. Theo thông tin về chất lượng nước đo tại chiều 18/9, đại diện công ty JVE cho biết độ pH đo tại bể nước thả cá Koi trên sông Tô Lịch trong mức thích hợp. Theo VTV 24 #trangtv #tranggiaitri #trangnews #trangtrai #trangdoi","6,2K","4,5K","1,3K",12,37,357,10,555 bình luậ,1609544322521980,/story.php?story_fbid=1609544322521980&id=497952710347819
Trắng TV,,2019-09-19 11:18:59,"ĐIỂM DANH BẰNG MÃ QR | TRẮNG NEWS Thế này toi mấy cha đi muộn rồi ông Giáo ơi..... Nỗi ‘ám ảnh’ của sinh viên ngày càng tăng lên: điểm danh bằng quét mã QR. Thời gian điểm danh chỉ diễn ra trong 1 phút. Thời sinh viên luôn là quãng thời gian đẹp nhất của mỗi đời người. Thế nhưng, chính trong thời gian này cũng có một ‘ám ảnh kinh hoàng' khiến sinh viên nhớ mãi không nguôi - điểm danh đầu giờ. Với ai đã từng trải qua thời sinh viên, chắc chắn sẽ chẳng còn lạ gì việc đầu mỗi buổi học, thầy cô lại đọc danh sách ‘dài dằng dặc' để điểm danh xem ai đi học, ai vắng. Ngoài cách điểm danh truyền thống là đọc tên sinh viên, hay điểm danh bằng dấu vân tay, mới đây, trên MXH xuất hiện một số hình ảnh điểm danh sinh viên bằng... mã QR Hình ảnh được ghi lại bởi sinh viên Đại học Luật Hà Nội, các sinh viên điểm danh bằng cách dùng điện thoại cá nhân quét mã QR được trình chiếu trên bảng. Thời gian để mã xuất hiện và sinh viên quét mã chỉ gói gọn trong vòng 60 giây. Ngoài ra, kể cả bài tập cũng làm với cách tương tự, khi sinh viên quét mã thì nội dung bài tập sẽ hiện lên. Được biết, đây mới là thử nghiệm ở một lớp học chứ chưa được áp dụng rộng rãi toàn trường. Một số sinh viên khá hào hứng với cách làm này, tuy nhiên một số khác tỏ ra e ngại vì nếu điểm danh bằng mã QR thế này thì rất khó để... đi học muộn. 1 sinh viên ĐH Luật chia sẻ: ‘Mình thấy điểm dành bằng cách quét mã QR rất hay, tiết kiệm thời gian. Thay vì mất cả 15 - 20 phút để gọi tên theo cách truyền thống thì quét mã chỉ mất 15 - 20 giây. Tuy nhiên, cách này mới chỉ là thử nghiệm. Hy vọng rằng cách điểm danh mới này sớm được áp dụng rộng rãi.' Theo: Tiin, HLU News #trangtv #tranggiaitri #trangnews #trangtrai #trangdoi","3,5K","2,6K",809,6,12,49,,382 bình luậ,1609526185857127,/story.php?story_fbid=1609526185857127&id=497952710347819
Trắng TV,,2019-09-18 22:00:02,"""KHI SAY EM TOÀN GỌI ĐIỆN CHO NGƯỜI YÊU CŨ"" !!! 😭😭😭 Team Trắng ơi, khi say các bạn thường làm gì? Lần say nhất của các bạn là như thế nào? Hãy chia sẻ cho chúng mình biết nhé! 😂😂😂 Đừng quên xem lại video mới nhất của Trắng tại đây: 👉🏻 https://youtu.be/6XfGpiq1DqE﻿ _________  Subscribe cho Trắng TV để giúp chúng mình đạt 2.000.000 subscribe nhé! Sẽ có một video cực kì đặc biệt nhằm kỷ niệm cột mốc đáng nhớ này đó!  👉https://bit.ly/TrangDenTV  #trangtv #trangfun #trangtrai",2K,"1,8K",182,14,6,14,1,1.175 bình luậ,1608884012588011,/story.php?story_fbid=1608884012588011&id=497952710347819
Trắng TV,,2019-09-18 21:00:04,"LẦN ĐẦU.. PHÊ ?!! [Trong Trắng 115] 20:00 ngày Thứ 6, 20.09.2019 Số Trong Trắng lần này, các nhân vật của chúng ta sẽ được trải nghiệm thứ gì mà lại có thể làm cho họ ... phê được nhỉ? Team Trắng có đoán được chủ đề của số Trong Trắng 115 sắp tới không? Hãy comment bên dưới cho chúng mình biết nhé! Đừng quên đón xem vào 20:00 tối thứ 6 tuần này !!! _______________ Subscribe cho Trắng TV để giúp chúng mình đạt 2.000.000 subscribe nhé! Sẽ có một video cực kì đặc biệt nhằm kỷ niệm cột mốc đáng nhớ này đó!  👉https://bit.ly/TrangDenTV",168,151,12,1,3,1,,22 bình luậ,1608888075920938,/story.php?story_fbid=1608888075920938&id=497952710347819
"Trắng TV,D'.Palais Louis",D'.Palais Louis,2019-09-16 15:37:50,"KIẾM 100 TRIỆU ĐƠN GIẢN CHỈ VỚI MỘT CÂU SLOGAN CHẤT  Triệu hồi các bác có hay viết status chất lừ nhé! Nếu các bác đã có dịp vi vu qua Nguyễn Văn Huyên, chắc hẳn đều ấn tượng với tòa nhà tân cổ điển mang tên D'. Palais Louis thuộc Tân Hoàng Minh phải không?? Tòa nhà tráng lệ được ví như ly rượu vang ủ 10 năm, càng ủ càng thơm nồng này đang rất cần có sự góp sức sáng tạo của các thánh văn thơ đây ạ!  Kiếm giải dễ dàng ngon ơ chỉ bằng vài phút động não, tổng giá trị giải thưởng 130 TRIỆU ĐỒNG với một câu Slogan phù hợp dự án. Cuộc thi đang diễn ra rất sôi động, thông tin hành lang từ ban giám khảo là có vài câu slogan khá đỉnh khá ngon rồi đó. Đừng để vụt mất cơ hội rinh quà to, tham gia ngay cùng TRẮNG TV thôi nào các tình yêu ơi!  https://www.facebook.com/dpalaislouis.vn/photos/a.368469590261471/738274519947641/?type=3&theater💥 ĐÁNH THỨC SÁNG TẠO - BAO TRỌN QUÀ KHỦNG 💥 🛎Giờ vàng đã điểm, tổng giải thưởng 𝟏𝟑𝟎.𝟎𝟎𝟎.𝟎𝟎𝟎 đồng tiền mặt của cuộc thi “𝐒á𝐧𝐠 𝐭á𝐜 𝐒𝐥𝐨𝐠𝐚𝐧 𝐜𝐡𝐨 𝐝ự á𝐧 𝐃'. 𝐏𝐚𝐥𝐚𝐢𝐬 𝐋𝐨𝐮𝐢𝐬” chính thức bắt đầu tìm kiếm người xứng đáng. Ai sẽ là chủ nhân của giải Nhất 𝟏𝟎𝟎.𝟎𝟎𝟎.𝟎𝟎𝟎 đồng tiền mặt? 💎Một bước trở thành Triệu Phú >>> Tham dự ngay cùng TÂN HOÀNG MINH 🎉🎉Cơ hội rộng mở cho tất cả người dân Việt Nam thân yêu. ➤ Chỉ cần bạn đầu tư chất xám, sáng tạo ra #Slogan thật hay rồi gửi ngay về cho BTC là có cơ hội ẵm giải thưởng cực lớn từ Tân Hoàng Minh – Một trong những Tập đoàn bất động sản hàng đầu Việt Nam. 💥Hãy BỨT PHÁ SÁNG TẠO – TƯ DUY THÔNG MINH để rinh giải KHỦNG. >>> Cùng Ad tìm hiểu thông tin chi tiết cuộc thi nhé! ✦ Ban tổ chức: Tập đoàn Tân Hoàng Minh ✦ Thời gian: Từ 16/09/2019 - 5/10/2019 ( Thời gian nhận bài dự thi từ ngày 16/09 đến 23/09 năm 2019) ✦ Phạm vi: Toàn quốc ✦ Đối tượng tham gia: Công dân Việt Nam hoặc người nước ngoài sinh sống và làm việc tại Việt Nam ⛳𝐘Ê𝐔 𝐂Ầ𝐔 - Slogan có độ dài không quá 10 từ, viết bằng tiếng Việt chuẩn, không sử dụng từ địa phương, từ lóng, tiếng nước ngoài. - Mỗi Slogan dự thi phải có một đoạn văn ngắn (không quá 500 từ) diễn giải về ý tưởng. - Nội dung giàu ý nghĩa, dễ nhớ, dễ hiểu, truyền tải được thông điệp, giá trị cốt lõi của dự án và chủ đầu tư Tân Hoàng Minh. - Bài dự thi phải đảm bảo tính độc đáo, ấn tượng, không giống, không lẫn, không sao chép, mô phỏng, sửa chữa, tương tự, trùng lặp, gây nhầm lẫn với slogan của các tổ chức, cá nhân trong và ngoài nước. - Slogan dự thi chưa được sử dụng, xuất hiện trên bất kỳ phương tiện thông tin đại chúng nào tại trong và ngoài nước, không là đối tượng tranh chấp bản quyền tác giả. - Sản phẩm dự thi không được vi phạm thuần phong mỹ tục Việt Nam, có nội dung xấu hay xuyên tạc, sử dụng các câu trong các tác phẩm văn học, bài hát... 📍𝐇Ì𝐍𝐇 𝐓𝐇Ứ𝐂 𝐓𝐇𝐀𝐌 𝐃Ự - Vòng Sơ khảo Người tham dự gửi bài dự thi cho BTC về email: banpr@tanhoangminh.com.vn với đầy đủ thông tin cá nhân (họ tên, ngày tháng năm sinh, CMND, địa chỉ, nghề nghiệp). Tiêu đề ghi rõ: Bài tham gia cuộc thi “Sáng tác Slogan cho dự án D'. Palais Louis”. 📥Nội dung Email: Slogan dự thi: """"................."""" Người dự thi: Nguyễn Văn A. Ngày tháng năm sinh:.............. Số điện thoại:.......................... Địa chỉ:................................. Số CMND:............................. Nghề nghiệp: .......................... 🎗Vòng Chấm điểm: Dựa trên số lượng các bài dự thi gửi về cho BTC, Ban Giám khảo của cuộc thi sẽ chấm điểm và lựa chọn ra 15 Slogan xuất sắc nhất để tham gia Vòng thi bình chọn trên Fangage dự án D'. Palais Louis. 🎗Vòng Bình chọn: BTC sẽ đăng tải slogan dự thi lên fanpage của dự án D'. Palais Louis: https://www.facebook.com/dpalaislouis.vn/ Thí sinh kêu gọi bình chọn để có cơ hội sở hữu những giải thưởng hấp dẫn. 🎁 𝐂Ơ 𝐂Ấ𝐔 𝐆𝐈Ả𝐈 𝐓𝐇ƯỞ𝐍𝐆 - 01 Giải nhất: 100,000,000 VNĐ - 03 Giải nhì: 10,000,000 VNĐ Người trúng giải nhất sẽ tự chịu mọi chi phí liên quan: thuế thu nhập cá nhân tính dựa trên giải thưởng, chi phí đi nhận giải. Đối với 3 giải nhì, BTC sẽ gửi giải thưởng qua đường bưu điện đối với những thí sinh ở ngoài khu vực Hà Nội. ⚠𝐋Ư𝐔 Ý 𝐂𝐇𝐔𝐍𝐆 𝐂𝐔Ộ𝐂 𝐓𝐇𝐈 - 1 người gửi 1 slogan dự thi - Bài dự thi trúng giải có câu khẩu hiệu (slogan) phải do chính người dự thi viết, không được sao chép của người khác, thương hiệu khác, dịch hoặc chuyển thể từ câu khẩu hiệu của thương hiệu khác. - Nếu BTC phát hiện hoặc nghi vấn đối với bất kì bài dự thi nào, BTC có quyền loại bỏ hoặc từ chối quyền dự thi của người tham gia - BTC có quyền sử dụng bài thi này cho bất kì mục đích nào mà không phải xin phép hay mua lại từ phía người dự thi - Trong trường hợp bài dự thi của những người tham gia có nội dung giống nhau, bài dự thi gửi đến Ban tổ chức trước sẽ là bài được lựa chọn. - Quyết định của ban tổ chức (BTC) là quyết định cuối cùng. BTC có quyền tạm ngưng hoặc thay đổi mọi quy định và thể lệ có liên quan đến cuộc thi mà không cần thông báo trước .  Top 15 slogan đã được lọt bình chọn vui lòng xem tại : https://www.facebook.com/dpalaislouis.vn/posts/744471205994639  🏢________Tập đoàn Tân Hoàng Minh________🏢",1K,1K,3,1,1,,,9 bình luậ,1608877982588614,/story.php?story_fbid=1608877982588614&id=497952710347819
Trắng TV,,2019-09-18 15:37:39,"TAY DƠ THÌ LẤY NƯỚC RỬA, NƯỚC DƠ THÌ PHẢI LẤY MÁU MÀ RỬA, HIỂU KHÔNG !? | TRẮNG TRẢI Giai thoại kể rằng, vào mùa hè, Vua Duy Tân thường ra nghỉ mát ở Cửa Tùng, một cửa biển đẹp ở Quảng Trị. Một hôm nhà vua từ bãi tắm lên, hai tay dính đầy cát, viên thị vệ bưng lại một thau nước ngọt mời vua rửa tay. Nhà vua vừa rửa tay vừa hỏi đùa: - Tay dơ thì lấy nước mà rửa, còn “nước” bẩn lấy chi mà rửa? Viên thị vệ lúng túng chưa biết trả lời sao thì Vua hỏi tiếp: - Nước bẩn thì làm thế nào cho sạch? Người thị vệ vẫn không trả lời được. Vua Duy Tân bèn nói: - ""Nước dơ thì phải lấy máu mà rửa, hiểu không?"" Viên thị vệ đâu có ngờ nhà vua chơi chữ, chuyển từ nước rửa tay sang một thứ nước khác ngàn lần đáng quý trọng là đất nước, là quê hương. Khi đất nước bị dơ bẩn bởi sự chà đạp của ngoại bang thì không thể rửa sạch bằng nước mà phải rửa bằng máu. Về sau, vua Duy Tân đã đứng lên hô hào toàn dân khởi nghĩa, lấy máu đào rửa cho sạch cái nhục vong quốc. Với vua ""Có mắt mà không thấy dân khổ là Mù - có tai mà không nghe dân than là Điếc - có miệng mà không dám lên tiếng bảo vệ dân,chống lại cường quyền là Câm!"" Tuy nhiên, khi hợp sức với tổ chức Việt Nam Quang Phục hội để bàn tính chuyện đánh Pháp, do kế hoạch bị lộ, vua bị bắt giam. Khi toàn quyền Pháp ở Hà Nội đích thân ra gặp và dụ dỗ, vua vẫn thủy chung trả lời: “Các ngài muốn buộc tôi làm vua nước Nam, thì hãy coi tôi là một ông vua trưởng thành và có quyền tự do hành động, nhất là quyền tự do trao đổi thư tín và chính kiến với chính phủ Pháp”. Nằm trong ""bộ ba"" ông vua yêu nước của thời Pháp đô hộ, vua Duy Tân là điểm sáng của hậu duệ Nguyễn Phúc Ánh, và góp phần đem lại cái nhìn công tâm hơn của người đời dành cho Nguyễn triều! Theo IFact #trangtv #tranggiaitri #trangnews #trangtrai #trangdoi","5,9K","5,5K",31,376,14,54,1,70 bình luậ,1608749825934763,/story.php?story_fbid=1608749825934763&id=497952710347819
