source,shared_from,date,text,reactions,likes,ahah,love,wow,sigh,grrr,comments,post_id,url
Trắng TV,,2019-09-03 20:00:02,"[TRẮNG TRẢI NGƯỜI YÊU CŨ] SAU CHIA TAY CÓ NÊN THÙ GHÉT NHAU!? Hầu như ai lúc mới chia tay cũng chẳng muốn nhìn mặt, sợ vì nhìn thấy nhau sẽ sinh ra cảm giác cũ, cái cảm giác buồn thương tiếc nuối. Nhưng qua một thời gian dài, tập quen cách sống vì bản thân, bỏ đi một thói quen vì nhau, chờ đợi phút giây tái ngộ... Thì sao!? Lúc ấy có còn sự ghét bỏ, sự vương vấn nữa hay không!? Mình có thể quay lại giai đoạn làm bạn nữa không!? Ý kiến của bạn đó!! Còn Trắng TV hôm nay có câu chuyện tan vỡ nhưng cái kết hạnh phúc dành cho cả hai người. Dù chẳng phải là hạnh phúc lứa đôi nhưng lại là hạnh phúc của bản thân khi đã chấp nhận và đặc biệt, chẳng còn bất kỳ sự hận thù nào trong nhau!!! Link Youtube nè: https://www.youtube.com/watch?v=ISoTyJFip5U _____________ Nhớ like và Subscribe giúp TRẮNG TV đạt 2.000.000 subscribe nhé! 👍🏻https://bit.ly/TrangDenTV #trắngtv #trắngtrải #ngườiyêucũ",550,477,53,18,2,,,78 bình luậ,1595374450605634,/story.php?story_fbid=1595374450605634&id=497952710347819
Trắng TV,,2019-09-03 17:38:48,"[TRẮNG TRẢI] NHỮNG CUỐN TRUYỆN TRANH THẦN THÁNH CẤT ĐẦY CẶP, TRÙM CHĂN ĐỌC TRỘM CỦA THẾ HỆ 8X, 9X Trong số những truyện tranh 'thần thánh' ngày xưa mà bất cứ đứa trẻ nào cũng yêu thích, săn lùng để đọc, giờ đây, chỉ còn những cái tên quen thuộc như Conan, Doraemon. Thế nhưng, chắc hẳn những ai thuộc thế hệ 8X, 9X vẫn không thể quên những bộ truyện đã 'làm mưa làm gió' suốt những năm tháng tuổi thơ của mình như: Dũng sĩ Hesman, Dấu ấn rồng thiêng, 7 viên ngọc rồng, Siêu quậy Teppi, Vua trò chơi, Bác sĩ quái dị Black Jack, Nữ hoàng Ai Cập... Cái thời 'huy hoàng' ấy, hầu như đứa trẻ nào cũng say mê với những cuốn truyện này. Bố mẹ cho tiền ăn sáng không dám ăn mà để dành mua truyện, bị bố mẹ đánh đòn vì tội trốn học cày truyện là những kỷ niệm giờ đã trở thành những ký ức đẹp. Và chắc hẳn, cả 'tuổi thơ dữ dội' của bạn sẽ ùa về khi xem bộ ảnh do anh Phạm Quốc Hiếu (31 tuổi, ở Đồng Hới, Quảng Bình) thực hiện. Người đàn ông thuộc thế hệ 8X chia sẻ, đây là những cuốn truyện đã gắn bó với tuổi thơ trốn học, gom lon bia dành tiền mua truyện của anh. Anh Hiếu còn cho biết thêm, có lần, do mải đọc truyện không lo học, anh đã bị bố xé hết truyện trong lúc tức giận. Sau đó, vì xót quá nên anh đã lấy băng dính ngồi dán lại từng tờ. Hiện những cuốn truyện tranh từ thuở xưa vẫn được anh nâng niu, cất giữ cẩn thận. Và còn rất nhiều những truyện tranh khác như Dấu ấn rồng thiêng, Nữ hoàng Ai cập, Cơn lốc sân cỏ, Jindo, Cô bé hạt tiêu Chie, Ninja loạn thị, Nhóc Maruko, Vua Hải Tặc... đều rất được những đứa trẻ ngày ấy say mê và xem như là 'kho báu' khi mua được truyện. Đố bạn kể thêm những truyện tranh tuổi thơ nào bạn đã từng đọc qua nhé!!! Theo Tiin",449,410,11,26,1,1,,54 bình luậ,1595367747272971,/story.php?story_fbid=1595367747272971&id=497952710347819
Trắng TV,,2019-09-03 10:15:29,"[TRẮNG NEWS] HÔM NAY CHÍNH LÀ SINH NHẬT CỦA DORAEMON - CHÚ MÈO MÁY NỔI TIẾNG NHẤT THẾ GIỚI! Trong kí ức của biết bao thế hệ người trẻ châu Á, Doraemon đã, đang và sẽ luôn là người bạn không thể thiếu được trong tuổi thơ của mỗi người. Nhắc đến nhân vật này là người ta lại nhớ ngay đến hình ảnh của một chú mèo máy tròn ủm với đôi bàn tay như hai cái bánh bao cùng tính cách gần gũi, tốt bụng và lúc nào cũng hết mình vì bạn bè xung quanh, đặc biệt là với anh bạn Nobita. Hôm nay (3/9) chính là ""ngày sinh"" của Doraemon, hay nói đúng hơn, thì đây chính là ngày mà Doraemon... sẽ được sinh ra. Trong bộ truyện của tác giả Fujiko Fujio, chú mèo máy này là một sản phẩm của con người trong tương lai. Cụ thể hơn, Doraemon được sinh vào ngày 3/9/2112 (thuộc thế kỉ XXII).  Do thắc mắc hoàn cảnh sa sút của gia đình Sewashi, Doraemon đã dùng Cỗ máy thời gian quay lại quá khứ vào thế kỉ XX (20) để tìm hiểu lý do. Cậu đã phát hiện ra nguyên nhân là Nobi Nobita - cụ tổ của Sewashi - do hậu đậu vụng về nên sau này khiến cho đời sống con cháu cũng khó khăn theo. Vậy là Doraemon quyết định đến sống cùng Nobita để giúp đỡ, hướng dẫn và chăm sóc cậu ta trong những lúc khó khăn. Chính từ đây mà tình bạn giữa chú mèo máy cùng cậu nam sinh ""đụng đâu hỏng đó"" bắt đầu nảy nở.  Điều đó đồng nghĩa rằng hôm nay chính là ""sinh nhật""... -94 của người bạn đáng yêu này. Nếu bạn còn nhớ thì lúc sinh ra, Doraemon có màu vàng cùng hai cái tai khá lớn. Tuy nhiên sau đó phần tai này đã bị chuột... gặm mất, vì quá buồn nên anh chàng này cũng chuyển thành màu xanh luôn.  Vào ngày hôm nay, rất nhiều những fanpage lớn nhỏ về truyện tranh trên thế giới đã đăng bài chúc mừng ngày đặc biệt của mèo máy Doraemon. Bên dưới mỗi bài viết là rất nhiều những bình luận xúc động về người bạn này. Một fan của Doraemon tên Ajimo Shika chia sẻ: ""Bận rộn quá nên lâu lắm rồi mình không đọc Doraemon. Ngày đó coi mấy tập truyện ngắn mà cứ ngẩn ngơ mãi vì trí tưởng tượng của tác giả lẫn sự dễ thương của các nhân vật. Đến lúc coi truyện dài thì lại xúc động và khóc hết nước mắt vì những hành trình đẹp cùng tình bạn đáng nể của ""đội quân nhí nhố"". Chắc tối nay phải coi lại Doraemon thôi!""  Cùng gửi những lời chúc đến với chú mèo máy cung Xử Nữ nổi tiếng nhất thế giới nhé!  Theo Kênh14",5K,4K,72,898,6,3,,397 bình luậ,1595161997293546,/story.php?story_fbid=1595161997293546&id=497952710347819
Trắng TV,,2019-09-03 09:42:19,"[TRẮNG NEWS] XƯỞNG ĐỒ CHƠI Ở HÀ NỘI BỐC CHÁY NGÙN NGỤT TỐI 2/9 Khoảng 19h30 ngày 2/9 tại khu nhà xưởng sản xuất đồ chơi tại đội 7, xã Ngọc Hồi, Thanh Trì (nằm trên đường ven khu công nghiệp Ngọc Hồi) xảy ra vụ hoả hoạn. Nhận được tin báo, khoảng 6 xe cứu hỏa cùng gần 50 cán bộ, chiến sĩ PCCC được huy động đến hiện trường dập lửa. Lực lượng chức năng huyện Thanh Trì được huy động để làm nhiệm vụ bảo vệ hiện trường, hỗ trợ các lực lượng tham gia chữa cháy. Đến 21h cùng ngày, lửa cơ bản được khống chế nhưng bên trong kho, khói vẫn mịt mù và bốc mùi khét lẹt.  Một người dân kể lại, thời điểm lửa bùng cháy, 1 chiếc xe bán tải bị lửa thiêu rụi, lực lượng PCCC phải dùng xe ủi phá tường tôn do khu xưởng khóa kín để dập lửa. Vụ việc không có thiệt hại về người, cơ quan chức năng đang điều tra, làm rõ nguyên nhân. Theo Dân trí #TrắngTV #TrắngNews #TrắngTrải #TrắngĐời",476,431,1,1,3,40,,33 bình luậ,1595138307295915,/story.php?story_fbid=1595138307295915&id=497952710347819
Trắng TV,,2019-09-02 21:03:33,Vèo cái đã hết 3 ngày nghỉ Lễ rồi! 😂😂 Kỳ nghỉ của bạn như thế nào? #trangtv #teamnghilechadidau,"1,2K",968,211,9,5,56,2,212 bình luậ,1594647604011652,/story.php?story_fbid=1594647604011652&id=497952710347819
Trắng TV,,2019-09-02 20:00:02,"YÊU XA KHÓ HAY NIỀM TIN KHÔNG BỀN!? Người ta bảo thật là dại khờ nếu cứ chờ đợi vào tình yêu nào đó xa xôi ngoài kia. Nhưng chẳng ai biết rằng cứ yêu vào là sẽ khờ đi, ngốc nghếch và đáng yêu hơn thường ngày. Tình yêu hay lắm, nó chẳng làm ta đi đúng hướng, lý trí cũng như tên say rượu mà nhường cho trái tim tỉnh táo dẫn đường… Nhưng bạn ạ, tình yêu kỳ diệu lắm, nếu cho đi niềm tin và gieo đúng chỗ, nó sẽ mọc thành cây hạnh phúc mà chưa bao giờ biết đến loại quả nào ngọt đến vậy. Như cặp đôi dưới đây, họ đã gặp những gì, bất đồng những gì và họ đã cùng nhau vun vén như thế nào. Cùng xem số mới nhất của Trắng TV nhé!!! 👉🏻 Xem full [TRẮNG TRẢI 59] tại đây: https://youtu.be/PxOwu25tXlo _____________ Nhớ like và Subscribe giúp TRẮNG TV đạt 2.000.000 subscribe nhé! 👍🏻https://bit.ly/TrangDenTV #trắngtv #trắngtrải #yêuxa",312,267,12,25,1,7,,21 bình luậ,1592773697532376,/story.php?story_fbid=1592773697532376&id=497952710347819
Trắng TV,,2019-09-02 16:44:40,"[TRẮNG ĐỜI] NHỮNG NGÀY TRƯỚC KHI BÁC MẤT Trong những ngày ốm, khi tỉnh lại sau mỗi lần cấp cứu, Bác lại hỏi han: Nước sông Hồng đã xuống chưa? Hôm nay đồng bào miền Nam đánh thắng ở đâu?... Ông Trần Viết Hoàn - nguyên Giám đốc Khu di tích Chủ tịch Hồ Chí Minh tại Phủ Chủ tịch - là người trực tiếp canh gác, bảo vệ Bác Hồ trong những ngày Bác ốm. Khi Bác mất, ông cũng là một trong số những chiến sĩ công an ở lại để tiếp tục trông nom di sản của Người. Kỷ niệm 50 năm ngày Bác Hồ đi xa, ông Trần Viết Hoàn kể lại nhiều kỷ niệm về giây phút xúc động trong những ngày cuối cùng của Bác Hồ. 16h ngày 12/8/1969, Bác Hồ gặp đồng chí Lê Đức Thọ tại nhà nghỉ Hồ Tây để nghe báo cáo tình hình Hội nghị Paris. Đêm hôm đó, Bác lên cơn sốt và ho, rồi những ngày sau, Bác ho nhiều hơn, sốt nặng hơn. Nhưng Bác vẫn lên xuống nhà sàn gắng gượng làm việc. Theo đề nghị của bác sĩ, tối 17/8/1969, Bác Hồ không làm việc ở nhà sàn nữa, Người xuống ở và làm việc tại ngôi nhà nhỏ phía sau nhà sàn. Đây là ngôi nhà mà Bộ Chính trị đã quyết định làm cho Bác trong những ngày tháng 5/1967 khi Bác sang Trung Quốc để chữa bệnh, với mục đích để bảo đảm an toàn cho Bác trong những năm máy bay giặc Mỹ bắn phá Hà Nội. Nhưng Bác không nhận sử dụng riêng cho mình, Bác nói: “Khi nào có nhiều đồng chí phụ trách đến làm việc với Bác thì họp ở nhà ấy cho chắc chắn. Còn lúc ở một mình, Bác cứ ở nhà sàn gỗ này thôi. Các chú lo cho Bác, cũng phải lo cho dân. Dân chịu được thế nào, Bác chịu được như vậy”. Một ngày Bác ốm nặng, nhưng Bác rất vui khi nghe báo cáo về Nghị quyết của Bộ Chính trị về kỷ niệm 4 ngày lễ lớn trong năm 1970. Bác nói với một đồng chí Ủy viên Bộ Chính trị: “Các chú nên bàn cho kỹ, còn ý kiến của Bác, Bác không đồng ý đưa ngày 19/5 là ngày kỷ niệm lớn trong năm 1970 (ngày 19/5 chính là ngày sinh nhật Bác). “Hiện nay, các cháu học sinh sắp bước vào năm học mới, giấy mực, tiền bạc dùng để tuyên truyền về ngày sinh của Bác thì các chú nên dành để in sách giáo khoa và mua dụng cụ học tập cho các cháu, khỏi lãng phí...”, Bác dặn. Những ngày tháng 8/1969, trời mưa to, mực nước sông Hồng lên cao, trong lúc Bác đang lâm bệnh, Trung ương mời Bác lên ATK (an toàn khu) đề phòng đê sông Hồng vỡ gây lụt lội. Nhưng Bác bảo: “Bác không thể bỏ dân, trước hết hãy lo cho dân”. Vì vậy, Trung ương đã chuẩn bị xe lội nước để đưa Bác lên ATK nếu Hà Nội bị lụt và đằng sau xe Bác có nhiều xe lội nước khác để cứu dân. Cho dù ở thời khắc nghiệt ngã của quy luật cuộc đời, Bác Hồ vẫn chăm lo trọn vẹn bổn phận của mình đối với ngày kỷ niệm Cách mạng tháng Tám và ngày Quốc khánh 2/9/1969. Ngày 1/9/1969, Bác rất mệt, cũng có lúc tỉnh táo và nhanh nhẹn hơn, tự tay bưng và ăn được chén con long nhãn. Những ngày Bác ốm, mỗi lần tỉnh dậy sau cấp cứu, Bác hỏi han mọi việc, mà điều đầu tiên Bác hỏi: Nước sông Hồng đã xuống chưa? Hôm nay đồng bào miền Nam đánh thắng ở đâu?... Ngày 29/8/1969, Bác nói với Thủ tướng Phạm Văn Đồng rằng lễ Quốc khánh, Bác sẽ ra dự mươi mười lăm phút. Nhưng 9h ngày 2/9/1969, Bác bị một cơn đau tim rất nặng, các giáo sư, bác sĩ Việt Nam và Trung Quốc phải thực hiện cấp cứu cho Bác. Đến 9h47, đồng chí Phạm Văn Đồng trào nước mắt: “Thôi các đồng chí ạ, Bác của chúng ta không qua khỏi nữa rồi”. Thế là, 9h47 ngày 2/9/1969 truyền đến cho nhân loại một nỗi đau, Bác Hồ ra đi mãi mãi để cho “đời tuôn nước mắt, trời tuôn mưa”. Ngày 2/9 thật linh thiêng làm sao. 2/9/1945, Bác Hồ đã cứu dân tộc khỏi kiếp khổ nạn, mang lại độc lập, tự do, hạnh phúc cho mọi người, thì ngày đó 24 năm sau, Người lại ra đi. Con số 9 cũng linh thiêng làm sao, khi 9h ngày 10/5/1965, Bác viết những dòng đầu tiên của bản Di chúc để lại những lời dặn dò cho hậu thế. 9h ngày 10/5/1969, Bác đã hoàn tất trọn vẹn những điều dặn lại cho mai sau. 9h ngày 19/5/1969, Bác xem lại lần cuối cùng những điều “gửi lại muôn vàn tình thân yêu” cho cháu con. Và 9h47 ngày 2/9/1969, Bác ra đi, hưởng thọ 79 tuổi. Ngày 9/9/1969, cả dân tộc làm lễ truy điệu để tiễn đưa Người về thế giới người hiền. Trong những ngày Bác yếu, hàng ngày xe cộ ra vào nhiều, đưa các đồng chí Trung ương vào thăm Bác, đưa các bác sĩ vào chữa bệnh cho Bác... nên người dân dự đoán rằng có thể Bác ốm. Vì thế, có nhiều người dân đến cổng đỏ (cổng ra vào Phủ Chủ tịch, hàng ngày Bác vẫn thường đi lại cổng này), nói lên một tâm nguyện: “Nếu đúng Bác ốm, chúng tôi xin hiến trái tim của mình để thay tim cho Bác”. Từ ngày 3 đến 6/9/1969, dòng người không lúc nào vắng, ai nấy đều nước mắt tuôn trào, buồn rầu, đội mưa thầm lặng, trật tự đi đến lễ đài Ba Đình để viếng ảnh Bác. Và những ngày thi hài Bác quàn trong quan tài kính đặt tại Hội trường Ba Đình, vì đông người vào viếng nên các cháu thiếu nhi không vào viếng Bác được, thế là các cháu cứ khóc lóc với các chú công an làm nhiệm vụ bảo vệ ngoài hội trường “các chú trả Bác cho chúng cháu đây”. Trước đó, lúc trở bệnh, Người đề nghị được uống chút nước dừa. Như hiểu được lòng của Bác, thư ký riêng của Bác - đồng chí Vũ Kỳ - nói với mấy anh em bảo vệ chúng tôi ra hai cây dừa trước nhà sàn lấy ở mỗi cây một trái, bổ ra hoà nước vào một chiếc cốc và tách ở mỗi trái một miếng cùi dừa bày vào đĩa, đưa lên cho Bác. Đó là hai cây dừa giống miền Nam hàng ngày Bác vẫn chăm bón. Bác đã nhấp một chút nước dừa để coi như được mang theo mình vào cõi trường sinh “nỗi nhớ miền Nam - nỗi nhớ nhà”... Theo Zing","2,9K","2,3K",12,408,1,234,,39 bình luậ,1594492090693870,/story.php?story_fbid=1594492090693870&id=497952710347819
Trắng TV,,2019-09-02 11:50:27,"[TRẮNG NEWS ĐẶC BIỆT] KỶ NIỆM QUỐC KHÁNH VÀ TINH THẦN DÂN TỘC VIỆT NAM BẤT DIỆT Tuyên ngôn Độc lập bất hủ 2-9-1945 đã mở ra một kỷ nguyên mới, lần đầu tiên người dân Việt Nam có quyền tự hào mình đã trở thành công dân của một nước tự do và độc lập. Cũng với Tuyên ngôn 2-9, nhiều dân tộc bị áp bức trên thế giới đã nhìn thấy con đường mà mình dân tộc mình có thể lựa chọn trong sự nghiệp đấu tranh giải phóng dân tộc. Ngày 2/9/1945 trở thành mốc son trong lịch sử đấu tranh giành độc lập của dân tộc. Đánh dấu sự ra đời của nước Việt Nam Dân chủ Cộng hòa, nhà nước công – nông đầu tiên ở Đông Nam Á. Từ đây, một kỷ nguyên mới đã mở ra cho dân tộc Việt Nam. Kỷ nguyên độc lập dân tộc gắn liền với chủ nghĩa xã hội. Và trong tâm khảm mỗi người dân Việt Nam, tinh thần của ngày Quốc khánh 2-9 sẽ đời đời bất diệt. Khát vọng hòa bình và tinh thần ấy của Tuyên ngôn độc lập ngày 2/9/1945 mãi mãi khắc sâu vào trái tim và khối óc của mỗi con người Việt Nam và đây là nguồn động viên lớn để khơi dậy lòng nhiệt huyết của thế hệ hôm nay quyết giữ vững nền độc lập tự do. #TrắngTV #TrắngNews #TrắngTrải #TrắngĐời",368,334,,34,,,,6 bình luậ,1594339044042508,/story.php?story_fbid=1594339044042508&id=497952710347819
Trắng TV,,2019-09-01 21:07:52,"[TRẮNG TRẢI] CON GÁI KHI YÊU NGƯỜI KÉM TUỔI… Con gái chúng mình khi yêu bố mẹ thường nhắc nhở: “Yêu người lớn tuổi thôi nhé, vì người ta lớn hơn mình có thể chở che, chăm sóc, biết nhường nhịn và không còn bốc đồng so với những cậu bé khác vì con gái suy nghĩ thường lớn hơn tuổi mà!!” Cũng đúng như vậy, khi yêu một cậu bé, mình cần nhiều sự tha thứ cho tuổi mải chơi của cậu hơn. Phải trưởng thành cả khi yêu lẫn khi bước qua một mối tình, phải đợi chờ cho cậu bé ấy lớn từng ngày, mà việc này thật vất vả… Cậu còn cứng đầu, bướng bỉnh luôn cho những điều mình làm là đúng mà chẳng bao giờ nghe mình - dù mình hơn tuổi cậu. Yêu người kém tuổi khổ thế ấy, nhưng đâu mỗi khổ thôi, hạnh phúc cũng có, dù cậu đôi lúc hay trêu chọc nhưng những điều ấy làm ngày của mình thêm rạng rỡ hơn. Vì cậu luôn vui vẻ và thích hát nên cảm giác cuộc sống cũng tươi trẻ vài phần… Con gái yêu người kém tuổi thế nào, chia sẻ với chúng mình nhé!!! Còn hôm nay Trắng TV cũng kể một câu chuyện như thế, một cậu bé yêu một người trưởng thành. Link Youtube: https://www.youtube.com/watch?v=PxOwu25tXlo&t=449s Nhớ like và Subscribe cho Trắng TV để xem được nhiều hơn nha :> #trắngtv #trắngtrải #yêuxa",607,532,64,9,1,,1,157 bình luậ,1593827560760323,/story.php?story_fbid=1593827560760323&id=497952710347819
Trắng TV,,2019-09-01 20:00:05,"NẾU MỘT NGÀY EM NGẢ NGHIÊNG VÌ AI ĐÓ KHÁC, MONG ANH SẼ GIỮ CHẶT EM LẠI…❤️ Một cặp đôi yêu lâu và yêu xa thì chắc chắn có nhiều vấn đề hơn tất thảy những cặp đôi bình thường. Việc “ngả nghiêng” một ai đó khác trong mối tình chúng mình, ai ở ngoài cũng đều nghĩ chẳng chấp nhận được, nhưng vì được nhận trách nhiệm tin tưởng và nuôi dưỡng tình cảm đó, mong một trong hai người sẽ níu lại. Chẳng vì những gì mình bỏ ra mà sợ hối hận những gì mình bỏ qua nhé…. Cùng gặp cặp đôi Linh và Jacob và câu chuyện yêu xa 3 năm của họ nhé. Tăng thêm niềm tin vào ai đó sẽ yêu thương bạn và cũng nhìn bạn đầy yêu thương như Jacob nhé!!! ❤️ 👉🏻 Xem full [TRẮNG TRẢI 59] tại đây: https://youtu.be/PxOwu25tXlo _____________ Nhớ like và Subscribe giúp TRẮNG TV đạt 2.000.000 subscribe nhé! 👍🏻https://bit.ly/TrangDenTV #trắngtv #trắngtrải #yêuxa",388,342,11,30,3,2,,34 bình luậ,1592772350865844,/story.php?story_fbid=1592772350865844&id=497952710347819
