source,shared_from,date,text,reactions,likes,ahah,love,wow,sigh,grrr,comments,post_id,url,share
Việt Hương,,2019-11-28 08:35:01,"Thắp nhang lạy các thánh nợ, trả tiền em, SẮP TẾT ...khi mượn nợ, nội ngoại hàng xóm em nó cũng biết, khi trả nó hỏi mình tên gì? Khi mượn nó nói nhiêu mình đưa nhiêu, khi trả nó trả nhiêu mình mừng nhận được bao nhiêu tuỳ lòng thương của nó. Em cũng  bái em luôn, nói cho vui,chứ người ta thường kết 1 câu tươi xanh, ngu ráng chịu ai biểu cho mượn.","5,1K","4,1K",790,202,6,6,,218 bình luậ,2598219093566057,/story.php?story_fbid=2598219093566057&id=241141239273866,Lưu
Việt Hương,,2019-11-27 11:37:49,"Sáng sớm thấy anh ấy gởi hình con gái hái ổi mà tinh thần lên cao kk. Con lớn quá, ổi lạ quá dính líu ríu luôn,cây ổi 1000 trái là có thiệt, 1m rưỡi đẻ 1m7 là sắp có thiệt kkk.",18K,17K,315,"1,1K",62,1,,450 bình luậ,2596056040449029,/story.php?story_fbid=2596056040449029&id=241141239273866,Lưu
Việt Hương,,2019-11-26 15:19:14,Mỹ gọi: 7148542930 Việt Nam gọi: 1800545484,3K,"2,5K",35,478,2,,,816 bình luậ,489319011681053,/story.php?story_fbid=489319011681053&id=241141239273866,Lưu
Việt Hương,,2019-11-26 15:07:20,Hú hú,"3,2K","2,7K",33,454,7,,1,427 bình luậ,2495949730681722,/story.php?story_fbid=2495949730681722&id=241141239273866,Lưu
Việt Hương,,2019-11-26 09:30:09,"Cỡ 65 tuổi như em mà ta nói mặt sáng tài, không vết Nám à nha. Mua chưa??? USA gọi: 7148542930 VN gọi: 1800545484 #Huongthicosmetic #Viethuong","Khả Như Trần và 2,8K người khác","2,5K",61,256,3,,,153 bình luậ,2593542324033734,/story.php?story_fbid=2593542324033734&id=241141239273866,Lưu
Việt Hương,,2019-11-25 15:37:45,"Còn 2 tháng nữa TẾT, nói gì nữa 4tuần là thay đổi, 8tuần (là 2 tháng) mặt sáng bừng hết NÁM. Xuất sắc chưa??? #viethuong #HuongThiCosmetic","2,2K",2K,4,193,3,,,156 bình luậ,2591853124202654,/story.php?story_fbid=2591853124202654&id=241141239273866,Lưu
Việt Hương,,2019-11-25 06:33:31,"Nó ngon thật sự quên mập kkk,em ăn mà kế bên anh tây ảnh nhìn say mê, chắc tại em đẹp! kkkkkkkkkk,chào buổi sáng cả nhà em Việt Nam rồi.","Khả Như Trần và 5,7K người khác","5,2K",71,411,5,,,206 bình luậ,2591064300948203,/story.php?story_fbid=2591064300948203&id=241141239273866,Lưu
Việt Hương,,2019-11-23 13:41:24,Thương chưa...rồi 2 đứa đã lấy nhao kk. Đố cả nhà ai là ai???,"7,5K","6,6K",265,637,7,,,323 bình luậ,2587063364681630,/story.php?story_fbid=2587063364681630&id=241141239273866,Lưu
Việt Hương,,2019-11-22 10:57:19,"Cả nhà ơi mặt mộc chỉ SERUM HƯƠNG THỊ. Check in tại Sentosa Singapore, sau khi ăn sáng và ca sĩ Don Ho đã chụp hình cho bé Hương. USA lễ Thanksgiving nên sales sập sàn luôn. Gọi ngay 714-854-2930.","Đỗ Cát Phượng và 7,6K người khác",7K,16,572,7,1,,286 bình luậ,2584502588271041,/story.php?story_fbid=2584502588271041&id=241141239273866,Lưu
Việt Hương,,2019-11-21 15:19:18,Hú hú,"3,8K","3,3K",22,538,3,4,2,890 bình luậ,781524768956998,/story.php?story_fbid=781524768956998&id=241141239273866,Lưu
Việt Hương,,2019-11-21 14:36:15,"Em đi Singapore đây, lần đầu tiên trung tâm Thúy Nga quay gần Việt Nam. Bay lẹ kk.","Đỗ Cát Phượng và 8,7K người khác","7,9K",55,654,9,,,292 bình luậ,2582576138463686,/story.php?story_fbid=2582576138463686&id=241141239273866,Lưu
Việt Hương,,2019-11-20 20:47:20,Hú hú,"Đỗ Cát Phượng và 3,2K người khác","2,6K",10,574,1,,4,1.591 bình luậ,851038198627472,/story.php?story_fbid=851038198627472&id=241141239273866,Lưu
Việt Hương,,2019-11-19 15:57:48,Tặng Cô giáo chai này thì nức mũi kkkk 680 ngàn à.,"2,1K","1,9K",13,193,2,,,147 bình luậ,2578223272232306,/story.php?story_fbid=2578223272232306&id=241141239273866,Lưu
Việt Hương,,2019-11-19 10:05:58,Cặp Sữa Tắm Gạo Ngọc Trai+ Gel tẩy tế bào body 470ngàn. Hợp lý cho quà tặng 20-11 Cô Thầy đều thích.,"1,2K","1,1K",2,101,3,,,74 bình luậ,2577748555613111,/story.php?story_fbid=2577748555613111&id=241141239273866,Lưu
Việt Hương,,2019-11-18 23:23:06,"1 tuần nay em quay cho kịp Tết, giờ này về sập nguồn, vậy mà em nhận bao nhiêu đề cử em biết khán giả yêu thương em lắm em khoẻ hẳn bung lụa kkk.","Lê Dương Bảo Lâm và 2,7K người khác","2,4K",12,272,2,,,180 bình luậ,2576825449038755,/story.php?story_fbid=2576825449038755&id=241141239273866,Lưu
Việt Hương,,2019-11-18 23:22:40,"Thải độc tố sâu dưới da, ngồi văn phòng máy lạnh tích dưới da, makeup, đi bụi đường thế nào cũng lão hoá hoá và gây mụn, mụn gạo, mụn thịt... Nhớ rửa mặt hé. SỮA RỬA MẶT BONG BÓNG. #viethuong #Huongthi",956,853,2,101,,,,62 bình luậ,2576824062372227,/story.php?story_fbid=2576824062372227&id=241141239273866,Lưu
Việt Hương,,2019-11-18 18:59:40,"Dạ ủng hộ chị lớn, và hỗ trợ bạn trẻ cả nhà ơi. https://m.youtube.com/watch?feature=youtu.be&v=eIaOU0UFyw4",Khả Như Trần và 982 người khác,885,1,96,1,,,34 bình luậ,2576378115750155,/story.php?story_fbid=2576378115750155&id=241141239273866,Lưu
Việt Hương,,2019-11-18 14:28:51,"Đi nắng mồ hôi tiết ra, môi trường ô nhiễm, bụi bẩn bám vào, ngồi máy lạnh nó tích tụ dưới lỗ chân lông. Sữa Rửa Mặt  Bóng Bóng - Thải Độc Tố của HƯƠNG THỊ không chỉ rửa sạch bề mặt da của bạn mà còn thải những độc tố, chất cặn bã tụ trong lỗ chân lông, giúp thông thoáng lớp da mặt của bạn. Hãy chăm sóc làn da của bạn ngay hôm nay! Còn dưỡng Body Silk nè, sữa tắm nè, Mặt nạ ngủ nè....Hương thị là sản phẩm sạch. Hotline tư vấn và đặt mua hàng: ☎ 1-800-54-54-84 (tại Việt Nam) ☎ 1-714-854-2930 (tại Mỹ)","1,4K","1,2K",8,121,3,,,99 bình luậ,2538855309544713,/story.php?story_fbid=2538855309544713&id=241141239273866,Lưu
Việt Hương,,2019-11-17 22:59:16,Vô Top 10 vui toá https://youtu.be/r8aiQ2bCIbI,"Việt Hương và 1,4K người khác","1,2K",21,152,3,,,86 bình luậ,2574637945924172,/story.php?story_fbid=2574637945924172&id=241141239273866,Lưu
Việt Hương,,2019-11-17 17:19:10,"Đi quay mà mọi người yêu thương khán giả khắp nơi gởi quà, từ bánh cá, bánh ngọt... Cốm...nước thơm... Đặt biệt máy massage luôn ... Ôi em cả đời được khán giả thương như vậy chết trên sân khấu cũng mãn nguyện!","Lê Dương Bảo Lâm và 8,9K người khác","8,2K",37,623,7,,,213 bình luậ,2574051799316120,/story.php?story_fbid=2574051799316120&id=241141239273866,Lưu
Việt Hương,,2019-11-17 09:20:17,"Dạ thằng bé con trai.......người ta cực ngoan lễ phép, biết con khi 19 tuổi chương trình NBA, sau 5năm gặp lại huy chương vàng con tính theo KÝ giải quốc tế và Châu Á luôn nha. Quá giỏi còn bị ĐẸP TRAI. Ps: thằng bé đang ở không, liên lạc tui gấp, CỰC PHẨM á kkkk","Phạm Huỳnh Hữu Tài và 7,1K người khác","6,5K",96,462,5,,,169 bình luậ,2573366422717991,/story.php?story_fbid=2573366422717991&id=241141239273866,Lưu
Việt Hương,,2019-11-16 22:29:28,"Cả nhà ơi nên làm tiếp t3,t4.... Không? Coi nhớ bấm Subscribe, Đăng Ký dùm em. https://youtu.be/r8aiQ2bCIbI",Khả Như Trần và 1K người khác,895,8,114,,,,81 bình luậ,2572404499480850,/story.php?story_fbid=2572404499480850&id=241141239273866,Lưu
Việt Hương,,2019-11-16 09:12:02,"1 buổi sáng quá tồi, từ con người tạo ra.Chỉ có nghệ thuật làm em quên tất cả,nay quay 5số, mong sẽ vui quên đời.",Đỗ Cát Phượng và 15K người khác,14K,43,"1,1K",92,3,,608 bình luậ,2571213422933291,/story.php?story_fbid=2571213422933291&id=241141239273866,Lưu
Việt Hương,,2019-11-15 12:37:07,"Rồi xong Tập 2, ai muốn chụp hình nè? TẤM HÌNH ÂM DƯƠNG kênh youtube Việt Hương TV nha nhớ subscribed đăng ký hé. #viethuong #viethuongtv #nghesiviethuong #soroianha #tamhinhamduong #yeutimdungxem  https://youtu.be/r8aiQ2bCIbI",1K,944,6,129,1,,,90 bình luậ,2569267976461169,/story.php?story_fbid=2569267976461169&id=241141239273866,Lưu
Việt Hương,,2019-11-15 12:10:36,Nóng hổi giữa trưa thứ 6 cả nhà ơi ... Tập 2 của serie Sợ rồi à nha! ... #viethuong #viethuongtv #soroianha #tamhinhamduong #yeutimdungxem,640,561,,78,1,,,61 bình luậ,2569235226464444,/story.php?story_fbid=2569235226464444&id=241141239273866,Lưu
Việt Hương,,2019-11-14 16:26:41,Bất kể mua gì tặng thầy cô đều được tặng quà với các combo dễ thương hé.,"1,7K","1,6K",7,154,1,,,132 bình luậ,2567355026652464,/story.php?story_fbid=2567355026652464&id=241141239273866,Lưu
Việt Hương,,2019-11-13 20:45:40,Hú hú,"5,5K","4,2K",51,"1,2K",6,5,5,9.039 bình luậ,1612844512189934,/story.php?story_fbid=1612844512189934&id=241141239273866,Lưu
Việt Hương,,2019-11-13 20:16:35,"Dạ báo đăng choáng quá, nên thôi tặng quà cho cả nhà để bớt chóng mặt 8h40 live stream hé. #huongthi #huongthicosmetics #viethuong #nghesiviethuong https://www.24h.com.vn/giai-tri/viet-huong-gay-choang-khi-deo-nhan-kim-cuong-gan-6-ty-du-su-kien-c731a1099550.html","3,2K","2,8K",79,275,16,,,185 bình luậ,2565585443496089,/story.php?story_fbid=2565585443496089&id=241141239273866,Lưu
Việt Hương,,2019-11-13 16:18:11,"20 tháng 11 lễ Thầy Cô, ở Mỹ lễ Tạ Ơn, Hương Thị xin tặng mùa lễ cả nhà ơi, mua là có quà.","2,2K",2K,3,163,,,,143 bình luậ,2565223756865591,/story.php?story_fbid=2565223756865591&id=241141239273866,Lưu
Việt Hương,,2019-11-12 20:23:57,Khuya rồi nên coi cả nhà ơi. https://youtu.be/7j68Hh1w9Nw,"1,1K",1K,17,107,1,,,91 bình luậ,2563470817040885,/story.php?story_fbid=2563470817040885&id=241141239273866,Lưu
Việt Hương,,2019-11-12 17:18:25,Nước hoa mới của Mỹ phẩm Hương Thị. Xuất sắc à nha! #elyza #elyzaperfume #NuocHoaElyza #elyzaparfume #huongthi #huongthicosmetic #viethuong #nghesiviethuong,"5,3K","4,8K",12,436,9,1,1,235 bình luậ,2563175363737097,/story.php?story_fbid=2563175363737097&id=241141239273866,Lưu
Việt Hương,,2019-11-12 12:30:14,"Nói thiệt là bữa đi ăn đám cưới bé Nhi+Thắng chị không biết sẽ mặc sao cho hợp, ở biển thì hơi quá với bộ đồ của mình? Nhưng nếu sau đó vô ăn tiệc thì bộ đồ hợp lý vì không biết nhà hàng đẳng cấp sao, nhưng hôm đó fan trẻ có thể thấy hơi già. Nhưng các cô chú khách mời của ba má chú rể cô dâu thì yêu quý khoái bộ đồ chụp hình quá trời kk, thôi thì có này có kia, nhưng khúc xuống sàn quẩy em không đem theo đồ nêm chơi luôn mọi người thông cảm nhảy đầm đồ dạ tiệc kkkk. Mọi người thông cảm.",Đỗ Cát Phượng và 38K người khác,34K,634,"3,4K",13,1,1,704 bình luậ,2562626040458696,/story.php?story_fbid=2562626040458696&id=241141239273866,Lưu
Việt Hương,,2019-11-11 12:23:07,Ta nói... Khán giả thương sống trọn đời  kkk. Ra rạp cả nhà ơi cho lên 100 tỷ cả nhà nha hé hé hé.,"7,8K",7K,109,641,39,1,,289 bình luậ,2560416197346347,/story.php?story_fbid=2560416197346347&id=241141239273866,Lưu
Việt Hương,,2019-11-10 22:00:43,Hú hú,"4,9K","4,1K",50,728,1,6,3,1.064 bình luậ,553375528794095,/story.php?story_fbid=553375528794095&id=241141239273866,Lưu
Việt Hương,,2019-11-10 19:39:25,,"2,3K","1,9K",228,169,3,,,155 bình luậ,2558884304166203,/story.php?story_fbid=2558884304166203&id=241141239273866,Lưu
"Việt Hương,Tối Chủ Nhật Vui Vẻ",Tối Chủ Nhật Vui Vẻ,2019-11-09 12:12:30,Tối nay 20 giờ cả nhà ơi VTV3 TỐI CHỦ NHẬT VUI VẺ. https://m.facebook.com/story.php?story_fbid=2163481840613115&id=1712228199071817Hãy chuẩn bị tinh thần bởi những bất ngờ xuất hiện trong Tập 3 sẽ vượt ngoài dự đoán của mọi người đó! 📺Đón xem Tập 3 Tối Chủ Nhật Vui Vẻ vào lúc 20G tối nay trên kênh VTV3 🎬Xem lại trên Youtube lúc 22G30 cùng ngày: bit.ly/kenhCNvuive  #VietHuong #HuynhLap #ToiChuNhatVuiVe  #VietcomFilm,681,598,16,67,,,,27 bình luậ,2558805620840738,/story.php?story_fbid=2558805620840738&id=241141239273866,Lưu
Việt Hương,,2019-11-10 16:24:49,Cả nhà ơi em cao vậy nên vượt thành tốt luôn.Tập 1 VƯỢT THÀNH CHIẾN  https://m.youtube.com/watch?v=henBud6DqYw,793,705,8,79,1,,,45 bình luậ,2558586334196000,/story.php?story_fbid=2558586334196000&id=241141239273866,Lưu
Việt Hương,,2019-11-10 10:41:58,"Từ ngàn xưa, ông bà ta đã biết sử dụng Trà Xanh và Rau Má như những loại cây thuốc làm đẹp từ thiên nhiên 🌿 Trà xanh chứa hoạt chất chống oxy hóa và lão hóa da, cho làn da luôn tươi trẻ, căng mịn 🌿 Rau má với công dụng làm mát và cấp ẩm cho da, đồng thời làm sạch da dịu nhẹ 🌟🌟 Sự kết hợp hoàn hảo của hai loại thảo mộc trong SỮA RỬA MẶT TRÀ XANH & RAU MÁ HƯƠNG THỊ Công dụng:  - Làm sạch da dịu nhẹ - Không làm mài mòn da - Dưỡng Ẩm sâu bên trong - Làm mát, thải độc Cho làn da sạch sẽ, thông thoáng lỗ chân lông và mịn màng, tươi sáng.  Số lượng sản phẩm giới hạn(limited) quà tặng nghề sĩ.Cả nhà nhanh tay đặt hàng nhanh nhé, số lượng không còn nhiều nữa đâu!","Lê Dương Bảo Lâm và 2,5K người khác","2,3K",13,165,3,,,147 bình luậ,2558133570907943,/story.php?story_fbid=2558133570907943&id=241141239273866,Lưu
Việt Hương,,2019-11-09 16:34:15,"Em xin phép nghĩ ngày làm việc, bung lụa xí ạ.",Việt Hương và 23K người khác,20K,228,"2,5K",66,,,868 bình luậ,2556457467742220,/story.php?story_fbid=2556457467742220&id=241141239273866,Lưu
