source,shared_from,date,text,reactions,likes,ahah,love,wow,sigh,grrr,comments,post_id,url,share
CafeLand.vn,,2019-11-16 09:00:09,"Ngay từ khi ra mắt, Paris Hoàng Kim đã trở thành thỏi nam châm thu hút sự quan tâm của khách hàng và các nhà đầu tư. Đặc biệt với sự tỉ mỉ đến từng chi tiết trong thiết kế, các căn hộ đều có sự bài trí linh hoạt và tối ưu không gian sử dụng, 100% căn hộ đều là căn góc, các phòng đều có cửa sổ. https://cafeland.vn/tin-tuc/paris-hoang-kim-so-huu-100-can-ho-deu-la-can-goc-83751.html",7,7,,,,,,Bình luậ,3067254189954863,/story.php?story_fbid=3067254189954863&id=158996624113982,Lưu
CafeLand.vn,,2019-11-16 08:57:54,"Era Central Point tọa lạc trên mặt tiền đường Lê Quý Đôn, phường Tân Xuân, Thành phố Đồng Xoài, tỉnh Bình Phước. Dự án cách trục đường Quốc lộ 14 khoảng 2,8km, do Era Group làm chủ đầu tư. Công ty Cổ phần Era Land là đơn vị phát triển dự án.",5,5,,,,,,Bình luậ,3067312933282322,/story.php?story_fbid=3067312933282322&id=158996624113982,Lưu
CafeLand.vn,,2019-11-16 08:20:16,Dự án bất động sản là hoạt động bỏ vốn đầu tư nhằm thiết lập mô hình kinh doanh trên một khu đất. Để phát triển một dự án bất động sản doanh nghiệp phải thực hiện theo một quy trình nhất định. https://cafeland.vn/tin-tuc/infographic-quy-trinh-phat-trien-du-an-bat-dong-san-83761.html,81,80,,1,,,,Bình luậ,3067251339955148,/story.php?story_fbid=3067251339955148&id=158996624113982,Lưu
CafeLand.vn,,2019-11-15 21:00:31,Bất an với dự án mang “họ” Khang Gia; HoREA đề xuất giải pháp khuyến khích xây bãi xe ngoài chung cư; “Ngậm đắng” với Nhà ở xã hội... là những thông tin nhà đất nổi bật trong 24h qua. https://cafeland.vn/tin-tuc/bat-dong-san-24h-buc-xuc-vi-loat-sai-pham-tai-nha-o-xa-hoi-83753.html,47,44,1,,2,,,Bình luậ,3065674283446187,/story.php?story_fbid=3065674283446187&id=158996624113982,Lưu
CafeLand.vn,,2019-11-15 20:00:40,"nhận xét về đề xuất này, ông Nguyễn Văn Đực, Phó giám đốc Công ty địa ốc Đất Lành, cho rằng đề xuất không để xe dưới tầng hầm nhà cao tầng là vô lý và là một cái nhìn hết sức ấu trĩ. https://cafeland.vn/tin-tuc/de-xuat-khong-de-xe-o-tang-ham-la-di-nguoc-xu-the-83729.html",36,26,8,1,1,,,13 bình luậ,3065672523446363,/story.php?story_fbid=3065672523446363&id=158996624113982,Lưu
CafeLand.vn,,2019-11-15 19:00:25,"Những nắm tuyết được tung lên lần đầu tiên ở xứ nhiệt đới, cảm giác hồi hộp khi lướt trên ván trượt tuyết, chụp hình lưu giữ kỷ niệm về một kỳ nghỉ đáng nhớ… là những trải nghiệm mới lạ tổ hợp giải trí tuyết Ski Ninh Chữ Bay sẽ mang lại cho du khách. Tất cả ở ngay trong lòng Khu tổ hợp giải trí - nghỉ dưỡng biển Sailing Bay Ninh Chữ tại TP Phan Rang - Tháp Chàm (Ninh Thuận). https://cafeland.vn/tin-tuc/nhung-trai-nghiem-tuyet-moi-la-tu-dubai-den-ninh-chu-83750.html",4,4,,,,,,Bình luậ,3065668013446814,/story.php?story_fbid=3065668013446814&id=158996624113982,Lưu
CafeLand.vn,,2019-11-15 18:00:38,"Hàng loạt dự án đang ngổn ngang, dang dở nhưng được nhà phân phối (công ty, doanh nghiệp, cá nhân) rao bán tràn lan và nhận tiền đặt cọc của người mua. Tuy nhiên khi được hỏi, chủ đầu tư lại trả lời không biết, đó là việc làm tự ý của nhà phân phối (?), gây nhiều bức xúc trong dư luận, ảnh hưởng đến tình hình ANTT trên địa bàn. https://cafeland.vn/tin-tuc/quang-ngai-ban-lua-non-du-an-chu-dau-tu-muon-tay-nha-phan-phoi-lach-luat-83748.html",6,6,,,,,,Bình luậ,3065666790113603,/story.php?story_fbid=3065666790113603&id=158996624113982,Lưu
CafeLand.vn,,2019-11-15 17:10:53,"HỘI THẢO: ""CƠ HỘI ĐẦU TƯ BẤT ĐỘNG SẢN VÙNG LÂN CẬN TP.HCM NĂM 2019"" Vào ngày 05/12/2019, sự kiện sẽ diễn ra tại TP.HCM với sự góp mặt của các nhà đầu tư bất động sản lớn Việt Nam, các chuyên gia về kinh tế, bất động sản và hàng trăm khách hàng quan tâm bất động sản. 📍 Trong năm 2019, bất động sản nhiều khu vực quanh TP.HCM đã có sự phát triển khá mạnh mẽ. Giá đất các tỉnh Long An, Đồng Nai, Vũng Tàu, Bình Dương, Bình Phước… tiếp tục tăng nhanh.  📍 Dù phát triển mạnh thị trường bất động sản các khu vực này vẫn còn nhiều tiềm năng khi mà tăng trưởng kinh tế Việt Nam vẫn đang được duy trì khá cao và tốc độ đô thị hóa đang diễn ra nhanh chóng. 📍 Vậy cơ hội nào để cho các nhà đầu tư bất động sản trong năm 2020 với các vùng lân cận TPHCM? Câu trả lời sẽ được các chuyên gia giải đáp trong hội thảo. _____________ ► Hội thảo diễn ra tại TP.HCM: - Thời gian: 08h30 - 12h00 ngày 05/12/2019 - Địa điểm: InterContinental Saigon Residences - 39 Lê Duẩn, Bến Nghé, Quận 1, HCM. - Hotline: 0942.825.711 - Đăng ký tham gia tại: http://bit.ly/2QlG908",124,122,,2,,,,Bình luậ,3065567103456905,/story.php?story_fbid=3065567103456905&id=158996624113982,Lưu
CafeLand.vn,,2019-11-15 16:10:30,"Bà Phấn mua căn nhà phố 5 tỷ đồng năm 2015, nay vọt lên 10 tỷ nhưng lo bán đi khó tìm được căn ưng ý với số tiền thu về. >> Xem chi tiết: https://cafeland.vn/tin-tuc/nha-pho-tang-gia-gap-doi-van-khong-dam-ban-83740.html #CafeLand #Nhapho",56,53,2,1,,,,1 bình luậ,3065454400134842,/story.php?story_fbid=3065454400134842&id=158996624113982,Lưu
CafeLand.vn,,2019-11-15 15:03:39,Công ty Cổ phần Tập đoàn Hà Đô công bố Quyết định của Cục thuế TP.Hà Nội về việc xử phạt vi phạm hành chính về thuế do khai sai dẫn đến thiếu số tiền thuế phải nộp. >> Xem chi tiết: https://cafeland.vn/tin-tuc/ha-do-bi-phat-va-truy-thu-thue-gan-57-ty-dong-83746.html #Cafeland #Hado,15,15,,,,,,Bình luậ,3065365003477115,/story.php?story_fbid=3065365003477115&id=158996624113982,Lưu
CafeLand.vn,,2019-11-15 14:30:58,"Không ít dự án Nhà ở xã hội dính sai phạm trong xây dựng, chủ đầu tư cố tình chậm khắc phục, kéo dài thời gian bàn giao nhà khiến cho người mua vô cùng bức xúc. #cafeland #nhaoxahoi",16,16,,,,,,Bình luậ,3065321656814783,/story.php?story_fbid=3065321656814783&id=158996624113982,Lưu
CafeLand.vn,,2019-11-15 13:10:12,"Sở Xây dựng TP.HCM vừa có báo cáo kết quả giải quyết kiến nghị của cử tri TP sau kỳ họp thứ 15, HĐND tp.hcm khóa IX. Thời gian qua đã có một số thắc mắc, kiến nghị của cử tri các quận, huyện liên quan đến vấn đề chống ngập của TP.HCM, tình trạng buôn bán hàng rong ở Công viên Gia Định và giải tỏa 20.000 căn nhà gần kênh rạch. >> Xem chi tiết: https://cafeland.vn/tin-tuc/so-xay-dung-cac-giai-phap-chong-ngap-o-tphcm-83737.html #Cafeland #chongngap",9,9,,,,,,Bình luậ,3065213446825604,/story.php?story_fbid=3065213446825604&id=158996624113982,Lưu
CafeLand.vn,,2019-11-15 11:16:17,"Bên cạnh việc xử lý nghiêm tình trạng phân lô bán nền, UBND tỉnh Bạc Liêu yêu cầu các địa phương trên địa bàn công khai, minh bạc thông tin về đất đai. >> Xem chi tiết: https://cafeland.vn/tin-tuc/bac-lieu-xu-nghiem-tinh-trang-phan-lo-ban-nen-83734.html #Cafeland #baclieu #phanlobannen",6,6,,,,,,Bình luậ,3065059020174380,/story.php?story_fbid=3065059020174380&id=158996624113982,Lưu
CafeLand.vn,,2019-11-15 10:08:09,"Ông GS. Đặng Hùng Võ cho rằng, mọi người đang nhầm lẫn khi tăng bảng giá đất của Nhà nước thì giá thị trường sẽ xuống. Trên thực tế, nếu ta giảm giá đất của nhà nước thì giá thị trường sẽ tiếp tục lên, điều này sẽ càng đẩy mạnh đầu cơ. >> Xem chi tiết: https://cafeland.vn/tin-tuc/ha-noi-dieu-chinh-gia-dat-tang-30-la-chua-sat-voi-thi-truong-83733.html #Cafeland #banggiadat",26,25,1,,,,,Bình luậ,3064958006851148,/story.php?story_fbid=3064958006851148&id=158996624113982,Lưu
CafeLand.vn,,2019-11-15 09:34:35,"Sunshine Group là chủ đầu tư xây dựng dự án với tổng mức vốn khoảng từ 10.000 tỉ đồng. Ngoài ra, Sunshine Group còn là đơn vị đầu tư các dòng sản phẩm khác như Sunshine Apartment, Sunshine Villas, Sunshine Sky Villas, Sunshine Marina,… Được biết, dự án Sunshine City Sài Gòn quận 7 đã khởi công vào quý 4/2018, dự kiến hoàn thành vào quý 4/2020.",5,5,,,,,,Bình luậ,3064902700190012,/story.php?story_fbid=3064902700190012&id=158996624113982,Lưu
CafeLand.vn,,2019-11-15 09:05:17,"Hội thảo:""CƠ HỘI ĐẦU TƯ BẤT ĐỘNG SẢN VÙNG LÂN CẬN TP.HCM NĂM 2020""  Năm 2019 bất động sản nhiều khu vực quanh TP.HCM đã có sự phát triển khá mạnh mẽ. Giá đất các tỉnh Long An, Đồng Nai, Vũng Tàu, Bình Dương, Bình Phước… tiếp tục tăng nhanh. Dù phát triển mạnh thị trường bất động sản các khu vực này vẫn còn nhiều tiềm năng khi mà tăng trưởng kinh tế Việt Nam vẫn đang được duy trì khá cao và tốc độ đô thị hóa đang diễn ra nhanh chóng.  Trước những diễn biến đó, Chuyên trang Đầu tư Bất động sản CafeLand - Tạp chí điện tử Nhà đầu tư tổ chức buổi hội thảo “Cơ hội đầu tư bất động sản vùng lân cận TP.HCM năm 2020”  Tại hội thảo các chuyên gia sẽ đánh giá về các vấn đề kinh tế vĩ mô chính sách ảnh hưởng đến thị trường bất động sản năm 2020 và một số năm tới. Đặc biệt, hội thảo sẽ tập trung đánh giá về tiềm năng, cơ hội đầu tư trên thị trường bất động sản vùng lân cận TP.HCM vào năm 2020 và một số năm tới.  >> Tham gia ngay hội thảo:    ",7,7,,,,,,Bình luậ,3064857760194506,/batdongsancafeland/photos/a.474825819197726/3064857760194506,Lưu
CafeLand.vn,,2019-11-15 08:42:22,"Theo một số chuyên gia, để tiếp tục duy trì tăng trưởng, các chủ đầu tư bất động sản nghỉ dưỡng sẽ phải đa dạng hóa thị trường, cân nhắc cả những địa điểm du lịch giàu tiềm năng và đa dạng hóa loại hình sản phẩm. >> Xem chi tiết: https://cafeland.vn/tin-tuc/bat-dong-san-nghi-duong-tang-truong-van-kha-quan-83732.html #cafeland #batdongsannghiduong",16,16,,,,,,1 bình luậ,3064822043531411,/story.php?story_fbid=3064822043531411&id=158996624113982,Lưu
CafeLand.vn,,2019-11-14 21:00:01,"Xu hướng giãn dân ra khỏi khu trung tâm, phát triển theo mô hình “đa cực” đang dần thay đổi quan niệm về trung tâm thành phố.",13,13,,,,,,Bình luậ,3063223653691250,/story.php?story_fbid=3063223653691250&id=158996624113982,Lưu
CafeLand.vn,,2019-11-14 20:00:02,"Quyết định thu hồi sau khi Công ty TNHH sản xuất và xây dựng Khánh Hòa có đơn xin trả lại đất dự án do không còn nhu cầu sử dụng. Dự án Cửu Long Sơn Tự được UBND tỉnh giao đất (có thu tiền sử dụng đất) từ năm 2012 - 2015, tổng diện tích hơn 513ha, trong đó 370ha là đất khoanh nuôi tái sinh, phục hồi môi trường rừng.",10,9,,,1,,,1 bình luậ,3063222763691339,/story.php?story_fbid=3063222763691339&id=158996624113982,Lưu
CafeLand.vn,,2019-11-14 19:00:01,"Thị trường bất động sản Nhơn Trạch đang là điểm đến hấp dẫn hàng đầu trong quý 4/2019 khi hàng loạt các công trình hạ tầng, giao thông được phê duyệt và đã tìm được “chủ nhân”. Ngày 11/11/2019 vừa qua, Tiến Lộc Group – Chủ đầu tư dự án Khu đô thị Tiến Lộc Garden chính thức ký hợp đồng phân phối độc quyền với Phúc Gia Khang.",10,10,,,,,,Bình luậ,3063222207024728,/story.php?story_fbid=3063222207024728&id=158996624113982,Lưu
CafeLand.vn,,2019-11-14 18:03:01,,94,93,,1,,,,1 bình luậ,877058309355766,/events/877058309355766?view=permalink&id=877058316022432,Lưu
CafeLand.vn,,2019-11-14 18:00:00,"Với chủ trương làm đường, huyện Krông Nô (Đắk Nông) đã thu hồi đất sản xuất của nhiều hộ dân và đền bù nhưng cuối cùng đất làm đường bị “xẻ thịt”, chuyển sang đất thổ cư để phân lô bán nền vì lý do…không phù hợp quy hoạch. >> Xem chi tiết: https://cafeland.vn/tin-tuc/dak-nong-thu-hoi-dat-lam-duong-xong-xe-thit-phan-lo-ban-nen-83722.html #cafeland #phanlobannen",14,7,4,,1,,2,Bình luậ,3063219353691680,/story.php?story_fbid=3063219353691680&id=158996624113982,Lưu
CafeLand.vn,,2019-11-14 17:30:00,"Bước vào quý IV/2019, thị trường bất động sản khu Nam trở thành “điểm sáng” của TP HCM khi hàng loạt dự án tỷ đô được các chủ đầu tư ồ ạt tung ra thị trường. >> Xem chi tiết: https://cafeland.vn/tin-tuc/trien-khai-cau-thu-thiem-4-mo-rong-duong-dao-tri-bat-dong-san-khu-nam-soi-dong-83712.html #cafeland #Cauthuthiem4",32,32,,,,,,Bình luậ,3063216990358583,/story.php?story_fbid=3063216990358583&id=158996624113982,Lưu
CafeLand.vn,,2019-11-14 17:00:26,UBND tỉnh Đồng Nai vừa duyệt quy hoạch phân khu tỷ lệ 1/5.000 Phân khu D1 với diện tích khoảng 1.831 ha tại phường Phước Tân theo điều chỉnh tổng thể quy hoạch chung TP Biên Hòa. >> Xem chi tiết: https://cafeland.vn/quy-hoach/dong-nai-duyet-quy-hoach-15000-phan-khu-d1-hon-1800-ha-o-bien-hoa-83723.html #Cafeland #Quyhoach #DongNai,20,20,,,,,,Bình luậ,3063213523692263,/story.php?story_fbid=3063213523692263&id=158996624113982,Lưu
CafeLand.vn,,2019-11-14 16:37:14,Có nên phát triển căn hộ 25m2 tại HCM ?,6,6,,,,,,Bình luậ,3063180580362224,/story.php?story_fbid=3063180580362224&id=158996624113982,Lưu
CafeLand.vn,,2019-11-14 15:26:15,"“Mở bán Chung cư mini đầy đủ nội thất giá chỉ từ 400 - 900 triệu đồng/căn, có sổ hồng, dọn đến ở luôn”... là những lời mời chào hấp dẫn đối với nhiều người có nhu cầu mua căn hộ giá rẻ. >> Xem chi tiết: https://cafeland.vn/tin-tuc/chung-cu-mini-co-thuc-su-ngon-bo-re-83707.html #Cafeland #Chungcu",17,14,1,2,,,,1 bình luậ,3063085127038436,/story.php?story_fbid=3063085127038436&id=158996624113982,Lưu
CafeLand.vn,,2019-11-14 13:15:36,"Ngân hàng TMCP Sài Gòn - Hà Nội (SHB) vừa thông báo bán khoản nợ vay với tổng giá trị 9,6 tỷ đồng của bà Phạm Thị Tuyết Nhung (Công ty Angel Lina) >> Xem chi tiết: https://cafeland.vn/tin-tuc/shb-rao-ban-no-xau-cua-cong-ty-angel-lina-83715.html #CafeLand #SHB #AngelLina",25,24,,1,,,,Bình luậ,3062909543722661,/story.php?story_fbid=3062909543722661&id=158996624113982,Lưu
CafeLand.vn,,2019-11-14 11:27:06,"Vị trí trên cao, không gian xanh mát, số lượng hữu hạn cùng hệ thống tiện ích đồng bộ… đó là những lý do nổi bật khiến biệt thự đồi luôn được săn đón. Ngoài ra, nguồn cung nhỏ giọt trong khi nhu cầu sở hữu cao cũng giúp phân khúc này luôn giữ được sức nóng với mức tăng trưởng ổn định tạo ra cơ hội sinh lời hấp dẫn cho nhà đầu tư. #Cafeland #Bietthudoi #batdongsanbietthu",10,10,,,,,,Bình luậ,3062769010403381,/story.php?story_fbid=3062769010403381&id=158996624113982,Lưu
CafeLand.vn,,2019-11-14 10:33:43,TP.HCM có nên phát triển căn hộ diện tích 25m2 ? Hãy cùng nghe chuyên gia phân tích Tham khảo nhiều video hơn: https://www.youtube.com/cafelandvietnam #Cafeland #TPHCM #Canho,44,38,,6,,,,8 bình luậ,718938178610315,/story.php?story_fbid=718938178610315&id=158996624113982,Lưu
CafeLand.vn,,2019-11-14 10:02:07,"Lâu nay, đất nền luôn là phân khúc được giới đầu tư săn đón bởi tiềm năng sinh lời lớn và giao dịch nhanh chóng. Tuy nhiên, đây cũng là thị trường có nhiều rủi ro khi một số doanh nghiệp không ngần ngại vẽ ra những dự án ma để lừa đảo người mua. #Cafeland #Sotdatnen #Luadao",26,26,,,,,,1 bình luậ,3062640803749535,/story.php?story_fbid=3062640803749535&id=158996624113982,Lưu
CafeLand.vn,,2019-11-14 09:19:27,"Năng lực thi công của một số nhà thầu còn hạn chế, không tuân thủ theo quy định của thiết kế là một trong những lý do Bộ trưởng Bộ Giao thông vận tải Nguyễn Văn Thể đưa ra khi trả lời chất vấn của các đại biểu tại kỳ họp thứ 7 Quốc hội khóa XIV về tình trạng các công trình xây dựng hạ tầng giao thông có chất lượng khá kém, nhiều công trình xuống cấp nhanh. >> Xem chi tiết: https://cafeland.vn/tin-tuc/cong-trinh-ha-tang-xuong-cap-nhanh-bo-giao-thong-van-tai-noi-gi-83705.html #Cafeland #Bogiaothong",12,9,,,,3,,1 bình luậ,3062569800423302,/story.php?story_fbid=3062569800423302&id=158996624113982,Lưu
CafeLand.vn,,2019-11-14 08:36:45,"Cơ hội sở hữu bất động sản cuối năm.  Những thái cuối năm này, sẽ có những biến động về thị trường #Cafeland #Batdongsan #bdscuoinam",24,23,,1,,,,Bình luậ,3062496790430603,/story.php?story_fbid=3062496790430603&id=158996624113982,Lưu
CafeLand.vn,,2019-11-13 21:00:00,"Dự án BT Nút giao thông Ngọc Hội được giao cho Công ty Phúc Sơn với tổng trị giá sử dụng đất tạm tính là 1.215 tỷ đồng sau 2 năm thi công mới chỉ xây dựng được một nhánh cầu vượt, với chiều dài khoảng 200m. >> Xem chi tiết: https://cafeland.vn/tin-tuc/du-an-bt-1200-ty-doi-dat-vang-san-bay-nha-trang-2-nam-lam-duoc-200m-83692.html #Cafeland #DuanBT",23,18,3,1,,1,,3 bình luậ,3061016737245275,/story.php?story_fbid=3061016737245275&id=158996624113982,Lưu
CafeLand.vn,,2019-11-13 20:00:00,"Năm 2010 tôi có mua một mảnh đất tại một dự án ở Bình Dương. Tôi cùng 10 người khác có lên văn phòng công ty yêu cầu phải có sổ và công ty ký xác nhận năm sau sẽ ra sổ nhưng đến nay vẫn chưa nhận được sổ. Chúng tôi có mang hồ sơ lên Sở Tài nguyên môi trường Bình Dương hỏi thì được biết trên địa bàn không có dự án mà chúng tôi đã mua. Xin hỏi, bây giờ chúng tôi có nên kiện ra tòa? Chúng tôi cần làm gì để đảm bảo được lợi ích của mình? >> Xem tư vấn: https://cafeland.vn/kien-thuc/mua-dat-nhieu-nam-khong-duoc-cap-so-co-nen-khoi-kien-83678.html #Cafeland #Hoidap",15,14,,1,,,,Bình luậ,3061013887245560,/story.php?story_fbid=3061013887245560&id=158996624113982,Lưu
CafeLand.vn,,2019-11-13 19:00:00,"Nhiều người bỏ ra cả chục tỷ, sở hữu những căn hộ được quảng cáo là cao cấp, nhưng vẫn phải chịu đựng những nỗi khổ không tên. >> Xem chi tiết: https://cafeland.vn/tin-tuc/nhung-noi-kho-khong-ten-cua-cac-chu-can-ho-chuc-ty-giua-trung-tam-thanh-pho-83683.html #Cafeland #batdongsan",30,28,2,,,,,Bình luậ,3061005153913100,/story.php?story_fbid=3061005153913100&id=158996624113982,Lưu
CafeLand.vn,,2019-11-13 17:52:08,"Nửa cuối 2019, Nhơn Trạch tiếp tục tái diễn cơn sốt đất lịch sử khi cầu Cát Lái chính thức được thông qua. Hiện nay, đông đảo người mua nhà từ TP.HCM và các tỉnh thành khác đang đổ về “săn tìm” những sản phẩm ưng ý mỗi dịp cuối tuần. >> Xem chi tiết: https://cafeland.vn/tin-tuc/diem-danh-nhung-khu-vuc-sot-dat-tai-nhon-trach-83688.html #cafeland #NhonTrach",36,34,2,,,,,7 bình luậ,3061001750580107,/story.php?story_fbid=3061001750580107&id=158996624113982,Lưu
CafeLand.vn,,2019-11-13 16:59:40,"Tính đến tháng 7/2018, cả nước vẫn tồn tại 110 công trình chung cư, nhà cao tầng đã được đưa vào hoạt động nhưng chưa được nghiệm thu về phòng cháy, chữa cháy. >> Xem chi tiết: https://cafeland.vn/tin-tuc/chay-no-chung-cu-nha-cao-tang-nong-nghi-truong-quoc-hoi-83690.html #Chungcu #cafeland #chayno",12,12,,,,,,Bình luậ,3060924493921166,/story.php?story_fbid=3060924493921166&id=158996624113982,Lưu
CafeLand.vn,,2019-11-13 16:17:42,"Phó Chủ tịch UBND TP.HCM Võ Văn Hoan vừa cho biết, tuyến metro số 1 Bến Thành – Suối Tiên sau khi được rà soát đã giảm tổng vốn đầu tư từ hơn 47.300 tỉ xuống còn 44.000 tỉ đồng. >> Xem chi tiết: https://cafeland.vn/tin-tuc/sau-ra-soat-tuyen-metro-so-1-giam-duoc-3400-ti-dong-83691.html #Cafeland #Metro1",92,54,32,1,5,,,9 bình luậ,3060868947260054,/story.php?story_fbid=3060868947260054&id=158996624113982,Lưu
CafeLand.vn,,2019-11-13 15:09:41,Thứ trưởng Bộ GTVT Lê Anh Tuấn vừa ký ban hành Quyết định số 2108 ngày 7/11/2019 phê duyệt điều chỉnh Quy hoạch Cảng hàng không Sa Pa. >> Xem chi tiết: https://cafeland.vn/tin-tuc/bo-gtvt-duyet-quy-hoach-chi-tiet-san-bay-sa-pa-371ha-83682.html #CafeLand #sanbaySapa,29,27,,2,,,,1 bình luậ,3060765040603778,/story.php?story_fbid=3060765040603778&id=158996624113982,Lưu
CafeLand.vn,,2019-11-13 13:11:16,UBND Thành phố đã duyệt dự án xây dựng mới Bệnh viện Đa khoa khu vực Thủ Đức do Ban Quản lý dự án đầu tư xây dựng các công trình Dân dụng và Công nghiệp làm chủ đầu tư. >> Xem chi tiết: https://cafeland.vn/tin-tuc/tphcm-xay-benh-vien-1000-giuong-tai-64-le-van-chi-quan-thu-duc-83684.html #Cafeland #ThuDuc #Xaybenhvien,27,25,,2,,,,Bình luậ,3060614637285485,/story.php?story_fbid=3060614637285485&id=158996624113982,Lưu
CafeLand.vn,,2019-11-13 10:47:23,"Trong số trên 100 dự án đầu tư xây dựng nhà ở, khu dân cư đã được cấp thẩm quyền tỉnh Quảng Ngãi cấp phép và phê duyệt trong 36 tháng qua, số có diện tích chưa đến 2ha/dự án tính bằng hàng chục, trong đó không ít DA chỉ khoảng 7000m2, tương đương 0,7ha. >> Xem chi tiết: https://cafeland.vn/tin-tuc/quang-ngai-nhan-nhan-du-an-dat-o-khu-dan-cu-be-nhu-lo-mui-83680.html #Cafeland #batdongsan",12,12,,,,,,1 bình luậ,3060414760638806,/story.php?story_fbid=3060414760638806&id=158996624113982,Lưu
CafeLand.vn,,2019-11-13 09:55:47,"Cuối năm 2019, tại khu Nam, hàng loạt siêu dự án quy mô vài nghìn căn hộ được các chủ đầu tư lớn “ồ ạt” đưa ra thị trường . Thông tin chuẩn bị triển khai cầu Thủ Thiêm 4 được xem là nguyên nhân chính tạo ra sức nóng “đột biến” của của khu vực này. >> Xem chi tiết: https://cafeland.vn/tin-tuc/trien-khai-cau-thu-thiem-4-bat-dong-san-khu-nam-soi-dong-83679.html #CafeLand #Cauthuthiem4",53,51,,1,1,,,5 bình luậ,3060331007313848,/story.php?story_fbid=3060331007313848&id=158996624113982,Lưu
CafeLand.vn,,2019-11-13 09:23:01,"Dự án khu nhà ở Tân Phước có diện tích hơn 4,6ha, quy mô dân số khoảng 900 người có tổng vốn đầu tư 473 tỉ đồng. >> Xem chi tiết: https://cafeland.vn/tin-tuc/ba-ria-vung-tau-chap-thuan-du-an-nha-o-gan-500-ti-dong-83672.html #Cafeland #DuanTanPhuoc",4,4,,,,,,Bình luậ,3060275893986026,/story.php?story_fbid=3060275893986026&id=158996624113982,Lưu
CafeLand.vn,,2019-11-13 08:53:34,"Dự án mở rộng khu dân cư Đông Bắc Quảng trường văn hóa trung tâm có quy mô gần 52ha, tổng vốn đầu tư dự kiến là 1.278 tỉ đồng. >> Xem chi tiết: https://cafeland.vn/tin-tuc/ca-mau-keu-goi-dau-tu-du-an-khu-dan-cu-gan-1300-ti-dong-83673.html #cafeland #Camau #khudancu",11,10,1,,,,,Bình luậ,3060228103990805,/story.php?story_fbid=3060228103990805&id=158996624113982,Lưu
CafeLand.vn,,2019-11-13 08:32:48,"Thị trường bất động sản TPHCM đang bước vào những tháng cuối năm 2019 trong sự chuyển động chậm chạp của nhiều dự án. Kể từ khi chính quyền thành phố siết chặt các thủ tục đầu tư, nhiều dự án lâm cảnh khó khăn, thậm chí chết lâm sàng. Tuy nhiên, ngay sau khi được gỡ rối pháp lý, nhiều dự án đã được rốt ráo xây dựng. Cụ thể tại quận 8, hiện có bốn dự án căn hộ đang được chủ đầu tư tăng tốc xây dựng, chạy đua nước rút để hoàn thành những công đoạn cuối cùng trước khi bàn giao nhà cho khách hàng. >> Xem chi tiết: https://cafeland.vn/tin-tuc/nhung-du-an-dang-buoc-vao-giai-doan-nuoc-rut-83676.html #Cafeland #DuanBDS",13,12,,1,,,,Bình luậ,3060194433994172,/story.php?story_fbid=3060194433994172&id=158996624113982,Lưu
CafeLand.vn,,2019-11-12 22:00:00,"Đầu tư bất động sản ngoài yếu tố vị trí đòi hỏi nhà đầu tư phải cân nhắc kỹ lưỡng từ pháp lý dự án, độ tin cậy của chủ đầu tư, cũng như tiềm năng sinh lời của khu vực.",19,19,,,,,,Bình luậ,3058711997475749,/story.php?story_fbid=3058711997475749&id=158996624113982,Lưu
