source,shared_from,date,text,reactions,likes,ahah,love,wow,sigh,grrr,comments,post_id,url,share
CafeLand.vn,,2019-11-12 21:00:00,"Cuối năm 2019 thị trường căn hộ cho chuyên gia nước ngoài thuê tại Bình Dương tiếp tục hấp dẫn giới đầu tư, nhờ phát triển dựa trên nhu cầu thực về nhà ở cho chuyên gia, có mức giá vừa phải, đặc biệt sở hữu mức lợi nhuận hấp dẫn lên đến 10% - 12% mỗi năm.",11,11,,,,,,Bình luậ,3058711337475815,/story.php?story_fbid=3058711337475815&id=158996624113982,Lưu
CafeLand.vn,,2019-11-12 20:00:02,"Kỳ vọng giá và thanh khoản tăng mạnh nên sàn bất động sản nở rộ ngay chân cầu Nhật Tân, nhưng lượng giao dịch thực tế rất thấp. >> Xem chi tiết: https://cafeland.vn/tin-tuc/dat-dong-anh-giao-dich-am-dam-83666.html #cafeland #DongAnh",9,9,,,,,,Bình luậ,3058710560809226,/story.php?story_fbid=3058710560809226&id=158996624113982,Lưu
CafeLand.vn,,2019-11-12 19:00:00,"Môi Giới Bất Động Sản – Vừa là nghề thu nhập khủng hàng đầu, vừa là nghề đào thải khốc liệt nhất. Phong phú về nguồn hàng, đa dạng danh sách khách hàng, chuyên nghiệp trong khả năng quản lý và truyền tải thông tin… đó chỉ là một số yêu cầu cơ bản nhất để “hành nghề” không thất bại. Cuộc đua ngày càng thảm khốc, ảm đạm khi người người đổ xô đi làm môi giới BĐS nhưng nhanh chóng bỏ cuộc chơi. >> Xem chi tiết: https://cafeland.vn/tin-tuc/uber-trong-linh-vuc-bat-dong-san-tiep-noi-mo-hinh-dinh-dam-hay-lai-mot-su-ra-di-83665.html #Cafeland #Moigioibatdongsan",30,30,,,,,,Bình luậ,3058708367476112,/story.php?story_fbid=3058708367476112&id=158996624113982,Lưu
CafeLand.vn,,2019-11-12 17:44:12,"Hàng loạt thông tin quan trọng về FLCHomes - thương hiệu bất động sản chủ lực của Tập đoàn FLC - sẽ được giới thiệu tại “Lễ ra mắt và giới thiệu cơ hội đầu tư FLCHomes - Discover the Galaxy”, tổ chức tại khách sạn Lotte, Hà Nội ngày 18/11 sắp tới. >> Xem chi tiết: https://cafeland.vn/tin-tuc/ngay-1811-flchomes-ra-mat-chinh-thuc-gioi-thieu-co-hoi-dau-tu-83662.html #FLChomes #Cafeland",10,10,,,,,,Bình luậ,3058697124143903,/story.php?story_fbid=3058697124143903&id=158996624113982,Lưu
CafeLand.vn,,2019-11-12 15:24:58,"Đồng Nai, Bình Thuận đang ráo riết chuẩn bị bàn giao mặt bằng, đảm bảo thời gian khởi công cao tốc Dầu Giây - Phan Thiết sớm nhất dự kiến vào Quý 1/2020. Đây là một trong những công trình trọng điểm của cả nước trong năm sau. >> Xem chi tiết: https://cafeland.vn/tin-tuc/cao-toc-dau-giay-phan-thiet-khoi-cong-quy-12020-bat-dong-san-bien-binh-thuan-ruc-rich-don-song-83641.html #Cafeland #Caotco #DauGiayPhanThiet",60,57,3,,,,,1 bình luậ,3058503750829907,/story.php?story_fbid=3058503750829907&id=158996624113982,Lưu
CafeLand.vn,,2019-11-12 14:51:07,Cần Thơ hiện có hàng trăm khu dân cư tự phát mọc lên trên đất nông nghiệp nằm ngoài quy hoạch sử dụng đất của chính quyền địa phương. Cre: VTV9 ________ #Cafeland #bấtđộngsản #bấtđộngsản2019 ►Theo dõi và xem nhiều video của CafeLand tại: https://goo.gl/thPyd2,5,4,,,1,,,Bình luậ,3058457700834512,/story.php?story_fbid=3058457700834512&id=158996624113982,Lưu
CafeLand.vn,,2019-11-12 14:21:13,"Hiện tượng chủ đầu tư “lách luật” tổ chức giới thiệu sản phẩm rầm rộ theo hình thức ký hợp đồng đặt cọc, hợp đồng đặt chỗ, hợp đồng góp vốn, phiếu đăng ký giữ chỗ… tiềm ẩn nhiều rủi ro. >> Xem thêm chi tiết: https://cafeland.vn/tin-tuc/trot-ky-hop-dong-dat-coc-giu-cho-khach-hang-om-rui-ro-tien-mat-tat-mang-83655.html #cafeland #ruiro #muanhadat",62,58,2,1,,1,,11 bình luậ,3058420104171605,/story.php?story_fbid=3058420104171605&id=158996624113982,Lưu
CafeLand.vn,,2019-11-12 13:30:01,"Khu đô thị Hàm Nghi có tổng diện tích 136,8ha với tổng vốn đầu tư dự kiến 24.000 tỉ đồng. >> Xem chi tiết: https://cafeland.vn/tin-tuc/ha-tinh-keu-goi-dau-tu-khu-do-thi-24000-ti-dong-83651.html #CafeLand #HaTinh",5,5,,,,,,Bình luậ,3058335540846728,/story.php?story_fbid=3058335540846728&id=158996624113982,Lưu
CafeLand.vn,,2019-11-12 13:13:33,"Theo UBND tỉnh Bình Thuận, 10 tháng đầu năm 2019 tỉnh đã chấp thuận đầu tư cho 75 dự án với tổng vốn đăng ký khoảng 12.503 tỷ đồng. >> Xem chi tiết: https://cafeland.vn/tin-tuc/binh-thuan-da-chap-thuan-dau-tu-75-du-an-83657.html #CafeLand #BinhThuan",9,9,,,,,,Bình luậ,3058332890846993,/story.php?story_fbid=3058332890846993&id=158996624113982,Lưu
CafeLand.vn,,2019-11-12 11:02:11,"Tại Việt Nam, #Officetel này cũng nhanh chóng bắt kịp với xu hướng và sớm trở thành “cơn sốt” trên thị trường bất động sản. Tuy nhiên, hiện nay khung pháp lý về loại hình bất động sản này vẫn còn để trống. Những quy định pháp luật dành cho officetel như quy chuẩn xây dựng, việc cấp giấy quyền sở hữu… đang làm các cơ quan chức năng lúng túng. #Cafeland #canhoOfficetel",10,10,,,,,,1 bình luậ,3058153020864980,/story.php?story_fbid=3058153020864980&id=158996624113982,Lưu
CafeLand.vn,,2019-11-12 10:42:47,"Dự án cảng hàng không Quốc tế Long Thành dự kiến sẽ hoàn thành chậm nhất vào năm 2025, tuy nhiên theo nhận định của các chuyên gia, đến nay tiến độ giải phóng mặt bằng vẫn rất chậm chạp, còn nhiều vướng mắc. Các đại biểu Quốc hội lo ngại tiến độ của dự án này khó đáp ứng mục tiêu đặt ra. >> Xem chi tiết: https://cafeland.vn/tin-tuc/du-an-san-bay-long-thanh-cham-giai-phong-mat-bang-se-khong-kip-tien-do-83645.html #Cafeland #SanbayLongThanh #Chamtiendo",27,25,2,,,,,3 bình luậ,3058125760867706,/story.php?story_fbid=3058125760867706&id=158996624113982,Lưu
CafeLand.vn,,2019-11-12 09:19:59,"Ngoài 2 vụ với tổng cộng 188 ha “đất vàng” nằm trên đường Phạm Ngọc Thạch, cửa ngõ thành phố mới Bình Dương bị thâu tóm, Báo Thanh Niên phát hiện thêm 2 diện tích khác của Tổng công ty sản xuất - xuất nhập khẩu Bình Dương cũng bị “xẻ thịt”. >> Xem chi tiết: https://cafeland.vn/tin-tuc/them-2-vu-thau-tom-dat-vang-o-binh-duong-83643.html #Cafeland #Binhduong #datvang",11,11,,,,,,1 bình luậ,3057898037557145,/story.php?story_fbid=3057898037557145&id=158996624113982,Lưu
CafeLand.vn,,2019-11-12 08:45:13,"SỬA LUẬT XÂY DỰNG Dự luật lần này tập trung sửa đổi, bổ sung 51 điều, hủy bỏ 1/168 điều của Luật Xây dựng 2014. Đáng chú ý là dự luật đã đơn giản hóa một số thủ tục hành chính trong lĩnh vực xây dựng, miễn giấy phép xây dựng (GPXD) đối với một số công trình xây dựng… >> Xem chi tiết: https://cafeland.vn/tin-tuc/sua-luat-xay-dung-8-truong-hop-khong-can-giay-phep-xay-dung-83644.html #Luatxaydung #CafeLand",80,79,,1,,,,6 bình luậ,3057840687562880,/story.php?story_fbid=3057840687562880&id=158996624113982,Lưu
CafeLand.vn,,2019-11-11 21:00:01,"Hội tụ trọn vẹn các yếu tố mảng xanh, kết nối điểm “vàng” cùng định hướng xây dựng khu dân cư hiện đại văn minh, Baria Residence đang trở thành điểm đến lý tưởng của những cư dân khao khát không gian sống đô thị phồn hoa liền kề TP.HCM.",13,13,,,,,,Bình luậ,3056185367728412,/story.php?story_fbid=3056185367728412&id=158996624113982,Lưu
CafeLand.vn,,2019-11-11 19:00:01,"Căn hộ dưới 40m2 này có nội thất màu đen trắng, gỗ mộc mạc và điểm nhấn gạch nung tự nhiên, sinh động với cây trồng trong nhà, mang đến một sự rung cảm hiện đại sắc nét. >> Xem chi tiết: https://cafeland.vn/xu-huong/can-ho-duoi-40m2-voi-trang-tri-sac-net-tinh-te-83580.html",11,11,,,,,,Bình luậ,3056183391061943,/story.php?story_fbid=3056183391061943&id=158996624113982,Lưu
CafeLand.vn,,2019-11-11 18:00:01,"Thông tin quy hoạch tại quận 12, TP.HCM. Tham khảo tại đây! >> Xem chi tiết: https://cafeland.vn/quy-hoach/tai-quan-12/ #Cafeland #Quyhoach #Quan12",16,16,,,,,,Bình luậ,3056178664395749,/story.php?story_fbid=3056178664395749&id=158996624113982,Lưu
CafeLand.vn,,2019-11-11 17:49:58,"Wyndham Soleil Danang là dự án căn hộ nghỉ dưỡng và khách sạn được cấp phép xây dựng với 4 tòa tháp cao từ 50-57 tầng. Ngay sau thành công của tòa khách sạn Ethereal, chủ đầu tư Tập đoàn PPC An Thịnh đã quyết định đưa Tháp căn hộ Nimbus – Hào quang của sự thông thái và tự chủ ra thị trường.",10,10,,,,,,Bình luậ,3056184651061817,/story.php?story_fbid=3056184651061817&id=158996624113982,Lưu
CafeLand.vn,,2019-11-11 17:30:00,Hiệp hội bất động sản TP.HCM (HoREA) vừa có văn bản góp ý kiến về khung giá đất giai đoạn 2019-2024 để khắc phục một số nội dung bất hợp lý của khung giá đất hiện nay. >> Xem chi tiết: https://cafeland.vn/tin-tuc/horea-kien-nghi-3-phuong-an-xay-dung-khung-gia-dat-moi-83639.html #CafeLand #Giadatmoi,17,14,2,1,,,,Bình luậ,3056172187729730,/story.php?story_fbid=3056172187729730&id=158996624113982,Lưu
CafeLand.vn,,2019-11-11 17:10:23,"Cao tốc Bến Lức-Long Thành sắp hoàn thiện, trong đó, đoạn Long An nối TP.HCM qua đường Nguyễn Văn Tạo (Nhà Bè) dự kiến thông xe trước. Thông tin này là một trong những nguyên nhân làm thị trường bất động sản khu Nam Sài Gòn “sốt” cục bộ. >> Xem chi tiết: https://cafeland.vn/tin-tuc/dat-nha-be-sot-cuc-bo-do-hieu-ung-tu-cao-toc-lon-nhat-khu-nam-83638.html #Cafeland #Datnhabe #sotdat",31,31,,,,,,Bình luậ,3056165154397100,/story.php?story_fbid=3056165154397100&id=158996624113982,Lưu
CafeLand.vn,,2019-11-11 16:30:00,"Được xem là chiến lược đúng đắn, các chủ đầu tư đã và đang không ngừng tìm kiếm các ý tưởng mới, tạo nên sự đột phá trong việc phát triển các tiện ích nội khu nhằm mang đến thị trường những dự án thật sự thu hút. Hiện nay, phát triển tiện ích xanh, chú trọng tiện ích cho trẻ em, đầu tư tiện ích cao cấp như Club house là những xu hướng nổi bật. >> Xem chi tiết: https://cafeland.vn/tin-tuc/khang-dinh-dang-cap-cua-du-an-khi-dau-tu-manh-vao-tien-ich-83601.html #CafeLand #Tienich",11,11,,,,,,Bình luậ,3055996707747278,/story.php?story_fbid=3055996707747278&id=158996624113982,Lưu
CafeLand.vn,,2019-11-11 16:00:00,"Sáng nay (11/11), Quốc hội đã thông qua nghị quyết kế hoạch phát triển kinh tế - xã hội năm 2020 với mục tiêu GDP là 6,8%, lạm phát dưới 4%. Nghị quyết gồm 4 điều, quyết nghị mục tiêu tổng quát, 12 chỉ tiêu, nhiệm vụ và giải pháp chủ yếu và tổ chức thực hiện kế hoạch phát triển kinh tế - xã hội năm 2020. >> Xem chi tiết: https://cafeland.vn/su-kien/quoc-hoi-thong-qua-muc-tieu-tang-truong-gdp-nam-2020-khoang-68-83629.html #Cafeland #GDP #thitruong",2,2,,,,,,Bình luậ,3055992277747721,/story.php?story_fbid=3055992277747721&id=158996624113982,Lưu
CafeLand.vn,,2019-11-11 15:32:10,"Có 363 đơn vị công khai lần đầu với số nợ 44,28 tỷ đồng thuế, phí, tiền thuê đất, tiền phạt và tiền chậm nộp.  >> Xem chi tiết: https://cafeland.vn/tin-tuc/ha-noi-beu-ten-loat-doanh-nghiep-bat-dong-san-no-thue-83633.html #Cafeland #doanhnghiepBDS",7,7,,,,,,Bình luậ,3055980524415563,/story.php?story_fbid=3055980524415563&id=158996624113982,Lưu
CafeLand.vn,,2019-11-11 15:00:09,"Thực tế cho thấy trẻ em tại nhiều thành phố đang thiếu chỗ vui chơi, giải trí, hoạt động đúng nghĩa. Cuộc sống của các em gói gọn trong việc: đi học, học thêm và chơi điện tử, thiếu không gian vận động ngoài trời. Việc này hoàn toàn không tốt cho sự phát triển của các em. >> xem chi tiết: https://cafeland.vn/tin-tuc/tre-em-sai-gon-ngu-guc-sau-lung-me-va-uoc-mo-ve-nhung-khoang-troi-rieng-dung-nghia-83605.html #Cafeland #batdongsan",40,31,1,1,3,4,,5 bình luậ,3055823611097921,/story.php?story_fbid=3055823611097921&id=158996624113982,Lưu
CafeLand.vn,,2019-11-11 14:30:00,"Bổ sung quy định giao đất, cho thuê đất đối với các thửa đất có diện tích nhỏ hơn diện tích tối thiểu được tách thửa do Nhà nước trực tiếp quản lý cho người sử dụng đất liền kề. Theo đó, phải đảm bảo 05 nguyên tắc giao đất, cho thuê đất. >> Xem chi tiết: https://cafeland.vn/tin-tuc/sap-co-quy-dinh-giao-dat-voi-thua-dat-co-dien-tich-nho-hon-dien-tich-toi-thieu-duoc-tach-thua-83621.html #Cafeland #Quydinhtachthua",26,25,,1,,,,1 bình luậ,3055820444431571,/story.php?story_fbid=3055820444431571&id=158996624113982,Lưu
CafeLand.vn,,2019-11-11 14:24:35,Nguồn cung khá hạn chế của biệt thự/nhà phố tại TPHCM. Nguồn: Savills #CafeLand #Bietthu #Nhapho,10,10,,,,,,Bình luậ,3055881914425424,/story.php?story_fbid=3055881914425424&id=158996624113982,Lưu
CafeLand.vn,,2019-11-11 14:00:00,"UniHomes Nam Sài Gòn được thành lập với sứ mệnh phục vụ khách hàng và mở rộng thị phần tại những thị trường trọng điểm như khu Nam Sài Gòn, khu Tây Sài Gòn và các tỉnh thành lân cận như Long An ... >> Xem chi tiết: https://cafeland.vn/tin-tuc/unihomes-nam-sai-gon-thanh-vien-thu-3-cua-unihomes-83630.html #CafeLand #UniHomes #NamSaiGon",8,8,,,,,,Bình luậ,3055815874432028,/story.php?story_fbid=3055815874432028&id=158996624113982,Lưu
CafeLand.vn,,2019-11-11 13:29:37,"Có thể phải tốn từ 133.000 đến 2,8 triệu USD để mua một ngôi nhà ở Sicily (Italy). Nhưng giờ đây, ở Cammarata, một thị trấn cổ nằm tại trung tâm Sicily, những ngôi nhà đang được cấp miễn phí. >> Xem thêm: https://cafeland.vn/tin-tuc/thi-tran-cap-nha-mien-phi-cho-nguoi-den-o-83632.html #Cafeland #muanha",12,11,,1,,,,Bình luậ,3055813377765611,/story.php?story_fbid=3055813377765611&id=158996624113982,Lưu
CafeLand.vn,,2019-11-11 13:12:54,"Đại diện Novaland cho biết trong thời gian tới, Tập đoàn sẽ tập trung tạo thêm chuỗi giá trị về phát triển du lịch bền vững, sẽ chú ý các hạng mục để làm tăng các thế mạnh sẵn có của tỉnh Bà Rịa – Vũng Tàu về: Du lịch Nghỉ dưỡng & Chăm sóc sức khoẻ; Du lịch Văn hóa, Giải trí, Ẩm thực và đặc biệt là du lịch sinh thái và du lịch kết hợp hội nghị, hội thảo. >> Xem chi tiết: https://cafeland.vn/tin-tuc/novaland-trien-khai-phuong-an-dau-tu-bat-dong-san-nghi-duong-tai-tinh-ba-ria-vung-tau-83628.html #Novaland #BDSnghiduong",35,35,,,,,,Bình luậ,3055792324434383,/story.php?story_fbid=3055792324434383&id=158996624113982,Lưu
CafeLand.vn,,2019-11-11 11:30:01,Việc Bình Dương dự kiến tăng bảng giá đất từ 45 - 95% so với hiện nay khiến một số doanh nghiệp lo ngại thị trường sẽ bị sốc giá. >> Xem chi tiết: https://cafeland.vn/tin-tuc/thi-truong-bat-dong-san-binh-duong-truoc-noi-lo-soc-gia-83623.html #CafeLand #Binhduong #Sotdat,34,33,1,,,,,8 bình luậ,3055426724470943,/story.php?story_fbid=3055426724470943&id=158996624113982,Lưu
CafeLand.vn,,2019-11-11 11:00:00,"Với nhà đầu tư sành sỏi vị trí dự án, căn góc, không gian sống cá nhân hóa... những điều này quyết định việc khách mua hoặc thuê sản phẩm nhiều hơn là giá bán của sản phẩm đó. >> Xem chi tiết: https://cafeland.vn/tin-tuc/nhung-khach-hang-it-quan-tam-toi-gia-khi-mua-nha-tai-tp-hcm-83622.html #CafeLand #batdongsan",13,13,,,,,,Bình luậ,3055423504471265,/story.php?story_fbid=3055423504471265&id=158996624113982,Lưu
CafeLand.vn,,2019-11-11 10:30:00,"UBND tỉnh Bắc Ninh vừa ra Quyết định phê duyệt Dự án đầu tư xây dựng cầu Chì kết nối 2 huyện Quế Võ và Gia Bình. Dự án có tổng chiều dài toàn tuyến hơn 4,1km, trong đó phần cầu hơn 2,1km tổng vốn đầu tư 1.892 tỉ đồng. >> Xem chi tiết: https://cafeland.vn/tin-tuc/bac-ninh-gan-1900-ti-xay-cau-noi-hai-huyen-que-vo-voi-gia-binh-83627.html #CafeLand #Xaycau #BacNinh",11,11,,,,,,2 bình luậ,3055419911138291,/story.php?story_fbid=3055419911138291&id=158996624113982,Lưu
CafeLand.vn,,2019-11-11 10:14:18,"Center City 3 nằm liền kề trung tâm hành chính Bàu Bàng, UBND xã Long Nguyên… Dự án Center City 3  với tổng số 953 lô, diện tích các lô đất nền dao động từ 95 m2 – 134 m2.  #CafeLand #CenterCity3 #Binhduong",3,2,,1,,,,Bình luậ,3055504151129867,/story.php?story_fbid=3055504151129867&id=158996624113982,Lưu
CafeLand.vn,,2019-11-11 10:00:01,"Vì Hoài Đức có chủ trương lên quận nên từ đầu năm nay, việc ""săn"" những mảnh đất ""màu mỡ"" đã khó hơn những năm trước rất nhiều. Bởi người mua đất để đầu cơ tập trung về đây để ""săn"" đất, còn người dân thì muốn ""om"" để chờ lên giá. >> Xem chi tiết: https://cafeland.vn/tin-tuc/ha-noi-chieu-tro-thoi-gia-dat-o-hoai-duc-thanh-tri-truoc-thong-tin-len-quan-83615.html #CafeLand #Giadat #Hanoi",1,,,1,,,,Bình luậ,3055415007805448,/story.php?story_fbid=3055415007805448&id=158996624113982,Lưu
CafeLand.vn,,2019-11-11 09:30:00,"Bên bán nhà và bên mua đã ký tên, lăn tay trên bản thảo hợp đồng chuyển nhượng tại phòng công chứng khi chưa giao nhận hết tiền. Sau đó, dù phát hiện lừa đảo nhưng bên bán không kịp “trở tay” vì bên mua đã kịp yêu cầu công chứng viên thực hiện lời chứng và phát hành hợp đồng mua bán. >> Xem chi tiết: https://cafeland.vn/tin-tuc/mat-nha-vi-ky-cong-chung-truoc-khi-nhan-du-tien-83614.html #CafeLand #Luadao #muabannhadat",118,103,4,,10,1,,14 bình luậ,3055365931143689,/story.php?story_fbid=3055365931143689&id=158996624113982,Lưu
CafeLand.vn,,2019-11-11 08:59:00,"Nhiều người dân xã Vĩnh Trinh, huyện Vĩnh Thạnh (TP Cần Thơ) bất bình khi chứng kiến một căn nhà mọc lên ngay cạnh cầu vượt đường T3 của tuyến cao tốc Lộ Tẻ - Rạch Sỏi. Người dân cho biết, chủ căn nhà này là người có “vai vế”, xây dựng sai quy định, vi phạm hành lang lộ giới, nhằm mục đích chờ đền bù. >> Xem chi tiết: https://cafeland.vn/tin-tuc/xay-nha-de-cho-den-bu-tien-ty-o-can-tho-83613.html #CafeLand #Denbu #vipham",8,8,,,,,,Bình luậ,3055362357810713,/story.php?story_fbid=3055362357810713&id=158996624113982,Lưu
CafeLand.vn,,2019-11-11 08:32:48,"Bình quân sau mỗi chu kỳ 10 năm, giá đất tăng ít nhất 3 lần, biến động giá ở vùng ven nhiều hơn trung tâm. >> Xem chi tiết: https://cafeland.vn/tin-tuc/gia-dat-tp-hcm-tang-gap-ba-sau-moi-thap-nien-83617.html #CafeLand #Giadat #TPHCM",93,89,,4,,,,6 bình luậ,3055311881149094,/story.php?story_fbid=3055311881149094&id=158996624113982,Lưu
CafeLand.vn,,2019-11-10 21:00:45,"Bên cạnh siêu xe hay phi cơ, bất động sản là một trong những thú vui xa xỉ của các tỷ phú USD. Một số tỷ phú đã chi hàng trăm triệu USD chỉ để mua hoặc xây nhà ở. https://cafeland.vn/doanh-nhan/doanh-nhan/5-ngoi-nha-dat-nhat-the-gioi-cua-cac-ty-phu-24412.html",8,8,,,,,,Bình luậ,3052779311402351,/story.php?story_fbid=3052779311402351&id=158996624113982,Lưu
CafeLand.vn,,2019-11-10 20:00:14,15 thần chú cho sale bất động sản,81,77,,4,,,,1 bình luậ,3052776401402642,/story.php?story_fbid=3052776401402642&id=158996624113982,Lưu
CafeLand.vn,,2019-11-10 19:00:32,"Thời gian qua, có không ít trường hợp người mua bị lừa đảo, mất tiền khi đầu tư vào các dự án phân lô bán nền “ma” do chủ đầu tư tự vẽ ra.  Thậm chí có nơi việc phân lô, bán nền trên cả đất nông nghiệp, không phải là đất ở và mua bán, chuyển nhượng đất khi chưa đủ điều kiện, cơ sở pháp lý. https://cafeland.vn/kien-thuc/hieu-ro-ve-phan-lo-ban-nen-de-tranh-rui-ro-82227.html",37,37,,,,,,1 bình luậ,3052772918069657,/story.php?story_fbid=3052772918069657&id=158996624113982,Lưu
CafeLand.vn,,2019-11-10 18:00:12,"Việc mua đất nền để xây nhà ở hay đầu tư là nhu cầu chính đáng của mỗi người; tuy nhiên, nếu không cảnh giác với các chiêu lừa đảo của kẻ xấu thì người mua sẽ rơi vào cảnh tiền mất tật mang. https://cafeland.vn/kien-thuc/tu-vu-alibaba-khi-mua-dat-nen-phai-biet-dieu-nay-de-tranh-bi-lua-dao-82934.html",16,16,,,,,,Bình luậ,3052770138069935,/story.php?story_fbid=3052770138069935&id=158996624113982,Lưu
CafeLand.vn,,2019-11-10 17:00:08,Người nước ngoài có được mua căn hộ từ cá nhân người Việt Nam? https://cafeland.vn/kien-thuc/nguoi-nuoc-ngoai-co-duoc-mua-can-ho-tu-ca-nhan-nguoi-viet-nam-83529.html,6,6,,,,,,Bình luậ,3052767944736821,/story.php?story_fbid=3052767944736821&id=158996624113982,Lưu
CafeLand.vn,,2019-11-10 16:00:08,"Chỉ trong 3 năm ngắn ngủi Alibaba đã lừa được 6.700 khách hàng, thu về khoản tiền 2.500 tỷ đồng. Vị Chủ tịch Nguyễn Thái Luyện cũng đã tuyển dụng được hơn 2.600 nhân viên và lập hơn 20 công ty “con”, chi nhánh khắp nơi.  Đặc biệt, ngay cả khi Chủ tịch của họ bị bắt nhiều nhân viên Alibaba vẫn lên Facebook bày tỏ lòng tin tưởng vào vị Chủ tịch và công ty của họ. Vậy, nghệ thuật nào khiến Nguyễn Thái Luyện có thể làm được những chuyện phi thường như vậy? https://cafeland.vn/phan-tich/bi-mat-nghe-thuat-gai-bay-cua-chu-tich-alibaba-nguyen-thai-luyen-82729.html",642,574,32,22,6,3,5,88 bình luậ,3052765994737016,/story.php?story_fbid=3052765994737016&id=158996624113982,Lưu
CafeLand.vn,,2019-11-10 15:00:36,UBND TP Cần Thơ vừa ban hành Quyết định 2649/QĐ-UBND chấp thuận đầu tư dự án Khu đô thị mới Đại Ngân do Công ty TNHH Thương mại Dịch vụ Đại Ngân làm chủ đầu tư. https://cafeland.vn/quy-hoach/can-tho-chap-thuan-dau-tu-kdt-dai-ngan-hon-6ha-o-ninh-kieu-83585.html,9,9,,,,,,Bình luậ,3052762861403996,/story.php?story_fbid=3052762861403996&id=158996624113982,Lưu
CafeLand.vn,,2019-11-10 14:00:41,"Ngành ngân hàng vừa khép lại quý 3/2019 với những tín hiệu tích cực, trong đó nhiều ngân hàng ghi nhận mức lợi nhuận hàng nghìn tỉ đồng. Điều này dự báo một năm tăng trưởng tốt của các ngân hàng. https://cafeland.vn/tin-tuc/nhieu-ngan-hang-lai-khung-trong-chin-thang-dau-nam-83607.html",4,4,,,,,,Bình luậ,3052761054737510,/story.php?story_fbid=3052761054737510&id=158996624113982,Lưu
CafeLand.vn,,2019-11-10 13:04:30,"Trong dự thảo sửa đổi thông tư 02/2016/TT – Bộ Xây dựng đưa ra quy định mới, sẽ có thêm một thành phần tham gia ban quản trị nhà chung cư đó là đại diện UBND Phường. https://cafeland.vn/tin-tuc/ai-cam-cai-ban-quan-tri-nha-chung-cu-83606.html",5,5,,,,,,Bình luậ,3052759251404357,/story.php?story_fbid=3052759251404357&id=158996624113982,Lưu
CafeLand.vn,,2019-11-10 12:00:48,"Thứ trưởng Bộ Giao thông Vận tải Nguyễn Nhật cho biết tổng vốn đầu tư các dự án BOT đến nay khoảng 210.000 tỷ đồng, bổ trợ đáng kể cho ngân sách đang rất hạn hẹp. https://cafeland.vn/tin-tuc/hoan-thien-co-so-phap-ly-thuc-day-du-an-ppp-giao-thong-83608.html",8,8,,,,,,Bình luậ,3052756084738007,/story.php?story_fbid=3052756084738007&id=158996624113982,Lưu
CafeLand.vn,,2019-11-10 11:00:53,"Chiến lược phát triển đô thị Việt Nam giai đoạn 2021-2030 đặt mục tiêu tỷ lệ đô thị hóa toàn quốc đạt từ 50-52%, với ít nhất ba đô thị đạt chuẩn đô thị quốc tế.  Tuy nhiên, diện tích đô thị mở rộng nhanh cũng đặt ra nhiều hệ luỵ, trong đó nổi bật là sẽ kéo theo tình trạng sử dụng đất đô thị chưa hiệu quả. https://cafeland.vn/quy-hoach/do-thi-viet-nam-dang-doi-mat-nhieu-thach-thuc-83610.html",12,12,,,,,,Bình luậ,3052754341404848,/story.php?story_fbid=3052754341404848&id=158996624113982,Lưu
CafeLand.vn,,2019-11-10 09:46:57,"Một số chuyên gia cho rằng, vướng mắc về pháp lý và động thái rà soát của cơ quan chức năng là nguyên nhân khiến cho nguồn cung nhà ở mới sụt giảm trong thời gian vừa qua.  Thực tế này có thể sẽ kéo dài sang năm 2020, dẫn đến sự leo thang về giá của một vài phân khúc. https://cafeland.vn/tin-tuc/du-bao-nguon-cung-nha-o-moi-se-giam-trong-nam-2020-83611.html",8,8,,,,,,Bình luậ,3052752241405058,/story.php?story_fbid=3052752241405058&id=158996624113982,Lưu
