source,shared_from,date,text,reactions,likes,ahah,love,wow,sigh,grrr,comments,post_id,url,share
TinMoi.vn,,2019-11-18 10:53:50,Chính thức cho ra khỏi ngành nữ đại úy gây náo loạn ở sân bay.,111,93,16,1,,,1,36 bình luậ,2515061361864333,/story.php?story_fbid=2515061361864333&id=269646396405852,Lưu
TinMoi.vn,,2019-11-18 10:07:53,Nhà cái đánh giá Việt Nam xếp ở cửa trên so với Thái Lan.  #ViệtNam #TháiLan,49,42,5,2,,,,6 bình luậ,2514976868539449,/story.php?story_fbid=2514976868539449&id=269646396405852,Lưu
TinMoi.vn,,2019-11-18 09:16:09,Bê tráp nhận 10 triệu đồng đủ để thấy độ xa hoa trong đám cưới của Bảo Thy và ông xã Doanh nhân của mình. #BảoThy,1,1,,,,,,Bình luậ,2514884835215319,/story.php?story_fbid=2514884835215319&id=269646396405852,Lưu
TinMoi.vn,,2019-11-18 08:31:00,Bà con cẩn thận với những phần thưởng trên mạng xã hội. #TinMoi,47,37,6,,2,1,1,9 bình luậ,2514801921890277,/story.php?story_fbid=2514801921890277&id=269646396405852,Lưu
TinMoi.vn,,2019-11-17 22:02:25,Không khí lạnh lại về.,12,12,,,,,,Bình luậ,2513593322011137,/story.php?story_fbid=2513593322011137&id=269646396405852,Lưu
TinMoi.vn,,2019-11-17 20:41:01,"Lễ rước dâu của BTV thời sự Thu Hà diễn ra tại nhà riêng trong không khí ấm cúng, lịch sự.",35,35,,,,,,Bình luậ,2513436875360115,/story.php?story_fbid=2513436875360115&id=269646396405852,Lưu
TinMoi.vn,,2019-11-17 19:16:15,"Trước thềm trận đấu giữa Thái Lan với Việt Nam, Kiatisak thừa nhận Việt Nam không sợ Thái Lan.",72,59,12,1,,,,20 bình luậ,2513291092041360,/story.php?story_fbid=2513291092041360&id=269646396405852,Lưu
TinMoi.vn,,2019-11-17 17:42:08,Báo Thái đã cử phóng viên đến thị sát nhà HLV Park Hang Seo.,52,39,11,,,,2,6 bình luậ,2513150118722124,/story.php?story_fbid=2513150118722124&id=269646396405852,Lưu
TinMoi.vn,,2019-11-17 16:20:50,Thái Lan kỳ vọng đạt HCV ở cả hạng mục bóng đá nam và nữ tại SEA Games 30.,24,19,4,1,,,,Bình luậ,2513035805400222,/story.php?story_fbid=2513035805400222&id=269646396405852,Lưu
TinMoi.vn,,2019-11-17 14:31:16,"Trước trận đấu, Báo Thái Lan tỏ ra lo lắng trước đội nhà.",26,26,,,,,,1 bình luậ,2512894688747667,/story.php?story_fbid=2512894688747667&id=269646396405852,Lưu
TinMoi.vn,,2019-11-17 13:36:12,Thêm 3 Đảng viên nữa bị kỷ luật trong vụ gian lận thi cử ở Sơn La.,9,7,2,,,,,2 bình luậ,2512828012087668,/story.php?story_fbid=2512828012087668&id=269646396405852,Lưu
TinMoi.vn,,2019-11-17 12:16:36,Bà con ra đường chú ý nhé!,121,110,1,3,3,4,,5 bình luậ,2512730435430759,/story.php?story_fbid=2512730435430759&id=269646396405852,Lưu
TinMoi.vn,,2019-11-17 10:23:42,Chỉ còn 2 ngày nữa là diễn ra trận đấu giữa Việt Nam và Thái Lan trong khi giá vé đã bị đẩy lên cao gấp chục lần.,19,17,1,1,,,,1 bình luậ,2512574662113003,/story.php?story_fbid=2512574662113003&id=269646396405852,Lưu
TinMoi.vn,,2019-11-17 07:51:38,Thực sự là đám cưới của gia đình trâm anh thế phiệt.,35,33,,2,,,,Bình luậ,2512354972134972,/story.php?story_fbid=2512354972134972&id=269646396405852,Lưu
TinMoi.vn,,2019-11-16 20:22:46,ĐT Thái Lan đã có mặt ở Hà Nội để chuẩn bị cho trận đấu với ĐT Việt Nam.,17,14,2,1,,,,Bình luậ,2511141112256358,/story.php?story_fbid=2511141112256358&id=269646396405852,Lưu
TinMoi.vn,,2019-11-16 19:05:07,Bảo Thy gửi lời nhắn đến bạn bè không khóc trong đám cưới mình.,10,8,2,,,,,Bình luậ,2511010822269387,/story.php?story_fbid=2511010822269387&id=269646396405852,Lưu
TinMoi.vn,,2019-11-16 16:29:32,HLV Park Hang Seo sẽ không để Đình Trọng tham dự SEA Games 30.,17,17,,,,,,1 bình luậ,2510788638958272,/story.php?story_fbid=2510788638958272&id=269646396405852,Lưu
TinMoi.vn,,2019-11-16 15:15:50,HLV Thái Lan muốn bảo mật tuyệt đối cho cuộc đối đầu với Việt Nam.,22,17,4,,1,,,12 bình luậ,2510694298967706,/story.php?story_fbid=2510694298967706&id=269646396405852,Lưu
TinMoi.vn,,2019-11-16 12:32:15,Truyền thông UAE liệt kê những HLV bị sa thải dưới thời thầy Park.,100,89,10,,1,,,3 bình luậ,2510487585655044,/story.php?story_fbid=2510487585655044&id=269646396405852,Lưu
TinMoi.vn,,2019-11-16 10:50:05,Trận đấu tới đây giữa ĐT Việt Nam và Thái Lan sẽ mang ý nghĩa rất quan trọng đối với Thái Lan.,46,42,4,,,,,3 bình luậ,2510345882335881,/story.php?story_fbid=2510345882335881&id=269646396405852,Lưu
TinMoi.vn,,2019-11-16 09:01:05,Hà Nội khẳng định chưa lấy và không bỏ một đồng nào để bù giá cho nước sông Đuống,9,8,,1,,,,2 bình luậ,2510187229018413,/story.php?story_fbid=2510187229018413&id=269646396405852,Lưu
TinMoi.vn,,2019-11-15 20:55:34,"Ngay trong buổi sáng ngày 15/11, ĐT Việt Nam đã có buổi tập dù mới chỉ đánh bại đối thủ UAE. #Bóngđá",31,30,,1,,,,1 bình luậ,2508448125858990,/story.php?story_fbid=2508448125858990&id=269646396405852,Lưu
TinMoi.vn,,2019-11-15 20:10:44,"Một ngày sau chiến thắng trước UAE, bóng đá Việt Nam lại tiếp tục đón nhận tin vui khi Đoàn Văn Hậu được để cử cầu thủ trẻ xuất sắc nhất châu Á. #ĐoànVănHậu",40,37,1,2,,,,1 bình luậ,2508412309195905,/story.php?story_fbid=2508412309195905&id=269646396405852,Lưu
TinMoi.vn,,2019-11-15 19:25:41,"Xuất hiện trong chương trình tặng sách của vua cafe Đặng Lê Nguyên Vũ, 'Chim công làng múa” Linh Nga nhận được nhiều quan tâm của sinh viên bởi nhan sắc xinh đẹp đặc trưng của một diễn viên múa. #LinhNga",10,10,,,,,,Bình luậ,2508367455867057,/story.php?story_fbid=2508367455867057&id=269646396405852,Lưu
TinMoi.vn,,2019-11-15 17:20:15,Bảo Thy chia sẻ đầy xúc động trước thềm đám cưới. #BảoThy,9,9,,,,,,Bình luậ,2508358702534599,/story.php?story_fbid=2508358702534599&id=269646396405852,Lưu
TinMoi.vn,,2019-11-15 16:40:53,2 vợ chồng tổ chức đưa người ra nước ngoài trái phép đã bị bắt giữ.,20,20,,,,,,Bình luậ,2508571175846685,/story.php?story_fbid=2508571175846685&id=269646396405852,Lưu
TinMoi.vn,,2019-11-15 15:22:57,Người đàn ông gốc Việt đã bị một tòa án ở Bruges đã kết án hơn 3 năm tù vì tội buôn người.,14,12,,,,,2,Bình luậ,2508457329191403,/story.php?story_fbid=2508457329191403&id=269646396405852,Lưu
TinMoi.vn,,2019-11-15 15:04:51,"Trong tất cả các đại diện của Đông Nam Á ra sân tại vòng loại World Cup 2022, chỉ có duy nhất ĐT Thái Lan phải nếm trải cảm giác thua cuộc. #WorldCup2022",54,50,3,,1,,,2 bình luậ,2508433792527090,/story.php?story_fbid=2508433792527090&id=269646396405852,Lưu
TinMoi.vn,,2019-11-15 15:04:51,"Trong tất cả các đại diện của Đông Nam Á ra sân tại vòng loại World Cup 2022, chỉ có duy nhất ĐT Thái Lan phải nếm trải cảm giác thua cuộc. #WorldCup2022",54,50,3,,1,,,2 bình luậ,2508433792527090,/story.php?story_fbid=2508433792527090&id=269646396405852,Lưu
TinMoi.vn,,2019-11-15 14:28:15,Đại úy Hiền sẽ bị hạ 2 cấp và cho ra khỏi ngành sau khi gây rối ở sân bay. #TinMoi,231,198,28,2,1,,2,80 bình luậ,2508386815865121,/story.php?story_fbid=2508386815865121&id=269646396405852,Lưu
TinMoi.vn,,2019-11-15 13:42:45,Truyền thông Thái Lan một lần nữa thất vọng khi đội nhà thất bại trước Malaysia. #TháiLan,58,52,6,,,,,1 bình luậ,2508331675870635,/story.php?story_fbid=2508331675870635&id=269646396405852,Lưu
TinMoi.vn,,2019-11-15 12:45:23,Hoài Linh khoe ảnh diện một cây hàng hiệu thương hiệu Dolce&Gabbana tại Australia. #HoàiLinh,31,31,,,,,,Bình luậ,2508165145887288,/story.php?story_fbid=2508165145887288&id=269646396405852,Lưu
TinMoi.vn,,2019-11-15 11:39:58,"Không có điều kiện theo dõi trận đấu trực tiếp trên SVĐ Mỹ Đình, mẹ của Tiến Linh vẫn vỡ òa trong sự sung sướng sau khi con trai lập công đẹp mắt. #TIẾNLINH",44,43,,1,,,,5 bình luậ,2508181285885674,/story.php?story_fbid=2508181285885674&id=269646396405852,Lưu
TinMoi.vn,,2019-11-15 10:37:26,"Với ngôi đầu bảng G vòng loại World Cup 2022, ĐT Việt Nam đã nhận số tiền thưởng từ LĐBĐ Việt Nam và các doanh nghiệp. #Bóngđá",61,59,1,,1,,,1 bình luậ,2508098935893909,/story.php?story_fbid=2508098935893909&id=269646396405852,Lưu
TinMoi.vn,,2019-11-15 09:52:56,Tiến Linh chia sẻ đầy hạnh phúc khi ghi bàn thắng duy nhất giúp tuyển Việt Nam đánh bại UAE. #TIẾNLINH,19,19,,,,,,Bình luậ,2508036659233470,/story.php?story_fbid=2508036659233470&id=269646396405852,Lưu
TinMoi.vn,,2019-11-15 09:03:06,"Trả lời họp báo sau trận đấu, HLV van Marwijk tỏ ra không hài lòng về công tác trọng tài cũng như bất phục trước chiến thắng của ĐT Việt Nam. #ĐTUAE",1,1,,,,,,1 bình luậ,2507966285907174,/story.php?story_fbid=2507966285907174&id=269646396405852,Lưu
TinMoi.vn,,2019-11-15 08:21:52,Thầy Park tuyệt vời quá! :),75,72,,3,,,,5 bình luậ,2507906765913126,/story.php?story_fbid=2507906765913126&id=269646396405852,Lưu
TinMoi.vn,,2019-11-15 07:45:12,Chiến thắng trước ĐT UAE đã giúp ĐT Việt Nam nhận được rất nhiều hệ số và vươn lên thứ hạng trên BXH FIFA. #TinMoi #ĐTViệtNam,94,93,,1,,,,Bình luậ,2507857139251422,/story.php?story_fbid=2507857139251422&id=269646396405852,Lưu
TinMoi.vn,,2019-11-15 07:10:34,Nhận biết thịt gà bị hỏng nhanh nhờ màu sắc. #TinMoi,4,4,,,,,,Bình luậ,2506448006059002,/story.php?story_fbid=2506448006059002&id=269646396405852,Lưu
TinMoi.vn,,2019-11-14 23:02:57,Không còn gì hợp lý hơn.,84,78,3,2,1,,,2 bình luậ,2507084242662045,/story.php?story_fbid=2507084242662045&id=269646396405852,Lưu
TinMoi.vn,,2019-11-14 22:46:17,Lẩu Thái vẫn luôn cay. :),39,37,2,,,,,Bình luậ,2507054362665033,/story.php?story_fbid=2507054362665033&id=269646396405852,Lưu
TinMoi.vn,,2019-11-14 22:06:18,Người hùng Tiến Linh của trận đấu với UAE với bàn thắng vô cùng đẹp mắt trên sân nhà. #TiếnLinh,52,51,1,,,,,3 bình luậ,2506987022671767,/story.php?story_fbid=2506987022671767&id=269646396405852,Lưu
TinMoi.vn,,2019-11-14 21:34:26,Hơi buồn cho đội bạn UAE.,12,12,,,,,,Bình luậ,2506927742677695,/story.php?story_fbid=2506927742677695&id=269646396405852,Lưu
TinMoi.vn,,2019-11-14 21:03:58,Ở một cự ly 30m nhưng Tiến Linh đã tạo nên một siêu phẩm cho ĐT Việt Nam.,76,71,,4,1,,,5 bình luậ,2506874106016392,/story.php?story_fbid=2506874106016392&id=269646396405852,Lưu
TinMoi.vn,,2019-11-14 20:33:37,"Bị chồng cũ cấm gặp con trai, Nhật Kim Anh van xin để được gặp con.",42,31,,2,1,7,1,13 bình luậ,2506819882688481,/story.php?story_fbid=2506819882688481&id=269646396405852,Lưu
TinMoi.vn,,2019-11-14 19:10:49,Đám cưới thế kỷ nhưng vẫn có những sự cố nhớ đời đối với Đông Nhi và Ông Cao Thắng. #ĐôngNhi   #ÔngCaoThắng,16,15,1,,,,,Bình luậ,2506462812724188,/story.php?story_fbid=2506462812724188&id=269646396405852,Lưu
TinMoi.vn,,2019-11-14 17:46:21,Nam danh hài Trấn Thành thẳng thừng từ chối tình cảm của một chàng trai và tuyên bố đã có gia đình. #TrấnThành,5,5,,,,,,Bình luậ,2506551606048642,/story.php?story_fbid=2506551606048642&id=269646396405852,Lưu
TinMoi.vn,,2019-11-14 17:01:50,Đội bóng nổi tiếng bậc nhất của giải Ngoại hạng Anh vừa gửi lời chúc đến ĐT Việt Nam trong trận đấu gặp ĐT UAE vào tối nay. #ĐTVIệtNam,50,47,,3,,,,Bình luậ,2506485476055255,/story.php?story_fbid=2506485476055255&id=269646396405852,Lưu
TinMoi.vn,,2019-11-14 16:12:52,"Sam xinh đẹp, rạng rỡ trong chuyến công tác tại Hàn Quốc. #Sam",6,6,,,,,,Bình luậ,2506412546062548,/story.php?story_fbid=2506412546062548&id=269646396405852,Lưu
TinMoi.vn,,2019-11-14 15:20:28,Cùng cổ vũ cho thầy Park và các học trò trong trận đấu tối nay thôi nào.  #ViệtNamvôđịch,62,56,1,5,,,,4 bình luậ,2506341019403034,/story.php?story_fbid=2506341019403034&id=269646396405852,Lưu
TinMoi.vn,,2019-11-14 14:34:33,BTC đã đưa ra những điều chỉnh về lịch thi đấu SEA Games 30 với ĐT U22 Việt Nam. #SEAGames30,12,11,1,,,,,Bình luậ,2506283209408815,/story.php?story_fbid=2506283209408815&id=269646396405852,Lưu
TinMoi.vn,,2019-11-14 13:46:38,Cứ phải thế mới chừa. :(,9,8,1,,,,,Bình luậ,2506224016081401,/story.php?story_fbid=2506224016081401&id=269646396405852,Lưu
TinMoi.vn,,2019-11-14 12:45:45,Bảo nổi cơn ghen khi nhân viên mình có ý định tán Khuê. #PhimHoahồngtrênngựctrái,9,8,1,,,,,1 bình luậ,2506050786098724,/story.php?story_fbid=2506050786098724&id=269646396405852,Lưu
TinMoi.vn,,2019-11-14 11:56:48,"Dù đang tập trung toàn lực cho trận đấu gặp Malaysia nhưng HLV Akira Nishino vẫn không quên ""do thám"" Việt Nam.",11,10,,,1,,,1 bình luậ,2506084826095320,/story.php?story_fbid=2506084826095320&id=269646396405852,Lưu
TinMoi.vn,,2019-11-14 11:12:16,ĐT UAE là một trong những đội tuyển được tận hưởng cơ sở vật chất và đãi ngộ hàng đầu thế giới. #UAE,29,29,,,,,,1 bình luậ,2506031006100702,/story.php?story_fbid=2506031006100702&id=269646396405852,Lưu
TinMoi.vn,,2019-11-14 10:24:16,"Nghệ sĩ, MC Quyền Linh mới được bầu là 1 trong 5 Phó chủ tịch Hội Bảo vệ quyền tác phẩm điện ảnh và truyền hình Việt Nam. #QuyềnLinh",13,13,,,,,,Bình luậ,2505969662773503,/story.php?story_fbid=2505969662773503&id=269646396405852,Lưu
TinMoi.vn,,2019-11-14 09:28:08,Bà con hôm nay ra đường nhớ mặc áo ấm nhé! #Thờitiết,10,7,,1,2,,,Bình luậ,2505895176114285,/story.php?story_fbid=2505895176114285&id=269646396405852,Lưu
TinMoi.vn,,2019-11-14 08:51:53,"Sau bao nhiêu cay đắng của cuộc đời, cuối cùng Thái cũng biết trân quý và hối tiếc những thứ đã mất. #PhimHoahồngtrênngựctrái",3,3,,,,,,1 bình luậ,2505843352786134,/story.php?story_fbid=2505843352786134&id=269646396405852,Lưu
TinMoi.vn,,2019-11-14 07:20:42,Thay đổi thói quen nhỏ có thể giúp con bạn được khỏe mạnh. #TinMoi,3,3,,,,,,Bình luậ,2504322586271544,/story.php?story_fbid=2504322586271544&id=269646396405852,Lưu
TinMoi.vn,,2019-11-13 22:52:34,"Chặn quảng cáo bằng các tiện ích, người dùng sẽ bị Youtube khoá tài khoản.",2,2,,,,,,Bình luậ,2504939182876551,/story.php?story_fbid=2504939182876551&id=269646396405852,Lưu
TinMoi.vn,,2019-11-13 21:12:40,Bắt đầu có không khí rồi bà con!,42,41,,1,,,,Bình luậ,2504756039561532,/story.php?story_fbid=2504756039561532&id=269646396405852,Lưu
TinMoi.vn,,2019-11-13 19:59:11,"Nhằm phục vụ công tác giao thông trước, trong và sau trận đấu, Hà Nội tiến hành cấm 20 tuyến đường.",17,17,,,,,,Bình luậ,2504627749574361,/story.php?story_fbid=2504627749574361&id=269646396405852,Lưu
TinMoi.vn,,2019-11-13 19:15:56,"Sau quá trình dài chuẩn bị, Lan Ngọc đã chính thức tung teaser MV mới khiến fan vô cùng thích thú, tò mò. #LanNgọc",2,2,,,,,,Bình luậ,2504340202936449,/story.php?story_fbid=2504340202936449&id=269646396405852,Lưu
TinMoi.vn,,2019-11-13 17:53:25,Nhiều thương binh xếp hàng chờ mua vé trận Việt Nam - UAE.,5,4,1,,,,,7 bình luậ,2504422799594856,/story.php?story_fbid=2504422799594856&id=269646396405852,Lưu
TinMoi.vn,,2019-11-13 17:20:16,HLV van Marwijk giành sự tôn trọng rất lớn với đối thủ Việt Nam. #HLVUAE,10,9,,,1,,,1 bình luậ,2504376492932820,/story.php?story_fbid=2504376492932820&id=269646396405852,Lưu
TinMoi.vn,,2019-11-13 15:19:32,HLV Park Hang Seo tự tin với sự chuẩn bị kỹ càng nhất cho trận đấu sắp tới gặp ĐT UAE. #ViệtNam #UAE,13,13,,,,,,1 bình luậ,2504220159615120,/story.php?story_fbid=2504220159615120&id=269646396405852,Lưu
TinMoi.vn,,2019-11-13 14:34:37,Khá Bảnh bị Tòa tuyên án hơn 10 năm tù. #KháBảnh,60,49,9,1,,1,,8 bình luậ,2504164009620735,/story.php?story_fbid=2504164009620735&id=269646396405852,Lưu
TinMoi.vn,,2019-11-13 13:48:19,"Một ngày trước khi trận đấu với ĐT UAE diễn ra, ĐT Việt Nam đã chốt danh sách 23 cầu thủ với 2 cái tên bị loại. #ĐTViệtNam #ĐTUAE",14,13,,1,,,,Bình luậ,2504107746293028,/story.php?story_fbid=2504107746293028&id=269646396405852,Lưu
TinMoi.vn,,2019-11-13 11:50:53,Anh Bảo bắt đầu thể hiện tình cảm với chị Khuê rồi. Hy vọng sẽ có một cái kết đẹp cho cặp đôi. :) #PhimHoahồngtrênngựctrái,28,27,,1,,,,Bình luậ,2503894849647651,/story.php?story_fbid=2503894849647651&id=269646396405852,Lưu
TinMoi.vn,,2019-11-13 10:46:17,ĐT UAE đã đặt chân đến Hà Nội để chuẩn bị cho cuộc đối đầu với ĐT Việt Nam tại vòng loại World Cup 2022. #WorldCup2022,22,22,,,,,,10 bình luậ,2503884199648716,/story.php?story_fbid=2503884199648716&id=269646396405852,Lưu
TinMoi.vn,,2019-11-13 10:06:56,"Nhờ lương cơ sở tăng, lương của cán bộ, công chức sẽ tăng tùy theo ngạch, bậc. #Lương",11,11,,,,,,3 bình luậ,2503830329654103,/story.php?story_fbid=2503830329654103&id=269646396405852,Lưu
TinMoi.vn,,2019-11-13 09:20:27,Ngô Bá Khá và đồng bọn đã bị đưa ra xét xử về tội Đánh bạc và Tổ chức đánh bạc trong sáng nay. #KháBảnh,30,29,,1,,,,2 bình luậ,2503767166327086,/story.php?story_fbid=2503767166327086&id=269646396405852,Lưu
TinMoi.vn,,2019-11-13 08:44:12,Đông Nhi và Ông Cao Thắng đã đáp máy bay về TP.HCM sau lễ cưới tại Phú Quốc. #ĐôngNhi    #ÔngCaoThắng,47,44,,2,,,1,5 bình luậ,2503716576332145,/story.php?story_fbid=2503716576332145&id=269646396405852,Lưu
TinMoi.vn,,2019-11-13 07:15:33,"Mệt mỏi, mờ mắt là một số biểu hiện của đường huyết cao mà bạn cần lưu ý, dù bạn không bị tiểu đường. #Sứckhỏe",5,5,,,,,,Bình luậ,2502305723139897,/story.php?story_fbid=2502305723139897&id=269646396405852,Lưu
TinMoi.vn,,2019-11-12 22:36:24,Lãnh đạo các sở ban ngành Hà Nội đã lên tiếng lý giải việc giá nước sạch sông Đuống cao hơn nước sạch sông Đà.,1,1,,,,,,Bình luậ,2502857469751389,/story.php?story_fbid=2502857469751389&id=269646396405852,Lưu
TinMoi.vn,,2019-11-12 21:06:57,Quốc hội đã chính thức thông qua Nghị quyết về dự toán ngân sách Nhà nước năm 2020.,20,20,,,,,,Bình luậ,2502706606433142,/story.php?story_fbid=2502706606433142&id=269646396405852,Lưu
TinMoi.vn,,2019-11-12 20:12:30,Đông Nhi và Ông Cao Thắng chia sẻ sau đám cưới nghìn tỷ.,8,8,,,,,,2 bình luậ,2502604859776650,/story.php?story_fbid=2502604859776650&id=269646396405852,Lưu
TinMoi.vn,,2019-11-12 19:10:59,"Trong đám cưới Đông Nhi – Ông Cao Thắng, cả Ngô Kiến Huy và Khổng Tú Quỳnh là bạn bè thân thiết nên đều được mời đến tham dự. #TinMoi #KhổngTúQuỳnh",29,27,1,,,1,,1 bình luậ,2502287196475083,/story.php?story_fbid=2502287196475083&id=269646396405852,Lưu
TinMoi.vn,,2019-11-12 17:47:13,"Không còn muốn xử kín, bà Lê Hoàng Diệp Thảo bất ngờ có đơn xin tòa xử công khai vụ ly hôn giữa mình và Đặng Lê Nguyên Vũ.",20,16,1,,2,1,,9 bình luậ,2502377179799418,/story.php?story_fbid=2502377179799418&id=269646396405852,Lưu
TinMoi.vn,,2019-11-12 17:23:00,Chủ xe Santafe TM2 ở Quảng Bình đã dở khóc dở cười khi bấm được biển số '1 năm 4 mùa mãi sinh tài'. #TinMoi,66,58,7,,,,1,12 bình luậ,2502341076469695,/story.php?story_fbid=2502341076469695&id=269646396405852,Lưu
TinMoi.vn,,2019-11-12 16:20:42,Phan Văn Đức và bạn gái Nhật Linh sắp kết hôn vào đầu năm sau. #PhanVănĐức,15,15,,,,,,Bình luậ,2502257283144741,/story.php?story_fbid=2502257283144741&id=269646396405852,Lưu
TinMoi.vn,,2019-11-12 15:24:53,Đại diện Việt Nam Nguyễn Tường San lọt top 8 chung kết Hoa hậu Quốc tế 2019 và đang bước tiếp vào phần thi ứng xử. #ÁhậuTườngSan,9,7,,2,,,,1 bình luậ,2502180583152411,/story.php?story_fbid=2502180583152411&id=269646396405852,Lưu
TinMoi.vn,,2019-11-12 14:51:58,"Bên cạnh việc trả lương cho HLV Park Hang Seo, VFF cũng phải chi tiền để giữ chân các trợ lý của thầy Park. #HLVParkHangSeo",5,5,,,,,,Bình luậ,2502138796489923,/story.php?story_fbid=2502138796489923&id=269646396405852,Lưu
TinMoi.vn,,2019-11-12 13:51:40,Liên đoàn bóng đá châu Á (AFC) đã công bố danh tính trọng tài sẽ bắt chính trận đấu thuộc vòng loại World Cup 2022 khu vực châu Á giữa Việt Nam và UAE. #WorldCup2022,10,10,,,,,,Bình luậ,2502066816497121,/story.php?story_fbid=2502066816497121&id=269646396405852,Lưu
TinMoi.vn,,2019-11-12 12:45:34,Những hình ảnh đẹp về câu chuyện tình 10 năm lung linh của Đông Nhi và Ông Cao Thắng. #TinMoi #ĐôngNhi    #ÔngCaoThắng,7,7,,,,,,Bình luậ,2501810716522731,/story.php?story_fbid=2501810716522731&id=269646396405852,Lưu
TinMoi.vn,,2019-11-12 11:46:55,Sở Văn hóa và Thể thao Quảng Ninh đã có kết luận cuối cùng về vụ việc Bích Phương hát nhép. #BíchPhương,17,15,2,,,,,5 bình luậ,2501908289846307,/story.php?story_fbid=2501908289846307&id=269646396405852,Lưu
TinMoi.vn,,2019-11-12 11:02:33,"Càng gần đến ngày trận đấu diễn ra, HLV Park Hang Seo càng thiết quân luật để ĐT Việt Nam có sự tập trung cao độ nhất. #TinMoi",13,13,,,,,,1 bình luậ,2501833153187154,/story.php?story_fbid=2501833153187154&id=269646396405852,Lưu
TinMoi.vn,,2019-11-12 10:12:43,"Cô Ngân chưa chịu bỏ cuộc, dự sẽ là vật cản lớn trong mối quan hệ giữa Khuê và Bảo. #PhimHoahồngtrênngựctrái",3,3,,,,,,Bình luậ,2501749889862147,/story.php?story_fbid=2501749889862147&id=269646396405852,Lưu
TinMoi.vn,,2019-11-12 09:17:43,"Do ảnh hưởng của không khí lạnh, khắp các tỉnh Bắc Bộ xuất hiện mưa rào và nhiều nơi có mưa dông. #Thờitiết",23,20,,1,1,1,,1 bình luậ,2501655816538221,/story.php?story_fbid=2501655816538221&id=269646396405852,Lưu
TinMoi.vn,,2019-11-12 08:44:10,Giảm trữ nước là một cách để giảm cân nhờ xông hơi và uống nước cất. #Sứckhỏe,1,1,,,,,,Bình luậ,2501598246543978,/story.php?story_fbid=2501598246543978&id=269646396405852,Lưu
TinMoi.vn,,2019-11-12 07:20:49,"Việc làm sạch, thanh tẩy ruột kết sẽ giúp bạn tránh được những vấn đề đáng lo ngại về sức khỏe. #Sứckhỏe",11,10,,1,,,,Bình luậ,2499866666717136,/story.php?story_fbid=2499866666717136&id=269646396405852,Lưu
TinMoi.vn,,2019-11-11 21:55:02,Ông Cao Thắng sử dụng giày độn đế để tăng chiều cao trong đám cưới với Đông Nhi.,6,5,1,,,,,1 bình luậ,2500400586663744,/story.php?story_fbid=2500400586663744&id=269646396405852,Lưu
TinMoi.vn,,2019-11-11 21:09:54,Phó chủ tịch UBND tỉnh Quảng Nam được bầu làm Phó Bí thư Tỉnh uỷ.,3,3,,,,,,Bình luậ,2500304980006638,/story.php?story_fbid=2500304980006638&id=269646396405852,Lưu
TinMoi.vn,,2019-11-11 20:05:50,Giải pháp theo dõi cảm xúc của con người bằng công nghệ nhận diện khuôn mặt.,1,1,,,,,,1 bình luậ,2500180970019039,/story.php?story_fbid=2500180970019039&id=269646396405852,Lưu
TinMoi.vn,,2019-11-11 19:10:53,"Đang có mặt tại Hà Lan, Đàm Vĩnh Hưng đã lập tức rủ Đoàn Văn Hậu đi ăn tối. #ĐàmVĩnhHưng #ĐoànVănHậu",31,29,,1,,,1,8 bình luậ,2499838663386603,/story.php?story_fbid=2499838663386603&id=269646396405852,Lưu
TinMoi.vn,,2019-11-11 18:00:23,Dù gần đến ngày khởi tranh nhưng U22 Việt Nam vẫn chưa nắm được nhiều thông tin để có được sự chuẩn bị tốt nhất cho giải đấu.,8,6,,1,,,1,Bình luậ,2499961786707624,/story.php?story_fbid=2499961786707624&id=269646396405852,Lưu
TinMoi.vn,,2019-11-11 17:27:59,Khắp các tỉnh miền Bắc sắp đón không khí lạnh kèm mưa lớn. #Thờitiết,23,20,,2,,1,,1 bình luậ,2499914400045696,/story.php?story_fbid=2499914400045696&id=269646396405852,Lưu
TinMoi.vn,,2019-11-11 16:09:44,Bộ Tài chính mới đây đã ban hành quy định về việc bổ sung thay đổi biểu tính lệ phí trước bạ với ô tô và xe máy. #TinMoi,7,6,,,1,,,Bình luậ,2499796400057496,/story.php?story_fbid=2499796400057496&id=269646396405852,Lưu
TinMoi.vn,,2019-11-11 14:56:51,Ngô Kiến Huy và Khổng Tú Quỳnh lần đầu gặp lại nhau sau khi chia tay. #NgôKiếnHuy #KhổngTúQuỳnh,20,20,,,,,,Bình luậ,2499698450067291,/story.php?story_fbid=2499698450067291&id=269646396405852,Lưu
TinMoi.vn,,2019-11-11 13:48:46,Giá vàng trong nước và giá vàng Thế giới có xu hướng giảm. #Giávàng,12,11,,,,,1,Bình luậ,2499611763409293,/story.php?story_fbid=2499611763409293&id=269646396405852,Lưu
