source,shared_from,date,text,reactions,likes,ahah,love,wow,sigh,grrr,comments,post_id,url,share
Báo Lao Động,,2019-11-25 20:33:38,"Bản tin Dự báo thời tiết mới nhất đêm nay và ngày mai 26.11 Theo nhận định của Trung tâm Dự báo Khí tượng Thuỷ văn Quốc gia, đêm nay và ngày mai 26.11, bộ phận không khí lạnh tiếp tục ảnh hưởng đến các nơi khác ở phía Đông Bắc Bộ, sau đó ảnh hưởng đến Bắc Trung Bộ, một số nơi ở phía Tây Bắc Bộ và Trung Trung Bộ. Do ảnh hưởng của không khí lạnh, ở Bắc Bộ có mưa vài nơi, riêng các tỉnh vùng núi đêm nay có mưa, mưa rào rải rác.  Xem chi tiết tại: https://laodong.vn/video/ban-tin-du-bao-thoi-tiet-moi-nhat-dem-nay-va-ngay-mai-2611-768234.ldo #dubaothoitiet",26,25,,1,,,,Bình luậ,581800075912844,/story.php?story_fbid=581800075912844&id=152570468273884,Lưu
Báo Lao Động,,2019-11-25 20:30:25,"1928 người thương vong do tai nạn giao thông trong 11 tháng; Xe khách tông xe máy, 2 nữ sinh tử vong thương tâm; Xe khách lao thẳng xuống cầu khiến 3 người bị thương... là những tin tức giao thông đáng chú nhất trong 24h qua.",3,2,,,,1,,Bình luậ,1222989191232001,/story.php?story_fbid=1222989191232001&id=152570468273884,Lưu
Báo Lao Động,,2019-11-25 20:05:50,"Trước việc chiếc áo số 10 ở U22 Việt Nam dự SEA Games 30 bị bỏ trống, huấn luyện viên Park Hang-seo đã chính thức lên tiếng giải thích.",5,5,,,,,,Bình luậ,1223017174562536,/story.php?story_fbid=1223017174562536&id=152570468273884,Lưu
Báo Lao Động,,2019-11-25 20:04:37,"Trước khi xét xử băng nhóm tín dụng đen lớn nhất nước, TAND tỉnh Thanh Hoá đã triệu tập tới 89 người có quyền lợi, nghĩa vụ liên quan, nhưng chỉ có 1 người  đến tòa.",36,26,6,,2,,2,Bình luậ,1223025301228390,/story.php?story_fbid=1223025301228390&id=152570468273884,Lưu
Báo Lao Động,,2019-11-25 20:00:01,"Người dân Hà Nội nháo nhác vì dư chấn rung lắc, động đất xảy ra ở đâu?; Cố tình đi vào đường cấm giờ cao điểm, hàng chục xe ôtô bị phạt... là tin tức Hà Nội nóng trong 24h qua.",3,3,,,,,,Bình luậ,1222988914565362,/story.php?story_fbid=1222988914565362&id=152570468273884,Lưu
Báo Lao Động,,2019-11-25 19:53:31,"Nếu chỉ đơn giản là đi vay thương mại với lãi suất cao mà xây dựng nhà máy thì bất kì công ty nào cũng làm được. Việc lựa chọn công ty vốn ít, phải đi vay thương mại lãi suất cao như Nhà máy nước mặt sông Đuống là dấu hỏi lớn.",49,34,10,,4,,1,Bình luậ,1223016864562567,/story.php?story_fbid=1223016864562567&id=152570468273884,Lưu
Báo Lao Động,,2019-11-25 19:45:38,Đội trưởng Faiq Bolkiah của U22 Brunei trong trận thua 0-6 trước U22 Việt Nam là người có gia thế hoàng tộc với một khối tài sản kếch xù.,3,3,,,,,,Bình luậ,1222992617898325,/story.php?story_fbid=1222992617898325&id=152570468273884,Lưu
Báo Lao Động,,2019-11-25 19:39:48,"Sau khi vi phạm giao thông và không xuất trình được giấy phép lái xe, người đàn ông điều khiển xe máy bị phát hiện mang theo 15 con dao.",12,12,,,,,,Bình luậ,1223007491230171,/story.php?story_fbid=1223007491230171&id=152570468273884,Lưu
Báo Lao Động,,2019-11-25 19:25:56,"Dù các bác sĩ đánh giá sản phụ không thể sinh tự nhiên qua ngả âm đạo nên chỉ định mổ lấy thai để đảm bảo tính mạng cho thai nhi. Tuy nhiên, sản phụ và gia đình vẫn quyết sử dụng phương pháp 'sinh thuận tự nhiên', khiến cả mẹ và thai nhi rơi vào tình trạng nguy hiểm.",4,3,1,,,,,Bình luậ,1222989891231931,/story.php?story_fbid=1222989891231931&id=152570468273884,Lưu
Báo Lao Động,,2019-11-25 19:19:10,"Ngày 25.11, nhiều công nhân phân xưởng 1,2 Cty TNHH Lợi Tín Lập Thạch (huyện Lập Thạch, tỉnh Vĩnh Phúc) đã đi làm trở lại theo thông báo của Cty.",10,9,,,1,,,Bình luậ,1222993054564948,/story.php?story_fbid=1222993054564948&id=152570468273884,Lưu
Báo Lao Động,,2019-11-25 19:13:37,"Chỉ từ việc tranh cãi gốc mai to nhỏ dẫn đến mâu thuẫn, nam thanh niên về tiệm sắt tiếp tục tranh cãi đồng nghiệp rồi dùng búa đánh chết đồng nghiệp.",12,9,1,,1,1,,Bình luậ,1222988474565406,/story.php?story_fbid=1222988474565406&id=152570468273884,Lưu
Báo Lao Động,,2019-11-25 19:11:42,"Nếu vụ tai nạn giao thông có người chết tại hiện trường hoặc chết trên đường đi cấp cứu… thì giao cho cơ quan Cảnh sát điều tra tiếp nhận thụ lý điều tra, giải quyết.",4,4,,,,,,Bình luậ,1222978844566369,/story.php?story_fbid=1222978844566369&id=152570468273884,Lưu
Báo Lao Động,,2019-11-25 19:00:22,"Những trường hợp chuyển nhượng quyền sử dụng đất dưới hình thức phân lô, bán nền trong dự án đầu tư xây dựng kinh doanh nhà ở không đúng quy định có thể sẽ bị phạt tới 1 tỉ đồng.",26,23,2,,,,1,Bình luậ,1222978451233075,/story.php?story_fbid=1222978451233075&id=152570468273884,Lưu
Báo Lao Động,,2019-11-25 18:44:39,"Sáng nay (25.11), 2 trận động đất liên tục xảy ra tại Trùng Khánh, Cao Bằng đã gây rung lắc khiến nhiều người dân lo lắng. Tuy nhiên, động đất không gây thiệt hại về người.",3,3,,,,,,Bình luậ,1222967104567543,/story.php?story_fbid=1222967104567543&id=152570468273884,Lưu
Báo Lao Động,,2019-11-25 18:35:11,"Ngày 25.11, công an TP. Hồ Chí Minh thông tin đã bắt giữ 3 đối tượng liên quan đến vụ cướp tiệm vàng Thông Phương (địa chỉ số 65/1 đường Trần Văn Mười, ấp Xuân Thới Đông 1, xã Xuân Thới Đông huyện Hóc Môn).",14,9,4,,,,1,Bình luậ,1222960701234850,/story.php?story_fbid=1222960701234850&id=152570468273884,Lưu
Báo Lao Động,,2019-11-25 18:18:59,"Chủ đầu tư đưa ra phương án nâng tĩnh không cầu bộ hành bị xe container kéo sập để đạt 4,75m theo tiêu chuẩn.",3,3,,,,,,Bình luậ,1222939444570309,/story.php?story_fbid=1222939444570309&id=152570468273884,Lưu
Báo Lao Động,,2019-11-25 18:08:59,"Sở Nội vụ TP.Hồ Chí Minh vừa đề nghị UBND quận Thủ Đức khẩn trương báo cáo giải trình toàn bộ vụ việc liên quan đến xây dựng không phép của ông Lê Hữu Thành - Phó Chủ tịch HĐND quận Thủ Đức và người thân tại hẻm 419 (phường Hiệp Bình Chánh, quận Thủ Đức).",38,24,8,,4,1,1,Bình luậ,1222940454570208,/story.php?story_fbid=1222940454570208&id=152570468273884,Lưu
Báo Lao Động,,2019-11-25 18:08:28,"Chiều 25.11, trao đổi với phóng viên, lãnh đạo UBND phường Thái Học, phường Thái Học, thành phố Chí Linh, Hải Dương, cho biết, trên địa bàn vừa xảy ra vụ tai nạn giao thông nghiêm trọng khiến 2 nữ sinh tử vong.",26,19,,,,7,,Bình luậ,1222940047903582,/story.php?story_fbid=1222940047903582&id=152570468273884,Lưu
Báo Lao Động,,2019-11-25 18:06:18,"Liên quan đến vụ nhiều công nhân nhập viện nghi ngộ độc khí tại các công ty da giày ở Nam Định và Vĩnh Phúc, nhiều ý kiến cho rằng cần phải sớm tìm ra nguyên nhân. Hơn 200 công nhân phải nhập viện nghi do ngộ độc khí là tiếng chuông đáng báo động cho các doanh nghiệp da giày.",4,3,,,,,1,Bình luậ,1222891864575067,/story.php?story_fbid=1222891864575067&id=152570468273884,Lưu
Báo Lao Động,,2019-11-25 18:05:37,"Ở bàn thắng nâng tỉ số lên 5-0 cho U22 Việt Nam trước U22 Brunei ở trận mở màn SEA Games 2019, bảng điện tử của đài truyền hình hiện tên hậu vệ Thành Chung là tác giả của pha lập công này. Tuy nhiên Đức Chinh mới là người ghi bàn thắng.",7,7,,,,,,Bình luậ,1222930874571166,/story.php?story_fbid=1222930874571166&id=152570468273884,Lưu
Báo Lao Động,,2019-11-25 17:45:23,"Với 88.20% số đại biểu tán thành, Quốc hội chính thức thông qua Luật sửa đổi, bổ sung một số điều của Luật Cán bộ, công chức và Luật Viên chức. Một trong những điểm mới của luật này là sẽ thực hiện bỏ ""viên chức suốt đời"" để thực hiện chế độ hợp đồng có thời hạn đối với viên chức.",488,435,25,18,8,2,,12 bình luậ,1222875357910051,/story.php?story_fbid=1222875357910051&id=152570468273884,Lưu
Báo Lao Động,,2019-11-25 17:26:18,"Cuộc sống người dân ở khu 16 (xã Đồng Lương, Cẩm Khê, Phú Thọ) hiện đang bị ảnh hưởng nghiêm trọng do ô nhiễm môi trường, ngày qua ngày, “bão ruồi” dày đặc tấn công khiến người dân phải mắc màn mới có thể ăn cơm.",51,28,1,,12,2,8,Bình luậ,1222860854578168,/story.php?story_fbid=1222860854578168&id=152570468273884,Lưu
Báo Lao Động,,2019-11-25 17:08:10,"Khách sạn nơi đội tuyển nữ Việt Nam từ chối cung cấp thêm đồ ăn theo yêu cầu của đội tuyển nữ Việt Nam khi mọi thứ phải đăng ký theo form, xin phép và có ý kiến từ Ban tổ chức SEA Games 2019.",80,46,4,1,3,7,19,Bình luậ,1222859977911589,/story.php?story_fbid=1222859977911589&id=152570468273884,Lưu
Báo Lao Động,,2019-11-25 16:50:00,"Liên tiếp trong một tuần trở lại đây, thủ đô Hà Nội - nơi ken dày chung cư và toà nhà cao tầng đã phải chịu dư chấn rung lắc khá mạnh từ 3 trận động đất. Câu hỏi được đặt ra là mức độ an toàn của cư dân trong chung cư, nhà cao tầng như thế nào khi động đất liên tục xảy ra?",38,30,1,,7,,,Bình luậ,1222861887911398,/story.php?story_fbid=1222861887911398&id=152570468273884,Lưu
Báo Lao Động,,2019-11-25 16:30:47,"Đại biểu Quốc hội cho rằng cần thiết phải bổ sung quy định Kiểm toán Nhà nước thực hiện giám định tư pháp, nhằm tăng cường việc giám sát, tránh oan sai trong khâu đặc biệt quan trọng này.",11,11,,,,,,Bình luậ,1222862437911343,/story.php?story_fbid=1222862437911343&id=152570468273884,Lưu
"Báo Lao Động,Lao Động TV",Lao Động TV,2019-11-25 16:24:40,"Cậu bé 10 tuổi sống một mình bơ vơ nơi rẻo cao https://laodong.vn/video/cau-be-10-tuoi-song-mot-minh-bo-vo-noi-reo-cao-768060.ldo Bố bỏ đi làm xa khi em mới được 2 tuổi, lúc lên 4 tuổi, mẹ lại bỏ đi lấy chồng để em sống với bà nội. Trớ trêu thay năm 2018 bà nội cũng bỏ em đi theo người khác. Kể từ đó, cậu bé 10 tuổi sống lủi thủi một mình trong ngôi nhà tranh với hàng nghìn khe hở lạnh thấu trời. Đau thương chưa dứt thì cách đây 10 ngày, người bố mà em còn không nhớ mặt đã mất trong một vụ tai nạn trên Lạng Sơn. Hoàn cảnh éo le đó chính là em Đặng Văn Khuyên học sinh lớp 5D, trường tiểu học Thành Long, xã Thành Long (Hàm Yên, Tuyên Quang).",129,75,,9,1,44,,Bình luậ,1222876444576609,/story.php?story_fbid=1222876444576609&id=152570468273884,Lưu
Báo Lao Động,,2019-11-25 16:10:09,"Ngày 25.11, Quốc hội nghe trình phương án nhân sự để bầu Ủy viên Ủy ban Thường vụ Quốc hội và Chủ nhiệm Ủy ban Pháp luật của Quốc hội. Theo đó, Đại biểu Quốc hội Hoàng Thanh Tùng (Đoàn Sóc Trăng) được giới thiệu bầu làm Ủy viên Ủy ban Thường vụ Quốc hội khóa XIV.",14,14,,,,,,Bình luậ,1222857354578518,/story.php?story_fbid=1222857354578518&id=152570468273884,Lưu
Báo Lao Động,,2019-11-25 15:48:04,"Theo lãnh đạo VEC E, sở dĩ có sự cố ""Trời mưa thì không lái xe"" là trong quá trình chuyển đổi thông tin giữa nội dung ""Đã uống rượu bia thì không lái xe"" sang thông tin ""Trời mưa, đường trơn trượt, giữ khoảng cách an toàn"" đã xảy ra sự cố kỹ thuật.",36,13,19,,3,,1,Bình luậ,1222817691249151,/story.php?story_fbid=1222817691249151&id=152570468273884,Lưu
Báo Lao Động,,2019-11-25 15:30:29,"Ở trận ra quân SEA Games 29, hậu vệ trẻ Đoàn Văn Hậu đã lập cú đúp đẹp mắt giúp U22 Việt Nam giành chiến thắng 4-0 trước U22 Timor Leste.",126,114,5,6,,,1,Bình luậ,1222816387915948,/story.php?story_fbid=1222816387915948&id=152570468273884,Lưu
Báo Lao Động,,2019-11-25 15:22:58,"Tiền đạo Hà Đức Chinh lập cú hat-trick, cùng với 3 bàn thắng của Thành Chung, Trọng Hùng và Việt Hưng đã giúp U22 Việt Nam đánh bại U22 Brunei với tỉ số 6-0 ở trận mở màn SEA Games 2019.",35,34,,1,,,,Bình luậ,1222839521246968,/story.php?story_fbid=1222839521246968&id=152570468273884,Lưu
Báo Lao Động,,2019-11-25 15:13:14,"Không có giấy phép lái xe, vẫn điều khiển xe chạy lấn đường sau chầu nhậu, hậu quả là gây tai nạn khiến bạn đi cùng tử vong...",8,7,,,,1,,Bình luậ,1222815641249356,/story.php?story_fbid=1222815641249356&id=152570468273884,Lưu
Báo Lao Động,,2019-11-25 14:59:46,Huấn luyện viên Park Hang-seo đã cất ngôi sao Quang Hải trong trận mở màn SEA Games 2019 với U22 Brunei và Thanh Thịnh sẽ đeo băng đội trưởng U22 Việt Nam.,22,20,,2,,,,1 bình luậ,1222816914582562,/story.php?story_fbid=1222816914582562&id=152570468273884,Lưu
Báo Lao Động,,2019-11-25 14:55:05,"UBND TP Hà Nội vừa xin lùi kế hoạch hoàn thành Dự án đường sắt đô thị Nam Thăng Long - Trần Hưng Đạo tới năm 2027 (chậm 12 năm), tăng vốn “khủng” tới 82%. Sau khi điều chỉnh, chi phí thi công 1km đường sắt lên tới 143 triệu USD (tương đương hơn 3.000 tỉ đồng).",88,27,26,1,9,2,23,Bình luậ,1222804807917106,/story.php?story_fbid=1222804807917106&id=152570468273884,Lưu
Báo Lao Động,,2019-11-25 14:39:59,"Vì Văn Toán khai có giao dịch 2 bánh heroin với bà Trần Thị Hiền (mẹ ruột nữ sinh Cao Mỹ Duyên) và không đòi được số tiền 300 triệu đồng bị nợ nên cùng đồng bọn bắt giữ cô con gái, cưỡng hiếp và sát hại dã man.",34,24,,,,1,9,Bình luậ,1222815191249401,/story.php?story_fbid=1222815191249401&id=152570468273884,Lưu
Báo Lao Động,,2019-11-25 14:37:45,"Hai cán bộ chiến sĩ làm việc trên Quốc lộ 20, đoạn qua tỉnh Đồng Nai đã tố cáo ""sếp"" Cảnh sát giao thông Đồng Nai ""bảo kê"" xe tải.",118,76,27,2,4,2,7,Bình luậ,1222803607917226,/story.php?story_fbid=1222803607917226&id=152570468273884,Lưu
Báo Lao Động,,2019-11-25 14:20:03,"Nỗi đau mất chồng vẫn chưa nguôi ngoai, chị Nguyễn Thị Cương (44 tuổi, ở thôn Đại Tiến, xã Thạch Tri, huyện Thạch Hà, tỉnh Hà Tĩnh) ngã quỵ khi biết tin con gái mắc bệnh ung thư xương ác tính.",31,9,,1,,21,,Bình luậ,1222732821257638,/story.php?story_fbid=1222732821257638&id=152570468273884,Lưu
Báo Lao Động,,2019-11-25 14:03:54,"Về vụ việc công nhân nghi ngộ độc khí, sáng 25.11, Văn phòng Ủy ban Quốc gia Ứng phó sự cố thiên tai và Tìm kiếm cứu nạn có báo cáo nhanh về tình hình khắc phục sự cố tại Công ty Giầy da Lợi Tín (huyện Lập Thạch, tỉnh Vĩnh Phúc).",10,10,,,,,,Bình luậ,1222732377924349,/story.php?story_fbid=1222732377924349&id=152570468273884,Lưu
Báo Lao Động,,2019-11-25 13:48:42,"Sau 4 năm lỡ hẹn với 8 lần lùi tiến độ, mới đây, Chủ tịch UBND thành phố Hà Nội Nguyễn Đức Chung, cho biết: nếu như mọi việc suôn sẻ, cuối tháng 12 năm nay dự án đường sắt Cát Linh – Hà Đông có thể được đưa vào khai thác thương mại. Đây là một tin vui đối với người dân Thủ đô, thế nhưng nó cũng đặt ra câu hỏi, liệu có thêm lần lùi tiến độ thứ 9(!?).",159,85,59,1,8,1,5,Bình luậ,1222731804591073,/story.php?story_fbid=1222731804591073&id=152570468273884,Lưu
Báo Lao Động,,2019-11-25 13:30:32,"Trao đổi với báo chí bên hành lang Quốc hội sáng 25.11, Thứ trưởng Thường trực Bộ Ngoại giao Bùi Thanh Sơn cho biết, hiện cơ quan chức năng của Việt Nam đang phối hợp với bên Anh để làm thủ tục pháp lý và phải chờ sự chấp thuận của thẩm phán bên Anh mới có thể đưa thi thể 39 nạn nhân tử vong trong container về nước.",3,3,,,,,,Bình luậ,1222730721257848,/story.php?story_fbid=1222730721257848&id=152570468273884,Lưu
Báo Lao Động,,2019-11-25 13:13:20,"Chỉ vì “nhiều chỗ đá bị bể góc, bể cạnh, gập ghềnh” mà phải cậy cả mặt sân lên để lát lại cho “thêm phần trang nghiêm”. Và sự “thêm phần trang nghiêm” ấy phải trả bằng 5 tỉ tiền thuế của dân.",351,197,41,1,8,18,86,Bình luậ,1222729717924615,/story.php?story_fbid=1222729717924615&id=152570468273884,Lưu
Báo Lao Động,,2019-11-25 12:55:33,"Người dân xóm Trại (xã Lộc An, Nam Định) phát hiện người phụ nữ có nhiều vết dao trên người, nghi phạm là chồng nạn nhân.",5,4,,,1,,,Bình luậ,1222729004591353,/story.php?story_fbid=1222729004591353&id=152570468273884,Lưu
Báo Lao Động,,2019-11-25 12:38:45,"Giá vàng hôm nay 25.11 tiếp tục lao dốc bất chấp nhiều yếu tố hỗ trợ tăng. Mở cửa phiên giao dịch, giá vàng được các đơn vị kinh doanh trong nước đồng loạt điều chỉnh giảm quanh ngưỡng 100.000 đồng/lượng.",20,20,,,,,,Bình luậ,1222696371261283,/story.php?story_fbid=1222696371261283&id=152570468273884,Lưu
Báo Lao Động,,2019-11-25 12:20:47,Báo Lao Động xin gửi tới quý độc giả lịch thi đấu và trực tiếp bóng đá nam SEA Games 30. Trận đấu tâm điểm ngày 25.11 là cuộc so tài giữa U22 Việt Nam vs U22 Brunei trong khuôn khổ bảng B.,21,21,,,,,,Bình luậ,1222695514594702,/story.php?story_fbid=1222695514594702&id=152570468273884,Lưu
Báo Lao Động,,2019-11-25 12:03:39,"Cục Quản lý Dược (Bộ Y tế) vừa có văn bản gửi Sở Y tế các tỉnh, thành phố trực thuộc Trung ương, Công ty cổ phần dược vật tư y tế Hải Dương về việc thu hồi thuốc Aciclovir không đạt tiêu chuẩn chất lượng do Công ty cổ phần dược vật tư y tế Hải Dương sản xuất.",17,15,,,,,2,Bình luậ,1222694757928111,/story.php?story_fbid=1222694757928111&id=152570468273884,Lưu
Báo Lao Động,,2019-11-25 11:45:31,"Cách đây một năm, cơ quan chức năng đã cắm biển cấm ô tô rẽ trái từ đường gom Đại lộ Thăng Long (hướng Hà Nội – Hòa Lạc) vào hầm chui sang khu vui chơi Thiên đường Bảo Sơn. Xe ô tô phải đi hầm chui phía trên cách đó khoảng 200m. Tuy nhiên vào giờ cao điểm, nút giao thông này thường xuyên xảy ra ùn ứ, thậm chí là tắc nghẽn kéo dài. Nguyên nhân dẫn đến tình trạng nói trên là do nhiều tài xế ô tô bất chấp biển cấm vẫn liều rẽ trái chỉ để... tiết kiệm vài phút đồng hồ!",37,31,2,,2,1,1,Bình luậ,1222693987928188,/story.php?story_fbid=1222693987928188&id=152570468273884,Lưu
Báo Lao Động,,2019-11-25 11:28:50,"Tại trụ sở UBND xã Trung Hà, huyện Chiêm Hóa, tỉnh Tuyên Quang công an thấy trên tay áo của La Thị Thức có vết máu, nghi là máu của cháu bé đang mất tích nên tập trung đấu tranh với người mẹ kế này.",29,20,,,,2,7,Bình luậ,1222692497928337,/story.php?story_fbid=1222692497928337&id=152570468273884,Lưu
Báo Lao Động,,2019-11-25 11:12:37,"Là người liên quan đến vụ án, song cựu Bộ trưởng Thông tin và Truyền thông Trương Minh Tuấn vắng mặt nên Viện kiểm sát nhân dân tỉnh Phú Thọ đề nghị hoãn phiên xét xử sơ thẩm ông Đặng Anh Tuấn (cựu Chánh Thanh tra Bộ Thông tin và Truyền thông).",69,38,11,,5,,15,Bình luậ,1222691791261741,/story.php?story_fbid=1222691791261741&id=152570468273884,Lưu
Báo Lao Động,,2019-11-25 10:55:38,"Bố bỏ đi làm xa khi em mới được 2 tuổi, lúc lên 4 tuổi, mẹ lại bỏ đi lấy chồng để em sống với bà nội. Trớ trêu thay năm 2018 bà nội cũng bỏ em đi theo người khác. Kể từ đó, cậu bé 10 tuổi sống lủi thủi một mình trong ngôi nhà tranh với hàng nghìn khe hở lạnh thấu trời. Đau thương chưa dứt thì cách đây 10 ngày, người bố mà em còn không nhớ mặt đã mất trong một vụ tai nạn trên Lạng Sơn.",146,71,,10,,64,1,2 bình luậ,1222682017929385,/story.php?story_fbid=1222682017929385&id=152570468273884,Lưu
Báo Lao Động,,2019-11-25 10:36:19,Một tiểu hành tinh khổng lồ có tốc độ nhanh gấp 60 lần máy bay Boeing sẽ bay qua trái đất hôm nay (25.11) và chỉ trở lại sau 7 năm.,20,18,,,2,,,Bình luậ,1222644144599839,/story.php?story_fbid=1222644144599839&id=152570468273884,Lưu
Báo Lao Động,,2019-11-25 10:18:09,"Theo các chuyên gia an toàn giao thông, rất nhiều tài xế từng bị ảo giác ôtô “đi lùi” khi đang chờ đèn đỏ, mặc dù xe đang đứng yên, chân phanh vẫn giữ hoặc đã về số N, P. Hiện tượng ảo giác này rất nguy hiểm, có thể khiến tài xế bị giật mình, vô tình đạp nhầm chân ga và gây thảm hoạ “xe điên”.",236,209,5,1,18,2,1,24 bình luậ,1222643531266567,/story.php?story_fbid=1222643531266567&id=152570468273884,Lưu
Báo Lao Động,,2019-11-25 09:59:53,Vụ việc xế sang BMW của một người đàn ông Nga được xe hút bể phốt chữa cháy đang lan truyền trên mạng xã hội.,8,6,2,,,,,Bình luậ,1222642777933309,/story.php?story_fbid=1222642777933309&id=152570468273884,Lưu
Báo Lao Động,,2019-11-25 09:42:25,"Mở rộng khám nghiệm hiện trường, công an tìm thấy phần đầu vụ phát hiện nửa thi thể đang phân hủy trong bụi cây ở Bình Phước.",95,65,,1,11,18,,Bình luậ,1222640634600190,/story.php?story_fbid=1222640634600190&id=152570468273884,Lưu
Báo Lao Động,,2019-11-25 09:19:51,"Ông Đặng Anh Tuấn, nguyên Chánh Thanh tra Bộ Thông tin và Truyền thông - Bộ Thông tin và Truyền thông bị cáo buộc vi phạm pháp luật khi cố che giấu các trò chơi đánh bạc trên mạng Internet.",49,37,6,,5,1,,Bình luậ,1222631447934442,/story.php?story_fbid=1222631447934442&id=152570468273884,Lưu
Báo Lao Động,,2019-11-25 09:03:54,"Đến hẹn lại lên, thời điểm này khách Trung Quốc đi theo tour giá rẻ, tour “0 đồng” bắt đầu ồ ạt vào Việt Nam qua cửa khẩu quốc tế Móng Cái. Tuy nhiên, cũng như mọi năm, thị trường khách vẫn nằm trong tay các Cty lữ hành ngoại tỉnh, nên câu chuyện quản lý và thu thuế cứ bàn đi bàn lại và không có kết quả, trong khi các Cty trong tỉnh cơ bản đã “chết” trên sân nhà vì quy định của UBND tỉnh Quảng Ninh.",17,14,2,,,,1,Bình luậ,1222602497937337,/story.php?story_fbid=1222602497937337&id=152570468273884,Lưu
Báo Lao Động,,2019-11-25 08:45:15,"Tỉ phú Michael Bloomberg, một trong những người đàn ông giàu nhất thế giới, chính thức tranh cử tổng thống Mỹ 2020 với quyết tâm giành chiến thắng trước ông Donald Trump.",22,17,2,,2,,1,Bình luậ,1222592057938381,/story.php?story_fbid=1222592057938381&id=152570468273884,Lưu
Báo Lao Động,,2019-11-25 08:26:33,"Ở SEA Games 30, Đoàn thể thao Việt Nam đặt mục tiêu giành 65-70 huy chương vàng để lọt top 3. Trong số rất nhiều niềm hy vọng vàng ở Philippines, bóng đá nam được quan tâm nhiều hơn cả. Đơn giản bởi đây là môn thể thao vua. Tấm huy chương vàng chắc chắn có ý nghĩa rất lớn, nhất là khi bóng đá nam Việt Nam chưa từng lên ngôi ở sân chơi SEA Games.",11,10,,1,,,,Bình luậ,1222590691271851,/story.php?story_fbid=1222590691271851&id=152570468273884,Lưu
Báo Lao Động,,2019-11-25 08:08:13,"Tưởng chừng đã ""lội ngược dòng"" thành công trước Sheffield, nhưng Man United vẫn không thể bảo vệ được thành quả và đành chấp nhận chia điểm tại vòng vòng 13 Premier League.",3,3,,,,,,Bình luậ,1222581844606069,/story.php?story_fbid=1222581844606069&id=152570468273884,Lưu
Báo Lao Động,,2019-11-25 07:47:17,"Dự báo thời tiết 25.11, do ảnh hưởng của không khí lạnh, ở Bắc Bộ có mưa vài nơi, riêng các tỉnh vùng núi có mưa, mưa rào rải rác. Từ chiều nay, các tỉnh Bắc và Trung Trung Bộ có mưa, mưa vừa, có nơi mưa to và dông. Ở Bắc Bộ và Bắc Trung Bộ từ đêm trời trở rét.",21,20,1,,,,,Bình luậ,1222578497939737,/story.php?story_fbid=1222578497939737&id=152570468273884,Lưu
