source,shared_from,date,text,reactions,likes,ahah,love,wow,sigh,grrr,comments,post_id,url,share
Báo Lao Động,,2019-11-21 19:58:03,"Sau 1 thời gian ở mức “chết” (12.000-14.000 đồng/kg), giá gà lông trắng đã bất ngờ tăng giá lên mức 37.000-40.000 đồng/kg.",17,13,3,,1,,,Bình luậ,1219189804945273,/story.php?story_fbid=1219189804945273&id=152570468273884,Lưu
Báo Lao Động,,2019-11-21 19:46:16,"Liên quan đến vụ việc các công nhân da giày tại Vĩnh Phúc bị nhập viện do nghi ngộ độc khí, phóng viên đã liên hệ với lãnh đạo Trung tâm Y tế huyện Lập Thạch (Vĩnh Phúc). Tuy nhiên, lãnh đạo trung tâm này đã viện ra đủ lý do, thậm chí mang tính ""bắt bẻ"" để từ chối báo chí. https://laodong.vn/ldld-vinh-phuc/cong-nhan-nghi-ngo-doc-khi-trung-tam-y-te-lap-thach-ne-bao-chi-the-nao-766766.ldo",15,14,,,1,,,Bình luậ,1219189248278662,/story.php?story_fbid=1219189248278662&id=152570468273884,Lưu
Báo Lao Động,,2019-11-21 19:42:30,"Ngày 21.11, đội tuyển U22 Việt Nam có những buổi tập ở sân nhân tạo của trường đại học Tôn Đức Thắng (TP.HCM). Trao đổi bên lề buổi tập, ông Park Hang Seo bày tỏ nỗi lo lắng vì các trụ cột có ít thời gian làm quen với mặt sân nhân tạo.",8,8,,,,,,Bình luậ,1219177118279875,/story.php?story_fbid=1219177118279875&id=152570468273884,Lưu
Báo Lao Động,,2019-11-21 19:31:54,"Chính phủ Hàn Quốc rất quan tâm và đã chỉ đạo, huy động các nguồn lực cao nhất cho công tác cứu hộ và tìm kiếm các nạn nhân mất tích.",42,38,,,,4,,Bình luậ,1219177571613163,/story.php?story_fbid=1219177571613163&id=152570468273884,Lưu
Báo Lao Động,,2019-11-21 19:24:58,Công nghệ VAR sẽ được sử dụng ở tất cả 32 trận đấu của vòng chung kết U23 Châu Á 2020.,66,65,1,,,,,Bình luậ,1219172764946977,/story.php?story_fbid=1219172764946977&id=152570468273884,Lưu
Báo Lao Động,,2019-11-21 19:10:37,"Trong số 9 dự án thuộc diện thanh tra, Thanh tra Chính phủ (TTCP) đã phát hiện nhiều vi phạm trong dự án tại ô đất DX1, DX2, DX3, DX4 và CX2 Khu đô thị Đông Nam đường Trần Duy Hưng của Công ty Cổ phần Thương mại và Dịch vụ Lã Vọng.",20,17,1,,2,,,Bình luậ,1219162564947997,/story.php?story_fbid=1219162564947997&id=152570468273884,Lưu
Báo Lao Động,,2019-11-21 19:04:04,"Chiến lược gia người Hàn Quốc khẳng định ông cùng với U22 Việt Nam sẽ nỗ lực hết mình để giành tấm huy chương vàng SEA Games 30, để đáp lại khát khao và nguyện vọng của hàng triệu người hâm mộ Việt Nam.",99,89,,10,,,,Bình luậ,1219149558282631,/story.php?story_fbid=1219149558282631&id=152570468273884,Lưu
Báo Lao Động,,2019-11-21 18:52:19,Cơ quan công an đã khẩn trương điều tra và xác định được danh tính cô gái bị xe ôtô Mercedes do nữ tài xế điều khiển tông tử vong trên đường Lê Văn Lương.,19,14,,,,5,,Bình luậ,1219148598282727,/story.php?story_fbid=1219148598282727&id=152570468273884,Lưu
Báo Lao Động,,2019-11-21 18:33:20,"Không hẹn mà gặp, nhiều đại biểu Quốc hội tại phiên thảo luận về Luật Đầu tư (sửa đổi) đã cùng có ý kiến nên đưa nước sạch vào ngành nghề kinh doanh có điều kiện. Một trong những trường hợp được các đại biểu nêu ra từ đó đề xuất là trường hợp Công ty Nước mặt sông Đuống, đã được doanh nghiệp Thái Lan mua lại 34 triệu cổ phiếu để trở thành cổ đông lớn thứ hai.",128,98,13,,3,10,4,Bình luậ,1219135884950665,/story.php?story_fbid=1219135884950665&id=152570468273884,Lưu
Báo Lao Động,,2019-11-21 18:24:46,Bê tông kè đổ gãy không thấy thép bên trong khiến người dân nhìn vào rất phản cảm.,45,21,13,,2,3,6,Bình luậ,1219122768285310,/story.php?story_fbid=1219122768285310&id=152570468273884,Lưu
Báo Lao Động,,2019-11-21 18:12:37,"Gần 1 tháng sau ngày Tịnh thất Bồng Lai (xã Hòa Khánh Tây, huyện Đức Hòa, Long An) bị một nhóm người đến đập phá, cơ sở tu tại gia này đang được cấp tốc xây dựng lại tươm tất, khang trang hơn từ tài trợ của 1 nhà hảo tâm.",106,93,2,7,4,,,Bình luậ,1219121711618749,/story.php?story_fbid=1219121711618749&id=152570468273884,Lưu
Báo Lao Động,,2019-11-21 18:07:16,"Sau giờ tan học, vừa rời cổng trường được khoảng 100m thì một nam sinh lớp 10 của Trung tâm Giáo dục nghề nghiệp - giáo dục thường xuyên huyện Lộc Hà (tỉnh Hà Tĩnh) bị một cựu học sinh dùng dao đâm bị thương.",37,17,2,,1,14,3,Bình luậ,1219118324952421,/story.php?story_fbid=1219118324952421&id=152570468273884,Lưu
Báo Lao Động,,2019-11-21 18:05:49,"Trước thông tin Táo Quân sẽ dừng phát sóng từ năm nay, nhiều khán giả bày tỏ sự tiếc nuối khi không còn ""thấy Táo là thấy Tết"".",28,22,2,,1,3,,Bình luậ,1219061364958117,/story.php?story_fbid=1219061364958117&id=152570468273884,Lưu
Báo Lao Động,,2019-11-21 17:30:49,"Đối tượng dụ dỗ nữ sinh gửi ảnh khỏa thân sau đó đe dọa, cưỡng ép quan hệ tình dục nhiều lần.",44,31,3,,2,4,4,Bình luậ,1219047341626186,/story.php?story_fbid=1219047341626186&id=152570468273884,Lưu
Báo Lao Động,,2019-11-21 17:13:39,"Thứ trưởng Bộ Y tế Nguyễn Trường Sơn cho biết chưa có kết luận rõ ràng về loại thuốc gây tê gây tai biến cho 3 sản phụ tại Bệnh viện Phụ Nữ nên Bộ vẫn phải cân nhắc, xem xét việc có tiếp tục sử dụng loại thuốc này hay không. Việc kiểm tra thuốc có vấn đề gì hay không phải mất gần 2 tháng.",34,23,3,,2,4,2,Bình luậ,1219046924959561,/story.php?story_fbid=1219046924959561&id=152570468273884,Lưu
Báo Lao Động,,2019-11-21 16:55:25,"Liên quan đến vụ việc bắt quả tang ổ nhóm đánh bạc gồm 52 người ở Vĩnh Phúc, cơ quan chức năng cho biết chủ sới bạc đã cải tạo hầm kiên cố như lô cốt.",17,16,1,,,,,Bình luậ,1219046408292946,/story.php?story_fbid=1219046408292946&id=152570468273884,Lưu
Báo Lao Động,,2019-11-21 16:46:35,"Theo chương trình làm việc của Quốc hội, ngày 22.11, Quốc hội sẽ tiến hành phê chuẩn việc miễn nhiệm Bộ trưởng Bộ Y tế đối với bà Nguyễn Thị Kim Tiến.",47,37,7,,2,,1,Bình luậ,1219060941624826,/story.php?story_fbid=1219060941624826&id=152570468273884,Lưu
Báo Lao Động,,2019-11-21 16:38:01,"Trưa ngày 21.11, VFC phát ra thông tin chương trình Táo Quân 2020 sẽ ngừng thực hiện sau 16 năm, khiến nhiều người không khỏi bất ngờ. Nghệ sĩ Nhân dân Công Lý - một trong những thành viên của êkip thực hiện Táo Quân cũng chính thức lên tiếng về việc này.",17,13,,1,,3,,Bình luậ,1219014698296117,/story.php?story_fbid=1219014698296117&id=152570468273884,Lưu
Báo Lao Động,,2019-11-21 16:27:00,"Ông Phạm Chí Dũng bị bắt vì tội “Làm, tàng trữ, phát tán hoặc tuyên truyền thông tin, tài liệu, vật phẩm nhằm chống Nhà nước CHXHCN Việt Nam” theo Điều 117 - Bộ luật Hình sự năm 2015.",48,35,5,,5,,3,Bình luậ,1219060518291535,/story.php?story_fbid=1219060518291535&id=152570468273884,Lưu
Báo Lao Động,,2019-11-21 16:22:36,"Trên tờ Chosun Ilbo (Hàn Quốc), huấn luyện viên Park Hang-seo đã chia sẻ rất nhiều về những kế hoạch với đội tuyển Việt Nam, những trăn trở khi tái ký hợp đồng dẫn dắt bóng đá Việt Nam.",23,22,,1,,,,Bình luậ,1219014188296168,/story.php?story_fbid=1219014188296168&id=152570468273884,Lưu
Báo Lao Động,,2019-11-21 16:06:22,"Nhận vay hộ gia đình anh Đỗ Thế Cảnh 500 triệu đồng, Loan yêu cầu làm hợp đồng công chứng giấy tờ nhà đất, rồi mang cầm cố. Người cầm cố tiếp tục dùng giấy tờ này để vay ngân hàng và dư nợ gần 1,5 tỉ đồng...",15,12,1,1,1,,,Bình luậ,1219013831629537,/story.php?story_fbid=1219013831629537&id=152570468273884,Lưu
Báo Lao Động,,2019-11-21 16:01:41,"Liên quan đến vụ việc nữ điều dưỡng bệnh viện Nhi Đồng 1 (TP.Hồ Chí Minh) bị đánh chấn thương xương hàm, theo cập nhật của PV Lao Động, một nữ hộ sinh của Bệnh viện Từ Dũ bị tạm đình chỉ công tác. Người này chính là vợ của người đàn ông đã chửi mắng, hành hung nữ điều dưỡng.",79,61,8,,1,2,7,1 bình luậ,1219045981626322,/story.php?story_fbid=1219045981626322&id=152570468273884,Lưu
Báo Lao Động,,2019-11-21 15:53:54,"Sáng 21.11, 3 ngày sau sự cố nguồn nước sông Đa Độ nhiễm mặn, đại diện Công ty Cổ phần cấp nước Hải Phòng khẳng định, đến thời điểm này, độ mặn trong nước đạt ngưỡng an toàn.",3,3,,,,,,Bình luậ,1218912054973048,/story.php?story_fbid=1218912054973048&id=152570468273884,Lưu
Báo Lao Động,,2019-11-21 15:50:06,"Đang chăm con và dọn quán, người vợ bị chồng uống rượu xông vào đánh. Trong lúc giằng co, người vợ dùng dao đâm trúng cổ khiến chồng tử vong.",5,2,,,1,,2,Bình luậ,1219013278296259,/story.php?story_fbid=1219013278296259&id=152570468273884,Lưu
Báo Lao Động,,2019-11-21 15:33:57,"Đường ống nước sông Đà lại gặp sự cố, tạm ngừng cấp nước khu Tây Nam Hà Nội; Bộ Công Thương: Mất cân đối cung cầu, Tết thiếu khoảng 200.000 tấn thịt heo; Nhà máy nước sông Đuống chưa nghiệm thu đã bán nước, uỷ ban xã ""lần đầu biết”... là những tin tức nóng nhất về kinh tế 24h qua.",7,5,1,,1,,,Bình luậ,1219012721629648,/story.php?story_fbid=1219012721629648&id=152570468273884,Lưu
Báo Lao Động,,2019-11-21 15:16:46,"Chỉ ra những bất cấp trong công tác làm luật hiện nay, đại biểu Nguyễn Thị Quyết Tâm (Đoàn TP.Hồ Chí Minh) đặt dấu hỏi về sự cầu thị của cơ quan soạn thảo luật trong việc tiếp thu ý kiến nhân dân, ý kiến của đại biểu Quốc hội.",86,59,24,,1,1,1,Bình luậ,1219012191629701,/story.php?story_fbid=1219012191629701&id=152570468273884,Lưu
Báo Lao Động,,2019-11-21 15:00:49,"Trả lời báo chí, đại diện Trung tâm sản xuất phim truyền hình cho biết năm nay sẽ không có Táo Quân 2020, thay vào đó là một chương trình mới.",33,30,,,,3,,Bình luậ,1218994691631451,/story.php?story_fbid=1218994691631451&id=152570468273884,Lưu
Báo Lao Động,,2019-11-21 14:57:29,"Liên tiếp những ngày qua, hàng trăm công nhân làm việc tại công ty TNHH Lợi Tín Lập Thạch (huyện Lập Thạch, tỉnh Vĩnh Phúc) phải nhập viện cấp cứu nghi do hít phải khí độc trong quá trình sản xuất.",13,8,,,4,1,,Bình luậ,1219011721629748,/story.php?story_fbid=1219011721629748&id=152570468273884,Lưu
Báo Lao Động,,2019-11-21 14:42:20,"Sau hàng loạt vụ việc trẻ em bị bạo hành, xâm hại, UBND TPHCM vừa kiến nghị Bộ Tư pháp nghiên cứu thành lập lực lượng cảnh sát chuyên bảo vệ trẻ em.",59,44,8,1,4,,2,Bình luậ,1218993771631543,/story.php?story_fbid=1218993771631543&id=152570468273884,Lưu
Báo Lao Động,,2019-11-21 14:24:28,"Chặt phá, lấn chiếm rừng, băm bờ biển không chỉ dồn đẩy Phú Quốc đến nguy cơ mất đi sinh cảnh, môi trường đa dạng sinh học mà điều khiến nhiều người lo hơn là hành vi này đang dần được hợp thức hóa...",29,22,1,,1,,5,Bình luậ,1218993184964935,/story.php?story_fbid=1218993184964935&id=152570468273884,Lưu
Báo Lao Động,,2019-11-21 14:10:07,"Con trai thứ 2 mất ở tháng thứ 7 vào năm 2014 vì một căn bệnh hiếm gặp. Đến nay, con trai thứ 3 của cặp vợ chồng thợ mỏ nghèo Từ Thanh Thế và Nguyễn Thị Minh Châu cũng đang trong tình trạng cực kỳ nguy hiểm.",38,20,,1,,17,,Bình luậ,1218913158306271,/story.php?story_fbid=1218913158306271&id=152570468273884,Lưu
Báo Lao Động,,2019-11-21 13:35:43,"Trao đổi với báo chí bên hành lang Quốc hội sáng 21.11, Thứ trưởng thường trực Bộ Ngoại giao Bùi Thanh Sơn cho biết, trước mắt Chính phủ sẽ ứng trước chi phí để đưa các nạn nhân trong vụ 39 người chết trong container ở Anh trở về quê hương.",9,9,,,,,,Bình luậ,1218911541639766,/story.php?story_fbid=1218911541639766&id=152570468273884,Lưu
Báo Lao Động,,2019-11-21 13:18:30,"Theo kết luận điều tra bổ sung, nhiều khoản tiền ""đi đêm"" giữa các bị cáo và những người được nhờ nâng điểm cho các thí sinh được cơ quan chức năng làm sáng tỏ.",129,91,20,,2,1,15,Bình luậ,1218911058306481,/story.php?story_fbid=1218911058306481&id=152570468273884,Lưu
Báo Lao Động,,2019-11-21 12:59:17,"Nữ sinh quê Cao Bằng kể lại trong lúc đi xe ôm đến trường dự lễ kỷ niệm Ngày Nhà giáo Việt Nam 20.11 thì bất ngờ bị chiếc Mercedes đâm trúng từ phía sau, dẫn đến bị thương phải nhập viện.",27,18,,,1,8,,Bình luậ,1218910178306569,/story.php?story_fbid=1218910178306569&id=152570468273884,Lưu
Báo Lao Động,,2019-11-21 12:41:03,"Thời gian vừa qua liên tục xảy ra tình trạng người đi đường không chấp hành tín hiệu ưu tiên từ các đoàn xe ưu tiên, gây cản trở quá trình thực hiện nhiệm vụ của lực lượng chức năng. Nhiều tài xế sau đó đã phải chịu phạt hành chính và bị tước bằng lái.",2,2,,,,,,Bình luậ,1218889494975304,/story.php?story_fbid=1218889494975304&id=152570468273884,Lưu
Báo Lao Động,,2019-11-21 12:20:54,"Phó Giám đốc Sở Thông tin và Truyền thông tỉnh Thái Nguyên được tuyển dụng công chức, bổ nhiệm nhiều chức vụ khi chưa có bằng trung học phổ thông.",576,343,157,2,43,8,23,Bình luậ,1218888898308697,/story.php?story_fbid=1218888898308697&id=152570468273884,Lưu
Báo Lao Động,,2019-11-21 12:00:45,Liên đoàn Bóng đá Việt Nam (VFF) đã có văn bản chính thức kiến nghị Liên đoàn bóng đá Châu Á (AFC) về hành vi khiếm nhã của trợ lý đội tuyển Thái Lan.,506,478,8,7,1,1,11,Bình luậ,1218888291642091,/story.php?story_fbid=1218888291642091&id=152570468273884,Lưu
Báo Lao Động,,2019-11-21 11:42:32,"Ngày 21.11, nguồn tin từ Cơ quan Cảnh sát điều tra (CSĐT) Công an TPHCM cho biết đã khởi tố vụ án, khởi tố bị can và bắt tạm giam đối với Trần Thị Hồng Hạnh (SN 1970, ngụ TPHCM, là Giám đốc Công ty TNHH Tư vấn đầu tư bất động sản Hoàng Kim Land (Công ty Hoàng Kim Land) để điều tra về tội ""Lừa đảo chiếm đoạt tài sản"".",45,40,3,,1,1,,Bình luậ,1218887548308832,/story.php?story_fbid=1218887548308832&id=152570468273884,Lưu
Báo Lao Động,,2019-11-21 11:23:24,"Mới đây, Đoàn kiểm tra liên ngành thuộc Ban chỉ đạo BCĐ389/TP do Đội Quản lý thị trường số 5 - Cục Quản lý thị trường thành phố Hà Nội làm Trưởng đoàn tiến hành kiểm tra điểm tập kết hàng hóa kinh doanh đồ chơi lắp ghép hình bản đồ có thể hiện ""đường lưỡi bò"" vi phạm chủ quyền biển đảo của Việt Nam.",50,45,1,1,2,,1,Bình luậ,1218868394977414,/story.php?story_fbid=1218868394977414&id=152570468273884,Lưu
Báo Lao Động,,2019-11-21 11:05:04,"Lực lượng Quản lý thị trường Hà Nội vừa tiến hành tiêu hủy 63 tấn hàng hóa vi phạm pháp luật, gồm thuốc lá, xì gà, dược liệu, hóa phẩm... trị giá gần 6 tỉ đồng.",9,9,,,,,,Bình luậ,1218839004980353,/story.php?story_fbid=1218839004980353&id=152570468273884,Lưu
Báo Lao Động,,2019-11-21 10:38:40,6 người đàn ông bị bắt ở miền trung Trung Quốc trong vụ cưỡng hiếp bé gái 11 tuổi bị ép làm gái mại dâm ở quán karaoke.,29,16,,,,1,12,Bình luậ,1218838134980440,/story.php?story_fbid=1218838134980440&id=152570468273884,Lưu
Báo Lao Động,,2019-11-21 10:30:45,"Sự việc 2 chị em ruột trong một gia đình ở Sóc Sơn (Hà Nội) liên tiếp tử vong vì mắc bệnh Whitmore đã khiến cho nhiều gia đình hoang mang, lo lắng. Tuy nhiên, các chuyên gia y tế cho rằng, căn bệnh này hoàn toàn có thể phòng tránh được nếu người dân tuân thủ những khuyến cáo của ngành y tế.",22,19,1,,1,1,,Bình luậ,1218816328315954,/story.php?story_fbid=1218816328315954&id=152570468273884,Lưu
Báo Lao Động,,2019-11-21 10:27:14,"Do có mâu thuẫn, đối tượng Vũ Đức Bộ đã có lần đe dọa giết mẹ vợ trước khi sự việc sát hại vào đêm 20.11.",17,6,,,1,1,9,Bình luậ,1218859691644951,/story.php?story_fbid=1218859691644951&id=152570468273884,Lưu
Báo Lao Động,,2019-11-21 10:13:06,"Hàng chục hộ dân tại hai tòa chung cư (nhà ở xã hội) E1, E2 ở gần khu công nghiệp Hòa Khánh (Đà Nẵng) đang sống trong sợ hãi vì những căn hộ của mình đang ngày một xuống cấp nghiêm trọng.",19,15,3,1,,,,Bình luậ,1218815718316015,/story.php?story_fbid=1218815718316015&id=152570468273884,Lưu
Báo Lao Động,,2019-11-21 09:56:21,"Kể từ năm 2018, ông chủ tập đoàn Reliance Industries - tỉ phú Mukesh Ambani đã soán ngôi người giàu nhất Châu Á của Jack Ma. Theo Forbes, tính đến ngày 20.11, tài sản của tỉ phú này đạt 59,3 tỉ USD, đứng thứ 13 trong top người giàu nhất hành tinh.",8,8,,,,,,Bình luậ,1218794458318141,/story.php?story_fbid=1218794458318141&id=152570468273884,Lưu
Báo Lao Động,,2019-11-21 09:38:11,"Theo các chuyên gia an toàn giao thông, phụ nữ thường có phản xạ chậm hơn đàn ông, đặc biệt là tâm lý hốt hoảng khi xảy ra sự cố. Không chỉ vậy, thói quen đi giày cao gót, điều khiển xe vội vàng thiếu quan sát là một trong những nguyên nhân khiến các nữ tài xế gây ra những tai nạn đáng tiếc.",67,55,7,,2,2,1,Bình luậ,1218792491651671,/story.php?story_fbid=1218792491651671&id=152570468273884,Lưu
Báo Lao Động,,2019-11-21 09:20:02,"Công tác nhân sự, miễn nhiệm Bộ trưởng Bộ Y tế với bà Nguyễn Thị Kim Tiến diễn ra vào kỳ họp thứ 8, Quốc hội khóa 14 khai mạc ngày 22.11.2019.",44,32,9,,1,,2,Bình luậ,1218791818318405,/story.php?story_fbid=1218791818318405&id=152570468273884,Lưu
Báo Lao Động,,2019-11-21 09:16:18,"Sáng 21.11, ông Lê Công Quyên - Chủ tịch UBND xã Thuỵ Lương, Thái Thụy, Thái Bình xác nhận, trên địa bàn vừa xảy ra vụ việc người phụ nữ đã chết dưới bể nước mưa, nghi vấn thủ phạm là con rể.",101,67,1,,7,12,14,Bình luậ,1218815324982721,/story.php?story_fbid=1218815324982721&id=152570468273884,Lưu
Báo Lao Động,,2019-11-21 09:03:50,"Dự án đường sắt 100.000 tỉ Lào Cai - Hà Nội - Hải Phòng đang gây choáng bởi số tiền đầu tư quá lớn, trong khi câu hỏi tưởng như dễ nhất “người hưởng lợi là ai?” lại có vẻ khó trả lời nhất.",504,313,91,2,26,13,59,Bình luậ,1218790754985178,/story.php?story_fbid=1218790754985178&id=152570468273884,Lưu
Báo Lao Động,,2019-11-21 09:03:50,"Dự án đường sắt 100.000 tỉ Lào Cai - Hà Nội - Hải Phòng đang gây choáng bởi số tiền đầu tư quá lớn, trong khi câu hỏi tưởng như dễ nhất “người hưởng lợi là ai?” lại có vẻ khó trả lời nhất.",504,313,91,2,26,13,59,Bình luậ,1218790754985178,/story.php?story_fbid=1218790754985178&id=152570468273884,Lưu
Báo Lao Động,,2019-11-21 08:43:34,"Thời điểm nhà máy nước sông Đuống khánh thành bán nước cho dân, Cục Kiểm định chất lượng (Bộ Xây dựng) vẫn chưa có văn bản nghiệm thu dự án. Cho đến nay vẫn chưa có thông tin chính thức từ Bộ Xây dựng về việc nghiệm thu dự án này. Trao đổi với phóng viên mới đây, lãnh đạo các xã Trung Mầu, Phù Đổng (Gia Lâm, Hà Nội) - nơi đang được cung cấp nước từ nhà máy sông Đuống tỏ ra bất ngờ trước thông tin này.",111,67,26,1,4,2,11,Bình luậ,1218768878320699,/story.php?story_fbid=1218768878320699&id=152570468273884,Lưu
Báo Lao Động,,2019-11-21 08:26:24,Nhà cầm quân gạo cội người Nhật Bản khẳng định sẽ tìm ra những thành viên trong ban huấn luyện đội tuyển Thái Lan có hành vi khiêu khích huấn luyện viên Park Hang-seo.,246,227,8,4,1,1,5,Bình luậ,1218768151654105,/story.php?story_fbid=1218768151654105&id=152570468273884,Lưu
Báo Lao Động,,2019-11-21 08:10:21,"Trong phản hồi gửi Báo Lao Động, Ban Chỉ đạo 389 Lạng Sơn thừa nhận tình trạng hàng hóa đi lậu vào trong nước qua địa bàn tỉnh là có thật nhưng lại khẳng định: Qua rà soát chính trị nội bộ, chưa phát hiện đồng chí nào có biểu hiện bảo kê, tiếp tay làm ngơ cho hoạt động xuất nhập cảnh và vận chuyển hàng hóa trái phép qua biên giới...",254,87,143,1,17,2,4,Bình luậ,1218767391654181,/story.php?story_fbid=1218767391654181&id=152570468273884,Lưu
Báo Lao Động,,2019-11-21 07:46:14,"Chủ cửa hàng kinh doanh, sửa chữa máy lọc nước ở Hải Phòng bị ""sờ gáy"" vì đăng tải thông tin thất thiệt về chất lượng nước trên mạng xã hội facebook.",7,5,1,,1,,,Bình luậ,1218762791654641,/story.php?story_fbid=1218762791654641&id=152570468273884,Lưu
Báo Lao Động,,2019-11-21 07:16:47,"Dự báo thời tiết 21.11, các tỉnh miền Bắc tiếp tục duy trì hình thái thời tiết ngày nắng hanh khô, đêm và sáng trời trở rét. Nhiệt độ cao nhất phổ biến 26 độ C.",2,2,,,,,,Bình luậ,1218747188322868,/story.php?story_fbid=1218747188322868&id=152570468273884,Lưu
Báo Lao Động,,2019-11-20 23:41:46,"Vụ Mercedes GLC bốc cháy giữa phố, 1 người chết: Nữ tài xế đã trình diện; Đến năm 2028 mới có người đàn ông đầu tiên nghỉ hưu ở tuổi 62; TPHCM ứng dụng trí tuệ nhân tạo phát hiện lỗi vi phạm giao thông... là những tin tức đáng chú ý nhất trong 24h qua.",8,6,,,,,2,Bình luậ,1218473995016854,/story.php?story_fbid=1218473995016854&id=152570468273884,Lưu
Báo Lao Động,,2019-11-20 22:30:20,"Ổi là trái cây được nhiều người yêu thích bởi chứa nhiều vitamin, dưỡng chất, chất xơ... Ổi không chỉ có tác dụng giúp làm đẹp da mà còn tốt cho sức khoẻ, giúp tim hoạt động tốt và giảm cân hiệu quả.",50,47,1,2,,,,Bình luậ,1218350031695917,/story.php?story_fbid=1218350031695917&id=152570468273884,Lưu
Báo Lao Động,,2019-11-20 21:58:23,Công nương Meghan có sức ảnh hưởng về thời trang nhất năm; Con trai cố Tổng thống Đức bị đâm chết khi đang giảng bài; Greta Thunberg giống bé gái hơn 100 năm trước... là những tin tức quốc tế đáng chú ý nhất 24h qua.,8,7,,1,,,,Bình luậ,1218348795029374,/story.php?story_fbid=1218348795029374&id=152570468273884,Lưu
Báo Lao Động,,2019-11-20 21:46:57,"Với các loại hệ thống nhóm máu hiện nay, việc biết rõ mình thuộc nhóm máu nào rất quan trọng trong quá trình truyền máu khi cần thiết. Điều này đảm bảo rằng máu của người hiến tương thích với máu của bệnh nhân, để giảm thiểu các phản ứng trong khi truyền máu và tránh mọi hậu quả không mong muốn.",7,7,,,,,,Bình luậ,1218348071696113,/story.php?story_fbid=1218348071696113&id=152570468273884,Lưu
Báo Lao Động,,2019-11-20 21:45:02,"Theo những thông tin mà báo chí Châu Âu đăng tải, có nhiều dấu hiệu cho thấy Man United sắp chiêu mộ thành công tiền đạo đang nổi như cồn ở Châu Âu là Erling Haaland.",5,5,,,,,,Bình luậ,1218314038366183,/story.php?story_fbid=1218314038366183&id=152570468273884,Lưu
Báo Lao Động,,2019-11-20 21:15:30,"Công an Quảng Trị tìm bị hại trong vụ lừa đảo ""đáo hạn ngân hàng""; Người vợ bị bạo hành ở Bình Dương thương tích đầy mình vẫn đang nằm viện; Tranh cãi mời bia hay rượu ngày giỗ mẹ, chồng cầm dao đâm chết vợ... là những tin pháp luật nóng nhất trong 24h qua.",10,9,,1,,,,Bình luậ,1218282898369297,/story.php?story_fbid=1218282898369297&id=152570468273884,Lưu
