source,shared_from,date,text,reactions,likes,ahah,love,wow,sigh,grrr,comments,post_id,url,share
Tuổi Trẻ Online,,2019-11-17 20:36:29,"'Hôm nay là ngày tràn đầy niềm vui đối với tôi, khi nhận được thư và hoa của bác thủ tướng Nguyễn Xuân Phúc. Tôi không ngờ câu chuyện nhỏ của mình lại nhận được sự quan tâm của bác'.",138,121,,17,,,,6 bình luậ,3851917191500887,/story.php?story_fbid=3851917191500887&id=214610578564918,Lưu
Tuổi Trẻ Online,,2019-11-17 18:26:24,"Iran quyết định điều chỉnh lại giá xăng và độc quyền phân phối sau khi xảy ra tình trạng xăng bị đầu cơ do được trợ giá khiến giá bán quá rẻ, chỉ 10.000 rial/lít (khoảng 5.500 đồng).",65,56,4,,2,3,,1 bình luậ,3851477954878144,/story.php?story_fbid=3851477954878144&id=214610578564918,Lưu
Tuổi Trẻ Online,,2019-11-17 17:29:30,"Cuối giờ chiều nay (17-11), Cơ quan CSĐT Công an Q.Bình Thạnh đã bắt khẩn cấp Nguyễn Tiến Dũng - nhân viên Trung Tâm hỗ trợ xã hội TP.HCM - để điều tra về hành vi dâm ô.",419,268,21,2,4,2,122,74 bình luậ,3851425218216751,/story.php?story_fbid=3851425218216751&id=214610578564918,Lưu
Tuổi Trẻ Online,,2019-11-17 15:49:32,Ông Dũng đã có hành vi dâm ô đối với nhiều bé gái đang được quản lý tại trung tâm. Thời gian tạm đình chỉ công tác 15 ngày kể từ ngày 18-11-2019.,468,223,26,,14,7,198,94 bình luậ,3851193688239904,/story.php?story_fbid=3851193688239904&id=214610578564918,Lưu
Tuổi Trẻ Online,,2019-11-17 15:22:49,Vụ việc xảy ra tại bệnh viện Sản nhi Nghệ An.,55,30,,1,7,16,1,Bình luậ,3851134034912536,/story.php?story_fbid=3851134034912536&id=214610578564918,Lưu
Tuổi Trẻ Online,,2019-11-17 14:00:08,"Trả lời phỏng vấn tờ Daily News ngày 17-11, 'huyền thoại' bóng đá Thái Lan Kiatisuk Senamuang khẳng định sự tự tin thái quá có thể khiến tuyển Việt Nam thất bại trước Thái Lan ở Mỹ Đình ngày 19-11.",240,150,82,1,4,1,2,86 bình luậ,3850951838264089,/story.php?story_fbid=3850951838264089&id=214610578564918,Lưu
"Tuổi Trẻ Online,Tuổi Trẻ",Tuổi Trẻ,2019-11-17 12:55:27,Góc nhìn trưa nay | ‘Đưa em về thanh xuân với cúc họa mi đầu mùa’Góc nhìn trưa nay | ‘Đưa em về thanh xuân với cúc họa mi đầu mùa’,7,6,1,,,,,Bình luậ,3850814211611185,/story.php?story_fbid=3850814211611185&id=214610578564918,Lưu
Tuổi Trẻ Online,,2019-11-17 11:11:37,"Ông Lê Minh Tấn - giám đốc Sở Lao động - thương binh và xã hội TP.HCM cho biết sở đang tiến hành kiểm tra, xác minh sự việc cán bộ Trung tâm hỗ trợ xã hội (TP.HCM) bị tố dâm ô và sẽ xử lý nghiêm vụ việc.",219,105,5,,17,5,87,22 bình luậ,3850586151633991,/story.php?story_fbid=3850586151633991&id=214610578564918,Lưu
Tuổi Trẻ Online,,2019-11-17 10:44:15,"Vietjet đảm bảo tất cả phi công sẽ có một ngày nghỉ trong khoảng 3-4 ngày làm việc, nghỉ phép có lương 1 tuần mỗi tháng, đi du lịch miễn phí trên khắp các điểm đến hấp dẫn tại Việt Nam và quốc tế nơi hãng có đường bay.",90,81,5,1,3,,,3 bình luậ,3850520881640518,/story.php?story_fbid=3850520881640518&id=214610578564918,Lưu
Tuổi Trẻ Online,,2019-11-17 09:08:09,"Bao trọn resort, đi bằng chuyên cơ, yêu cầu đầu bếp riêng... chỉ là một trong những yêu cầu dịch vụ mà giới kinh doanh du lịch thường phục vụ các vị khách du lịch hạng sang.",16,16,,,,,,Bình luậ,3850274261665180,/story.php?story_fbid=3850274261665180&id=214610578564918,Lưu
Tuổi Trẻ Online,,2019-11-17 08:07:51,"Cảnh sát Pháp phải dùng vòi rồng và hơi cay để giải tán cuộc biểu tình kỷ niệm 1 năm phong trào ""áo vàng"", sau khi đợt biểu tình này chuyển hướng bạo động.",15,15,,,,,,Bình luậ,3850135008345772,/story.php?story_fbid=3850135008345772&id=214610578564918,Lưu
Tuổi Trẻ Online,,2019-11-17 07:32:14,Thổ Nhĩ Kỳ thông báo đã bắt giữ tổng cộng 25 người họ hàng của Abu Bakr Al-Baghdadi - thủ lĩnh đã bị tiêu diệt của tổ chức khủng bố Nhà nước Hồi giáo (IS).,31,29,1,,1,,,1 bình luậ,3850056205020319,/story.php?story_fbid=3850056205020319&id=214610578564918,Lưu
Tuổi Trẻ Online,,2019-11-16 16:15:00,"Chỉ với một chiếc micro và bục sân khấu nhỏ gọn, những nghệ sĩ hài độc thoại nghiệp dư đang tạo ra ""những tiếng cười đêm muộn cho cuộc sống về đêm đã quá xuất sắc của Sài Gòn"", báo Mỹ New York Times viết như thế.",5,5,,,,,,Bình luậ,3847724635253476,/story.php?story_fbid=3847724635253476&id=214610578564918,Lưu
Tuổi Trẻ Online,,2019-11-16 16:04:43,"Ngủ dậy qua nhà hàng xóm người dân phát hiện nam cán bộ Trung tâm văn hóa tỉnh Bình Phước đã tử vong bất thường trong nhà. Cửa nhà mở toang, xe máy lại để ngoài sân.",44,33,4,,5,2,,Bình luậ,3847703728588900,/story.php?story_fbid=3847703728588900&id=214610578564918,Lưu
Tuổi Trẻ Online,,2019-11-16 15:54:11,Sự kiện gạo ST25 được bình chọn là ngon nhất thế giới tại Philippine đã trở thành “cú hích” cho doanh nghiệp xuất khẩu lẫn uy tín của gạo Việt trên thương trường.,175,161,3,10,1,,,13 bình luậ,3847681468591126,/story.php?story_fbid=3847681468591126&id=214610578564918,Lưu
Tuổi Trẻ Online,,2019-11-16 15:35:50,"Mấy ngày qua, dư luận xứ Đài Loan trợn mắt nhìn một ông đại gia được mệnh danh ""vua cần cẩu"" lên Facebook đăng ảnh khoe dinh thự và ""cuộc sống hạnh phúc"" với 4 bà vợ.",48,34,9,,5,,,6 bình luậ,3847646128594660,/story.php?story_fbid=3847646128594660&id=214610578564918,Lưu
Tuổi Trẻ Online,,2019-11-16 15:03:00,"Ngày 16-11, Liên đoàn Bóng đá Việt Nam (VFF) cho biết trung vệ Trần Đình Trọng không kịp hồi phục chấn thương để có thể tham dự SEA Games 30. HLV Park Hang Seo đã trả Đình Trọng về CLB để tiếp tục tập hồi phục với bác sĩ.",29,20,,1,1,7,,1 bình luậ,3847574758601797,/story.php?story_fbid=3847574758601797&id=214610578564918,Lưu
Tuổi Trẻ Online,,2019-11-16 14:42:42,Trực tiếp: Đội Thái Lan đến Hà Nội,27,24,3,,,,,2 bình luậ,3847533525272587,/story.php?story_fbid=3847533525272587&id=214610578564918,Lưu
Tuổi Trẻ Online,,2019-11-16 14:31:36,"Đó là câu chuyện về nữ hộ lý tại Bệnh viện nhiệt đới TP.HCM Nguyễn Thị Thanh, 49 tuổi. Chị Thanh tình nguyện chăm sóc một cụ già 90 tuổi mà không nhận một đồng thù lao nào.",114,91,1,20,2,,,2 bình luậ,3847509405274999,/story.php?story_fbid=3847509405274999&id=214610578564918,Lưu
Tuổi Trẻ Online,,2019-11-16 14:21:14,"Bất ngờ đã đến khi bộ ba Anh Đức, Hà Minh Tuấn cùng Công Phượng phải ngồi dự bị nhìn Tiến Linh đá chính rồi ghi bàn thắng đẹp mắt vào lưới UAE.",30,30,,,,,,3 bình luậ,3847486891943917,/story.php?story_fbid=3847486891943917&id=214610578564918,Lưu
Tuổi Trẻ Online,,2019-11-16 14:08:59,Các nhà khoa học thuộc Viện công nghệ Massachusetts (MIT) vừa trình làng thành tựu mới: những robot hình khối vuông nhỏ có khả năng tự lắp ráp với nhau như phim viễn tưởng.,7,6,,,1,,,Bình luậ,3847462651946341,/story.php?story_fbid=3847462651946341&id=214610578564918,Lưu
Tuổi Trẻ Online,,2019-11-16 13:58:24,Tiền vệ 20 tuổi Ekanit Panya tuyên bố sẽ giúp đội tuyển Thái Lan giành trọn 3 điểm trong chuyến làm khách trên sân Mỹ Đình của đội tuyển Việt Nam ngày 19-11 ở vòng loại World Cup 2022.,422,225,154,5,34,2,2,195 bình luậ,3847436618615611,/story.php?story_fbid=3847436618615611&id=214610578564918,Lưu
Tuổi Trẻ Online,,2019-11-16 13:46:14,"14h20 chiều nay 16-11, đội tuyển Thái Lan có mặt tại Hà Nội để chuẩn bị đối đầu với đội tuyển Việt Nam. HLV Akira Nishino đã thuê riêng sân của Trung tâm thể thao Viettel để đội tuyển Thái Lan tập luyện và cấm cửa báo chí tác nghiệp.",41,25,12,,4,,,10 bình luậ,3847410345284905,/story.php?story_fbid=3847410345284905&id=214610578564918,Lưu
Tuổi Trẻ Online,,2019-11-16 13:31:12,Dân mạng đã khen không tiếc lời với một chiến sĩ PCCC sau bức ảnh và clip cho thấy anh đã cung cấp oxy để cứu một con mèo trong tình trạng nguy kịch: ngạt khói nghiêm trọng và bất động.,60,47,3,8,2,,,1 bình luậ,3847376418621631,/story.php?story_fbid=3847376418621631&id=214610578564918,Lưu
"Tuổi Trẻ Online,Tuổi Trẻ",Tuổi Trẻ,2019-11-16 12:41:59,Góc nhìn trưa nay | Chiêm ngưỡng ‘kho báu vật’ mộc bản ở miền TâyGóc nhìn trưa nay | Chiêm ngưỡng ‘kho báu vật’ mộc bản ở miền Tây,12,12,,,,,,Bình luậ,3847278895298050,/story.php?story_fbid=3847278895298050&id=214610578564918,Lưu
Tuổi Trẻ Online,,2019-11-16 12:20:05,"Thấy chiếc xe buýt dừng lâu ven đường, bà con xung quanh tò mò đến coi thì phát hiện tài xế xe buýt nằm gục trên ghế lái, cạnh thi thể có một bãi nôn ói.",135,70,,,17,48,,11 bình luậ,3847235168635756,/story.php?story_fbid=3847235168635756&id=214610578564918,Lưu
Tuổi Trẻ Online,,2019-11-16 12:05:19,"""Thật kinh khủng khi những thứ như thế này lại tồn tại!"" - một người dùng Twitter hoảng sợ.",72,48,15,,5,3,1,5 bình luậ,3847206781971928,/story.php?story_fbid=3847206781971928&id=214610578564918,Lưu
Tuổi Trẻ Online,,2019-11-16 11:52:41,Quy trình chăn nuôi để tạo ra thịt hiện nay của loài người được xem là một nguồn gây ô nhiễm không nhỏ cho hành tinh. Vì vậy giải pháp làm ra thịt từ… không khí không chỉ giúp bảo vệ trái đất của chúng ta mà còn tốt cho sức khỏe.,11,8,3,,,,,1 bình luậ,3847180738641199,/story.php?story_fbid=3847180738641199&id=214610578564918,Lưu
Tuổi Trẻ Online,,2019-11-16 11:41:18,Cả Bệnh viện Chợ Rẫy TP.HCM và chùa Vĩnh Nghiêm đều khẳng định trang facebook 'chùa Vĩnh Nghiêm' đăng tải nội dung kêu gọi quyên góp tiền mổ tim cho trẻ dưới 16 tuổi là mạo danh để lừa đảo.,143,90,2,,16,5,30,10 bình luậ,3847152185310721,/story.php?story_fbid=3847152185310721&id=214610578564918,Lưu
Tuổi Trẻ Online,,2019-11-16 11:30:36,Nam tiếp viên xe buýt 51B-248 85 tuyến 81 (Bến xe Chợ Lớn - Lê Minh Xuân) có hành vi khinh thường hành khách sử dụng vé tập khi đi xe buýt nên phải đi học lại nghiệp vụ.,59,39,4,1,2,2,11,14 bình luậ,3847130661979540,/story.php?story_fbid=3847130661979540&id=214610578564918,Lưu
Tuổi Trẻ Online,,2019-11-16 11:16:52,"Sau chuỗi trận chơi khá tốt, quãng thời gian 'trăng mật' của HLV Akira Nishino cùng tuyển Thái Lan cuối cùng kết thúc. HLV người Nhật Bản đang bắt đầu đối mặt với sức ép từ những đồng nghiệp bản địa.",48,38,7,,3,,,12 bình luậ,3847100195315920,/story.php?story_fbid=3847100195315920&id=214610578564918,Lưu
Tuổi Trẻ Online,,2019-11-16 11:03:46,"Ngày 15-11, Công an quận Ngũ Hành Sơn (Đà Nẵng) đang tạm giữ hình sự 5 người có hành vi rủ nhau hỗn chiến gây mất an ninh trật tự trên địa bàn.",26,18,6,,2,,,1 bình luậ,3847068925319047,/story.php?story_fbid=3847068925319047&id=214610578564918,Lưu
Tuổi Trẻ Online,,2019-11-16 10:47:54,"Trả lời phỏng vấn tờ The National (UAE), HLV người Hà Lan Bert Van Marwijk đã tiếc nuối khi công nghệ hỗ trợ trọng tài VAR không được áp dụng ở vòng loại World Cup 2022, khiến UAE thất bại 0-1 trước Việt Nam ngày 14-11.",36,19,13,,3,1,,20 bình luậ,3847031888656084,/story.php?story_fbid=3847031888656084&id=214610578564918,Lưu
Tuổi Trẻ Online,,2019-11-16 10:40:42,"Trong trận đấu giữa Figueirense với Ponte Preta ở vòng 36 Giải hạng nhì Brazil, thủ môn Pegorari đã dùng 'tiểu xảo' đẩy bóng ra khỏi lưới, 'lừa gạt' trọng tài cứu cho đội nhà bàn thua.",43,27,14,,2,,,Bình luậ,3847014498657823,/story.php?story_fbid=3847014498657823&id=214610578564918,Lưu
Tuổi Trẻ Online,,2019-11-16 10:27:47,Một số tiếp viên hàng không của hãng American Airlines được cho là vẫn còn sợ hãi khi bay trên các máy bay dòng 737 MAX của Hãng Boeing và thậm chí cầu xin không bị bắt quay lại phục vụ trên các máy bay này.,28,21,2,,5,,,Bình luậ,3846978845328055,/story.php?story_fbid=3846978845328055&id=214610578564918,Lưu
Tuổi Trẻ Online,,2019-11-16 10:13:56,"Nghi ngờ cô giáo trẻ 'cặp bồ' với chồng mình, bà Hiếu lần tìm tài khoản Facebook cô giáo, tải hình ảnh cô và gia đình về rồi đăng lên mạng vu khống, bôi nhọ...",13,9,3,,1,,,Bình luậ,3846950725330867,/story.php?story_fbid=3846950725330867&id=214610578564918,Lưu
Tuổi Trẻ Online,,2019-11-16 10:03:18,"Các đối tượng xăm mình hành hung, khủng bố tinh thần, uy hiếp người thân của con nợ để đòi nợ thuê... Nên cấm hay để dịch vụ này tồn tại?",112,62,12,,3,4,31,50 bình luậ,3846924402000166,/story.php?story_fbid=3846924402000166&id=214610578564918,Lưu
Tuổi Trẻ Online,,2019-11-16 09:48:10,"Toàn bộ dân làng nơi đây đều chung tay trồng 111 cây xanh mỗi khi có một bé gái được sinh ra. Nó vừa là kỷ niệm vừa nhắc nhở về quyền con người, chăm sóc con cái cho đến lúc trưởng thành.",50,41,1,4,4,,,5 bình luậ,3846886435337296,/story.php?story_fbid=3846886435337296&id=214610578564918,Lưu
Tuổi Trẻ Online,,2019-11-16 09:26:27,"Chim bồ câu tung tăng trên đường phố là hình ảnh bao người mê mẩn, nhưng ít ai ngờ các nhà nghiên cứu phát hiện một sự thật đáng sợ: ngón chân bồ câu biến dạng ở đô thị. Riêng ở Paris, ai cho chim bồ câu ăn bị phạt nặng.",65,54,3,,7,1,,1 bình luậ,3846836772008929,/story.php?story_fbid=3846836772008929&id=214610578564918,Lưu
Tuổi Trẻ Online,,2019-11-16 09:05:05,"Sở Giao thông vận tải TP.HCM đã xác nhận cầu thấp hơn thiết kế 0,17-0,33m và chỉ mới lắp 3 tiếng đã ""rụng"" như trời giáng xuống xe container khi xe chạy qua.",364,160,111,3,26,9,55,66 bình luậ,3846790838680189,/story.php?story_fbid=3846790838680189&id=214610578564918,Lưu
Tuổi Trẻ Online,,2019-11-16 08:56:43,"Hôm nay TP.HCM và Nam Bộ nắng, một số nơi có mưa rào và dông lúc chiều tối và đêm, nhiệt độ thấp nhất 23 - 26 độ C. Hà Nội nhiệt độ thấp nhất 19 - 22 độ C, Đà Nẵng 23 - 26 độ C...",10,10,,,,,,Bình luậ,3846771332015473,/story.php?story_fbid=3846771332015473&id=214610578564918,Lưu
Tuổi Trẻ Online,,2019-11-16 08:56:08,"Hôm nay TP.HCM và Nam Bộ nắng, một số nơi có mưa rào và dông lúc chiều tối và đêm, nhiệt độ thấp nhất 23 - 26 độ C. Hà Nội nhiệt độ thấp nhất 19 - 22 độ C, Đà Nẵng 23 - 26 độ C...",4,4,,,,,,Bình luậ,3846769325349007,/story.php?story_fbid=3846769325349007&id=214610578564918,Lưu
Tuổi Trẻ Online,,2019-11-16 08:40:49,"Đó là một hành trình 20 năm của kỹ sư Hồ Quang Cua với nhóm nghiên cứu lúa Sóc Trăng (ST). Hạt ngọc ấy thì ra bán đầy ở VN.. Sóc Trăng, giá mỗi bọc 5kg 100.000 đồng, Cần Thơ 120.000 đồng... Nhiều bà con Hà Nội 'mê tít'...",106,94,4,4,4,,,8 bình luậ,3846728665353073,/story.php?story_fbid=3846728665353073&id=214610578564918,Lưu
Tuổi Trẻ Online,,2019-11-16 08:36:49,Hơn 1.500 con chim đã chết rải rác suốt 5-7km dọc ven bờ hồ nước mặn Sambhar ở bang Rajasthan phía tây Ấn Độ trong khi các chuyên gia môi trường chưa biết nguyên nhân chính xác là gì.,19,12,,,2,5,,Bình luậ,3846719772020629,/story.php?story_fbid=3846719772020629&id=214610578564918,Lưu
Tuổi Trẻ Online,,2019-11-16 08:21:45,Cựu đại sứ Mỹ tại Ukraine Marie Yovanovitch khẳng định chính quyền Trump có âm mưu loại bà ra khỏi ngành ngoại giao trong cuộc điều trần tối 15-11. Tổng thống Trump lập tức đáp trả trên Twitter.,18,18,,,,,,Bình luậ,3846686922023914,/story.php?story_fbid=3846686922023914&id=214610578564918,Lưu
Tuổi Trẻ Online,,2019-11-16 08:12:09,"Đá bại UAE để đoạt ngôi đầu bảng G vòng loại 2 World Cup 2022 khu vực châu Á với 10 điểm (hơn Thái Lan, UAE cùng Malaysia lần lượt 3 và 4 điểm), tuy nhiên vị trí này chưa tạo ra một ưu thế rõ ràng cho tuyển Việt Nam.",19,18,,1,,,,Bình luậ,3846666822025924,/story.php?story_fbid=3846666822025924&id=214610578564918,Lưu
Tuổi Trẻ Online,,2019-11-16 07:59:42,"Chùa Linh Sâm - một ngôi chùa đang được dựng bên cạnh đền Hữu, di tích lịch sử - kiến trúc nghệ thuật cấp quốc gia ở Nghệ An - vừa bị đình chỉ xây dựng.",19,14,4,,1,,,2 bình luậ,3846639278695345,/story.php?story_fbid=3846639278695345&id=214610578564918,Lưu
Tuổi Trẻ Online,,2019-11-16 07:46:15,"Rạng sáng 16-11, siêu sao Lionel Messi đã ghi bàn thắng duy nhất giúp Argentina đá bại Brazil 1-0 trong trận giao hữu diễn ra tại Saudi Arabia. Đây là lần đầu tiên sau 7 năm, Messi mới lại phá lưới kình địch Brazil.",11,10,1,,,,,Bình luậ,3846607345365205,/story.php?story_fbid=3846607345365205&id=214610578564918,Lưu
Tuổi Trẻ Online,,2019-11-16 07:37:18,"Nhà Trắng ngày 15-11 thông báo bản thỏa thuận thương mại một phần giữa Mỹ và Trung Quốc có thể sẽ được ký ở cấp bộ trưởng, không phải giữa hai nhà lãnh đạo.",5,5,,,,,,Bình luậ,3846584888700784,/story.php?story_fbid=3846584888700784&id=214610578564918,Lưu
Tuổi Trẻ Online,,2019-11-16 06:36:42,"Mặc dù chưa chính thức công bố quyết định tranh cử tổng thống, nhưng ngày 15-11, tỉ phú Michael Bloomberg đã phát động chiến dịch quảng cáo online 100 triệu USD để ‘đấu’ ông Trump.",26,20,2,1,1,1,1,5 bình luậ,3846446288714644,/story.php?story_fbid=3846446288714644&id=214610578564918,Lưu
Tuổi Trẻ Online,,2019-11-16 00:08:56,"Ông T. - chủ tiệm vàng trên đường Trần Văn Mười (H. Hóc Môn, TP.HCM) kể lại giây phút đối mặt với kẻ cướp chĩa súng về mình và bắn hai phát nhưng ông may mắn không trúng đạn.",138,98,8,,22,4,6,9 bình luậ,3845504878808785,/story.php?story_fbid=3845504878808785&id=214610578564918,Lưu
Tuổi Trẻ Online,,2019-11-15 22:53:48,"Hơn 1.500 hộ dân ở cồn Nhất Trí bên biển Nha Trang phải ""sống treo"" suốt 15 năm qua bởi quy hoạch và ""dự án treo"".",12,12,,,,,,Bình luậ,3845282568831016,/story.php?story_fbid=3845282568831016&id=214610578564918,Lưu
Tuổi Trẻ Online,,2019-11-15 22:36:21,"Thứ trưởng Bộ GD-ĐT Nguyễn Hữu Độ cho biết sắp tới sẽ thực hiện chương trình phổ thông mới, mong thầy cô giáo cố gắng tiếp cận, dạy học sinh bằng cả nhân cách.",76,41,27,2,3,3,,21 bình luậ,3845223738836899,/story.php?story_fbid=3845223738836899&id=214610578564918,Lưu
Tuổi Trẻ Online,,2019-11-15 22:24:09,"Ít nhất 27 người thiệt mạng và nhiều người bị thương chỉ trong một đêm do sét đánh và mưa lớn gây sụp đổ nhà cửa tại khu vực sa mạc Thar, tỉnh Sindh của Pakistan.",40,23,,2,9,6,,Bình luậ,3845187645507175,/story.php?story_fbid=3845187645507175&id=214610578564918,Lưu
Tuổi Trẻ Online,,2019-11-15 22:08:37,"Cục Quản lý thực phẩm và dược phẩm Mỹ (FDA) cảnh báo nhiều loại thuốc không kê đơn do Trung Quốc sản xuất đã bị phát hiện là ""tạp nhiễm"", bao gồm cả các miếng dán lột mụn trứng cá.",66,40,12,2,11,,1,Bình luậ,3845140435511896,/story.php?story_fbid=3845140435511896&id=214610578564918,Lưu
Tuổi Trẻ Online,,2019-11-15 21:55:25,Bức ảnh một con chim quý của Úc đậu trên cành cây nhìn về khu rừng cháy tan hoang đang được chia sẻ chóng mặt và khiến không ít người bật khóc.,250,145,2,12,6,85,,12 bình luậ,3845100872182519,/story.php?story_fbid=3845100872182519&id=214610578564918,Lưu
Tuổi Trẻ Online,,2019-11-15 21:34:36,"Không có đơn vị chịu trách nhiệm giám định, không có tiêu chuẩn để đánh giá chất lượng thuốc lá điếu ngoại nhập lậu, khiến hàng triệu bao thuốc lá nằm kho, thất thoát.",11,10,1,,,,,1 bình luậ,3845038112188795,/story.php?story_fbid=3845038112188795&id=214610578564918,Lưu
Tuổi Trẻ Online,,2019-11-15 21:21:11,"Các giáo viên ở huyện Kỳ Sơn, Nghệ An đã kịp thời đỡ đẻ cho sản phụ. Bé trai 3kg chào đời trong niềm vui của gia đình sản phụ lẫn các cô giáo.",40,33,,7,,,,Bình luậ,3844996295526310,/story.php?story_fbid=3844996295526310&id=214610578564918,Lưu
Tuổi Trẻ Online,,2019-11-15 21:09:14,"Đêm qua, Công Phượng đã có những pha đi bóng tốt, lắt léo... khiến nhiều cổ động viên trầm trồ. Song, đầu đó vẫn còn là sự tiếc nuối về tính hiệu quả của những lần dứt điểm.",25,23,,2,,,,2 bình luậ,3844958958863377,/story.php?story_fbid=3844958958863377&id=214610578564918,Lưu
Tuổi Trẻ Online,,2019-11-15 20:58:17,Các CĐV Hà Lan đồng loạt lên tiếng yêu cầu HLV Johnny Jansen để cầu thủ này vào sân đá cho Heerenveen.,89,85,,3,1,,,2 bình luậ,3844925928866680,/story.php?story_fbid=3844925928866680&id=214610578564918,Lưu
Tuổi Trẻ Online,,2019-11-15 20:46:37,"Chỉ vì cháu Đạt không chịu ăn sáng, Hải tàn nhẫn đánh con riêng của vợ hờ dẫn tới tử vong rồi nói dối là do cháu bé 7 tuổi bị ngã trong phòng tắm để qua mặt người dân và cơ quan chức năng.",50,28,,1,,3,18,9 bình luậ,3844891745536765,/story.php?story_fbid=3844891745536765&id=214610578564918,Lưu
Tuổi Trẻ Online,,2019-11-15 20:34:23,Đoàn kiểm tra EC đề nghị Việt Nam quyết liệt hơn nữa trong việc chống tàu thuyền của ngư dân khai thác hải sản trái phép tại vùng biển các quốc gia khác.,10,10,,,,,,Bình luậ,3844852682207338,/story.php?story_fbid=3844852682207338&id=214610578564918,Lưu
Tuổi Trẻ Online,,2019-11-15 20:23:29,"Ngày 15-11, đội tuyển Việt Nam đã có buổi tập tại Trung tâm Đào tạo bóng đá trẻ thuộc Liên đoàn Bóng đá Việt Nam. Có thể thấy sau chiến thắng hôm qua, tâm trạng của các cầu thủ đang vô cùng thoải mái.",12,11,,1,,,,Bình luậ,3844819548877318,/story.php?story_fbid=3844819548877318&id=214610578564918,Lưu
Tuổi Trẻ Online,,2019-11-15 20:12:14,"Sau vụ việc bị quay lén buổi tập trước trận đấu với Malaysia ở vòng loại World Cup 2022, dường như Thái Lan đang muốn nhắm đến một địa điểm tập kín đáo hơn để chuẩn bị cho trận gặp Việt Nam.",54,28,25,1,,,,20 bình luậ,3844788662213740,/story.php?story_fbid=3844788662213740&id=214610578564918,Lưu
Tuổi Trẻ Online,,2019-11-15 19:59:19,"Tiếp viên hàng không là một nghề thoạt nhìn thì ""sướng"" nhưng thật ra lại nhiều áp lực, cả về thể chất lẫn tinh thần. Cũng như bao nghề khác, một chút thư giãn và óc hài hước luôn có ích.",31,23,6,,2,,,Bình luậ,3844753065550633,/story.php?story_fbid=3844753065550633&id=214610578564918,Lưu
Tuổi Trẻ Online,,2019-11-15 19:47:51,Dự án đường sắt Cát Linh - Hà Đông đến nay đã 5 lần chậm tiến độ và chưa thể đưa vào vận hành do còn 4 vấn đề lớn chưa được giải quyết.,41,24,12,,2,1,2,15 bình luậ,3844720968887176,/story.php?story_fbid=3844720968887176&id=214610578564918,Lưu
Tuổi Trẻ Online,,2019-11-15 19:36:41,"Bé trai 17 tháng tuổi ở huyện Triệu Sơn (Thanh Hóa) bị hóc hạt hướng dương, che lấp đường thở, toàn thân tím tái khiến người thân hốt hoảng phải đưa đến Bệnh viện Nhi Thanh Hóa cấp cứu.",31,17,,1,3,10,,1 bình luậ,3844690988890174,/story.php?story_fbid=3844690988890174&id=214610578564918,Lưu
Tuổi Trẻ Online,,2019-11-15 19:25:45,Công điện vừa được Thủ tướng ban hành về sự cố máy bay của Vietjet và T’way Air bị móp mũi nhưng không có dấu vết va chạm với chim trời.,35,29,2,1,3,,,1 bình luậ,3844661902226416,/story.php?story_fbid=3844661902226416&id=214610578564918,Lưu
