source,shared_from,date,text,reactions,likes,ahah,love,wow,sigh,grrr,comments,post_id,url,share
Blogtamsu,,2019-11-05 18:00:57,Better an honest enemy than a false friend.,397,347,23,15,3,4,5,3 bình luậ,701569557004252,/story.php?story_fbid=701569557004252&id=156957931746758,Lưu
Blogtamsu,,2019-11-05 17:00:06,Father is the mountain and I am only the green grass Father is heaven creating white clouds for me to fly on,99,91,,4,2,1,1,1 bình luậ,808893499558420,/story.php?story_fbid=808893499558420&id=156957931746758,Lưu
Blogtamsu,,2019-11-05 16:00:52,The law of causality always exists in life :),327,281,5,14,,5,22,1 bình luậ,430361427887726,/story.php?story_fbid=430361427887726&id=156957931746758,Lưu
Blogtamsu,,2019-11-05 15:00:24,"Female director harmed by her rival in love, vindicated thanks to her kindness.",143,128,2,10,3,,,2 bình luậ,779404652495690,/story.php?story_fbid=779404652495690&id=156957931746758,Lưu
Blogtamsu,,2019-11-05 14:00:44,Don't do bad deeds or you'll bear all the harsh results alone.,54,49,2,2,1,,,1 bình luậ,418265665759795,/story.php?story_fbid=418265665759795&id=156957931746758,Lưu
Blogtamsu,,2019-11-05 13:04:27,The worst crime originates from us. The fear of any crimes is punishment.,111,81,,10,2,14,4,9 bình luậ,388410885374349,/story.php?story_fbid=388410885374349&id=156957931746758,Lưu
Blogtamsu,,2019-11-05 12:00:56,"No matter how small kind thing is, it'll never be a waste. Do good and good will come to you!",197,171,,20,6,,,3 bình luậ,1463833273764616,/story.php?story_fbid=1463833273764616&id=156957931746758,Lưu
Blogtamsu,,2019-11-05 11:00:09,"Never complain about how others treat you, just see how you treat others!",114,105,1,6,,2,,1 bình luậ,598564964014205,/story.php?story_fbid=598564964014205&id=156957931746758,Lưu
Blogtamsu,,2019-11-04 21:00:03,Karma has no deadline!!Karma không có thời hạn!!,84,67,4,4,,6,3,3 bình luậ,2757167137669460,/story.php?story_fbid=2757167137669460&id=156957931746758,Lưu
Blogtamsu,,2019-11-04 19:00:40,Words can build a country. Words can also destroy a country. Problems mostly come from the tongue.Từ ngữ có thể xây dựng một quốc gia. Lời nói cũng có thể phá hủy một quốc gia. Vấn đề hầu hết đều đến từ lưỡi.,84,71,4,6,1,1,1,7 bình luậ,526447594861653,/story.php?story_fbid=526447594861653&id=156957931746758,Lưu
Blogtamsu,,2019-11-04 18:00:48,Family is the most important thing in your life. You can't turn back with your family to creat your career.,67,57,6,4,,,,1 bình luậ,413664772633860,/story.php?story_fbid=413664772633860&id=156957931746758,Lưu
Blogtamsu,,2019-11-04 17:00:35,"In life, it's better to learn how to forgive and love more. Don't lose your own happiness due to your selfishness.",31,27,1,2,1,,,6 bình luậ,935134303520117,/story.php?story_fbid=935134303520117&id=156957931746758,Lưu
Blogtamsu,,2019-11-04 16:00:26,"If you really want to be with someone, give him something that can't be bought or measured with money. It is sincerity and faithfulness.",75,62,,9,3,,1,5 bình luậ,557684408317485,/story.php?story_fbid=557684408317485&id=156957931746758,Lưu
Blogtamsu,,2019-11-04 15:00:22,"Every why has a where fore. If you have a good life and don't do anything wrong with your conscience, you will pass struggle, no matter how big it is!Mỗi lý do tại sao lại có một nơi nào đó trước đó. Nếu bạn có một cuộc sống tốt đẹp và đừng làm bất cứ điều gì sai với lương tâm của bạn, bạn sẽ vượt qua cuộc đấu tranh, cho dù nó lớn đến mức nào!",111,93,1,13,,,4,2 bình luậ,542473386528649,/story.php?story_fbid=542473386528649&id=156957931746758,Lưu
Blogtamsu,,2019-11-04 14:00:38,"No matter if you are rich or poor, ugly or beautiful everyone is of equal status. Only those who respect the others deserve respect.",106,89,3,6,1,5,2,6 bình luậ,1384704451692482,/story.php?story_fbid=1384704451692482&id=156957931746758,Lưu
Blogtamsu,,2019-11-04 13:04:21,"The more you calculate, the more you lose",49,42,2,3,,1,1,1 bình luậ,989428184732148,/story.php?story_fbid=989428184732148&id=156957931746758,Lưu
