source,shared_from,date,text,reactions,likes,ahah,love,wow,sigh,grrr,comments,post_id,url,share
"Blogtamsu,Best Ideas",Best Ideas,2019-11-25 08:45:59,Oh didn't know this before!Highlighter pen tricks you wish you know before 🤗Những mẹo bút Highlighter bạn ước gì bạn biết trước đây 🤗,1,1,,,,,,Bình luậ,591292281646652,/story.php?story_fbid=591292281646652&id=156957931746758,Lưu
Blogtamsu,,2019-11-27 19:00:44,Math becomes so easy by following our tips 😜😜 Source: Best Ideas,17,15,1,1,,,,1 bình luậ,588089875300226,/story.php?story_fbid=588089875300226&id=156957931746758,Lưu
Blogtamsu,,2019-11-27 18:00:25,Not everyone is alert enough to know what is good for their children!,22,18,,,,3,1,1 bình luậ,591304228312124,/story.php?story_fbid=591304228312124&id=156957931746758,Lưu
"Blogtamsu,Bnews Life",Bnews Life,2019-11-27 17:09:33,"They are so adorable 😍😍Wanna Date? - With two different personalities, will they become a couple in the end?Muốn hẹn hò không? - Với hai tính cách khác nhau, liệu cuối cùng họ có trở thành một cặp không?",2,1,,1,,,,Bình luậ,591565811619299,/story.php?story_fbid=591565811619299&id=156957931746758,Lưu
"Blogtamsu,Bnews Life",Bnews Life,2019-11-27 15:16:46,Such a touching story 😢😢Come Out–Step Into The Light| The boy in the LGBT community shared his stigmatized childhood.,3,2,,,1,,,Bình luậ,591508524958361,/story.php?story_fbid=591508524958361&id=156957931746758,Lưu
Blogtamsu,,2019-11-27 15:00:26,We usually need life hacks to solve small problems and ease our lives. We always choose super handy life hacks that will help you in any situation. Today we prepared a new collection of lifehacks that will help you to solve various problems and other creative ideas #lifehack #tieshoelaces #cleanshoes #thinksmart4 #thinksmart Source: Best Ideas,28,27,,1,,,,1 bình luậ,591486848293862,/story.php?story_fbid=591486848293862&id=156957931746758,Lưu
Blogtamsu,,2019-11-27 14:00:24,Don't forget to check out this video to get some hilarious drawing hacks (y) Source: Best Ideas,12,12,,,,,,1 bình luậ,591351141640766,/story.php?story_fbid=591351141640766&id=156957931746758,Lưu
Blogtamsu,,2019-11-27 13:00:13,Love your parent and treat them with loving care. For you will only know their value when you see their empty chair.,45,31,,1,,6,7,6 bình luậ,591304568312090,/story.php?story_fbid=591304568312090&id=156957931746758,Lưu
Blogtamsu,,2019-11-27 12:00:18,Don't judge someone base on their appearance.,40,33,6,1,,,,2 bình luậ,591303594978854,/story.php?story_fbid=591303594978854&id=156957931746758,Lưu
Blogtamsu,,2019-11-27 11:00:24,Useful tips with toothpaste that you should know :D Source: Best Ideas,12,10,1,,1,,,1 bình luậ,591350231640857,/story.php?story_fbid=591350231640857&id=156957931746758,Lưu
"Blogtamsu,Best Ideas",Best Ideas,2019-11-23 10:38:54,Interesting! 🤩🤩Watch this video to know the best hacks with highlighter pen <3,3,3,,,,,,Bình luậ,591287908313756,/story.php?story_fbid=591287908313756&id=156957931746758,Lưu
Blogtamsu,,2019-11-27 08:00:01,Cuddling 🥰🥰,70,55,,15,,,,Bình luậ,589780785131135,/story.php?story_fbid=589780785131135&id=156957931746758,Lưu
Blogtamsu,,2019-11-26 19:00:43,Save these tips from aloe vera to help you shine 👌 Source: Best Ideas,65,65,,,,,,1 bình luậ,588089388633608,/story.php?story_fbid=588089388633608&id=156957931746758,Lưu
Blogtamsu,,2019-11-26 18:00:41,Money and material are essential things in life!,57,43,,6,,8,,1 bình luậ,590467195062494,/story.php?story_fbid=590467195062494&id=156957931746758,Lưu
Blogtamsu,,2019-11-26 16:00:23,Genius hacks and tricks to make you pro in folding paper 😉 Source: Best Ideas,28,28,,,,,,1 bình luậ,590690481706832,/story.php?story_fbid=590690481706832&id=156957931746758,Lưu
Blogtamsu,,2019-11-26 14:00:19,Try some easy drawing hacks that make you suprised 😉 Source: Best Ideas,12,11,,1,,,,1 bình luậ,590505668391980,/story.php?story_fbid=590505668391980&id=156957931746758,Lưu
Blogtamsu,,2019-11-26 13:00:33,God observes what we do. Don't do anything against our conscience.Chúa quan sát những gì chúng ta làm. Đừng làm bất cứ điều gì chống lại lương tâm của chúng ta.,72,59,1,7,,4,1,1 bình luậ,590466531729227,/story.php?story_fbid=590466531729227&id=156957931746758,Lưu
Blogtamsu,,2019-11-26 12:00:59,The stain on a car can be cleaned But the bad personality is hard to do soVết bẩn trên một chiếc xe có thể được rửa sạch Nhưng tính cách xấu thì khó làm lắm,92,86,,,1,3,2,4 bình luậ,590465098396037,/story.php?story_fbid=590465098396037&id=156957931746758,Lưu
Blogtamsu,,2019-11-26 11:00:38,Save your life by some useful life hacks 😉 Source: Best Ideas,10,10,,,,,,1 bình luậ,590504855058728,/story.php?story_fbid=590504855058728&id=156957931746758,Lưu
Blogtamsu,,2019-11-26 08:00:00,Calming teatime 😊,45,42,,3,,,,Bình luậ,587282628714284,/story.php?story_fbid=587282628714284&id=156957931746758,Lưu
Blogtamsu,,2019-11-25 19:00:50,Simple math tricks you shouldn't miss out 🤩 Source: Best Ideas,46,45,,1,,,,4 bình luậ,587274208715126,/story.php?story_fbid=587274208715126&id=156957931746758,Lưu
Blogtamsu,,2019-11-25 18:00:33,"As a girl, take care of yourself, love yourself then th real price of your life will appear and bring you a fairy ending in this ordinary life.",164,132,2,1,,15,14,6 bình luậ,589634695145744,/story.php?story_fbid=589634695145744&id=156957931746758,Lưu
Blogtamsu,,2019-11-25 17:00:14,"We know getting from point A to point B can be well, challenging…  Okay, really challenging. But don’t stress! We’ve got some great hacks up our sleeve that will ease your anxiety and let you have a fabulous time, wherever you end up!  #funny #tips #tricks #ThinkSmart3 Source: Best Ideas",14,13,1,,,,,1 bình luậ,589883691787511,/story.php?story_fbid=589883691787511&id=156957931746758,Lưu
Blogtamsu,,2019-11-25 14:00:36,Highlighter pen tricks you wish you know before 🤗 Source: Best IdeasNhững mẹo bút Highlighter bạn ước gì bạn biết trước đây 🤗 Nguồn: Best Ideas,12,11,,,,1,,1 bình luậ,589714435137770,/story.php?story_fbid=589714435137770&id=156957931746758,Lưu
Blogtamsu,,2019-11-25 13:00:21,"As a loser in a marathon you adulteress, don't try to seize the prize.",72,66,1,3,1,1,,2 bình luậ,589634085145805,/story.php?story_fbid=589634085145805&id=156957931746758,Lưu
Blogtamsu,,2019-11-25 12:00:33,A clean fast is better than a dirty breakfast.,141,123,1,11,3,3,,1 bình luậ,589633661812514,/story.php?story_fbid=589633661812514&id=156957931746758,Lưu
Blogtamsu,,2019-11-25 11:00:56,Do you know useful life hack with tape? Check out this video 😜 Source: Best Ideas,31,27,,4,,,,1 bình luậ,589712488471298,/story.php?story_fbid=589712488471298&id=156957931746758,Lưu
Blogtamsu,,2019-11-25 09:00:32,"Only a few seconds of carelessness, maybe you will lose your child forever :(",74,68,,1,1,2,2,2 bình luậ,579190956190118,/story.php?story_fbid=579190956190118&id=156957931746758,Lưu
Blogtamsu,,2019-11-25 08:00:00,Make your birthday parties more fancy and memorable! 🥳🥳,243,210,,25,8,,,1 bình luậ,587281135381100,/story.php?story_fbid=587281135381100&id=156957931746758,Lưu
Blogtamsu,,2019-11-24 19:00:36,You're going to brush your teeth but suddenly find out that your toothpaste is run out and you can't go out to buy the new one?  Don't worry! This video will help you find out a solution Source: Best Ideas,13,11,,2,,,,1 bình luậ,588088748633672,/story.php?story_fbid=588088748633672&id=156957931746758,Lưu
Blogtamsu,,2019-11-24 18:00:03,Family is the place where no one abandoned the other one! <3,170,153,1,11,5,,,2 bình luậ,588853671890513,/story.php?story_fbid=588853671890513&id=156957931746758,Lưu
Blogtamsu,,2019-11-24 14:00:40,Watch this video to know the best hacks with highlighter pen <3 Source: Best Ideas,23,23,,,,,,1 bình luậ,588219798620567,/story.php?story_fbid=588219798620567&id=156957931746758,Lưu
Blogtamsu,,2019-11-24 13:00:48,"A smart person should only keep the money in thier head, not their heart. :(",96,84,3,4,2,1,2,2 bình luậ,588849271890953,/story.php?story_fbid=588849271890953&id=156957931746758,Lưu
Blogtamsu,,2019-11-24 12:00:15,"It's nothing wrong with the love of a mother! But, everything has a limit! :)",69,63,2,1,1,1,1,3 bình luậ,588847445224469,/story.php?story_fbid=588847445224469&id=156957931746758,Lưu
Blogtamsu,,2019-11-24 11:00:28,Do You Know Those Interesting Uses of Rubber Bands? Don't miss out this video!!! Source: Best Ideas,15,13,,2,,,,1 bình luậ,588224578620089,/story.php?story_fbid=588224578620089&id=156957931746758,Lưu
Blogtamsu,,2019-11-24 10:00:04,"God gives you a beautiful appearance, but you have no personality!",64,59,2,2,,1,,1 bình luậ,579188549523692,/story.php?story_fbid=579188549523692&id=156957931746758,Lưu
Blogtamsu,,2019-11-24 09:00:12,Every day is not Saturday. No one knows who is the better one in the future :)Mỗi ngày đều không phải là thứ Bảy. № một người biết ai là người tốt hơn trong tương lai :),165,151,8,4,1,1,,1 bình luậ,579188209523726,/story.php?story_fbid=579188209523726&id=156957931746758,Lưu
Blogtamsu,,2019-11-24 08:00:00,OMG these food samplers look so real! 🤩🤩Ôi trời ơi những món ăn này thật là thật! 🤩🤩,54,46,,4,4,,,Bình luậ,587279145381299,/story.php?story_fbid=587279145381299&id=156957931746758,Lưu
Blogtamsu,,2019-11-23 19:00:40,Follow these tips if you want your shoes be more fancy 😎 Source: Best Ideas,535,511,1,9,13,,1,6 bình luậ,588088228633724,/story.php?story_fbid=588088228633724&id=156957931746758,Lưu
Blogtamsu,,2019-11-23 18:00:44,"If you can't teach your children good things, at least know how to treat others properly in front of them",140,120,,7,1,12,,2 bình luậ,587986291977251,/story.php?story_fbid=587986291977251&id=156957931746758,Lưu
Blogtamsu,,2019-11-23 17:00:32,"Love to make your friends squirm? If you love playing jokes on your friends, watch this video for more awesome pranks! Can’t wait to try these pranks out on your friends? Don’t forget to subscribe to Think Smart's YouTube Channel so you never miss out on all the fun. See you next time! <3 #pranks #funny #DIY Source: Best IdeasThích làm cho bạn bè của bạn bị quằn quại? Nếu bạn thích chơi trò đùa trên bạn bè của bạn, hãy xem video này để có thêm những trò chơi khăm tuyệt vời! Không thể chờ đợi để thử những trò chơi khăm này trên bạn bè của bạn? Đừng quên đăng ký để nghĩ kênh YouTube của thông minh để bạn không bao giờ bỏ lỡ những niềm vui. Hẹn gặp lại lần sau! <3 #pranks #funny #DIY Nguồn: Best Ideas",19,14,5,,,,,1 bình luậ,588167658625781,/story.php?story_fbid=588167658625781&id=156957931746758,Lưu
Blogtamsu,,2019-11-23 16:00:27,School hacks to make your life easier ☺️ Source: Best IdeasCác mẹo trường học để cho cuộc sống của bạn dễ dàng hơn ☺️ Nguồn: Best Ideas,39,36,,3,,,,2 bình luậ,588125995296614,/story.php?story_fbid=588125995296614&id=156957931746758,Lưu
Blogtamsu,,2019-11-23 14:00:04,Useful math tips that you should know :D Source: Best IdeasMẹo toán hữu ích mà bạn nên biết :D Nguồn: Best Ideas,45,40,,2,3,,,1 bình luậ,588030675306146,/story.php?story_fbid=588030675306146&id=156957931746758,Lưu
Blogtamsu,,2019-11-23 13:00:07,There's always a second chance in life!  It's TOMORROW!,156,146,2,1,,2,5,1 bình luậ,587983491977531,/story.php?story_fbid=587983491977531&id=156957931746758,Lưu
Blogtamsu,,2019-11-23 12:00:13,Don't be blinded by money. Don't lose your dignity easily.Đừng vì tiền mà mù quáng. Đừng đánh mất nhân phẩm của bạn dễ dàng.,234,199,2,11,,22,,4 bình luậ,587983098644237,/story.php?story_fbid=587983098644237&id=156957931746758,Lưu
Blogtamsu,,2019-11-23 11:00:47,Other Used of Glue Gun Sticks That You Wish You Know Before Source: Best Ideas,22,21,,1,,,,1 bình luậ,588029985306215,/story.php?story_fbid=588029985306215&id=156957931746758,Lưu
Blogtamsu,,2019-11-23 10:00:43,Don't judge others by the value of the clothes they wear :),141,128,7,6,,,,1 bình luậ,579187342857146,/story.php?story_fbid=579187342857146&id=156957931746758,Lưu
Blogtamsu,,2019-11-23 08:00:00,For blueberries lovers 😍😍😍,73,57,,14,2,,,Bình luậ,587277748714772,/story.php?story_fbid=587277748714772&id=156957931746758,Lưu
Blogtamsu,,2019-11-23 09:00:26,"Money can fulfill your needs, but it can't buy you happiness :)",205,183,15,6,1,,,3 bình luậ,579186109523936,/story.php?story_fbid=579186109523936&id=156957931746758,Lưu
Blogtamsu,,2019-11-22 19:00:48,These extremely nice tips will save your time 😉 Source: Best Ideas,8,8,,,,,,1 bình luậ,587271452048735,/story.php?story_fbid=587271452048735&id=156957931746758,Lưu
Blogtamsu,,2019-11-22 18:00:57,"God forbid any of these situations happen to you! But it's better to be prepared just in case! Find out how to survive during a hurricane, after falling under thin ice, during a storm and others! Stay safe and be healthy!",18,16,,1,1,,,3 bình luậ,587442535364960,/story.php?story_fbid=587442535364960&id=156957931746758,Lưu
Blogtamsu,,2019-11-22 17:00:12,Simple drawing tips that you need to try 🖌🖌🖌 Source: Best Ideas,32,29,,,2,1,,1 bình luậ,587420068700540,/story.php?story_fbid=587420068700540&id=156957931746758,Lưu
Blogtamsu,,2019-11-22 14:00:53,Do you know about these genius math tricks? 😲 Source: Best IdeasBạn có biết về những mẹo toán thiên tài này không? 😲 Nguồn: Best Ideas,58,53,1,2,2,,,1 bình luậ,587230762052804,/story.php?story_fbid=587230762052804&id=156957931746758,Lưu
Blogtamsu,,2019-11-22 11:00:20,School hacks you wish you knew before (y) Source: Best IdeasCác mẹo trường học mà bạn ước gì bạn biết trước đây (y) Nguồn: Best Ideas,56,54,,2,,,,1 bình luậ,587237752052105,/story.php?story_fbid=587237752052105&id=156957931746758,Lưu
Blogtamsu,,2019-11-22 10:00:07,"If others don't respect you, still respect them. Don't let other people's action affect your personality :)",25,21,,,,1,3,1 bình luậ,579185409524006,/story.php?story_fbid=579185409524006&id=156957931746758,Lưu
Blogtamsu,,2019-11-22 09:00:52,Just like little princesses 🥰🥰🥰,90,74,,10,6,,,Bình luậ,587182322057648,/story.php?story_fbid=587182322057648&id=156957931746758,Lưu
Blogtamsu,,2019-11-22 09:00:25,The mistakes begin from anger and end with regret. Think carefully before acting :)Những sai lầm bắt đầu từ sự tức giận và kết thúc với sự hối tiếc. Suy nghĩ kỹ trước khi diễn :),260,230,19,4,3,2,2,1 bình luậ,579183969524150,/story.php?story_fbid=579183969524150&id=156957931746758,Lưu
Blogtamsu,,2019-11-21 21:00:00,"It's easy for husbands and wife to get together, but it's hard to love and trust each other.",17,15,,,,,2,2 bình luậ,585799755529238,/story.php?story_fbid=585799755529238&id=156957931746758,Lưu
Blogtamsu,,2019-11-21 20:00:58,"In the countryside, there are miracles. People there are always loving, supporting and helping each otherỞ nông thôn có những phép màu. Mọi người luôn yêu thương, ủng hộ và giúp đỡ lẫn nhau",20,16,1,2,,,1,1 bình luậ,586360428806504,/story.php?story_fbid=586360428806504&id=156957931746758,Lưu
Blogtamsu,,2019-11-21 18:00:35,Do good for others. It's will come back to you in unexpected ways.Làm tốt cho người khác. Nó sẽ trở lại với bạn trong những cách bất ngờ.,141,103,2,23,,13,,3 bình luậ,586360208806526,/story.php?story_fbid=586360208806526&id=156957931746758,Lưu
Blogtamsu,,2019-11-21 17:00:03,Don't be because of a small action but misunderstand the purpose of others,35,24,6,3,1,,1,8 bình luậ,586359958806551,/story.php?story_fbid=586359958806551&id=156957931746758,Lưu
Blogtamsu,,2019-11-21 16:30:25,Do not lose your true happiness because of the immediate possessions.,131,118,1,8,3,1,,1 bình luậ,419511025411291,/story.php?story_fbid=419511025411291&id=156957931746758,Lưu
Blogtamsu,,2019-11-21 16:00:03,"The human language is so trivial not one word can describe how revered being the parenthoodNgôn ngữ của con người quá tầm thường, không một từ nào có thể diễn tả được sự tôn trọng của những người được tôn trọng như",23,17,2,4,,,,5 bình luậ,586359102139970,/story.php?story_fbid=586359102139970&id=156957931746758,Lưu
Blogtamsu,,2019-11-21 15:30:02,"Before showing the talent, people should show their moral first",37,25,2,9,1,,,Bình luậ,2482952835280862,/story.php?story_fbid=2482952835280862&id=156957931746758,Lưu
Blogtamsu,,2019-11-21 15:00:45,"Just live well, God will have the arrangement.",80,62,,9,6,1,2,5 bình luậ,586358852139995,/story.php?story_fbid=586358852139995&id=156957931746758,Lưu
Blogtamsu,,2019-11-21 14:30:22,"In this life, anything can happen",65,57,4,1,,3,,Bình luậ,1111309649072959,/story.php?story_fbid=1111309649072959&id=156957931746758,Lưu
Blogtamsu,,2019-11-21 14:00:28,"It's our expression, attitude, perspective and human contact. It's everything that makes us feel warm inside!",56,41,,5,2,7,1,2 bình luậ,586358698806677,/story.php?story_fbid=586358698806677&id=156957931746758,Lưu
Blogtamsu,,2019-11-21 13:00:08,"Don't hearltessly judge other people, because you don't know what they were going through!",47,38,,3,,6,,3 bình luậ,586358508806696,/story.php?story_fbid=586358508806696&id=156957931746758,Lưu
Blogtamsu,,2019-11-21 12:00:49,Thank you for leading us into the forest of knowledge. Thank you for leading us to the sea of love. 💖,19,17,,,,1,1,1 bình luậ,586358382140042,/story.php?story_fbid=586358382140042&id=156957931746758,Lưu
Blogtamsu,,2019-11-21 11:00:58,"Don’t let the immediate things cover your eyes, sometimes what you see and hear are not necessarily the truth",136,100,,2,,12,22,8 bình luậ,586357915473422,/story.php?story_fbid=586357915473422&id=156957931746758,Lưu
Blogtamsu,,2019-11-21 10:00:08,Never lose hope. Good things will come soon.  🌻💗,245,224,1,12,,8,,1 bình luậ,579183366190877,/story.php?story_fbid=579183366190877&id=156957931746758,Lưu
Blogtamsu,,2019-11-21 09:00:19,Never be greedy and ungrateful. Helping others is also help yourself. 💗💕💞👍<3 <3 <3,286,229,,17,,38,2,1 bình luậ,579182886190925,/story.php?story_fbid=579182886190925&id=156957931746758,Lưu
Blogtamsu,,2019-11-20 21:00:01,A stupid woman will sacrifice her all for a man's love.,34,31,,,,3,,2 bình luậ,585798982195982,/story.php?story_fbid=585798982195982&id=156957931746758,Lưu
Blogtamsu,,2019-11-20 18:00:06,You will reap what you sow and your karma is me,116,101,1,6,6,1,1,2 bình luậ,585603332215547,/story.php?story_fbid=585603332215547&id=156957931746758,Lưu
Blogtamsu,,2019-11-20 17:00:39,Mom is the best thing in life! <3,61,48,,,,13,,3 bình luậ,585603072215573,/story.php?story_fbid=585603072215573&id=156957931746758,Lưu
Blogtamsu,,2019-11-20 16:30:21,"We are busy growing up without realizing that our parents are aging, spend more time with your parents when you can",86,66,1,1,1,10,7,1 bình luậ,472101640097015,/story.php?story_fbid=472101640097015&id=156957931746758,Lưu
Blogtamsu,,2019-11-20 16:00:30,Love springs and grows from sincerity and fondness,22,17,5,,,,,1 bình luậ,585601935549020,/story.php?story_fbid=585601935549020&id=156957931746758,Lưu
Blogtamsu,,2019-11-20 15:33:45,I think unconditional love is just a myth only the mom's love that I believe it's not a myth!,89,64,,7,1,16,1,2 bình luậ,1028468954163278,/story.php?story_fbid=1028468954163278&id=156957931746758,Lưu
Blogtamsu,,2019-11-20 15:00:24,Father can cary the heavy burden of life for you. Don't think of fahter as a burden when he gets old,24,20,,4,,,,1 bình luậ,585601698882377,/story.php?story_fbid=585601698882377&id=156957931746758,Lưu
Blogtamsu,,2019-11-20 14:30:37,"In any relationship, if you use your heart to love someone, you will get that person's heart back",68,60,,6,1,,1,Bình luậ,450427062326222,/story.php?story_fbid=450427062326222&id=156957931746758,Lưu
Blogtamsu,,2019-11-20 14:00:51,Everything needs to be heard from both sides. Do not just because of one-sided words that disrupt family happinessMọi thứ đều cần được nghe từ cả hai bên. Đừng chỉ vì lời nói bên phá vỡ hạnh phúc gia đình,33,23,7,1,,,2,4 bình luậ,585601422215738,/story.php?story_fbid=585601422215738&id=156957931746758,Lưu
Blogtamsu,,2019-11-20 12:00:10,Any amount of fotune would turn to dust if we only spend without earning,27,23,,2,,2,,2 bình luậ,585600682215812,/story.php?story_fbid=585600682215812&id=156957931746758,Lưu
Blogtamsu,,2019-11-20 11:00:39,Never be satisfied with what you have. That is the biggest fault of the human,39,33,5,1,,,,1 bình luậ,585600385549175,/story.php?story_fbid=585600385549175&id=156957931746758,Lưu
Blogtamsu,,2019-11-20 10:00:26,All dreams can come true as long as we are determined and live our best with it,175,141,4,14,12,3,1,5 bình luậ,579177556191458,/story.php?story_fbid=579177556191458&id=156957931746758,Lưu
Blogtamsu,,2019-11-20 09:00:41,You'll receive the fruits back if you do nothing wrong. 🙂Bạn sẽ nhận lại trái cây nếu bạn không làm gì sai. 🙂,80,77,,3,,,,1 bình luậ,579177166191497,/story.php?story_fbid=579177166191497&id=156957931746758,Lưu
Blogtamsu,,2019-11-19 21:00:01,Think of poor people whenever squandering your money.  😌😌,164,147,9,2,4,,2,8 bình luậ,582317939210753,/story.php?story_fbid=582317939210753&id=156957931746758,Lưu
Blogtamsu,,2019-11-19 19:00:16,"What is done by night, appear by day. If you don't wan't people to know what you do, it's best not to do it.",83,71,9,1,1,1,,5 bình luậ,584768792299001,/story.php?story_fbid=584768792299001&id=156957931746758,Lưu
Blogtamsu,,2019-11-19 17:00:45,"If everyone only thinks about their own benefits, good things will become less and less",42,34,1,1,1,4,1,2 bình luậ,584768458965701,/story.php?story_fbid=584768458965701&id=156957931746758,Lưu
Blogtamsu,,2019-11-19 16:30:08,"Girls, love wisely so you will not have to meet a mother-in-law like the one in the video you just watched",95,80,,9,,4,2,5 bình luậ,468940147081803,/story.php?story_fbid=468940147081803&id=156957931746758,Lưu
Blogtamsu,,2019-11-19 16:00:29,Every child is a child. Don't distinguish between one from another by their backgroundsMỗi đứa trẻ đều là một đứa trẻ. Đừng phân biệt một người khác bởi nền tảng của họ,36,28,,1,1,4,2,4 bình luậ,584768202299060,/story.php?story_fbid=584768202299060&id=156957931746758,Lưu
Blogtamsu,,2019-11-19 15:30:45,We cannot judge other people's works or look down on them by their appearance,96,76,2,10,1,7,,Bình luậ,823506101439811,/story.php?story_fbid=823506101439811&id=156957931746758,Lưu
Blogtamsu,,2019-11-19 15:00:25,One of the happiest moments ever is when you find your parents.,171,140,1,11,2,17,,4 bình luậ,584767568965790,/story.php?story_fbid=584767568965790&id=156957931746758,Lưu
Blogtamsu,,2019-11-19 14:30:19,"As a mother-in-law, don't distinguish daughter-in-law and daughter",618,537,15,9,3,9,45,9 bình luậ,2635886269971906,/story.php?story_fbid=2635886269971906&id=156957931746758,Lưu
Blogtamsu,,2019-11-19 14:00:09,"Only our parents will love us unconditionally, but this world only loves you with conditions!",31,23,,,1,6,1,1 bình luậ,584767405632473,/story.php?story_fbid=584767405632473&id=156957931746758,Lưu
Blogtamsu,,2019-11-19 13:00:50,"Love and happiness are like you plant a tree. If you want the tree to grow well, you must take care of it carefully.",121,102,1,9,1,6,2,8 bình luậ,584767198965827,/story.php?story_fbid=584767198965827&id=156957931746758,Lưu
Blogtamsu,,2019-11-19 12:00:35,Know more before judging others. Don't judge a book by its cover.,20,19,,1,,,,1 bình luậ,584767002299180,/story.php?story_fbid=584767002299180&id=156957931746758,Lưu
Blogtamsu,,2019-11-19 11:00:12,"Don't let her down, okay? If your mother is still alive, don't let her cry!",65,52,,1,1,7,4,5 bình luậ,584766825632531,/story.php?story_fbid=584766825632531&id=156957931746758,Lưu
Blogtamsu,,2019-11-19 10:00:02,Let's give and you will get what you deserve <3,50,48,,1,,1,,1 bình luậ,575264569916090,/story.php?story_fbid=575264569916090&id=156957931746758,Lưu
Blogtamsu,,2019-11-19 09:00:15,The most important thing a father can do for his children is to love their mother. <3,156,128,,15,,11,2,7 bình luậ,575264159916131,/story.php?story_fbid=575264159916131&id=156957931746758,Lưu
Blogtamsu,,2019-11-18 21:00:00,"Mother's house may not be spacious, but there's definitely enough love in it. <3",12,12,,,,,,1 bình luậ,582317485877465,/story.php?story_fbid=582317485877465&id=156957931746758,Lưu
Blogtamsu,,2019-11-18 20:00:28,Being honest is the most important thing in a relationship <3,57,48,3,5,1,,,2 bình luậ,583986892377191,/story.php?story_fbid=583986892377191&id=156957931746758,Lưu
Blogtamsu,,2019-11-18 17:00:18,You have to work to earn your living. Those who are just waiting for the money to come to them freely will suffer from the consequence for it someday,28,21,3,,1,1,2,1 bình luậ,583986195710594,/story.php?story_fbid=583986195710594&id=156957931746758,Lưu
Blogtamsu,,2019-11-18 16:30:45,A stupid man is the one who sabotages his marriage :),183,163,,11,5,1,3,3 bình luậ,444921716210267,/story.php?story_fbid=444921716210267&id=156957931746758,Lưu
