source,shared_from,date,text,reactions,likes,ahah,love,wow,sigh,grrr,comments,post_id,url,share
Thỏ Bảy Màu,,2019-11-27 21:35:40,Alo mọi người ơi. Hành trình bóc lịch của Thỏ nay đã đến với 2 nhà sách siêu bự là FAHASA và PHƯƠNG NAM trên toàn quốc rồi nhe. Mọi người có thể ra và mua về bóc lịch với em. Còn ai lười thì lại order qua link phía dưới nhóe <3,"1,6K","1,2K",228,179,16,13,4,188 bình luậ,2977329705610987,/story.php?story_fbid=2977329705610987&id=932903660053612,Lưu
Thỏ Bảy Màu,,2019-11-26 18:46:07,"Tuy không sinh cùng ngày cùng tháng cùng năm, nhưng anh nguyện chết cùng ngày cùng năm cùng tháng ._.",21K,"9,2K",10K,158,64,"1,4K",2,642 bình luậ,2974618202548804,/story.php?story_fbid=2974618202548804&id=932903660053612,Lưu
Thỏ Bảy Màu,,2019-11-25 20:32:46,"Nếu các người thành tâm muốn biết, tao chia sẻ bí kíp tình iu bảo hành trọn đời, chỉ  được áp dụng 1 lần trước khi nhiều lần nữa .-.  #TroiSinhMotCap #BiKipBenNhau","Thỏ Bảy Màu và 6,2K người khác","3,6K","2,3K",196,16,44,3,268 bình luậ,2972378222772802,/story.php?story_fbid=2972378222772802&id=932903660053612,Lưu
Thỏ Bảy Màu,,2019-11-24 18:46:32,"Năm sắp hết tết sắp đến ._. Em và lương tâm ngồi lại tâm sự với nhau cả đêm, thấy cả năm chỉ đi tạo nghiệp làm cho liêm sỉ cạn vơi, nhân phẩm hao mòn. Nên quyết định cuối năm nay sẽ đi bóc lịch để phục hồi nhân phẩm. Lịch này là tự tay em vẽ, không cần mặc đồng phục vẫn có thể bóc mỗi tháng một tờ tại nhà mà hiệu quả giải nghiệp vẫn siêu to khổng lồ, bên trong lại còn có sticker Thỏ cute và chữ ký của anh tác giả cho 500 bản đầu tiên :"">  Mọi người hãy zo ủng hộ em mỗi người một cuốn ngồi bóc hết năm để cùng nhau phục hồi nhân phẩm nhóe Link đặt hàng: http://bit.ly/2KNw0Wv",Thỏ Bảy Màu và 13K người khác,10K,833,"1,4K",46,27,3,502 bình luậ,2969691246374833,/story.php?story_fbid=2969691246374833&id=932903660053612,Lưu
"Thỏ Bảy Màu,Warrior Vietnam",,2019-11-22 20:47:48,"Đứa nào rớt môn đi theo tao #vudieutangluc #Warrior  #QuaRiO #03BaWarrior🔥 [Kiểm tra 60' - Môn “dẩy đầm” phối hợp hát karaoke] 🔥 Các con ngoan, trò giỏi đâu bay vô đây!  20/11, Qua-Ri-Ơ tặng riêng anh em chiếc clip 1 tiếng để tập...",Thỏ Bảy Màu và 12K người khác,"9,2K","2,8K",66,16,279,2,251 bình luậ,2964919403518684,/story.php?story_fbid=2964919403518684&id=932903660053612,Lưu
Thỏ Bảy Màu,,2019-11-22 17:41:14,Tột đỉnh của sự giận dỗi >:|,Thỏ Bảy Màu và 44K người khác,24K,17K,369,71,"1,2K",39,925 bình luậ,2964552960221995,/story.php?story_fbid=2964552960221995&id=932903660053612,Lưu
"Thỏ Bảy Màu,7UP",,2019-11-21 19:47:13,"Nhanh tay nhất cái Động Thỏ rồi mà vẫn ko lấy được code :<  Các bạn sống chậm thôi ._. #7UP #thanhmatvichanh #monngonbungvi[MINIGAME] 7UP THANH MÁT VỊ CHANH, MÓN NGON BỪNG VỊ  Muốn sang phải bắc cầu kiều, món ngon phải có 7UP cạnh bên đây này. 7Uppers ơi, 7Uppers ơi, tham gia thử...",18K,12K,"5,7K",69,23,424,5,226 bình luậ,2962404233770201,/story.php?story_fbid=2962404233770201&id=932903660053612,Lưu
Thỏ Bảy Màu,,2019-11-20 21:27:16,Mày nhìn tao nè thằng lol ._.,17K,10K,"6,4K",83,24,841,4,382 bình luậ,2960049530672338,/story.php?story_fbid=2960049530672338&id=932903660053612,Lưu
Thỏ Bảy Màu,,2019-11-20 19:16:27,Lớp nào nhiều tình cảm nhất thì mình về lớp đó thôi :3 #PocaVietnam,Thỏ Bảy Màu và 10K người khác,"5,3K","4,3K",249,26,95,7,395 bình luậ,2959780140699277,/story.php?story_fbid=2959780140699277&id=932903660053612,Lưu
Thỏ Bảy Màu,,2019-11-18 21:20:39,Nếu mày đã muốn vậy thì để tao hốt mày ._. #Juno #Black_Friday #Siêu_sale #All_Items,11K,"6,7K","4,1K",77,21,290,7,296 bình luậ,2955453471131944,/story.php?story_fbid=2955453471131944&id=932903660053612,Lưu
Thỏ Bảy Màu,,2019-11-18 20:18:50,Lần đầu em đến nhà gái chơi ._.,Thỏ Bảy Màu và 20K người khác,10K,"9,4K",67,34,922,12,552 bình luậ,2955326197811338,/story.php?story_fbid=2955326197811338&id=932903660053612,Lưu
Thỏ Bảy Màu,,2019-11-15 21:19:49,Tag đứa 1 ngày đi ỉa 80 lần vào đây,Thỏ Bảy Màu và 15K người khác,10K,"4,9K",75,28,482,30,2.425 bình luậ,2947964395214185,/story.php?story_fbid=2947964395214185&id=932903660053612,Lưu
Thỏ Bảy Màu,,2019-11-15 19:03:41,Con chim sao mày lừa tao ._.  #FlySQ  #visitsingapore,Thỏ Bảy Màu và 11K người khác,6K,"5,3K",57,21,269,3,339 bình luậ,2947691205241504,/story.php?story_fbid=2947691205241504&id=932903660053612,Lưu
Thỏ Bảy Màu,,2019-11-14 17:59:10,Tui 0 - 1 Crush,Thỏ Bảy Màu và 18K người khác,10K,"6,8K",161,46,"1,2K",18,689 bình luậ,2945267812150510,/story.php?story_fbid=2945267812150510&id=932903660053612,Lưu
Thỏ Bảy Màu,,2019-11-11 20:05:27,"Em à,",Thỏ Bảy Màu và 23K người khác,12K,"9,7K",96,78,1K,55,784 bình luậ,2938465702830721,/story.php?story_fbid=2938465702830721&id=932903660053612,Lưu
Thỏ Bảy Màu,,2019-11-10 17:45:26,Tag đứa tụi bây muốn chửi vào đây. Tao bảo kê ._.,"Thỏ Bảy Màu và 8,8K người khác","5,7K","2,7K",51,18,194,8,864 bình luậ,2935899996420625,/story.php?story_fbid=2935899996420625&id=932903660053612,Lưu
Thỏ Bảy Màu,,2019-11-10 11:30:49,"Lời nói không mất tiền mua, lựa lời mà nói cho đừng bị xiên ._. #vivoY19 #GiáGhiBàn #SaleTungLưới",Thỏ Bảy Màu và 14K người khác,"8,4K","5,2K",55,18,419,11,304 bình luậ,2935361123141179,/story.php?story_fbid=2935361123141179&id=932903660053612,Lưu
Thỏ Bảy Màu,,2019-11-09 19:06:41,Đã nghèo mà lại còn gáy nữa ._. #ViettelStore #Samsung #11_11,Thỏ Bảy Màu và 13K người khác,"9,9K",3K,52,21,353,6,253 bình luậ,2933618699982088,/story.php?story_fbid=2933618699982088&id=932903660053612,Lưu
Thỏ Bảy Màu,,2019-11-08 21:03:23,Haiz ._.,Thỏ Bảy Màu và 21K người khác,13K,"4,9K",357,91,"2,2K",12,822 bình luậ,2931451500198808,/story.php?story_fbid=2931451500198808&id=932903660053612,Lưu
Thỏ Bảy Màu,,2019-11-08 11:03:12,Rồi viên nào cho tao? ._.,Nguyễn Ngọc Thạch và 14K người khác,"8,7K",5K,72,21,371,6,354 bình luậ,2930549440289014,/story.php?story_fbid=2930549440289014&id=932903660053612,Lưu
Thỏ Bảy Màu,,2019-11-07 20:00:23,Trái tim này em chỉ dành cho mình anh... và các bạn like hình này nữa :3 #thegioiskinfood #singlesdaysale,Thỏ Bảy Màu và 10K người khác,"5,9K","3,9K",131,24,244,9,356 bình luậ,2929072433770048,/story.php?story_fbid=2929072433770048&id=932903660053612,Lưu
Thỏ Bảy Màu,,2019-11-06 21:19:30,Cực kỳ thuyết phục,18K,"9,3K",8K,71,41,659,14,647 bình luậ,2926943060649652,/story.php?story_fbid=2926943060649652&id=932903660053612,Lưu
Thỏ Bảy Màu,,2019-11-06 09:52:55,"Đau chim quá, hãy bấm like để cứu em :<",Thỏ Bảy Màu và 12K người khác,8K,"4,2K",403,45,181,9,496 bình luậ,2925963020747656,/story.php?story_fbid=2925963020747656&id=932903660053612,Lưu
Thỏ Bảy Màu,,2019-11-05 20:15:42,"Đồ ăn có thể giảm giá, nhưng Thỏ vẫn biết cách giữ giá nè ❤   #TrumCuoiBAEMIN",10K,"5,9K","3,9K",78,23,286,2,437 bình luậ,2924526044224687,/story.php?story_fbid=2924526044224687&id=932903660053612,Lưu
