source,shared_from,date,text,reactions,likes,ahah,love,wow,sigh,grrr,comments,post_id,url
Muvik,,2019-08-08 23:00:01,"10 LỢI ÍCH CỦA KHÔNG CÓ NGƯỜI YÊU... 1. Không có người yêu, không phải thức khuya nhắn tin, ngủ sớm thì dáng ngon, da đẹp,... 2. Không có người yêu, được sống là chính mình. Cắt kiểu tóc tomboy thích, mặc kiểu áo mình ưa, ăn món ăn mình muốn. 3. Không có người yêu, không phải đau đầu nghĩ xem anh ấy có yêu em không? Không phải đau đầu suy diễn/suy đoán/suy nghĩ xem tại sao người ấy online mà không nhắn tin với mình, họ làm gì trong lúc đó, rồi từ đó mà cãi nhau. 4. Không có người yêu, không phải thất hẹn với người này để đúng hẹn vs ny, không phải lí do bận rộn để không rep ib người khác, để rep ib ny cho kịp. Không sợ làm ai buồn. 5. Không có người yêu, mình là tỉ phú thời gian của chính mình. Có thời gian để làm đẹp, để dành cho sở thích của em, để kiếm tiền, để đi du lịch. 6. Không có người yêu, em có thời gian để nối lại những mối quan hệ cũ tưởng đã phai màu vì sự vô tâm của mình, em có thời gian để quan tâm nhiều hơn đối vs gia đình, biết được nhiều giá trị trong cuộc sống... khi một mình. Trước kia, người ấy là trung tâm trong thế giới của mình, còn giờ mình làm chủ thế giới riêng. 7. Không có người yêu, không phải lo chuyện ghen tuông, hay bị ghen tuông. Không phải báo cáo là mình đi đâu, đi vs ai, về chưa, người đi cùng mình có mqh như thế nào với mình. 8. Không có người yêu, không phải tốn nước bọt hỏi ""Anh có yêu/nhớ em không? "", không phải rón rén e dè sợ mất, em không phải im lặng, không phải sống trong nỗi lo sợ, nỗi buồn triền miên vì sự vô tâm của người mình yêu. 9. Không có người yêu, không cần phải giải thích về những hành động của mình. Em thoải mái đăng ảnh thả thính, thoải mái tán gẫu, thậm chí là thoải mái chọn ""đôi giày phù hợp"" với mình. 10. Điều cuối cùng, khi không có người yêu, thì có người yêu lúc nào cũng được.",1K,852,145,30,2,4,,153 bình luậ,2326456637391453,/story.php?story_fbid=2326456637391453&id=989970697706727
Muvik,,2019-08-08 22:15:00,Lạ lùng em tới... Hãy tới bên anh trong chiều đông xa vắng Mà sao giờ đây nhìn lại chẳng còn thấy em ... Lạ lùng - Vũ.,273,254,7,12,,,,79 bình luậ,2326525204051263,/story.php?story_fbid=2326525204051263&id=989970697706727
Muvik,,2019-08-08 22:00:01,Chưa có chiêu nào là chưa trải qua T.T,942,710,207,9,1,15,,243 bình luậ,2326456014058182,/story.php?story_fbid=2326456014058182&id=989970697706727
Muvik,,2019-08-08 21:40:00,Ai còn nhớ nick Yahoo của mình không?,77,63,12,1,,1,,17 bình luậ,2326484390722011,/story.php?story_fbid=2326484390722011&id=989970697706727
Muvik,,2019-08-08 21:30:00,Không có tháng nào là cái vòng tuần hoàn này nó không lặp lại.,334,262,65,,,7,,40 bình luậ,2326461264057657,/story.php?story_fbid=2326461264057657&id=989970697706727
Muvik,,2019-08-08 21:15:00,"Gặp em từ thể đơn bào, rồi tiến hoá Xa em từ khi thềm lục địa đầy biến hoá Muốn được ôm em qua kỷ Ju-ra Hoá thạch cùng nhau trên những phiến đá (phá đá cùng nhau) Rồi loài người tìm thấy lửa, anh lại tìm thấy em Anh tưởng rằng mọi thứ sẽ được bùng cháy lên Muốn được cùng em, trồng rau bên hồ cá Nhưng tim em lúc đó, đang là thời kì đồ đá Anh đã tin vào em như tin vào thuyết nhật tâm Như Ga-li-lê người ta nói anh thật hâm Có lẽ Đác-win biết biển cả sẽ khô hơn Nhưng anh tin ông ta không biết chúng ta đang tiến hoá để cô đơn (tiến hoá để cô đơn) Và có lẽ Đác-win biết biển cả sẽ khô hơn Nhưng anh tin ông ta không biết chúng ta đang tiến hoá để cô đơn (tiến hoá để cô đơn)",211,194,13,4,,,,53 bình luậ,2326549037382213,/story.php?story_fbid=2326549037382213&id=989970697706727
Muvik,,2019-08-08 21:00:02,"Ai chưa có gấu thì tìm cách cải thiện tình hình ngay, nhất là mấy người sinh 3 tháng 8, 9, 10 nhá!",1K,843,153,8,6,7,1,314 bình luậ,2326455174058266,/story.php?story_fbid=2326455174058266&id=989970697706727
Muvik,,2019-08-08 20:30:01,Tuyệt đỉnh hạnh phúc !  Có ai đang ... không ?,112,78,32,2,,,,3 bình luậ,2326460547391062,/story.php?story_fbid=2326460547391062&id=989970697706727
Muvik,,2019-08-08 20:00:02,"""Người mơ xa xôi người mơ người có xe hơi nhà lầu  Ta mơ tìm được ra người gắn bó hơi thở cả đời cho nhau"" - Hôm nay sao tôi cô đơn quá - Tóc Tiên ft. Rhymastic",61,60,,1,,,,6 bình luậ,2326566924047091,/story.php?story_fbid=2326566924047091&id=989970697706727
Muvik,,2019-08-08 20:00:01,"ĐÁM CƯỚI Ở VIỆT NAM... ----------------------- - Thiệp mời ghi 5h chiều, nhưng nếu đúng 5h mình tới thì có khi tới sớm hơn cả cô dâu, chú rể. Có người rút kinh nghiệm tới tầm ... 8h tối, bắt đầu ăn thì mới vô ăn luôn cho gọn. - Tiền mừng cũng là việc nhức đầu để lo, đi một mình thì bỏ tiền nhiều quá sẽ tiếc, bỏ ít quá thì ngại, đi hai người thì lại có khi đi như chỉ một người. Có người còn lật cuốn sổ ra coi luôn là lần trước đứa mời mình đi bao nhiêu để mình đi lại cho đúng, không tính trượt giá. - Đi đám cưới nhưng nhiều chị em mặc đồ nổi hơn cả cô dâu. Có chị mặc cả cái đầm cam hai ba tầng, trong khi cô dâu mặc màu trắng đơn giản. Có người trang điểm đậm như kinh kịch bên Tàu, có người thì mặc đầm xuyên thấu thấy hết cả nội y. - Dresscode là thứ ít ai quan tâm, có chị còn mặc cả cái áo đầm màu đen có trang trí thêm các mảng màu trắng lẫn tím. - Ít có tiệc nào có đủ người hướng dẫn để khách biết phải ngồi đâu. Nên thành ra có mấy bàn chỉ có bốn năm người ngồi nhưng nhất quyết không dồn lại vì chả quen biết gì nhau. - Dẫn theo con nít đi ăn tiệc nhưng ít để ý kiểm soát con mình, có khi đang làm lễ thì đứa con khóc ré lên, phiền bên trên. Hay có tiệc đứa trẻ chạy chơi vấp té, va đầu vào thành sân khấu phải đi cấp cứu. - Có tiệc thì lại chẳng để ý đến đồ ăn, đãi những món lẩu nặng mùi như cá măng chua, mấy mươi cái lẩu trong không gian kín, ăn xong người ai cũng bốc mùi. - Đi ăn tiệc có khi lại chê đồ ăn dở, có khi ăn tiệc cưới của khách sạn năm sao, mỗi món chỉ dọn lên một phần nhỏ thì chê ăn không no, phí tiền đi. - Cô dâu chú rể đi chào bạn đến tội nghiệp, cô dâu vác cái áo cưới dài thậm thượt đi chào cả trăm bàn, có khi còn chẳng quen biết ai trong bàn đấy nhưng vẫn cứ chào. - Có nhiều anh coi tiệc cưới như bữa nhậu bia chùa, nên uống sống uống chết, đến khi say thì kiếm chuyện cãi nhau, có tiệc đánh nhau tới phang cả chai bia vào đầu chú rể, tung tóe máu đi viện. - Có mấy chú thì cứ say vào là phải lên ca hát nhảy múa, nhưng toàn ca nhạc kỳ cục. Có lúc thì ca bản ""Đồi thông hai mộ"", sung hơn thì năm bảy ông kéo lên rồi hát ""Năm anh em trên một chiếc xe tăng."" - Đám cưới về, lại bắt đầu mở sổ ra ghi lại coi ai đã đi bao nhiêu, để sau này nó có mời thì mình đi lại cho khỏi... lỗ. Nguồn: Nguyễn Ngọc Thạch",102,84,14,4,,,,9 bình luậ,2326454470725003,/story.php?story_fbid=2326454470725003&id=989970697706727
Muvik,,2019-08-08 19:30:01,Tháng 7 với tháng 11 là có sức khỏe tốt lắm hen?,"2,5K",2K,454,58,12,39,15,1.052 bình luậ,2326459844057799,/story.php?story_fbid=2326459844057799&id=989970697706727
Muvik,,2019-08-08 19:00:01,"Admin mới nghe bài Thắc Mắc của Thịnh Suy thôi, còn bạn thì sao?",68,67,,1,,,,1 bình luậ,2326562530714197,/story.php?story_fbid=2326562530714197&id=989970697706727
Muvik,,2019-08-08 19:00:00,"Khi bạn trai là người thiếu tinh tế? 1. Đưa chàng về nhà ăn cơm, bố lôi ra một chai rượu, cười xởi lởi bảo: Cháu uống tự nhiên như ở nhà nhé. Chàng đáp: Cháu mà tự nhiên như ở nhà thì chai này đi ngay trong một nốt nhạc. 2. Tôi giả vờ khen: Bạn gái cũ của anh xinh nhỉ? Hắn đáp: Em đừng để tâm mấy cái đó, giờ với anh xinh hay xấu không quan trọng nữa. 3. Đi chợ đêm, tôi mặc cả: Cháu còn mỗi 90k thôi, chú để cho cháu đi mà. Chủ quán lưỡng lự một hồi, đang định gật đầu thì hắn ở sau lưng xen vào: Anh vẫn còn tiền nè em. 4. Bị đứa lớp bên bắt nạt, về mách anh người yêu. Anh ta nóng mặt quát: Láo thật! Đánh chó phải ngó mặt chủ chớ! 5. Đưa hắn về nhà chơi, hắn thấy bà ngoại đang coi TV một mình bèn chạy lại hỏi han: Ông đâu rồi hả bả? Bà tôi móm mém cười bảo: Ông đi đến một nơi rất xa rồi. Thực ra ông tôi mất đã lâu. Không ngờ hắn hồn nhiên hỏi tiếp: Sao bà không đi theo ông ạ? 6. Anh cầm tay em có được không? Thánh thần thiên địa ơi, muốn cầm thì cầm đi, chẳng lẽ phải để tôi nhắc đến bước nắm tay rồi đó sao? 7. Mẹ tôi hỏi hắn có hút thuốc không, hắn lắc đầu quầy quậy. Mẹ hài lòng lắm, bèn kể thêm là ông tôi hút thuốc nhiều, phổi rỗ như tổ ong. Hắn tiếp lời như này đây: Vậy ông chết chưa ạ? 8. - Em giận à? - Không. - Vậy thì tốt. 9. Tôi hỏi: Tết năm nay anh hi vọng bất ngờ gì sẽ hiện diện trong bữa cơm tất niên? Ý tôi là muốn hắn đưa tôi về ra mắt bố mẹ. Kết cục hắn phang cho câu: Giò lụa. 10. Sau khi chơi tàu lượn trên không xong, tôi ôm bụng nôn thốc nôn tháo, hắn vừa xoa lưng cho tôi vừa trầm trồ: Trưa nay em ăn nhiều loại hoa quả nhỉ! 11. Trong lúc điên tiết, tôi hét vào di động: Đừng có liên lạc với tôi nữa! Kết quả mấy hôm liền hắn im thin thít và lặn mất tăm thật. Cực chẳng đã, tôi đành gọi cho hắn: Ý anh là như thế nào? Hắn mới thật thà phân bua: Em không cho anh liên lạc trước mà, anh đâu dám trái lời em. 12. - Mai đi xem phim với mình nhé? - Okie. - Không ngờ cậu dễ rủ thật. 13. - Anh đang làm gì đấy. - Chơi Game. - Vậy à. Vậy anh chơi tiếp đi. - Ừ. ...Thật chỉ muốn lao vào đập tan máy tính của hắn. 14. - Đôi giày này xinh anh nhỉ? - Em thích là được. - Em muốn cắt tóc ngắn?! - Em thích là được. - Em muốn đi chơi?! - Em thích là được. - Em giận thật đấy!! - Em thích là được. - Em muốn chia tay!!! - Em thích là được. 15. - Trưa nay anh mời em đi ăn cơm nhé. - Để hôm khác đi. - Ừ thế anh đi ăn đây. ... Sao không rủ thêm một câu nữa chứ?! 16. Lần đầu tiên hôn nhau, hắn cười bảo: Em nhận ra vị trí cái răng giả của anh không? Tôi nghĩ thầm trong bụng Sao hỏi câu ngốc thế không biết nhưng vẫn nhỏ nhẹ lắc đầu. Hắn bèn trợn mắt kinh ngạc: Thật á? Không thể nào! Bạn gái cũ của anh nhận ra ngay mà! Đã chia tay. 17. Thú thật thì nói chuyện với Siri còn thú vị hơn nói chuyện với hắn. 18. Ngồi học ở thư viện, bất ngờ nhận được mẩu giấy của chàng trai đối diện: Mấy tuần nay mình đều thấy bạn, chúng mình làm quen nhé! Ngẩng lên thấy tai anh ta đỏ ửng, nhìn cũng dễ thương, tôi bèn thu dọn sách vở, đến bên anh ta bảo: Mình về đây, cậu có muốn về cùng không? Ai ngờ hắn đáp: Cậu về trước đi, mình còn bài này chưa làm xong. 19. - Em lạnh quá. - May mà anh mặc áo lót giữ ấm, chẳng lạnh tí nào. 20. - Đêm qua 2h em mới ngủ. - Thế à, anh thì 3h. ... Tôi thèm so xem ai ngủ muộn hơn với nhà anh đấy à? Anh cũng không buồn quan tâm có chuyện gì buồn phiền làm tôi ngủ muộn thế? 21. - Làm thế nào để tỏ tình với chàng trai mình thích? - Thì cứ thẳng thắn nói ra thôi. - Mình thích cậu. - Đúng rồi đó. ... Thật đúng là, muốn lãng mạn tí cũng không được, đành phải banh lỗ tai hắn ra mà hét vào: Là cậu đó, người tôi thích là cậu đó! 22. - Nếu em bằng lòng cùng anh cày game mỗi ngày, anh sẽ thành bạn trai của em chứ? - Em lên level mấy rồi? 23. Từ lúc quen hắn, tôi chợt nhận ra mình có khả năng kiềm chế cảm xúc vô cùng tuyệt vời, dường như có đủ sức mạnh để bao dung tha thứ cho cả nhân loại vậy. 24. - Nếu em và mẹ anh rơi xuống sông cùng lúc, anh sẽ cứu ai? - Mẹ anh biết bơi, mẹ sẽ cứu em lên. - Không, bắt buộc anh phải nhảy xuống cơ! - Thế thì em chết chắc rồi, vì anh không biết bơi, mẹ nhất định sẽ cứu anh trước. Nguồn: Weibo - Dịch: Kiem Duong",218,169,43,2,1,2,1,17 bình luậ,2326453644058419,/story.php?story_fbid=2326453644058419&id=989970697706727
Muvik,,2019-08-08 18:30:00,"Một nụ cười luôn hé, Thế Giới vẫn quay Còn tôi vẫn nơi đây, đưa bàn tay lên trời xanh, ôm trọn vào lòng Một khoảng trời nhỏ bé, giữa những khát khao Cơ mà chỉ tôi với riêng tôi, đêm nằm nghe Một bài ca, về Tình Yêu, ôi chán ngán. Lang thang một mình, cũng chẳng làm sao Bao nhiêu lâu nay tôi đã quen rồi, quen rồi, quen một mình như thế Yêu thêm một người, có chắc là mình sẽ good lên, hay là chỉ thêm đau đầu? Forever Alone",122,116,5,1,,,,21 bình luậ,2326529064050877,/story.php?story_fbid=2326529064050877&id=989970697706727
Muvik,,2019-08-08 18:02:00,Bạn biết ai cần thì giới thiệu cho nó đi.,411,292,114,1,1,3,,125 bình luậ,2326445274059256,/story.php?story_fbid=2326445274059256&id=989970697706727
