source,shared_from,date,text,reactions,likes,ahah,love,wow,sigh,grrr,comments,post_id,url
POPS Kids,,2019-10-05 21:00:09,"Oops, một pha thám tử mất balance cho Trường Giang, Hứa Minh Đạt rồi :v  Còn có bất ngờ nào hơn :v  Link: https://youtu.be/fAYtVnjGM_w  Cre: POPS TV VIETNAM  #POPSKids #POPSTVVIETNAM #haikich #TruongGiang #HuaMinhDat #nqn",31,26,5,,,,,Bình luậ,1371014066395272,/story.php?story_fbid=1371014066395272&id=178475505649140
POPS Kids,,2019-10-05 20:00:01,Cả nhà ai đã nghe qua món Gà Không Lối Thoát chưa!? Thật ra món đó còn được gọi là Gà Bó Xôi đó ;) Mời cả nhà cùng xem cách để làm món Gà Không Lối Thoát sao cho thật ngon nhé: https://youtu.be/L8xfd_BLq0s #POPSKids #BepCoMinh #Jaian,6,6,,,,,,Bình luậ,1370591043104241,/story.php?story_fbid=1370591043104241&id=178475505649140
POPS Kids,,2019-10-05 19:30:19,Lần đầu Louis được mẹ dắt đi gặp bồ câu đông vậy đó hơi choáng ngợp chăng 😂  Link: https://youtu.be/qlaeJxyS1xE  Cre: Lime Entertainments  #POPSKids #LimeEntertainments #condentuhanhtinhnao #cdthtn #giadinhNgocLan #Louis #nqn,9,8,1,,,,,Bình luậ,1371012333062112,/story.php?story_fbid=1371012333062112&id=178475505649140
POPS Kids,,2019-10-05 18:00:01,"Đây là quán hủ tiếu da heo xoắn mang đậm phong cách hủ tiếu gõ Sài Gòn nằm ở bờ kè đường Nam Kỳ Khởi Nghĩa, quận 3. Chiếc xe đẩy cũ kỹ có món độc đáo hủ tiếu da héo xoắn mà chị Diễm đã bán được gần 30 năm theo nắng mưa của Sài Gòn. Chị bán từ 15h chiều đến 23h đêm hàng ngày và khách đến có thể ngồi ở trong con hẻm nhỏ để thưởng thức. Mỗi phần hủ tiếu da heo xoắn của chị Diễm bán với giá 15k/tô, ngoài ra khách có thể kêu thêm chén da heo xoắn, giá khá mềm 10k. Nếu có dịp lang thang Sài gòn bạn nhớ ghé đến quán chị Diễm để thưởng thức món hủ tiếu gõ da heo xoắn, đảm bảo sẽ mê luôn <3  Link: https://youtu.be/ArlcwZjD9zU  Cre: Ẩm Thực và Du Lịch #POPSKids #amthucvadulich #hutieudaheoxoan #nqn",44,44,,,,,,1 bình luậ,1364998563663489,/story.php?story_fbid=1364998563663489&id=178475505649140
POPS Kids,,2019-10-05 17:00:01,Mời cả nhà cùng xem cách làm món Cá Lau Kinh và Ốc Bưu Hấp Sả cực ngon và lạ nè ;) Chuẩn bị bữa ăn tụ họp cuối tuần tại đây nha: https://youtu.be/vLvOsBA6fno #POPSKids #DanDaMienTay #Jaian,19,17,,1,,,1,1 bình luậ,1370592389770773,/story.php?story_fbid=1370592389770773&id=178475505649140
POPS Kids,,2019-10-05 16:00:00,"Trời ơi tin được không, Tom & Jerry biến thù thành bạn nè.😱 - Xem full clip tại: https://youtu.be/ha2RA3P8r4c #POPSKids #TomandJerry #Hoathinhtiengviet #BoomerangVN #Jaian",28,22,5,1,,,,Bình luậ,1370917286404950,/story.php?story_fbid=1370917286404950&id=178475505649140
POPS Kids,,2019-10-05 15:00:49,"Tom & Jerry ngoài đời thật chắc ít gì cũng là rich kid. Ăn chơi đập phá suốt ngày, giờ còn chơi hàng độc lấy cầu lửa ra làm bóng chuyền 🙄🙄 - Xem full clip tại: https://youtu.be/O9NadLI_D3s #POPSKids #TomandJerry #Hoathinhtiengviet #BoomerangVN #Jaian",44,37,5,2,,,,Bình luậ,1370917803071565,/story.php?story_fbid=1370917803071565&id=178475505649140
POPS Kids,,2019-10-05 14:00:22,Kẻ thù gì mà gặp hoài hoài luôn á. Cứ bám riết theo là sao vậy ta == - Xem full clip tại: https://youtu.be/dU9ejSVUfP8 #POPSKids #Boomerang #Ben10 #Ben10Omniverse #Jaian,5,5,,,,,,Bình luậ,1370917586404920,/story.php?story_fbid=1370917586404920&id=178475505649140
POPS Kids,,2019-10-05 13:00:01,Nuôi cua đồng bằng trùn quế có thể sinh lời :o Cùng xem bí quyết như thế nào nhé: https://youtu.be/Z4SNu3KpGb8 #POPSKids #TrangTraiConTrung #Jaian,56,55,,1,,,,Bình luậ,1370591599770852,/story.php?story_fbid=1370591599770852&id=178475505649140
POPS Kids,,2019-10-05 12:29:02," ️POPS - Tuyệt đỉnh giải trí, hoàn toàn miễn phí    Tải ngay:    ",7,7,,,,,,Bình luậ,1371009929729019,/pops.kids/photos/a.178476965648994/1371009929729019
POPS Kids,,2019-10-05 12:00:00,Không ngờ con trùn quế này cũng có thể giúp người ta thoát nghèo sao :o Cùng xem thử cách nuôi và làm sao con Trùn Quế này lại kinh đến vậy: https://youtu.be/iphkPAWIVIY #POPSKids #TrangTraiConTrung #Jaian,11,10,1,,,,,Bình luậ,1369976023165743,/story.php?story_fbid=1369976023165743&id=178475505649140
POPS Kids,,2019-10-05 11:00:07,Xúi bạn nghỉ bán bột chiên chạy xe ôm và cái kết :) ➡ Link Full: http://youtu.be/SD1CcQoLdmE #popskids #popstv,52,47,3,2,,,,2 bình luậ,1369207549909257,/story.php?story_fbid=1369207549909257&id=178475505649140
POPS Kids,,2019-10-05 10:00:11,Bảo bối giúp giảm cân thành công 100% :)) ➡ Xem tiếp tại đây: https://youtu.be/3YXUg64slNs #popskids #doraemon #long,9,6,,3,,,,Bình luậ,1369218273241518,/story.php?story_fbid=1369218273241518&id=178475505649140
POPS Kids,,2019-10-04 22:00:16,Tay nghề Anh Tú có làm Trường Giang trầm trồ? :v  Link: https://youtu.be/UXHr6GUl0bM  Đăng kí kênh YouTube Trường Giang tại: https://www.youtube.com/channel/UCpdBEsgVIcWbrwWuemjnxXg  #POPSKids #TrườngGiang #muonanphailanvaobep #MAPLVB #AnhTú #nqn,25,23,,1,1,,,Bình luậ,1370331076463571,/story.php?story_fbid=1370331076463571&id=178475505649140
POPS Kids,,2019-10-04 21:30:36,🦞 Tôm rang me chua chua ngọt ngọt ngon vô cùng 🦞 Chỉ mỗi tội thiếu người bóc vỏ tôm cho :P ➡ Link Full: http://youtu.be/nehw6Ty7tnU #popskids #popskidsmusic #vaobepmoingay #naugihomnay,25,22,2,1,,,,Bình luậ,1369195583243787,/story.php?story_fbid=1369195583243787&id=178475505649140
POPS Kids,,2019-10-04 21:30:12,Bé ơi ngủ đi đêm đã khuya rồi  Để những ác mộng sẽ luôn trêu em Bé ơi ngủ ngoan trong tiếng kêu gào  Hồn ma gọi em cùng đi vào nghĩa trang  À ơi à ơi à .. à ơi. Chúc bé gặp ma 👻 - Xem full clip tại: https://youtu.be/LIUcKTuqfVI #POPSKids #Boomerang #hoathinhBoomerang #phimhoathinh,6,4,2,,,,,Bình luậ,1369966783166667,/story.php?story_fbid=1369966783166667&id=178475505649140
POPS Kids,,2019-10-04 21:00:37,"Lâu lâu có dịp có trổ kinh nghiệm mà nhầm kèo quá chị Thuỷ ơi 😂   Link: https://youtu.be/C7Rimz8Raus  Cre: FAP TV  ---------------------------------------------------------------------------- ➡ Đăng clip hay, hình ảnh cute của các bé để săn quà khủng tại group nhà POPS Kids: http://bit.ly/MDTTMiniGame #POPSKids #FAPTV #VinhRau #LuongMinhTrang #RibiSachi #nqn",39,31,6,2,,,,Bình luậ,1370330129796999,/story.php?story_fbid=1370330129796999&id=178475505649140
POPS Kids,,2019-10-04 20:00:01,Món Cá Lóc Kho Tộ này tuy quen thuộc và dân dã nhưng không phải ai cũng biết cách làm món này ngon ;) Hãy cùng Cô Minh làm thử món này để bữa cơm gia đình trở nên đậm đà hơn nhé ;) https://youtu.be/-gCukajy8Vo #POPSKids #BepCoMinh #Jaian,20,17,,2,,,1,Bình luậ,1369973563165989,/story.php?story_fbid=1369973563165989&id=178475505649140
POPS Kids,,2019-10-04 19:30:03,Hong biết Hùng Tâm có “tứk” hong ta chứ chưa đầy 1 tuổi nữa :v  Link: https://youtu.be/5TzRubWLuQk  Cre: Lime Entertainments  #POPSKids #LimeEntertainments #condentuhanhtinhnao #QuocCoQuocNghiep #HungTam #nqn,7,6,,1,,,,Bình luậ,1370179929812019,/story.php?story_fbid=1370179929812019&id=178475505649140
POPS Kids,,2019-10-04 18:27:40,"THỊT HEO KHÌA NƯỚC DỪA, món ruột của ai đây!!!  Ăn cùng cơm nóng có tuyệt không chứ 😍   Ngoài ra mọi người có thể ăn với bánh mì hay bún cũng rất ngon đó 😍    Link: https://youtu.be/Ogq9bjLuNt4  -------------------------------------------------- ➡ Đăng clip hay, hình ảnh cute của các bé để săn quà khủng tại group nhà POPS Kids: http://bit.ly/MDTTMiniGame #POPSKids #truyenhinhDongthap #thdt #dacsanmiensongnuoc #monkhianambo #nqn",113,110,,3,,,,12 bình luậ,1370330573130288,/story.php?story_fbid=1370330573130288&id=178475505649140
POPS Kids,,2019-10-04 17:00:01,Canh chua Ốc Bươu tuy đạm bạc nhưng lại hấp dẫn nức lòng người :o Cùng xem cách làm món này như thế nào nhé: https://youtu.be/n9ji3cna8Y8 #POPSKids #DanDaMienTay #Jaian,59,57,,2,,,,Bình luậ,1369975209832491,/story.php?story_fbid=1369975209832491&id=178475505649140
POPS Kids,,2019-10-04 16:00:31,Tôi kể ngày nay chuyện Jerry Trái tim lầm chỗ để trên đầu Chỉ vì vô ý vào tròng giặc Yêu nhầm Robot trách chi ai 😭 - Xem full clip tại: https://youtu.be/O9NadLI_D3s #Thichhoathinh #TomandJerry #Hoathinhtiengviet #BoomerangVN,53,47,3,3,,,,1 bình luậ,1369966976499981,/story.php?story_fbid=1369966976499981&id=178475505649140
POPS Kids,,2019-10-04 16:00:01,"KHÁM PHÁ VŨ TRỤ VUI HỌC CÙNG SAMSUNG, POPS KIDS VÀ VUS Một chương trình tương tác, khám phá, vừa chơi vừa học dành riêng cho các bé từ 3 đến 8 tuổi, tổ chức bởi Samsung, kết hợp với POPS Kids và Anh văn Hội Việt Mỹ (VUS) tại SAMSUNG 68 vào chủ nhật tuần này! Đến với chương trình, ba mẹ và các bé sẽ được tha hồ trải nghiệm những sản phẩm công nghệ mới nhất của Samsung. Đặc biệt, các em nhỏ sẽ được thưởng thức chương trình giải trí thiếu nhi hấp dẫn Mầm Chồi Lá, và tham gia vào lớp học tiếng Anh có 1 không 2 We Learn We Play. Đăng ký tham gia ngay: https://www.samsung.com/vn/explore/samsung68/kham-pha-tv-qled-8k/ #Samsung #QLED8K #POPSKids #VUS #VuTruVuiHoc #Samsung68 #MamChoiLa #WeLearnWePlay",6,6,,,,,,Bình luậ,1370043786492300,/story.php?story_fbid=1370043786492300&id=178475505649140
POPS Kids,,2019-10-04 14:00:42,Khi đã trót ăn quá nhiều. Và rồi thì là giờ bụng lại quá to huhu. - Xem full clip tại: https://youtu.be/ha2RA3P8r4c #POPSKids #TomandJerry #Hoathinhtiengviet #BoomerangVN,117,99,16,2,,,,1 bình luậ,1369966479833364,/story.php?story_fbid=1369966479833364&id=178475505649140
POPS Kids,,2019-10-04 13:44:39,Chúc mừng POPS Kids Junior đạt được Nút Bạc YouTube 🎉🎉🎉 Cùng POPS Kids đưa POPS Kids Junior lên Nút Vàng YouTube nha cả nhà ơi 😍 #POPSKids #POPSKidsJunior #Jaian,55,50,1,3,1,,,9 bình luậ,1370165466480132,/story.php?story_fbid=1370165466480132&id=178475505649140
POPS Kids,,2019-10-04 12:00:01,Thử thách đoán tên phim hoạt hình tuổi thơ. Nhưng cái kết chỉ toàn nhận được những câu trả lời khó đỡ #POPSKids #POPSMEME #Jaian,787,530,244,6,2,5,,33 bình luậ,1364184547078224,/story.php?story_fbid=1364184547078224&id=178475505649140
POPS Kids,,2019-10-04 11:00:44,"Làm sao để tìm được một ứng dụng giải trí nào vừa bổ ích cho bé mà lại khiến ba mẹ hài lòng về mặt an toàn và tính năng đây?  Đừng lo! Đã có POPS KIDS - chọn lọc về nội dung, dễ dàng trong sử dụng, lại còn giúp ba mẹ dễ dàng kiểm soát việc các bạn trẻ nhà mình dùng internet nữa chứ. Tuyệt vời hơn nữa, POPS KIDS nay còn có thể cài đặt trên Sony Android TV.  Giải trí cuối tuần cùng trẻ chưa bao giờ thoải mái đến thế. Các bạn đã thử cùng Xuân Bắc và Bé Bi chưa nè? ------------------------------ #POPSKids #SonyAndroidTV #POPSApp",10,10,,,,,,Bình luậ,1369202526576426,/story.php?story_fbid=1369202526576426&id=178475505649140
POPS Kids,,2019-10-04 10:00:33,1 Ông Nô ăn vạ chưa đủ sao lần này là 2 ông Nô :)) Đô xác định là ăn đủ :)) Link đây cả cùng xem full trọn bộ Doraemon ;) https://youtu.be/l13h3lZD_30 --------------------------- #POPSKids #Jaian #Doraemon,17,14,1,2,,,,1 bình luậ,1369217506574928,/story.php?story_fbid=1369217506574928&id=178475505649140
POPS Kids,,2019-10-03 22:00:03,"Em cô tư bến phà, đây chuyến phà miền tây. Em gian nan sớm chiều gánh hàng rao bán quanh năm  Cô Tư Bến Phà | Dương Tú Vy - Dương Nghi Đình  Link: https://youtu.be/kln5pjmXgLY  Cre: DƯƠNG NGHI ĐÌNH OFFICIAL  #POPSKids #duongnghidinh #cotubenpha #bolero #nqn",8,7,,1,,,,Bình luậ,1369397199890292,/story.php?story_fbid=1369397199890292&id=178475505649140
POPS Kids,,2019-10-03 21:30:13,“Mẹ sẽ về với anh em mình mà”- Nghe đau xé lòng :( 🎶🎶🎶 Link Full: http://youtu.be/ghXqfKk-baU #popskids #duongnghidinh #nucnodemtruong,99,93,,6,,,,3 bình luậ,1369193863243959,/story.php?story_fbid=1369193863243959&id=178475505649140
POPS Kids,,2019-10-03 21:00:03,Nỗi lòng của biết bao sĩ tử thầy cô có hiểu hem :3  Link: https://youtu.be/JC7zIiokE4g Cre: FAP TV  #POPSKids #FAPTV #HuynhPhuong #VinhRau #ThaiVu #nqn,18,14,4,,,,,1 bình luậ,1369373506559328,/story.php?story_fbid=1369373506559328&id=178475505649140
POPS Kids,,2019-10-03 20:30:00,"⭐️ Lần đầu tiên trong lịch sử của loài người 3000 năm qua, NASA đã gián tiếp ""thay đổi"" thuật chiêm tinh và cách nhận biết về các chòm sao, qua đó cũng có thể làm thay đổi thứ tự của 12 Cung Hoàng Đạo.  🎈 Thứ tự mới của 13 cung hoàng đạo, ứng với ngày sinh theo khái niệm mới của NASA:  1.Capricorn - Ma Kết: 20/1 - 16/2. 2.Aquarius - Bảo Bình: 16/2 - 11/3. 3.Pisces - Song Ngư: 11/3 - 18/4. 4.Aries - Bạch Dương: 18/4 - 13/5. 5.Taurus - Kim Ngưu: 13/5 - 21/6. 6.Gemini - Song Tử: 21/6 - 20/7. 7.Cancer - Cự Giải: 20/7 - 10/8. 8.Leo - Sư Tử: 10/8 - 16/9. 9.Virgo - Xử Nữ: 16/9 - 30/10. 10.Libra - Thiên Bình: 30/10 - 23/11. 11.Scorpio - Bọ Cạp: 23/11 - 29/11. 12.Ophiuchus - Xà Phu: 29/11 - 17/12. 13.Sagittarius - Nhân Mã: 17/12 - 20/1.  🌿  Nhưng tóm lại, các bạn cũng nhớ là Thiên Văn Học và Chiêm Tinh Học là hai phạm trù khác nhau, và sau khi cộng đồng mạng chia sẻ quá nhiều về vấn đề này, NASA có đính chính như sau: ""Chúng tôi không phải là thay đổi cung hoàng đạo của các bạn, chúng tôi chỉ đơn giản là đang làm toán thôi. Chúng tôi nghiên cứu thiên văn học chứ không phải chiêm tinh học, chiêm tinh học là một tàn dư của những nền văn minh cổ đại, còn chúng tôi đơn giản là đưa ra những con số của thời bây giờ"".",38,28,2,1,7,,,5 bình luậ,1369460466550632,/story.php?story_fbid=1369460466550632&id=178475505649140
POPS Kids,,2019-10-03 20:00:00,Cùng cô Minh làm thử món bánh mì phô mai tan chảy nào cả nhà ơi ;) Món này chưa bao giờ là hết hot luôn đó ;) Cùng xem hướng dẫn tại link dưới này nha: https://youtu.be/dE41uqXXP3s #POPSKids #BepCoMinh #Jaian,5,5,,,,,,Bình luậ,1368437079986304,/story.php?story_fbid=1368437079986304&id=178475505649140
POPS Kids,,2019-10-03 19:30:01,"🎐 Hãy cùng POPS Kids xem lại những khoảnh khắc nổi bật trong suốt sự kiện vừa rồi nhé cả nhà <3 Cả nhà có thấy bài nhạc này quen không nào? 😂 🎈 POPS Kids kết hợp cùng nhãn hàng Kem Wall’s tổ chức chương trình “Trung Thu Khắng Khít, Cười Vui Tít” cho các bé thiếu nhi với rất nhiều hoạt động sôi nổi và thú vị đã diễn ra tại Vạn Hạnh Mall.  --- 🍀 Khám phá thêm các sản phẩm của Wall’s tại đây: https://bit.ly/2ZpREJt #POPSKids #TrungThuKhắngKhítCườiVuiTít #KemWalls #XơiKemPháCỗ #VuiTítTrungThu",27,27,,,,,,Bình luậ,1369343086562370,/story.php?story_fbid=1369343086562370&id=178475505649140
POPS Kids,,2019-10-03 18:12:29,Món ốc vừa giòn vừa dai chấm cùng nước chấm đặc biệt ai đã thưởng thức rồi cũng ghiền hết :3  Link: https://youtu.be/OqE7KzB5XZE  Cre: Miền Tây Vlogs  #POPSKids #mientayvlogs #ocvoivoi #nqn,89,81,2,2,4,,,5 bình luậ,1369441326552546,/story.php?story_fbid=1369441326552546&id=178475505649140
POPS Kids,,2019-10-03 17:00:53,Ếch đồng nướng cây chuối nghe lạ tại quá!!!! Không biết ăn có ngon không ta? Link cho cả nhà cùng xem nè: https://youtu.be/CyZ3b45cbbc ------------------------ #POPSKids #Jaian #DanDaMienTay,63,59,,3,1,,,5 bình luậ,1368814726615206,/story.php?story_fbid=1368814726615206&id=178475505649140
POPS Kids,,2019-10-03 16:00:14,"Tom&Jerry thi nhảy sao mà sập luôn cả tòa nhà == Vui thôi, đừng vui quá. - Xem ful clip tại: https://youtu.be/7LILdqoKi4E #POPSKids #TomandJerry #Hoathinhtiengviet #BoomerangVN",10,5,4,1,,,,Bình luậ,1368813356615343,/story.php?story_fbid=1368813356615343&id=178475505649140
POPS Kids,,2019-10-03 15:00:14,"Tom nhà mình cuồng si cô mèo này đây ❤ Đời lại hem như mơ, nàng mèo này lại đi thích chuột Jerry mất tiêu rồi. - Xem ful clip tại: https://youtu.be/7LILdqoKi4E #POPSKids #TomandJerry #Hoathinhtiengviet #BoomerangVN",35,23,4,7,,,1,Bình luậ,1368816333281712,/story.php?story_fbid=1368816333281712&id=178475505649140
POPS Kids,,2019-10-03 14:00:35,Quả đậu phộng tưởng không quan trọng nhưng lại quan trọng không tưởng. - Link: https://youtu.be/tMkI-mD08O8 #Boomerang #Ben10 #Ben10Omniverse #POPSKids,5,3,,1,1,,,Bình luậ,1368812883282057,/story.php?story_fbid=1368812883282057&id=178475505649140
POPS Kids,,2019-10-03 13:00:00,Kỳ nghỉ bão táp của Chowdrer đã khiến cho cả nhà phải lâm vào cảnh dỡ khóc dỡ cười :)) Cùng xem Chowder đã làm nên tội tình gì nha: https://youtu.be/ULJ8uh41KbI #POPSKids #Chowder #Jaian,2,2,,,,,,Bình luậ,1368342866662392,/story.php?story_fbid=1368342866662392&id=178475505649140
POPS Kids,,2019-10-03 12:00:01,Chỉ với vài bước đơn giản và một số vật dụng trong nhà! Bạn có thể tự làm cho mình một chiếc kính vạn hoa siêu đẹp luôn đó :o Cùng xem cách làm kính vạn hoa tại đây nha: https://youtu.be/HeWEMNv9xoU #POPSKids #NidoKhoaHoc #Jaian,3,2,,1,,,,Bình luậ,1368439109986101,/story.php?story_fbid=1368439109986101&id=178475505649140
POPS Kids,,2019-10-03 11:05:26,"7 kiểu cắt tỉa hoa quả từ những loại trái cây tươi ngon quen thuộc hằng ngày sẽ giúp bạn trang trí dĩa trái cây thật đẹp, bắt mắt và cực kỳ ấn tượng cho bàn tiệc của mình <3  Link: https://youtu.be/9dAAfZAyXLQ  Cre: Hướng Nghiệp Á Âu  #POPSKids #huongnghiepAAu #nqn",12,11,,1,,,,Bình luậ,1369216353241710,/story.php?story_fbid=1369216353241710&id=178475505649140
POPS Kids,,2019-10-03 11:00:47,Nếu bạn thắc mắc món quà vặt yêu thích của tuổi thơ được làm như thế nào thì câu trả lời là đây ❤  Link FULL youtube: https://youtu.be/5NL-wIKqaj4 #POPSKids #ThanhNienMietVuon #anvat #nqn,95,92,,3,,,,5 bình luậ,1369202153243130,/story.php?story_fbid=1369202153243130&id=178475505649140
POPS Kids,,2019-10-02 22:00:02,Bắt gà chắc dễ lắm nên Trường Giang mới mang cao gót hả ta :v  Link: https://youtu.be/Z-4d1TIXOJE Đăng kí kênh YouTube Trường Giang tại: https://www.youtube.com/channel/UCpdBEsgVIcWbrwWuemjnxXg  #POPSKids #TrườngGiang #muonanphailanvaobep #MAPLVB #AnhTú #nqn,34,27,7,,,,,Bình luậ,1368455146651164,/story.php?story_fbid=1368455146651164&id=178475505649140
POPS Kids,,2019-10-02 21:30:01,"Băn khoăn cuối tuần không biết nấu gì để sum họp gia đình, bạn bè thì cả nhà có thể thử món gỏi hản sản ngũ sắc siêu nhiều topping này nha 😋   Link: https://youtu.be/x2Pt7h7uLNk  Cre: Thanh Niên Miệt Vườn  #POPSKids #thanhnienmietvuon #tnmv #goihaisan #nguoimientay #amthucmelam #nqn",25,25,,,,,,3 bình luậ,1368596739970338,/story.php?story_fbid=1368596739970338&id=178475505649140
POPS Kids,,2019-10-02 21:00:02,Làm cách nào chơi game mà thuận cả đôi bên đây :v   Link: https://youtu.be/mgQlsN2fxAU  Cre: FAP TV  #POPSKids #FAPTV #HuynhPhuong #ThaiVu #nqn,14,14,,,,,,1 bình luậ,1368624029967609,/story.php?story_fbid=1368624029967609&id=178475505649140
POPS Kids,,2019-10-02 20:30:01,Vương miện gì mà tiện “dữ dzậy” he :v Link: https://youtu.be/Bp6MmVP1Asw  #POPSKids #TodayWePlay #SurpriseToyUnboxing #daphopvuongmien #nqn,5,5,,,,,,Bình luậ,1368540789975933,/story.php?story_fbid=1368540789975933&id=178475505649140
POPS Kids,,2019-10-02 20:00:02,Cách làm món Gỏi Bóp Hành Hoa siêu ngon siêu hấp dẫn và đậm đà phong cách gà Miền Trung luôn ;) https://youtu.be/D2DsAzvihU0 #POPSKids #Jaian #BepCoMinh,9,9,,,,,,Bình luậ,1366802746816404,/story.php?story_fbid=1366802746816404&id=178475505649140
POPS Kids,,2019-10-02 19:30:01,Hai phụ huynh nam Quốc Cơ - Quốc Nghiệp và “hiện trường” cho 2 nhóc tì 8 tháng nhà mình ăn :v  Link: https://youtu.be/o6_59SMIk0M  Cre: Lime Entertainments  #POPSKids #LimeEntertainments #condentuhanhtinhnao #QuocCoQuocNghiep #HungTam #Bap #nqn,15,12,3,,,,,1 bình luậ,1368444023318943,/story.php?story_fbid=1368444023318943&id=178475505649140
POPS Kids,,2019-10-02 17:38:15,Cùng xem cách làm món Ốc Giác Xào Lục Bình Siêu ngon siêu dân dã đây ;) https://youtu.be/3MHMYF6wBgY #POPSKids #Jaian #DanDaMienTay,23,23,,,,,,1 bình luậ,1368437976652881,/story.php?story_fbid=1368437976652881&id=178475505649140
POPS Kids,,2019-10-02 16:00:00,"ỨNG DỤNG POPS SẼ RA MẮT NGƯỜI DÙNG VÀO NGÀY 5/10 Sau một thời gian chuẩn bị, chúng tôi xin chính thức thông báo ngày ra mắt của POPS - Ứng dụng giải trí mới nhất đến từ nhà POPS Worldwide. Bật mí thêm: POPS là ứng dụng xem nội dung trực tuyến thuần Việt, chúng tôi mong muốn mang đến cho người dùng những nội dung đặc sắc nhất đến từ các nhà sản xuất chất lượng tại Việt Nam và thế giới. Hãy theo dõi POPS - Trải nghiệm giải trí mới  để không bỏ lỡ những tin tức nóng hổi nhất. #POPSApp #POPSWorldwide #ComingSoon",7,7,,,,,,Bình luậ,1368416963321649,/story.php?story_fbid=1368416963321649&id=178475505649140
POPS Kids,,2019-10-02 15:00:06,"Có máy chọc giận kiếm ra tiền được nên Nobita chạy đôn chạy đáo đi ""kiếm chuyện"" khắp nơi nhưng không ai nổi giận :v  Cho đến khi cả thế giới đều người phát hoả thì...  Link FULL tập nè: https://youtu.be/mlB6LIJ0jCM  Subcribe POPS Kids để xem thêm nhiều tập phim hay tai đây nhe cả nhà: https://goo.gl/37Hb7g  #POPSAnime #POPSKids #Doraemon #Nobita #nqn",57,49,7,1,,,,1 bình luậ,1368413926655286,/story.php?story_fbid=1368413926655286&id=178475505649140
POPS Kids,,2019-10-02 13:00:00,Các bạn đã được thấy một trang trại nuôi dế bao giờ chưa :o Cùng xem một trang trại nuôi dế sẽ trông như thế nào nhé: https://youtu.be/sh1FNWv4t9Q #POPSKids #DanDaMienTay #Jaian,66,62,,1,2,1,,3 bình luậ,1368343459995666,/story.php?story_fbid=1368343459995666&id=178475505649140
POPS Kids,,2019-10-02 12:00:07,"Ai mà nghĩ Jerry luôn là kẻ bị bắt nạt, yếu thế thì xem lại đi nha. Chuột Jerry cũng hem phải dạng vừa đâu !! - Xem ful clip tại: https://youtu.be/7LILdqoKi4E #Thichhoathinh #TomandJerry #Hoathinhtiengviet #BoomerangVN",84,70,11,3,,,,Bình luậ,1368342919995720,/story.php?story_fbid=1368342919995720&id=178475505649140
POPS Kids,,2019-10-01 20:00:00,Món Hoành Thánh Chong Chóng này sao lạ quá ta :o Cùng xem thử cách làm món này với đầu bếp Jack Lee nhé ;) https://youtu.be/WMRYN-goDDA #POPSKids #ChiecBungAmAp #Jaian,3,3,,,,,,Bình luậ,1367461130083899,/story.php?story_fbid=1367461130083899&id=178475505649140
POPS Kids,,2019-10-01 19:30:01,‘Ông lão đánh cá và con cá vàng’: Có dũng khí mới làm được người thiện lương?  Link: https://youtu.be/4XhTZVWtXNs  #POPSKids #chuyencochuake #onglaodanhcavaconcavang #nqn,10,10,,,,,,Bình luậ,1367551550074857,/story.php?story_fbid=1367551550074857&id=178475505649140
POPS Kids,,2019-10-01 18:00:01,Gà tre rang muối vừa thơm chất thịt lại vừa chắc nhưng không hề dai sẽ là món ăn lý tưởng cho thực đơn của cả gia đình bạn <3  Link: https://youtu.be/n5abTG6IySU  Cre: Truyền Hình Đồng Tháp  #POPSKids #truyềnhìnhĐồngTháp #thđt #dacsanmiensongnuoc #garangmuoihot #nqn,42,42,,,,,,Bình luậ,1367587413404604,/story.php?story_fbid=1367587413404604&id=178475505649140
POPS Kids,,2019-10-01 17:00:00,Cả nhà đã được ăn thử món Bánh Lọt Cá Lóc này chưa??? Nếu chưa thì cùng làm thử theo trong clip để được thử món ăn dân dã và độc đáo này nhé ;) https://youtu.be/LzIOdxkbvjQ #POPSKids #DanDaMienTay #Jaian,40,38,,2,,,,2 bình luậ,1366806426816036,/story.php?story_fbid=1366806426816036&id=178475505649140
POPS Kids,,2019-10-01 16:00:01,"Chưa đầy 24 tiếng nữa, POPS sẽ mang đến cho bạn thông tin chính thức về sản phẩm mới nhất của chúng tôi. Nhớ theo dõi POPS - Trải nghiệm giải trí mới để đừng bỏ lỡ cập nhật mới nhất! #POPSWorldwide #ComingSoon",3,3,,,,,,Bình luậ,1367576816738997,/story.php?story_fbid=1367576816738997&id=178475505649140
