source,shared_from,date,text,reactions,likes,ahah,love,wow,sigh,grrr,comments,post_id,url
Soha Quân Sự,,2019-10-12 12:17:06,"Sợ bị trả đũa, Saudi cuống cuồng vũ trang: Iran chỉ ấn nút là các ""ốc đảo dầu mỏ"" sụp đổ? https://soha.vn/so-bi-tra-dua-saudi-cuong-cuong-vu-trang-iran-chi-an-nut-la-cac-oc-dao-dau-mo-sup-do-20191012104249343.htm",2,1,1,,,,,Bình luậ,1444236032391990,/story.php?story_fbid=1444236032391990&id=390862884395982
Soha Quân Sự,,2019-10-12 08:01:10,"Hải quân Mỹ chưa hết nỗi lo về P-700 Granit, tên lửa chống hạm siêu âm nguy hiểm nhất hiện tại, đã phải đối mặt với tên lửa siêu vượt âm Zircon, vũ khí của chiến tranh tương lai. https://m.soha.vn/tau-san-bay-can-cu-my-nhu-ca-tren-thot-voi-2-loai-vu-khi-nay-cua-nga-20191011224325781.htm",8,8,,,,,,1 bình luậ,1444092872406306,/story.php?story_fbid=1444092872406306&id=390862884395982
Soha Quân Sự,,2019-10-12 07:58:56,"Này anh lính chiến, người bạn pháo binh. Anh rót cho khéo nhé, kẻo lầm vào nhà tôi. Nhà tôi ở cuối chân đồi. Và mấy chú lính pháo binh Thổ Nhĩ Kỳ đã lầm thật, mời lính đặc nhiệm Mỹ xơi bão thép ở Syria. https://soha.vn/cap-nhat-linh-my-bi-tho-nhi-ky-na-phao-o-aleppo-o-syria-sieu-tau-dau-iran-trung-2-qua-ten-lua-20191012074356343.htm",29,24,4,,1,,,Bình luậ,1444091652406428,/story.php?story_fbid=1444091652406428&id=390862884395982
Soha Quân Sự,,2019-10-11 15:46:24,"""Chiến thuật phòng không tốt nhất là tấn công vào các căn cứ không quân, phá hủy các máy bay trên đường băng hoặc phục kích trực thăng đối phương đang đáp xuống mặt đất bằng ATGM"". https://soha.vn/kurd-se-cam-chiu-de-tho-thong-tri-tren-khong-con-vu-khi-bi-mat-gi-chua-tung-ra-20191011123114453.htm",21,20,1,,,,,1 bình luậ,1443457949136465,/story.php?story_fbid=1443457949136465&id=390862884395982
Soha Quân Sự,,2019-10-11 15:25:10,Các anh phiến quân Syria nếu không có đặc nhiệm Thổ đi kèm thì chắc chỉ giỏi...bắt gà bắt chó.,29,23,5,1,,,,1 bình luậ,1443440982471495,/story.php?story_fbid=1443440982471495&id=390862884395982
Soha Quân Sự,,2019-10-11 15:24:08,"Dân quân người Kurd khai hỏa súng máy W85 (QJC-88) do Trung Quốc sản xuất trên motor. Trong cuộc đua giữa hai thiết kế súng máy Trung Quốc để trang bị cho PLA, W85 đã thua Type 85.  Tuy nhiên W85 lại ""thành công rực rỡ"" trong việc xuất khẩu, súng được sử dụng chủ yếu trong các lực lượng đối địch ở các vùng xung đột như Syria, Sudan, Afghanistan, Campuchia, Sri Lanka, Iraq, Iran...",94,81,9,,4,,,20 bình luậ,1443440392471554,/story.php?story_fbid=1443440392471554&id=390862884395982
Soha Quân Sự,,2019-10-11 15:16:28,"Chỉ mất khoảng 20 phút chuẩn bị, chiếc xe tăng T-90S nặng hơn 46 tấn của Việt Nam hoàn toàn có thể di chuyển dưới nước như một chiếc tàu ngầm. https://m.soha.vn/khong-chi-co-phao-to-giap-xin-xe-tang-t-90-viet-nam-con-co-mot-kha-nang-dac-biet-20191007162540046.htm",16,15,,,1,,,1 bình luậ,1443436035805323,/story.php?story_fbid=1443436035805323&id=390862884395982
Soha Quân Sự,,2019-10-11 14:26:58,"NÓNG: Tàu chở dầu Iran bị tấn công gần cảng Saudi, Trung Đông trên bờ vực chiến tranh? https://soha.vn/nong-tau-cho-dau-iran-bi-tan-cong-gan-cang-saudi-trung-dong-tren-bo-vuc-chien-tranh-2019101114145189.htm",74,65,,,9,,,6 bình luậ,1443408229141437,/story.php?story_fbid=1443408229141437&id=390862884395982
Soha Quân Sự,,2019-10-11 08:33:15,"Mỹ sẽ thay thế AGM-158C LRASM và RGM-184A NSM cho tên lửa Harpoon đã lỗi thời để đối phó với các mối đe dọa từ lực lượng hải quân đối phương, đặc biệt là Trung Quốc. https://soha.vn/my-bien-che-ten-lua-dep-va-thong-minh-dap-tra-man-duyet-binh-khoe-me-cua-trung-quoc-20191010115541062.htm",13,13,,,,,,Bình luậ,1443170882498505,/story.php?story_fbid=1443170882498505&id=390862884395982
Soha Quân Sự,,2019-10-11 08:30:25,"Súng trường Karabiner 98 Kurz (còn gọi là K-98) là súng trường tiêu chuẩn của Đức quốc xã. Súng bắn đạn 7.92x57mm Mauser. Tại Iraq, người ta đã có sáng kiến ""độ"" lại súng để bắn từ hộp tiếp đạn 5,56x45 mm NATO. Chưa rõ khả năng của khẩu súng này ra sao tuy nhiên đây được coi là một sáng kiến vì ở quốc gia này, đạn 5,56 dễ kiếm hơn đạn 7,92 (hiện tại không còn được sản xuất ở quy mô công nghiệp quốc phòng).",56,53,1,,2,,,10 bình luậ,1443168612498732,/story.php?story_fbid=1443168612498732&id=390862884395982
Soha Quân Sự,,2019-10-11 08:17:18,"Chiều muộn ngày 10/10, Quân đội Thổ Nhĩ Kỳ và lực lượng đồng minh - Quân đội Quốc gia Syria (NSA) đã cắt đứt và kiểm soát tuyến đường chủ chốt ở vùng Đông Bắc Syria. https://m.soha.vn/cap-nhat-tho-nhi-ky-khep-chat-vong-vay-o-syria-chiem-hang-loat-dia-ban-chu-chot-20191011074107171.htm",25,23,,,2,,,Bình luậ,1443156425833284,/story.php?story_fbid=1443156425833284&id=390862884395982
Soha Quân Sự,,2019-10-10 23:13:58,"Trung Quốc có kế hoạch xây dựng ít nhất 4 cụm tác chiến tàu sân bay vào năm 2030. Tuy nhiên, việc lựa chọn J-20 cho tàu sân bay theo đúng cách mà người Mỹ đã sai lầm có thể sẽ khiến họ mất thêm ít nhất là 20 năm. https://m.soha.vn/dua-j-20-len-tau-san-bay-trung-quoc-dang-tu-nhan-chim-tham-vong-hai-quan-xuong-day-bien-20191009171724265.htm",11,8,3,,,,,1 bình luậ,1442838762531717,/story.php?story_fbid=1442838762531717&id=390862884395982
Soha Quân Sự,,2019-10-10 16:57:58,Cô gái người  Kurd cầm AK ở lề phải xuất hiện trong clip cho thấy hình ảnh được chụp ở cùng một địa điểm với nhóm thanh niên vũ trang người Kurd.,82,75,1,,2,4,,10 bình luậ,1442583482557245,/story.php?story_fbid=1442583482557245&id=390862884395982
Soha Quân Sự,,2019-10-10 16:09:28,Xe bọc thép của Thổ Nhĩ Kỳ tiếp tục cơ động về hướng các mũi tấn công trong lãnh thổ Syria.,43,40,,,3,,,4 bình luậ,1442555425893384,/story.php?story_fbid=1442555425893384&id=390862884395982
Soha Quân Sự,,2019-10-10 15:57:34,Hình ảnh trên google map cho thấy các vị trí pháo binh của Thổ Nhĩ Kỳ hướng về phía Syria.,14,13,,1,,,,Bình luậ,1442544085894518,/story.php?story_fbid=1442544085894518&id=390862884395982
Soha Quân Sự,,2019-10-10 15:56:15,Thanh niên người Kurd ở miền bắc Syria chuẩn bị chiến đấu chống lại cuộc tấn công của Thổ Nhĩ Kỳ (clip 2).,85,80,1,,1,3,,16 bình luậ,1442543115894615,/story.php?story_fbid=1442543115894615&id=390862884395982
Soha Quân Sự,,2019-10-10 15:55:30,Thanh niên người Kurd ở miền bắc Syria chuẩn bị chiến đấu chống lại cuộc tấn công của Thổ Nhĩ Kỳ (clip 1).,124,110,1,2,4,7,,2 bình luậ,1442542502561343,/story.php?story_fbid=1442542502561343&id=390862884395982
Soha Quân Sự,,2019-10-10 15:52:48,Tuyên bố của ông Trump được đưa ra sau khi binh lính Quân đội Thổ Nhĩ Kỳ đã tràn qua bên kia biên giới tiến vào lãnh thổ Syria với sự yểm trợ của hỏa lực không quân trước đó. https://soha.vn/tt-trump-tra-thu-vat-ly-do-bat-ngo-khien-ong-chu-nha-trang-tu-bo-nguoi-kurd-o-syria-20191010104835687.htm,13,11,2,,,,,1 bình luậ,1442541139228146,/story.php?story_fbid=1442541139228146&id=390862884395982
Soha Quân Sự,,2019-10-10 15:52:13,"Mỹ và phương Tây khao khát có thể chạm tay vào một chiếc trực thăng Hind. Họ muốn biết nhiều hơn nữa về nó và sẵn lòng thực hiện những thỏa thuận ""bẩn"" để có được mẫu máy bay này. https://soha.vn/thoa-thuan-ban-cua-my-va-chien-dich-danh-cap-truc-thang-vu-trang-lien-xo-ngay-trong-dem-20191009142122406.htm",142,135,3,,3,,1,6 bình luậ,1442540749228185,/story.php?story_fbid=1442540749228185&id=390862884395982
Soha Quân Sự,,2019-10-10 15:51:49,"Để hạn chế tối đa thiệt hại từ các cuộc tấn công bằng UAV của phiến quân Syria, Quân đội Nga đã cho ra đời một mẫu căn cứ quân sự thế hệ mới được làm từ cát hoặc đất đá. https://soha.vn/quan-doi-nga-xay-lau-dai-cat-de-chong-uav-nghe-vo-ly-nhung-hieu-qua-khong-tuong-20191010104213687.htm",8,8,,,,,,1 bình luậ,1442540535894873,/story.php?story_fbid=1442540535894873&id=390862884395982
Soha Quân Sự,,2019-10-10 15:51:27,Ankara lo ngại rằng một thực thể ủng hộ PKK ở biên giới phía Nam chắc chắn sẽ trở thành bệ phóng cho các cuộc tấn công vào Thổ Nhĩ Kỳ và do vậy coi đây là một mối đe dọa hiện hữu. https://soha.vn/tai-sao-tho-nhi-ky-tan-cong-mien-bac-syria-20191010082221781.htm,14,13,,,1,,,1 bình luậ,1442540005894926,/story.php?story_fbid=1442540005894926&id=390862884395982
Soha Quân Sự,,2019-10-10 15:51:02,"Theo người lính đặc nhiệm Mỹ, các tay súng người Kurd đang cố bấu víu vào sự trợ giúp từ Washington và không đồng minh nào còn tin vào Mỹ nữa vì TT Trump đã ""đóng sập cánh cửa"". https://soha.vn/linh-dac-nhiem-my-xau-ho-va-nhuc-nha-khi-bo-roi-dong-minh-theo-lenh-ong-trump-2019101010185164.htm",50,39,11,,,,,7 bình luậ,1442539375894989,/story.php?story_fbid=1442539375894989&id=390862884395982
Soha Quân Sự,,2019-10-10 13:08:02,Thổ quyết tâm đè bẹp các em Kurd bất chấp thế giới lên tiếng. Qua đây mới thấy truyền thống bỏ mặc đồng minh của Mỹ đã lên thêm một đỉnh cao mới. https://soha.vn/cap-nhat-dai-quan-tho-danh-lon-chua-tung-co-o-syria-dan-nao-loan-di-tan-cong-dong-tg-len-tieng-khan-cap-20191010070112343.htm,38,31,3,1,2,,1,1 bình luậ,1442448485904078,/story.php?story_fbid=1442448485904078&id=390862884395982
Soha Quân Sự,,2019-10-09 22:36:21,"Thổ Nhĩ Kỳ đã chính thức phát động chiến dịch tiến công quân sự ở miền Bắc Syria. Khổ thân các em gái Kurd xinh đẹp, rắn rỏi https://soha.vn/cap-nhat-tiem-kich-su-35-nga-danh-chan-quyet-liet-chien-dau-co-israel-o-syria-tho-im-lang-bat-thuong-20191009081314078.htm",12,9,,,3,,,Bình luậ,1441949285953998,/story.php?story_fbid=1441949285953998&id=390862884395982
Soha Quân Sự,,2019-10-09 21:05:11,"Cuộc đàm phán với Mỹ hôm 6/10 là thành công đầu tiên, chiến thắng quân sự ở Syria cùng với việc tái khởi động cung cấp F-35 vào tháng 11 sẽ là ""kết thúc trong mơ"" với Thổ Nhĩ Kỳ. https://m.soha.vn/tho-nhi-ky-1-von-4-loi-vua-so-huu-f-35-s-400-su-57-lai-co-co-hoi-danh-bai-nguoi-kurd-20191009141408906.htm",10,8,1,,1,,,Bình luậ,1441877709294489,/story.php?story_fbid=1441877709294489&id=390862884395982
Soha Quân Sự,,2019-10-09 21:04:19,"Tính từ thời điểm Nga bắt đầu tham gia chiến dịch quân sự ở Syria, các máy bay không người lái của nước này đã thực hiện hơn 23.000 chuyến bay với tổng thời gian hơn 140.000 giờ. https://m.soha.vn/kinh-nghiem-xuong-mau-o-syria-da-dua-nga-tro-thanh-nuoc-che-tao-uav-dang-cap-the-gioi-20191009160928671.htm",49,47,,2,,,,1 bình luậ,1441877109294549,/story.php?story_fbid=1441877109294549&id=390862884395982
Soha Quân Sự,,2019-10-09 18:41:45,"Toàn bộ khu vực bắc Syria, dọc theo mọi con đường, trên các cánh đồng, khu dân cư, người Kurd đã đào một hệ thống hầm ngầm và công sự chiến đấu dày đặc, chờ sẵn lính Thổ Nhĩ Kỳ. https://m.soha.vn/nguoi-kurd-da-chuan-bi-tu-lau-cho-su-phan-boi-cua-my-tu-dia-cua-linh-tho-20191008171100734.htm",59,54,2,1,1,1,,7 bình luậ,1441774082638185,/story.php?story_fbid=1441774082638185&id=390862884395982
Soha Quân Sự,,2019-10-09 18:39:00,"Khi sở hữu Su-57, Myanmar sẽ trở thành quốc gia Đông Nam Á có được các khả năng tấn công tầm xa đầy uy lực với sức mạnh răn đe vượt xa tầm khu vực. https://m.soha.vn/su-57-nga-se-giup-mot-quoc-gia-dong-nam-a-so-huu-kha-nang-tan-cong-vo-doi-20191009095208671.htm",44,39,4,,1,,,6 bình luậ,1441772289305031,/story.php?story_fbid=1441772289305031&id=390862884395982
Soha Quân Sự,,2019-10-09 18:37:14,"Chiến đấu cơ Israel xuất hiện bất ngờ ở phía Nam Syria, lập tức tiêm kích Su-35 Nga báo động chiến đấu và xuất kích truy cản, bẻ gãy đợt tấn công của KQ Do Thái nhằm vào Syria. https://m.soha.vn/cap-nhat-tiem-kich-su-35-nga-danh-chan-quyet-liet-chien-dau-co-israel-o-syria-tho-im-lang-bat-thuong-20191009081314078.htm",21,19,,,2,,,Bình luậ,1441770959305164,/story.php?story_fbid=1441770959305164&id=390862884395982
Soha Quân Sự,,2019-10-09 10:26:30,"3 vị trí bàn đạp tấn công của quân Thổ và FSA về hướng Manbij, khu vực này sẽ khá phức tạp nếu Thổ tấn công và SAA quyết định tiến chiếm.",15,15,,,,,,Bình luậ,1441472989334961,/story.php?story_fbid=1441472989334961&id=390862884395982
Soha Quân Sự,,2019-10-09 10:22:52,"Hàng nghìn tàn quân IS nếu được Thổ Nhĩ Kỳ tiếp quản từ người Mỹ sẽ ra sao? Dưới đây là một chiến binh Quân đội Syria Tự do (FSA) thuộc nhóm Jaysh al-Sharqiya tại vị trí chuẩn bị tấn công người Kurd ở miền bắc Syria: ""Chúng tôi sẽ đánh vào các vị trí quân sự của kẻ thù (của Allah), những kẻ vô thần và những kẻ ngoại đạo Arab bẩn thỉu"". Theo bình luận của một số người Syria thì chiến binh này nói giọng Morocco.",27,26,1,,,,,3 bình luậ,1441470132668580,/story.php?story_fbid=1441470132668580&id=390862884395982
Soha Quân Sự,,2019-10-09 10:17:50,"Hai khẩu súng trường tấn công FN FAL và AKM được ""độ"" khá tinh xảo tại Idlib, Syria.",99,97,,2,,,,9 bình luậ,1441466179335642,/story.php?story_fbid=1441466179335642&id=390862884395982
Soha Quân Sự,,2019-10-09 10:04:41,Một chiến binh Houthi trang bị súng trường tấn công AK đã bắt sống xe bọc thép LAV-25 cho thấy vũ khí trang bị hiện đại không hẳn là một yếu tố quyết định chiến thắng. https://soha.vn/linh-chan-dat-houthi-chia-ak-goi-hang-linh-dai-gia-saudi-trong-xe-boc-thep-vai-ra-quan-20191008183318937.htm,40,31,8,,1,,,1 bình luậ,1441455439336716,/story.php?story_fbid=1441455439336716&id=390862884395982
Soha Quân Sự,,2019-10-09 08:47:43,"Trong lễ duyệt binh diễn ra hôm 1/10, QĐ Trung Quốc đã cho máy bay không người lái tấn công tự sát ASN-301 tiến qua Quảng trường Thiên An Môn, dấu hiệu cho thấy nó đã trực chiến. https://m.soha.vn/trung-quoc-sao-chep-thanh-cong-sat-thu-chong-radar-cuc-ky-loi-hai-cua-israel-20191008130804515.htm",26,24,1,,1,,,Bình luậ,1441410896007837,/story.php?story_fbid=1441410896007837&id=390862884395982
Soha Quân Sự,,2019-10-09 08:36:42,Nga bây giờ tích cực bảo vệ Syria thật khi liên tiếp cho Su-35 và Su-30SM xuất kích đánh chặn máy bay Israel. TT Putin ra lệnh bắn bỏ nên chiến đấu cơ Israel sợ quá cúp đuôi chạy té khói. https://soha.vn/cap-nhat-tiem-kich-su-35-nga-danh-chan-quyet-liet-chien-dau-co-israel-o-syria-tho-im-lang-bat-thuong-20191009081314078.htm,61,60,,1,,,,2 bình luậ,1441404916008435,/story.php?story_fbid=1441404916008435&id=390862884395982
Soha Quân Sự,,2019-10-08 21:35:34,Chiến thắng chớp nhoáng trong Chiến tranh 6 ngày đồng nghĩa với việc Israel thu được một lượng vũ khí khổng lồ từ quân đội các nước Ả Rập https://m.soha.vn/tiet-lo-ve-kho-vu-khi-khong-lo-israel-thu-duoc-sau-chien-tranh-6-ngay-kha-nang-bien-hoa-cua-nguoi-do-thai-20191008111110296.htm,34,33,,,1,,,Bình luậ,1440992196049707,/story.php?story_fbid=1440992196049707&id=390862884395982
Soha Quân Sự,,2019-10-08 21:35:07,"Quyết định rút quân khỏi miền bắc Syria được coi là khởi đầu của ""hiệu ứng domino"" với các đồng minh của Mỹ và là một chiến thắng của Iran và Thổ ở khu vực Trung Đông. https://m.soha.vn/israel-va-cac-dong-minh-cay-dang-my-quay-lung-ngay-truoc-tuong-lai-den-toi-20191008121608984.htm",11,11,,,,,,1 bình luậ,1440991689383091,/story.php?story_fbid=1440991689383091&id=390862884395982
Soha Quân Sự,,2019-10-08 19:18:37,"Các chuyên gia quân sự đánh giá việc đưa lựu pháo M777 lên các vùng núi cao có thể sẽ không mang lại hiệu quả tác chiến như Ấn Độ kỳ vọng, nhưng họ không có sự lựa chọn nào khác. https://m.soha.vn/an-do-dung-truc-thang-cau-luu-phao-m777-len-bien-gioi-san-sang-ung-chien-voi-trung-quoc-20191008102804765.htm",31,28,2,,1,,,3 bình luậ,1440881096060817,/story.php?story_fbid=1440881096060817&id=390862884395982
Soha Quân Sự,,2019-10-08 19:17:59,"Ngày 8/10, ít nhất 150 lính đặc nhiệm Mỹ ở 3 tiền đồn quan trọng gần biên giới Thổ Nhĩ Kỳ đã bắt đầu rút về một căn cứ quân sự của Mỹ ở phía Bắc Iraq. https://m.soha.vn/syria-hang-nghin-khung-bo-is-se-thao-chay-khoi-cac-nha-tu-khi-my-rut-quan-20191008120356406.htm",15,11,4,,,,,2 bình luậ,1440880492727544,/story.php?story_fbid=1440880492727544&id=390862884395982
Soha Quân Sự,,2019-10-08 19:17:22,TT Putin đã ra quyết định chấn động TG khi Damacus khẩn thiết xin giúp đỡ. Ngày 30/9 là dấu mốc tròn 4 năm kể từ khi các lực lượng không quân vũ trụ Nga bắt đầu tham chiến ở Syria. https://m.soha.vn/sau-quyet-dinh-chan-dong-tg-cua-ong-putin-lan-luot-cac-vu-khi-hien-dai-xung-tran-o-syria-20191007083123984.htm,44,42,,2,,,,3 bình luậ,1440879919394268,/story.php?story_fbid=1440879919394268&id=390862884395982
Soha Quân Sự,,2019-10-08 08:55:00,"Sau khi đoạn phim cho thấy một chỉ huy Israel ""mạnh tay"" với những người lính dưới quyền hôm 4/10 được lan truyền trên mạng xã hội, truyền thông Iran đã đả kích hành động này. https://m.soha.vn/iran-da-xoay-binh-linh-israel-doi-quan-hung-manh-nhat-trung-dong-dang-mo-ngu-20191007144706281.htm",25,22,3,,,,,1 bình luậ,1440488746100052,/story.php?story_fbid=1440488746100052&id=390862884395982
Soha Quân Sự,,2019-10-08 08:53:56,"Khoảng 90.000 quân của các lực lượng đối địch đang chuẩn bị lao vào cuộc chiến ""một mất, một còn"" tại khu vực 30 km tính từ biên giới Thổ Nhĩ Kỳ vào sâu trong lãnh thổ Syria. https://m.soha.vn/tho-nhi-ky-dai-chien-o-syria-cang-thang-tot-do-cho-tt-erdogan-phat-lenh-no-sung-20191007172003218.htm",29,26,1,,2,,,2 bình luậ,1440487832766810,/story.php?story_fbid=1440487832766810&id=390862884395982
Soha Quân Sự,,2019-10-08 08:53:26,"Tại Triển lãm DSE Vietnam 2019 tổ chức ở Hà Nội, Tổng Công ty Rosoboronexport của Nga đã trưng bày mô hình tàu tuần tra chống biệt kích thuộc Dự án 21980E. https://m.soha.vn/nga-chao-hang-viet-nam-tau-chong-biet-kich-toi-tan-tai-trien-lam-dse-2019-20191002113937425.htm",70,67,,2,1,,,2 bình luậ,1440487346100192,/story.php?story_fbid=1440487346100192&id=390862884395982
Soha Quân Sự,,2019-10-08 08:52:46,"Ukraine nâng cấp 150 chiếc T-64 lên chuẩn T-64BM Bulat khiến Nga cảm thấy khó chịu, và không gì có thể giải tỏa tốt hơn là để xe tăng T-90 bắn tan xác cái gai này trên thao trường. https://m.soha.vn/xe-tang-t-90-nga-khong-thuong-tiec-ban-bam-dap-t-64-tuong-tu-cua-ukraine-20191007024754171.htm",13,11,1,1,,,,Bình luậ,1440486856100241,/story.php?story_fbid=1440486856100241&id=390862884395982
Soha Quân Sự,,2019-10-08 08:39:17,"Khu khú, lính Mỹ cúp đuôi tháo chạy, để mặc Thổ Nhĩ Kỳ bem đồng minh ở Syria. Đúng là chả tin được bố con anh nào sất, cứ phải tự lực cánh sinh thôi. R.I.P các bạn SDF. https://soha.vn/cap-nhat-tho-chinh-thuc-khai-dao-chien-dau-co-don-dap-xuat-kich-nem-bom-sdf-o-syria-20191008081534171.htm",44,41,3,,,,,5 bình luậ,1440479209434339,/story.php?story_fbid=1440479209434339&id=390862884395982
Soha Quân Sự,,2019-10-08 08:35:03,"Quân đội Việt Nam mua hàng xịn của Đức, chứng tỏ đẳng cấp ""tay chơi"" có nghề đấy. https://soha.vn/viet-nam-la-quoc-gia-thu-2-so-huu-khi-tai-hien-dai-bac-nhat-tg-tinh-hoa-made-in-germany-20191007105940421.htm",138,128,6,3,1,,,7 bình luậ,1440476456101281,/story.php?story_fbid=1440476456101281&id=390862884395982
Soha Quân Sự,,2019-10-07 11:25:12,Xe bọc thép chống mìn (MRAP) BMC Kipri được Thổ Nhĩ Kỳ viện trợ cho lực lượng GNA ở Tripoli bị LNA phá hủy. Chưa rõ loại vũ khí gì đã được sử dụng tuy nhiên nhiều khả năng là RPG-7V.,40,35,1,,4,,,2 bình luậ,1439734896175437,/story.php?story_fbid=1439734896175437&id=390862884395982
Soha Quân Sự,,2019-10-07 08:23:44,"Trước nguy cơ Thổ Nhĩ Kỳ phát động chiến dịch quy mô lớn ở Đông Bắc Syria, tấn công lực lượng do Mỹ hậu thuẫn, Nga lập tức tăng cường tuần tra ở khu vực này, ngăn Thổ động binh. https://m.soha.vn/cap-nhat-nga-noi-co-nguoi-nghe-de-co-nguoi-so-than-toc-ra-tay-dep-yen-tho-nhi-ky-o-syria-20191007081120593.htm",49,45,4,,,,,5 bình luậ,1439638002851793,/story.php?story_fbid=1439638002851793&id=390862884395982
Soha Quân Sự,,2019-10-07 08:22:57,"Tương lai nước Mỹ sẽ trở nên ""mong manh dễ vỡ"" bằng việc tự làm suy yếu khả năng phòng thủ hạt nhân, trong khi đó Trung Quốc, Triều Tiên và Iran dần hoàn thiện năng lực của ICBM. https://m.soha.vn/my-xep-giap-quy-hang-truoc-ten-lua-trung-quoc-la-chan-hat-nhan-da-thieu-nay-con-yeu-20191006201926203.htm",3,2,1,,,,,Bình luậ,1439637416185185,/story.php?story_fbid=1439637416185185&id=390862884395982
Soha Quân Sự,,2019-10-07 08:21:58,"Nếu thành sự thật, đây sẽ không phải là tin tức vui vẻ gì với Mỹ. https://m.soha.vn/tung-choi-day-day-tin-don-mua-s-300-nga-nhung-quoc-gia-nay-se-lieu-minh-voi-my-de-co-duoc-s-400-20191006124159546.htm",25,24,1,,,,,1 bình luậ,1439636716185255,/story.php?story_fbid=1439636716185255&id=390862884395982
Soha Quân Sự,,2019-10-07 08:21:21,"Những hình ảnh mới nhất về tàu hộ vệ 18 thuộc Lữ đoàn 171, Vùng 2 Hải quân cho thấy dường như con tàu đã được lắp bệ phóng tên lửa phòng không vác vai. https://m.soha.vn/tau-chien-lop-pohang-han-quoc-chuyen-giao-cho-viet-nam-duoc-nang-cap-them-hoa-luc-manh-20190929111428581.htm",61,60,,1,,,,1 bình luậ,1439636269518633,/story.php?story_fbid=1439636269518633&id=390862884395982
Soha Quân Sự,,2019-10-06 18:54:11,Là bộ phận nhỏ nhất trong IDF nhưng hải quân lại đóng vai trò quan trọng trong việc bảo vệ các lợi ích lãnh thổ Israel và đảm bảo duy trì toàn vẹn năng lực răn đe cho nước này. https://m.soha.vn/vu-khi-bi-mat-cua-israel-neu-chien-tranh-voi-iran-luc-luong-hai-quan-bi-lang-quen-201910061052135.htm,19,19,,,,,,1 bình luậ,1439078476241079,/story.php?story_fbid=1439078476241079&id=390862884395982
Soha Quân Sự,,2019-10-06 18:53:42,Với yêu cầu của Quân đội Philippines hiện tại nhiều khả năng nước này sẽ chọn mua biến thể phóng đi từ mặt đất của tên lửa siêu thanh BrahMos cho nhiệm vụ phòng thủ bờ biển. https://m.soha.vn/philippines-mua-ten-lua-sieu-thanh-brahmos-y-dinh-da-qua-ro-rang-2019100609440714.htm,31,31,,,,,,Bình luậ,1439077912907802,/story.php?story_fbid=1439077912907802&id=390862884395982
Soha Quân Sự,,2019-10-06 18:53:10,Đây là một mối đe dọa mà Mỹ có lẽ chưa sẵn sàng để đối phó. https://m.soha.vn/tt-trump-cho-coi-thuong-giay-phut-kinh-hoang-nhat-la-khi-ten-lua-iran-gioi-xuong-tau-san-bay-va-can-cu-my-20191006092652656.htm,12,12,,,,,,1 bình luậ,1439077556241171,/story.php?story_fbid=1439077556241171&id=390862884395982
Soha Quân Sự,,2019-10-06 18:52:37,"Theo tướng McConnville, Trung Quốc đang nhanh chóng gia tăng sức mạnh quân sự và sẽ trở thành đối thủ chính và đáng gờm nhất của Mỹ trong khoảng thời gian sau năm 2028. https://m.soha.vn/quan-doi-trung-quoc-doi-thu-dang-gom-nhat-cua-lau-nam-goc-sau-nam-2028-2019100522410539.htm",14,14,,,,,,1 bình luậ,1439077149574545,/story.php?story_fbid=1439077149574545&id=390862884395982
Soha Quân Sự,,2019-10-06 17:19:58,"Thổ Nhĩ Kỳ công nhận máu chiến thật, bất chấp đàn anh Mỹ ra sức can ngăn vẫn quyết định chơi lớn 1 lần ở Syria. https://soha.vn/cap-nhat-saudi-nga-ngua-ve-quyet-dinh-cua-my-doi-voi-iran-israel-san-sang-cho-tinh-huong-xau-nhat-20191006092138531.htm",16,15,1,,,,,1 bình luậ,1439013719580888,/story.php?story_fbid=1439013719580888&id=390862884395982
