source,shared_from,date,text,reactions,likes,ahah,love,wow,sigh,grrr,comments,post_id,url
Soha Quân Sự,,2019-09-18 14:15:55,"Hoa Kỳ và Ukraine đã khai mạc cuộc tập trận Rapid Trident 19 ngày 16/9. Hơn 3.000 nhân viên quân sự từ Hoa Kỳ và NATO đang tham gia cuộc tập trận đa quốc gia diễn ra hàng năm tại Yavoriv, ​​Ukraine. Cuộc tập trận diễn ra để nhằm vào ai, điều đó không có gì khó để trả lời.",1,1,,,,,,Bình luậ,1423107581171502,/story.php?story_fbid=1423107581171502&id=390862884395982
Soha Quân Sự,,2019-09-16 14:28:52,"Lính dù Hoa Kỳ đang thử nghiệm thực địa các phương tiện cơ động mới trong cuộc tập trận Saber Junction 2019 tại Trung tâm huấn luyện Grafenwoehr, Đức. Phương tiện cơ động mặt đất của quân đội (GMV) có trọng tải 3.200 pound (1.451 kg) đủ khả năng chuyên chở cho một tiểu đội (9 người) và các loại vũ khí trang bị. GMV có thể được vận chuyển trong khoang các máy bay V-22, CH-53, C-130 và C-5 hoặc treo bên ngoài bằng trực thăng CH-47 Chinook.",,,,,,,,Bình luậ,1421590361323224,/story.php?story_fbid=1421590361323224&id=390862884395982
Soha Quân Sự,,2019-09-16 14:24:44,"Textron, một trong ba nhà thầu sản xuất nguyên mẫu súng trường tấn công biệt đội thế hệ mới (NGSW) đã trình bày các nguyên mẫu của họ. Súng trường tấn công và súng máy của chương trình NGSW được cho là thiết kế theo dạng modul và sử dụng cỡ đạn 6,8mm.",,,,,,,,Bình luậ,1421588477990079,/story.php?story_fbid=1421588477990079&id=390862884395982
Soha Quân Sự,,2019-09-18 14:08:32,"Quân đội Hoa Kỳ hôm nay đã thực hiện cuộc không kích thứ 41 của mình tại Somalia trong năm 2019, cuộc tấn công này nhắm vào các chiến binh khủng bố al-Shabaab.",1,1,,,,,,Bình luậ,1423104091171851,/story.php?story_fbid=1423104091171851&id=390862884395982
Soha Quân Sự,,2019-09-18 12:12:39,"Một sở chỉ huy, bệnh viện quân đội và các đường hầm trải dài hàng trăm mét bị phát hiện ở Khan Sheikhoun. Các cơ sở bị phát hiện trong một hang động ở phía nam tỉnh Idlib. Khu vực này từng nằm trong vùng phiến quân kiểm soát nhiều năm trước khi được giải phóng cuối tháng 8. ""Không chỉ có các công sự dã chiến mà còn có một lượng lớn vũ khí, đạn dược và trang bị chiến đấu"". Khu vực có diện tích khoảng 10.000 mét vuông, có một sở chỉ huy, một bệnh viện dã chiến và một khu vực nghỉ ngơi ngoài ra là một mạng lưới các lối đi ngầm. ""Kích thước chính xác chưa thể được xác định trong thời điểm hiện tại, bởi vì phiến quân đã đặt mìn khắp nơi trước khi rút lui. "" Quân đội Syria không loại trừ rằng tổ chức gây tranh cãi ""Mũ bảo hiểm trắng"" đã sản xuất video về vụ tấn công vũ khí hóa học vào tháng 4/2017 và là lý do cho cuộc không kích của Mỹ diễn ra sau đó.",3,3,,,,,,Bình luậ,1423049557843971,/story.php?story_fbid=1423049557843971&id=390862884395982
Soha Quân Sự,,2019-09-16 15:36:01,"Tổng thống Hàn Quốc Moon Jae-in đã cảnh báo các cơ quan chính phủ không sử dụng tên Biển Nhật Bản (Vùng nước giáp với bán đảo Triều Tiên, Nga và Nhật Bản) thay vì gọi đó là Biển Đông. Hiện nay, 97,2% các bản đồ quốc tế và các văn bản chỉ sử dụng tên gọi Biển Nhật Bản. Hoa Kỳ, Trung Quốc và Việt Nam và hầu hết các nước chỉ sử dụng tên gọi là biển Nhật Bản. Liên Hiệp Quốc cũng sử dụng tên gọi Biển Nhật Bản.",2,2,,,,,,Bình luậ,1421621557986771,/story.php?story_fbid=1421621557986771&id=390862884395982
Soha Quân Sự,,2019-09-16 15:32:14,"Máy bay trực thăng Mil Mi-38 đầu tiên được sản xuất cho mục đích thương mại đã sẵn sàng bàn giao cho khách hàng và sẽ được vận hành bởi Russian Direct Systems, một nhà vận hành máy bay thương mại tư nhân của Nga. Mi-38 có khả năng vận chuyển 30 hành khách và được coi là sự thay thế cho các trực thăng Mi-8 và Mi-17 trong tương lai.",1,1,,,,,,Bình luậ,1421619791320281,/story.php?story_fbid=1421619791320281&id=390862884395982
Soha Quân Sự,,2019-09-16 15:28:24,Quân đội Hoa Kỳ đã bắt đầu thử nghiệm Thiết bị đánh chặn máy bay không người lái (UAV) có độ cao thấp (BLADE) các nguyên mẫu được gắn trên xe chống mìn (MRAP). Có vẻ nhà sản xuất UAV đứng đầu thế giới đã bắt đầu thực sự quan tâm đến việc khắc chế UAV của đối thủ (Nga - Trung Quốc - Iran)...,3,3,,,,,,Bình luậ,1421618151320445,/story.php?story_fbid=1421618151320445&id=390862884395982
Soha Quân Sự,,2019-09-16 14:38:38,Một số hình ảnh ấn tượng của một lính bắn tỉa (nhiều khả năng là phiến quân) Syria.,3,3,,,,,,Bình luậ,1421594651322795,/story.php?story_fbid=1421594651322795&id=390862884395982
Soha Quân Sự,,2019-09-16 14:34:37,"Một kho vũ khí bị phát hiện tại Jassim, Daraa - miền nam Syria.",1,1,,,,,,Bình luậ,1421592941322966,/story.php?story_fbid=1421592941322966&id=390862884395982
Soha Quân Sự,,2019-09-16 09:26:47,"Mặc dù đã thất bại tại Syria, các nhóm địch ngầm IS vẫn tiếp tục hoạt động trong các khu vực lãnh thổ cũ và các vùng do các nhóm tiền thân al-Qaeda kiểm soát. Chống một nhóm khủng bố đã khó khăn nhưng chống một phong trào khủng bố còn khó khăn hơn nhiều.",,,,,,,,Bình luậ,1421448114670782,/story.php?story_fbid=1421448114670782&id=390862884395982
Soha Quân Sự,,2019-09-16 09:29:13,"Cảnh quay tại ga tàu điện ngầm Wanchai, Hong Kong. Có thể thấy rõ người phản biểu tình đã tìm cách ngăn chặn người biểu tình di chuyển ở các ga điện ngầm như thế nào.",2,2,,,,,,Bình luậ,1421448984670695,/story.php?story_fbid=1421448984670695&id=390862884395982
Soha Quân Sự,,2019-09-16 09:21:15,"Với những hình ảnh thiệt hại tại hiện trường, có thể xác định cuộc tập kích của Houthi vào các cơ sở dầu mỏ của Saudi có sự tham gia của hàng chục UAV và tên lửa hành trình.",1,1,,,,,,Bình luậ,1421444711337789,/story.php?story_fbid=1421444711337789&id=390862884395982
Soha Quân Sự,,2019-09-15 13:33:16,"AFP: Trong một đất nước bị chia cắt bởi các cuộc xung đột và chiến tranh tuyên truyền, các nhà báo của Libya bị cuốn vào cuộc chiến giữa các mặt trận và các lãnh chúa, khiến họ trở nên rủi ro chỉ đứng sau những người lính.",2,2,,,,,,Bình luậ,1420761141406146,/story.php?story_fbid=1420761141406146&id=390862884395982
Soha Quân Sự,,2019-09-15 09:23:23,Hình ảnh tương tự nhau nhưng lại kể một câu chuyện “nhân-quả”. Ảnh 1: Cơ sở lọc dầu của Iraq bốc cháy sau cuộc tập kích bằng tên lửa từ Arab Saudi vào năm 2003 (cuộc xâm lược Iraq của Hoa Kỳ). Ảnh 2: Cơ sở dầu mỏ của Arab Saudi bốc cháy sau cuộc tập kích bằng UAV của Houthi vào năm 2019. Đố các mem phân biệt được đâu là 1 và đâu là 2?,3,3,,,,,,1 bình luậ,1420633228085604,/story.php?story_fbid=1420633228085604&id=390862884395982
Soha Quân Sự,,2019-09-15 09:19:29,6 quân nhân UAE thiệt mạng sau một cuộc không kích của máy bay chiến đấu GNA vào al-Jufrah. Trong khi cả LNA và GNA đều xác nhận thông tin thì UAE tuyên bố 6 người này thiệt mạng do “tai nạn xe hơi”. UAE hiện đã rút phần lớn lực lượng khỏi Yemen và họ đang tập trung cho chiến trường Libya trong nỗ lực nhằm vào tổ chức Huynh đệ Hồi giáo được sự hậu thuẫn của Thổ Nhĩ Kỳ.,2,2,,,,,,Bình luậ,1420631208085806,/story.php?story_fbid=1420631208085806&id=390862884395982
Soha Quân Sự,,2019-09-15 09:15:23,"Đồ họa này cho thấy các hệ thống phòng thủ tên lửa của Saudi xung quanh các cơ sở dầu Abqaiq đã không hiệu quả trong thời gian cuộc tập kích của Houthi diễn ra vào rạng sáng thứ bảy. Máy bay không người lái của Houthi ở trong phạm vi tác xạ của Hệ thống Patriot PAC-2, nhưng lại nằm ngoài phạm vi của hệ thống Hawk. Có thể suy đoán do thiết kế bởi các vật liệu tổng hợp, kích thước nhỏ của UAV và khả năng bay thấp đã giúp chúng tránh bị phát hiện.",3,3,,,,,,Bình luậ,1420628951419365,/story.php?story_fbid=1420628951419365&id=390862884395982
Soha Quân Sự,,2019-09-15 09:10:07,"Trái với quân Mỹ hay quân Thổ, lính Nga đóng tại Tall Rifat, Tây Bắc Aleppo (lân cận khu vực Afrin) không cần vũ trang khi di chuyển trong khu dân cư. Nó cho thấy mức độ an ninh cao, cũng như vị thế của người Nga ở Syria nói chung và trong vùng chính phủ kiểm soát nói riêng.",2,2,,,,,,1 bình luậ,1420626034752990,/story.php?story_fbid=1420626034752990&id=390862884395982
Soha Quân Sự,,2019-09-15 09:02:36,"Trong một nỗ lực ngăn chặn các cuộc không kích của Israel ở Syria và Iraq, Vệ binh cách mạng Hồi giáo Iran (IRGC) đã triển khai hệ thống phòng không do họ sản xuất tại thị trấn al-Bukamal nằm trên biên giới Syria. Các lực lượng trung thành với Iran như Hezbollah Lebanon, Kaitab Hezbollah Iraq đã kiểm soát al-Bukamal vào cuối năm 2017 và thị trấn thuộc tỉnh Deir Ezzor này đã trở thành vị trí quan trọng trên tuyến đường vận chuyển vũ khí từ Iran qua Iraq, Syria và Lebanon.",1,1,,,,,,Bình luậ,1420621798086747,/story.php?story_fbid=1420621798086747&id=390862884395982
Soha Quân Sự,,2019-09-14 08:49:56,"1 năm sau khi kiểm soát Afrin bằng chiến dịch “Cành Oliu”, khu vực do phiến quân thân Thổ kiểm soát vẫn chưa an toàn do hoạt động mạnh của các nhóm người Kurd. Ngay tại thành phố thủ phủ Afrin, hôm qua một quả bom đặt trong xe máy đã phát nổ.",,,,,,,,Bình luậ,1419792214836372,/story.php?story_fbid=1419792214836372&id=390862884395982
Soha Quân Sự,,2019-09-14 08:44:15,"Với thất bại ở Bắc Hama, phiến quân thân Thổ đổ lỗi cho... UNHCR đã viện trợ cho Quân đội Syria. Giận cá chém thớt là có thật các mem ạ.",,,,,,,,Bình luậ,1419788491503411,/story.php?story_fbid=1419788491503411&id=390862884395982
Soha Quân Sự,,2019-09-15 08:35:30,"Những chiến binh Yemen này đã khiến việc sản xuất dầu của Arab Saudi bị đình trệ, hãy tưởng tượng họ sẽ làm gì nếu đi giày... Ad: Thực ra đánh sơn cước - lẳng thủ pháo vào chốt như Houthi ở biên giới Saudi thì cần gì giày.",2,2,,,,,,Bình luậ,1420607928088134,/story.php?story_fbid=1420607928088134&id=390862884395982
Soha Quân Sự,,2019-09-14 09:02:43,"Cùng với việc pháo kích và không kích một loạt các vị trí của phiến quân ở Kafranbel, Maarat al-Numan và thị trấn Shannan, Nga-Syria đã mở các cửa khẩu để người dân có thể trở về các khu dân cư họ mới kiểm soát ở Bắc Hama và Đông Idlib. Những hoạt động thu hút dân bằng áp lực quân sự như thế này thường là khởi đầu cho một chiến dịch quân sự mới ở Syria. Rõ ràng rằng Thu - Đông năm nay Nga-Syria sẽ tái chiếm một phần lớn của khu vực trung tâm Idlib, vấn đề chỉ là thời gian.",2,2,,,,,,Bình luậ,1419799031502357,/story.php?story_fbid=1419799031502357&id=390862884395982
Soha Quân Sự,,2019-09-14 08:47:27,"Deir Ezzor, 2 năm sau khi phá vây khỏi phiến quân và IS. Hôm nay là ngày tốt nghiệp của khoá huấn luyện cảnh sát vũ trang tại tỉnh này. Thành phần được cho là lấy từ những thanh niên địa phương được gọi nhập ngũ sau khi phá vây (cuối năm 2017). Tất nhiên, một phần trong số họ có thể là cựu phiến quân hoặc dân quân thân IS đã được “xoá trắng” lý lịch.",1,1,,,,,,Bình luậ,1419790411503219,/story.php?story_fbid=1419790411503219&id=390862884395982
Soha Quân Sự,,2019-09-13 15:29:41,Một chiến binh Ukraine với súng trường của lực lượng đặc biệt VSS Vintorez do Nga sản xuất. Đây là vũ khí khá hiếm trong khu vực và có thể là chiến lợi phẩm.,,,,,,,,Bình luậ,1419172721564988,/story.php?story_fbid=1419172721564988&id=390862884395982
Soha Quân Sự,,2019-09-14 08:40:34,"Khi lệnh ngừng bắn kết thúc, Sư đoàn 4 Thiết giáp Vệ binh Cộng Hoà Syria đã bắt đầu khai hoả pháo và tên lửa hạng nặng ở khu vực Kabani thuộc tỉnh Latakia. Sư đoàn 4 vẫn tiếp tục kìm chân một cụm quân mạnh của HTS-TIP và WaM (3 nhóm khủng bố chính ở Tây Bắc Syria) để các đơn vị khác phát triển từ phía nam Idlib.",1,1,,,,,,Bình luậ,1419786064836987,/story.php?story_fbid=1419786064836987&id=390862884395982
Soha Quân Sự,,2019-09-13 15:36:04,Máy cày trong chiến tranh có thể trở thành một phương tiện cơ giới nếu được lắp đặt súng máy.,2,2,,,,,,1 bình luậ,1419177021564558,/story.php?story_fbid=1419177021564558&id=390862884395982
Soha Quân Sự,,2019-09-13 15:33:44,"Họ từng là các chỉ huy của Lữ đoàn 1 ((Phiến quân Quân đội Syria tự do - FSA) ở Barzeh, Damascus. Họ cũng là phe phiến quân đã ngăn Jaysh al-Islam xâm nhập Damascus và liên minh với Faylaq al-Rahman và FSA ở Nazareth vào thời điểm đó. Giờ đây họ đang chiến đấu trong màu áo quân đội Syria ở vùng nông thôn phía nam Idlib.",1,1,,,,,,Bình luậ,1419175568231370,/story.php?story_fbid=1419175568231370&id=390862884395982
Soha Quân Sự,,2019-09-13 14:11:56,"Mặc dù Hạm đội 2 của Hải quân Mỹ đang thực hiện việc triển khai một ""Nhóm tác chiến mặt nước"" và không che giấu việc sử dụng nó để kìm hãm người Nga nhưng họ lại thiếu tàu sân bay! https://soha.vn/tau-san-bay-truman-bi-su-co-bat-ngo-de-mac-nhieu-tau-chien-my-bi-de-doa-o-dai-tay-duong-20190913081943968.htm",1,1,,,,,,Bình luậ,1419134974902096,/story.php?story_fbid=1419134974902096&id=390862884395982
Soha Quân Sự,,2019-09-13 14:11:14,Mối lo ngại ngày càng gia tăng về chương trình hạt nhân của Trung Quốc trong những năm 1970 đã thúc đẩy Liên Xô cho ra đời một phiên bản phi cơ đặc biệt. https://soha.vn/su-gia-dac-biet-cua-lien-xo-khien-phong-khong-trung-quoc-khoc-rong-vi-bat-luc-2019091311233414.htm,2,2,,,,,,Bình luậ,1419134451568815,/story.php?story_fbid=1419134451568815&id=390862884395982
Soha Quân Sự,,2019-09-13 09:17:09,"KQ Syria vừa ném bom nhiều mục tiêu, trong đó có một căn cứ UAV phiến quân, nơi thường được chúng sử dụng để xuất kích tấn công vào căn cứ Khmeimim, đầu não KQ Nga tại Syria. https://m.soha.vn/cap-nhat-dap-nat-can-cu-xuat-kich-cua-uav-phien-quan-nga-syria-xoa-so-moi-lo-lang-bay-lau-2019091308105789.htm",2,2,,,,,,Bình luậ,1418992788249648,/story.php?story_fbid=1418992788249648&id=390862884395982
Soha Quân Sự,,2019-09-13 09:16:38,"Qua thực chiến tốt ở Syria, đã giúp BTR-80 lọt vào mắt xanh nhiều nước trên thế giới. Đây cũng là một lựa chọn tốt để Lục quân Việt Nam hiện đại hóa các đơn vị bộ binh cơ giới. https://m.soha.vn/thuc-chien-xuat-sac-o-syria-neu-co-btr-80-luc-quan-viet-nam-nhu-ho-moc-them-canh-20190912121829734.htm",1,1,,,,,,Bình luậ,1418992491583011,/story.php?story_fbid=1418992491583011&id=390862884395982
Soha Quân Sự,,2019-09-13 09:15:35,"Phát hiện chiến đấu cơ Israel ""ló mặt"" ở phía Nam Syria, lập tức tiêm kích Su-35 Nga xuất kích đánh chặn, bẻ gãy ý đồ tập kích vào Damascus của Không quân Do Thái. https://m.soha.vn/su-35-danh-chan-may-bay-israel-bo-chay-bi-truy-sat-o-syria-kq-israel-lung-lay-bi-the-20190912113933171.htm",2,2,,,,,,Bình luậ,1418991744916419,/story.php?story_fbid=1418991744916419&id=390862884395982
Soha Quân Sự,,2019-09-12 20:19:45,"Nhận thức được rõ rằng mình chưa đủ khả năng đối đầu với Mỹ, TQ đã tìm tới Nga– lúc này đang triển khai tiêm kích Su-30, được đông đảo ý kiến đánh giá là đáng gờm nhất thế giới. https://m.soha.vn/be-bang-truoc-my-trung-quoc-da-nho-su-30mkk-cua-nga-ma-ngang-mat-len-nhu-the-nao-20190912153928265.htm",1,1,,,,,,Bình luậ,1418558951626365,/story.php?story_fbid=1418558951626365&id=390862884395982
Soha Quân Sự,,2019-09-12 14:19:20,"Theo một thỏa thuận mới được ký kết, Tehran sẽ cho phép 5.000 nhân viên an ninh Trung Quốc có mặt trên đất Iran với mục đích bảo vệ các dự án đầu tư của Bắc Kinh tại đây. https://soha.vn/5000-linh-trung-quoc-se-tham-gia-bao-ve-du-an-400-ty-usd-o-iran-2019091211232325.htm",,,,,,,,Bình luậ,1418351991647061,/story.php?story_fbid=1418351991647061&id=390862884395982
Soha Quân Sự,,2019-09-12 14:18:50,"Bên cạnh năng lực tấn công mặt đất vượt trội, ít ai biết rằng tiêm kích bom Su-22 của Không quân Việt Nam còn sở hữu cả khả năng chống hạm bằng các tên lửa Kh-29TE đầy uy lực. https://soha.vn/ten-lua-sat-thu-diet-ham-dang-gom-cua-chien-dau-su-22-khong-quan-viet-nam-day-uy-luc-20190910103231843.htm",,,,,,,,Bình luậ,1418351514980442,/story.php?story_fbid=1418351514980442&id=390862884395982
Soha Quân Sự,,2019-09-12 14:18:12,"Theo giới chuyên gia, Nga đang quyết tâm đầu tư lớn vào các hệ thống tên lửa mới nhằm mục đích đánh bại các hệ thống phòng thủ của Mỹ, hiện nay cũng như trong tương lai. https://soha.vn/sieu-ten-lua-hat-nhan-bat-kha-chien-bai-cua-nga-se-duoc-dua-vao-truc-chien-6-nam-toi-20190912094923718.htm",,,,,,,,Bình luậ,1418351188313808,/story.php?story_fbid=1418351188313808&id=390862884395982
Soha Quân Sự,,2019-09-11 19:49:37,Với cấu hình vũ khí trên các tàu hộ vệ tên lửa Gepard của Nga hiện tại có thể thấy Tàu 016 Quang Trung Hải quân Việt Nam gần như đang là biến thể mạnh nhất của lớp tàu này. https://m.soha.vn/thay-vu-khi-tren-tau-gepard-nga-ngo-ngang-ve-suc-manh-tau-016-quang-trung-cua-hqvn-20190909111257593.htm,,,,,,,,Bình luậ,1417738245041769,/story.php?story_fbid=1417738245041769&id=390862884395982
Soha Quân Sự,,2019-09-12 14:20:47,Những động thái quân sự gần đây của Venezuela và Colombia có thể dẫn tới một cuộc xung đột biên giới giữa hai nước với sự tham gia của các nhóm bán vũ trang. https://soha.vn/dan-quan-venezuela-voi-500000-khau-sung-truong-ap-sat-bien-gioi-colombia-chien-tranh-can-ke-20190912114904921.htm,2,2,,,,,,Bình luậ,1418352938313633,/story.php?story_fbid=1418352938313633&id=390862884395982
Soha Quân Sự,,2019-09-12 14:19:47,Không chỉ Binh chủng Tàu ngầm Việt Nam mà nhiều quốc gia Đông Nam Á khác cũng cử các học viên tham gia chương trình huấn luyện quốc tế ISETP do Hải quân Hàn Quốc tổ chức. https://soha.vn/bo-doi-tau-ngam-viet-nam-tham-gia-chuong-trinh-huan-luyen-quoc-te-cua-han-quoc-20190911182124921.htm,1,1,,,,,,Bình luậ,1418352241647036,/story.php?story_fbid=1418352241647036&id=390862884395982
Soha Quân Sự,,2019-09-11 19:48:20,"Tối ngày 10/9, tờ Sputnik đưa tin Serbia đã tuyên bố sẽ mua 9 máy bay không người lái tấn công (UCAV) từ Trung Quốc. https://m.soha.vn/uav-tan-cong-tq-tham-nhap-lo-lua-balkan-chau-au-giat-minh-truoc-canh-bao-cua-my-20190911154012562.htm",,,,,,,,Bình luậ,1417736928375234,/story.php?story_fbid=1417736928375234&id=390862884395982
Soha Quân Sự,,2019-09-11 18:19:26,"Sau 5 giờ cố tìm cách mở buồng lái tiêm kích tàng hình F-22 mà không thành công, các nhân viên cứu hộ ở căn cứ Langley đã buộc phải phá buồng lái của chiến đấu cơ đắt nhất nước Mỹ. https://m.soha.vn/giai-cuu-phi-cong-ket-trong-buong-lai-tiem-kich-tang-hinh-f-22-phai-dung-bien-phap-manh-20190910163802125.htm",,,,,,,,Bình luậ,1417682188380708,/story.php?story_fbid=1417682188380708&id=390862884395982
Soha Quân Sự,,2019-09-11 18:18:51,Các máy bay F-35 và F-15 Không quân Mỹ đã thả gần 36.000 kg bom xuống mục tiêu là hòn đảo Qanus nằm ở tỉnh Salah ad Din của Iraq để phá hủy các hang ổ của khủng bố IS tại đây. https://m.soha.vn/f-35-f-15-khong-quan-my-dong-loat-gioi-36-tan-bom-tieu-diet-khung-bo-tai-iraq-20190911070325015.htm,,,,,,,,Bình luậ,1417681785047415,/story.php?story_fbid=1417681785047415&id=390862884395982
Soha Quân Sự,,2019-09-11 18:18:21,Trong lúc các đồng minh của mình liên tiếp hứng chịu những thất bại choáng váng thì Liên Xô tất nhiên cũng không thể ngồi yên. https://m.soha.vn/chien-tranh-6-ngay-my-cang-nhu-day-dan-truoc-canh-bao-sac-lanh-tu-lien-xo-the-chien-3-qua-can-ke-20190911110957703.htm,,,,,,,,Bình luậ,1417681495047444,/story.php?story_fbid=1417681495047444&id=390862884395982
Soha Quân Sự,,2019-09-11 08:22:51,"Su-35 Nga xuất kích truy đuổi, đánh chặn chiến đấu cơ Israel, ngăn cản thành công một đợt tập kích lớn bằng tên lửa nhằm vào Syria. Chuyện ngày càng hay. https://soha.vn/cap-nhat-tiem-kich-su-35-nga-truy-can-chien-dau-co-israel-be-gay-dot-tan-cong-lon-vao-syria-20190911080101187.htm",,,,,,,,Bình luậ,1417389801743280,/story.php?story_fbid=1417389801743280&id=390862884395982
Soha Quân Sự,,2019-09-10 22:51:00,"Cho tới nay, tất cả các chứng cứ thu thập được từ các nguồn thông tin mở trên các phương tiện truyền thông xã hội chỉ cho thấy một máy bay MiG-21 của Không quân Ấn Độ bị rơi. https://m.soha.vn/mig-21-bi-ban-tan-xac-trong-tran-khong-chien-an-do-pakistan-f-16-van-con-la-dieu-bi-an-20190502150109856.htm",,,,,,,,Bình luậ,1417091815106412,/story.php?story_fbid=1417091815106412&id=390862884395982
Soha Quân Sự,,2019-09-10 22:50:28,"Nhiều tin đồn cho rằng, cũng như biến thể trước đó là Mi-35M (Mi-24P), dự kiến Mi-24P-1M cũng sẽ sớm được thử lửa trên chiến trường khốc liệt Syria. https://m.soha.vn/truc-thang-xe-tang-bay-cua-nga-dot-pha-tu-kinh-nghiem-xuong-mau-cua-mi-35m-o-syria-20190910130126968.htm",,,,,,,,Bình luậ,1417091291773131,/story.php?story_fbid=1417091291773131&id=390862884395982
Soha Quân Sự,,2019-09-10 22:49:35,"Sau 11 năm, máy bay tấn công tàng hình F-117 chưa hoàn toàn bị loại biên, nó vẫn tiếp tục cất cánh trong các hoạt động bí mật cả ở Hoa Kỳ lẫn Trung Đông những năm gần đây. https://m.soha.vn/chim-ung-dem-f-117-tai-xuat-sau-11-nam-loai-bien-tiet-lo-bat-ngo-20190910170110093.htm",,,,,,,,Bình luậ,1417090398439887,/story.php?story_fbid=1417090398439887&id=390862884395982
Soha Quân Sự,,2019-09-10 22:52:15,"Hải quân Ấn Độ đã hoàn thiện xây dựng kế hoạch mua 200 tàu chiến, 500 máy bay và 24 tàu ngầm tấn công trong khoảng thời gian từ 3 - 4 năm tới đây. https://m.soha.vn/quyet-doi-pho-trung-quoc-an-do-chi-130-ty-usd-sam-vu-khi-moi-toan-hang-khung-20190910161858984.htm",1,1,,,,,,Bình luậ,1417092735106320,/story.php?story_fbid=1417092735106320&id=390862884395982
Soha Quân Sự,,2019-09-10 11:22:02,Việc các UAV Israel liên tiếp bị bắn hạ khi hoạt động bên trong lãnh thổ Lebanon đang khiến giới phân tích bất ngờ về năng lực phòng không của Hezbollah. https://soha.vn/uav-israel-rung-nhu-sung-hezbollah-co-vu-khi-phong-khong-toi-thuong-nao-trong-tay-20190909170408843.htm,,,,,,,,Bình luậ,1416675201814740,/story.php?story_fbid=1416675201814740&id=390862884395982
Soha Quân Sự,,2019-09-10 07:46:04,"Gió đổi chiều ở Libya: Lực lượng Tướng Haftar ""ôm đầu máu"", dân quân GNA tổng phản công? https://m.soha.vn/gio-doi-chieu-o-libya-luc-luong-tuong-haftar-om-dau-mau-dan-quan-gna-tong-phan-cong-20190909114012968.htm",,,,,,,,Bình luậ,1416557991826461,/story.php?story_fbid=1416557991826461&id=390862884395982
Soha Quân Sự,,2019-09-10 07:44:39,"AC-130 đã có một lịch sử tham gia các hoạt động quân sự tại Việt Nam, Panama, Afghanistan và Iraq kể từ khi nó được KQ Mỹ đưa vào trang bị vào cuối năm 1960. https://m.soha.vn/my-loai-bien-cuu-chien-binh-cuoi-cung-mo-sang-trang-su-moi-voi-tan-binh-ac-130j-20190909153057906.htm",,,,,,,,Bình luậ,1416557135159880,/story.php?story_fbid=1416557135159880&id=390862884395982
