source,shared_from,date,text,reactions,likes,ahah,love,wow,sigh,grrr,comments,post_id,url
VietnamPlus,,2019-08-01 10:30:08,"Tính từ ngày 15/12/2018 đến 14/6/2019, đường sắt xảy ra 75 vụ tai nạn, làm chết 53 người, bị thương 30 người.",7,6,,,,1,,2 bình luậ,10157384625904441,/story.php?story_fbid=10157384625904441&id=120834779440
VietnamPlus,,2019-10-12 08:56:24,Vẫn thiếu trứng vịt lộn,5,5,,,,,,Bình luậ,10157566922114441,/story.php?story_fbid=10157566922114441&id=120834779440
VietnamPlus,,2019-10-10 14:17:03,"Người nước ngoài đến VN làm việc cũng có ""người this người that""",5,5,,,,,,Bình luậ,10157561984369441,/story.php?story_fbid=10157561984369441&id=120834779440
VietnamPlus,,2019-10-07 14:23:19,"Sự kiện được ngóng đợi nhất mùa Nobel năm nay có lẽ là sự trở lại của giải Nobel Văn học, sau khi hạng mục này vắng bóng trong năm 2018, với những bê bối quấy rối tình dục làm rúng động Viện Hàn lâm Thụy Điển - tổ chức lựa chọn người đoạt giải thưởng này.",7,6,,,,1,,1 bình luậ,10157553850769441,/story.php?story_fbid=10157553850769441&id=120834779440
VietnamPlus,,2019-10-04 19:10:02,Không có Mạc Hồng Quân!,3,3,,,,,,Bình luậ,10157545649149441,/story.php?story_fbid=10157545649149441&id=120834779440
VietnamPlus,,2019-10-04 19:08:48,Dùng giấy tờ giả mà leo lên tận trưởng phòng!,6,6,,,,,,Bình luậ,10157545647329441,/story.php?story_fbid=10157545647329441&id=120834779440
VietnamPlus,,2019-09-25 10:54:38,"Nhà hoạt động môi trường trẻ tuổi Greta Thurnberg đã bị các nhân viên an ninh chặn lại để nhường đường cho Tổng thống Mỹ Donald Trump, khi ông chủ Nhà Trắng tới phát biểu tại Đại hội đồng Liên hợp quốc hôm 24/9 về biến đổi khí hậu. Trước đó, trong bài phát biểu tại Đại hội đồng hôm 23/9, Thurnberg đã gây chấn động khi chỉ trích các nhà lãnh đạo thế giới ""cướp đi môi trường sống của thế hệ sau."" Ông Trump sau đó cũng có dòng tweet về nhà hoạt động môi trường người Thụy Điển như sau: “Cô gái này nhìn giống như một cô gái trẻ và vui tươi, đang chờ đón một tương lai tươi sáng và tuyệt vời. Thật tuyệt khi được chứng kiến.”",16,15,1,,,,,Bình luậ,10157520242159441,/story.php?story_fbid=10157520242159441&id=120834779440
VietnamPlus,,2019-09-13 17:49:57,"Một tuần trước ngày Trung Thu, những chiếc bánh Trung Thu nhân thịt ""giả"" đã được rao bán trên trang thương mại điện tử Taobao.",2,2,,,,,,Bình luậ,10157490918069441,/story.php?story_fbid=10157490918069441&id=120834779440
VietnamPlus,,2019-09-12 09:29:21,"Đây không chỉ là hành động phá hoại, mà là tội ác!",17,10,,,,2,5,1 bình luậ,10157487995339441,/story.php?story_fbid=10157487995339441&id=120834779440
VietnamPlus,,2019-09-11 08:43:07,Nhiều màu đẹp quá. Nhưng liệu doanh số có bị ảnh hưởng bởi cuộc chiến thương mại Mỹ-Trung không đây?,11,11,,,,,,Bình luậ,10157485554184441,/story.php?story_fbid=10157485554184441&id=120834779440
VietnamPlus,,2019-09-09 10:25:46,,11,11,,,,,,Bình luậ,10157481058174441,/VietnamPlus/photos/a.10150680330819441/10157481058174441
VietnamPlus,,2019-09-05 11:22:18,,18,16,,2,,,,Bình luậ,10157470631114441,/VietnamPlus/photos/a.10150680330819441/10157470631114441
VietnamPlus,,2019-08-27 12:37:36,"""Vô ý làm chết người""",3,3,,,,,,Bình luậ,10157449042184441,/story.php?story_fbid=10157449042184441&id=120834779440
VietnamPlus,,2019-08-20 16:20:25,Thêm một đối thủ nội địa của Facebook.,10,9,1,,,,,2 bình luậ,10157432030634441,/story.php?story_fbid=10157432030634441&id=120834779440
VietnamPlus,,2019-08-19 16:29:45,Thật không chấp nhận nổi hành vi của tài xế này!,9,7,,,,1,1,Bình luậ,10157429685959441,/story.php?story_fbid=10157429685959441&id=120834779440
VietnamPlus,,2019-08-19 10:24:51,Đời đời nhớ ơn Bác!,8,8,,,,,,Bình luậ,10157429250559441,/story.php?story_fbid=10157429250559441&id=120834779440
VietnamPlus,,2019-08-14 15:08:41,"Một đoạn video ghi cảnh cụ ông và cụ bà tay không chống trả hai tên cướp mang hung khí đã gây sốt tại Ấn Độ. Đoạn video ghi từ camera an ninh cho thấy khi cụ ông Shanmugavel (72 tuổi) đang ngồi nghỉ ngoài sân thì bất ngờ bị một tên cướp bịt mặt dùng khăn siết cổ. May mắn là vợ ông là bà Senthaamarai (69 tuổi) thấy động nên từ trong nhà lao ra, nhặt chiếc dép ném vào tên cướp để cứu chồng.  Lúc này, tên cướp thứ hai cũng xuất hiện, nhưng bị cụ ông giật chiếc khăn bịt mặt nên có phần luống cuống. Sau đó, hai vợ chồng cụ Shanmugavel đã dùng những chiếc ghế nhựa chống trả quyết liệt, buộc hai tên cướp phải bỏ chạy. Sự việc xảy ra vào khoảng 21 giờ ngày 11/8, tại làng Kadayam thuộc bang Tamil Nadu. Nhà của cụ Shanmugavel nằm ở rìa làng, gần với khu rừng, sống khá biệt lập, nên đó có thể là lý do khiến họ trở thành mục tiêu của bọn trộm cướp.",25,20,4,,1,,,2 bình luậ,10157416999474441,/story.php?story_fbid=10157416999474441&id=120834779440
VietnamPlus,,2019-08-13 12:55:45,Chúc mừng bố Sơn!,17,17,,,,,,Bình luậ,10157414362264441,/story.php?story_fbid=10157414362264441&id=120834779440
VietnamPlus,,2019-07-12 23:43:39,Chống lụt bằng lu chăng?,7,7,,,,,,1 bình luậ,10157338259924441,/story.php?story_fbid=10157338259924441&id=120834779440
